,id,text,date,retweets,favorites,mentions,hashtags,geo,region
363,1300851710085169152,Bean loves welding rods and meatal! @fishntexas - The Saltwater Cowboy https://www.instagram.com/p/CEmkurbnaUD/?igshid=135nxq3u7ud9q,2020-09-01 17:43:10+00:00,0,1,,,,Corpus_noquery
364,1300851613372944392,Daria lo fuera por verte de nuevooo,2020-09-01 17:42:47+00:00,2,5,,,,Corpus_noquery
365,1300851479822184451,Damn that sound good lol,2020-09-01 17:42:16+00:00,0,0,,,,Corpus_noquery
366,1300851282056540161,"i wish it was possible to visit every art museum, pretty garden, & yummy restaurants in da world :(( another dream of mine ",2020-09-01 17:41:28+00:00,2,6,,,,Corpus_noquery
367,1300851082277588995,Why I feel Trump doesn't really care about the citizens. Sports to be isn't as important as people's health. Especially if they allow the stadiums to be full,2020-09-01 17:40:41+00:00,0,3,,,,Corpus_noquery
368,1300850821056397312,Concluyó el mes de agosto con grandes e inolvidables bendiciones. Hoy inicia septiembre y miramos de frente con toda la confianza en el Altísimo! #WeAreLight #TLOTW #LLDM,2020-09-01 17:39:39+00:00,8,53,,#WeAreLight #TLOTW #LLDM,,Corpus_noquery
369,1300850809425465346,This fish got the top fish prize yesterday! @South Bay Marina https://www.instagram.com/p/CEmkUe6HVW8/?igshid=t0n52lzds95w,2020-09-01 17:39:36+00:00,0,0,,,,Corpus_noquery
370,1300850542382657536,Yaaaass,2020-09-01 17:38:32+00:00,0,0,,,,Corpus_noquery
371,1300850263109111811,So this loser isn't even there to settle the unrest. Probably just there to rile up his base,2020-09-01 17:37:26+00:00,0,0,,,,Corpus_noquery
372,1300849952629952514,"Since December 2019 I have lost 5 wonderful people and one amazing dog and just when I think I dont have anymore tears, I cry more.",2020-09-01 17:36:11+00:00,0,1,,,,Corpus_noquery
373,1300849797730107396,"omg, tell her happy birthday this is the most precious picture ever!!! ",2020-09-01 17:35:35+00:00,0,1,,,,Corpus_noquery
374,1300849517236039681,@HeyAshleyBaby @beeancarina,2020-09-01 17:34:28+00:00,0,2,@HeyAshleyBaby @beeancarina,,,Corpus_noquery
375,1300848656095023104,Did you watch the video,2020-09-01 17:31:02+00:00,0,1,,,,Corpus_noquery
376,1300848296752185344,,2020-09-01 17:29:37+00:00,0,2,,,,Corpus_noquery
377,1300848272408481792,A little old man at the bank told me he and his wife loved my hair cut it's a good day,2020-09-01 17:29:31+00:00,0,3,,,,Corpus_noquery
378,1300847494025408519,"If you see me sleeping in my car, mind your business. I’ve been up since 6 and I don’t leave school til 9:30 tonight.",2020-09-01 17:26:25+00:00,0,0,,,,Corpus_noquery
379,1300847448810835970,Why y’all (Republicans) (Trumptards) worry about ratings so much? ,2020-09-01 17:26:15+00:00,0,1,,,,Corpus_noquery
380,1300847074418794496,This man is delusional ,2020-09-01 17:24:45+00:00,0,0,,,,Corpus_noquery
381,1300846843082018818,"Sorry @LandryLocker but @LopezOnSports is right, there is no way Coach O will get a 6 yr extension UNLESS we win the Super Bowl! @SportsRadio610 #WeAreTexans #loopholes",2020-09-01 17:23:50+00:00,1,23,@LandryLocker @LopezOnSports @SportsRadio610,#WeAreTexans #WeAreTexans #loopholes,,Corpus_noquery
382,1300846532288294913,My graduating class wasn’t big so like 95% of them I got on social media. More than half started their junior or senior year of college this month. The rest got pregnant and have little families now. And im high af in bed with my cats feeling behind in life ,2020-09-01 17:22:36+00:00,1,23,,,,Corpus_noquery
383,1300846453531840515,The work will be worth it.,2020-09-01 17:22:17+00:00,0,1,,,,Corpus_noquery
384,1300846104657850369,Future bright and I love it,2020-09-01 17:20:54+00:00,1,2,,,,Corpus_noquery
385,1300845770816577537,Dreams by The Cranberries will always be on repeat,2020-09-01 17:19:34+00:00,0,0,,,,Corpus_noquery
386,1300845558278557697, ,2020-09-01 17:18:44+00:00,0,3,,,,Corpus_noquery
387,1300845465001512961,LARL,2020-09-01 17:18:22+00:00,1,5,,,,Corpus_noquery
388,1300845274768736256,,2020-09-01 17:17:36+00:00,0,2,,,,Corpus_noquery
389,1300844161134989313,Matrix waiting on his girlfriends !,2020-09-01 17:13:11+00:00,0,1,,,,Corpus_noquery
390,1300844072752558082,you are exactly who I want,2020-09-01 17:12:50+00:00,0,0,,,,Corpus_noquery
391,1300843885560819713,@lookner https://m.broadcastify.com/listen/feed/5915 Was hearing this one,2020-09-01 17:12:05+00:00,0,0,@lookner,,,Corpus_noquery
392,1300843822474199040,The Dude Matrix it’s always Dog Day at God Father Kennels,2020-09-01 17:11:50+00:00,0,2,,,,Corpus_noquery
393,1300843642257633280,Check us out! @Bowhuntingcom at the ATA Show 2020 want to learn more? Hit the website link check out google Instagram TikTok twitter LinkedIn YOUTube SnapChat And FaceBook hashtag @ArcheryTrade_ #GatorGrippHD #Ifitfitsitgripps,2020-09-01 17:11:07+00:00,0,0,@Bowhuntingcom @ArcheryTrade_,#GatorGrippHD #Ifitfitsitgripps,,Corpus_noquery
394,1300843608745152512,Each shirt you take. A pair of your socks will be mine,2020-09-01 17:10:59+00:00,0,0,,,,Corpus_noquery
395,1300843205005639683,big words ,2020-09-01 17:09:23+00:00,0,1,,,,Corpus_noquery
396,1300842849458696192,how do I get it to t bone me.,2020-09-01 17:07:58+00:00,0,1,,,,Corpus_noquery
397,1300842746475839489,@lookner I'm hoping Trump gets boo'd out of Kenosha and then bitches and moans at his next press conference,2020-09-01 17:07:33+00:00,0,0,@lookner,,,Corpus_noquery
398,1300842725856743425,Gonna get it one way or another!,2020-09-01 17:07:28+00:00,0,2,,,,Corpus_noquery
399,1300842624732012544,Anyone have or know a business needing tint please give me a call or dm will go out and give a free quote !! @WindshieldTexas,2020-09-01 17:07:04+00:00,1,1,@WindshieldTexas,,,Corpus_noquery
400,1300842245281722368,"@TolarianCollege glad your number one prediction for zendikar rising is correct so far as well as expeditions being back. Also, do you substitute at Strixhaven sometimes? Lol",2020-09-01 17:05:34+00:00,0,0,@TolarianCollege,,,Corpus_noquery
401,1300841973088227328,,2020-09-01 17:04:29+00:00,0,1,,,,Corpus_noquery
402,1300841004434681857,My birthday is this month and it’s just another day because i live in eternal suffering and pain and I’m all ALONEEE ,2020-09-01 17:00:38+00:00,0,3,,,,Corpus_noquery
403,1300840499830554630,proved that last night,2020-09-01 16:58:38+00:00,0,1,,,,Corpus_noquery
404,1300840067968176128,I just can’t shake the thought of you .,2020-09-01 16:56:55+00:00,0,0,,,,Corpus_noquery
405,1300840020216033280,Best food I had wen I was down there no cap,2020-09-01 16:56:43+00:00,0,1,,,,Corpus_noquery
406,1300839913458462721,Can we all agree that fetishizing petite small bodies is fucking weird and shouldn’t be a thing,2020-09-01 16:56:18+00:00,1,6,,,,Corpus_noquery
407,1300839891442585603,I haven’t talked to @fabiamoralez in a minute and she sends me this randomly Having friends that love you and care for you is literally what keeps me going ,2020-09-01 16:56:13+00:00,2,4,@fabiamoralez,,,Corpus_noquery
408,1300839678279639040,VIRGO QUEEN (am I doing this right ?),2020-09-01 16:55:22+00:00,1,26,,,,Corpus_noquery
409,1300839643542441989,"I finally read it, just a few weeks ago",2020-09-01 16:55:14+00:00,0,0,,,,Corpus_noquery
410,1300839577540849664,Idk what ur talkin bout,2020-09-01 16:54:58+00:00,0,0,,,,Corpus_noquery
411,1300839560478425088,"Arrow Exterminators CC,TX https://youtu.be/3Y_pW94UB5Q via @YouTube @ArrowExt",2020-09-01 16:54:54+00:00,0,0,@YouTube @ArrowExt,,,Corpus_noquery
412,1300839424448778242,maluma is FINEEEE,2020-09-01 16:54:21+00:00,1,16,,,,Corpus_noquery
413,1300838888378896386, ,2020-09-01 16:52:14+00:00,0,0,,,,Corpus_noquery
414,1300838831210586114,Better Well played.,2020-09-01 16:52:00+00:00,0,0,,,,Corpus_noquery
415,1300838607201218568,#byebyebugs #arrowexterminators #texascheck #bughunters #pesthunters #maskwearing #exterminator #national bravo Zulu from #surfman374 ThankYou NO @ArrowExt,2020-09-01 16:51:07+00:00,0,0,@ArrowExt,#byebyebugs #arrowexterminators #texascheck #bughunters #pesthunters #maskwearing #exterminator #national #surfman374,,Corpus_noquery
416,1300838193936429058,"You do realize: 1) ND can only accept things OFFERED to them. So blame NBC, not ND 2) Everyone is on TV now, show me the recruiting advantage. Does anyone do ANY research or think before shouting nonsense from a mountain top?",2020-09-01 16:49:28+00:00,0,1,,,,Corpus_noquery
417,1300838057395003392,"another month, another rent bill to pay ",2020-09-01 16:48:55+00:00,18,40,,,,Corpus_noquery
418,1300837612760989698,Thank you coach. Means a lot,2020-09-01 16:47:09+00:00,0,1,,,,Corpus_noquery
419,1300837570738302978,Thank you Lee! Keep getting after it out there my man ,2020-09-01 16:46:59+00:00,0,1,,,,Corpus_noquery
420,1300837369088802818,"That entire Biden in Pennsylvania episode was bizarre to say the least. He held a ""campaign rally"" inside a warehouse with a few journalists, while 20 people with Biden signs waited outside to see him. Then he mucked up his teleprompter speech? WTH was that?",2020-09-01 16:46:11+00:00,3,6,,,,Corpus_noquery
421,1300836404763725825,Listen to Dreams 2 Reality - YUNG Ft. O.G. by Oscar OG Garcia on #SoundCloud,2020-09-01 16:42:21+00:00,0,0,,#SoundCloud,,Corpus_noquery
422,1300835597062414342,i mean open your snap,2020-09-01 16:39:09+00:00,0,0,,,,Corpus_noquery
423,1300835253888655360,When the durag finally comes off ,2020-09-01 16:37:47+00:00,0,1,,,,Corpus_noquery
424,1300834963563126786,some dude just yelled out “I have no friends” in my class... you okay buddy?,2020-09-01 16:36:38+00:00,0,4,,,,Corpus_noquery
425,1300834945892593666,YESSSS FINALLY,2020-09-01 16:36:34+00:00,1,1,,,,Corpus_noquery
426,1300834472510791681,Are these the same Pt.2,2020-09-01 16:34:41+00:00,3,57,,,,Corpus_noquery
427,1300834207145619456, ,2020-09-01 16:33:37+00:00,0,0,,,,Corpus_noquery
428,1300834179786174465,Absolutes Present Pt. 2 ,2020-09-01 16:33:31+00:00,0,10,,,,Corpus_noquery
429,1300833641212391424,This is life!,2020-09-01 16:31:23+00:00,0,0,,,,Corpus_noquery
430,1300833528582680578,I-Team is hosting a virtual event with daily challenges all week where you can win great prizes! Be sure to join and follow @iteamTAMUCC !!!,2020-09-01 16:30:56+00:00,1,2,@iteamTAMUCC,,,Corpus_noquery
431,1300833136943796224,My lessons are going well and where I’m at is really sinking in. I am definitely happy with how things are despite small road bumps with technology or programs. Forward never straight. #eaglepride #fns #themove,2020-09-01 16:29:22+00:00,0,4,,#eaglepride #fns #themove,,Corpus_noquery
432,1300832820944928774,"You embody everything I hate about our generation. I don’t think you knew those folks in the 60’s. The hardest thing you’ve ever been through wouldn’t even make them bat an eye. Entitled, pampered, disreputable.",2020-09-01 16:28:07+00:00,0,2,,,,Corpus_noquery
433,1300832546691964932,,2020-09-01 16:27:02+00:00,0,0,,,,Corpus_noquery
434,1300832331368927232,All these schools not playing and our first game is on SEC ....ALTERNATE channel? https://twitter.com/Perroni247/status/1300831031226966017,2020-09-01 16:26:10+00:00,0,0,,,,Corpus_noquery
435,1300832042066882561,literally me at home,2020-09-01 16:25:01+00:00,0,3,,,,Corpus_noquery
436,1300832004481654784, ,2020-09-01 16:24:52+00:00,0,0,,,,Corpus_noquery
437,1300831985045311489,@CCISD #hoops,2020-09-01 16:24:48+00:00,0,0,@CCISD,#hoops,,Corpus_noquery
438,1300831613526380544,@magicmicscast @misterorange @OriginalOestrus @MoxReuby Is it Wednesday yet? I'm already ready for Magic Mics,2020-09-01 16:23:19+00:00,0,1,@magicmicscast @misterorange @OriginalOestrus @MoxReuby,,,Corpus_noquery
439,1300831547906457601,I’m over getting migraines,2020-09-01 16:23:03+00:00,0,1,,,,Corpus_noquery
440,1300831538582519819,Big moves this month,2020-09-01 16:23:01+00:00,1,3,,,,Corpus_noquery
441,1300831436702912517,I can’t wait for this,2020-09-01 16:22:37+00:00,1,2,,,,Corpus_noquery
442,1300830597976330241,this is too good to be true ,2020-09-01 16:19:17+00:00,0,3,,,,Corpus_noquery
443,1300829397151363073,"Hey @TheGlenlivet_Us, I’m ready to add a whisky flask to my #LaborDay weekend plans #TheGlenlivetPromo tweet that",2020-09-01 16:14:31+00:00,0,0,@TheGlenlivet_US,#LaborDay #TheGlenlivetPromo,,Corpus_noquery
444,1300829277051551749," Be not wise in thine own eyes: fear the Lord , and depart from evil. Proverbs 3:7 KJV https://bible.com/verse-of-the-day/pro.3.7/60147",2020-09-01 16:14:02+00:00,0,0,,,,Corpus_noquery
445,1300828002687881217,nothing but lames,2020-09-01 16:08:58+00:00,0,0,,,,Corpus_noquery
446,1300827941182504961,Thank you to Speedy's Snacks Snowballs for sponsoring our 2020-2021 Moody Cheer Squad!!,2020-09-01 16:08:44+00:00,0,3,,,,Corpus_noquery
447,1300827810844602368,My fav ,2020-09-01 16:08:12+00:00,0,0,,,,Corpus_noquery
448,1300827752896106498,Thank you to Arturo's Car Service for sponsoring our 2020-2021 Moody Cheer Squad!!,2020-09-01 16:07:59+00:00,0,5,,,,Corpus_noquery
449,1300827687938916355,no way it’s september.. someone’s lying to me,2020-09-01 16:07:43+00:00,0,6,,,,Corpus_noquery
450,1300827614488268800,Thank you to OMEGA CRANE for sponsoring our 2020-2021 Moody Cheer Squad!!,2020-09-01 16:07:26+00:00,0,4,,,,Corpus_noquery
451,1300827543558393857,I drink @corewaterUSA,2020-09-01 16:07:09+00:00,2,0,@corewaterUSA,,,Corpus_noquery
452,1300827506753318918,Thank you to the Blossom Shop for sponsoring our 2020-2021 Moody Cheer Squad!!,2020-09-01 16:07:00+00:00,1,8,,,,Corpus_noquery
453,1300827390168502275,Thank you to First Command for sponsoring our 2020-2021 Moody Cheer Squad!!,2020-09-01 16:06:32+00:00,1,2,,,,Corpus_noquery
454,1300827263844392960,Thank you to Pediatrix Dental for sponsoring our 2020-2021 Moody Cheer Squad!!,2020-09-01 16:06:02+00:00,0,4,,,,Corpus_noquery
455,1300827160316444672,Please support my GoFundMe campaign: https://www.gofundme.com/f/24dl9h2qtc?utm_medium=social&amp;utm_source=twitter&amp;utm_campaign=p_na+share-sheet&amp;pc_code=tw_co_dashboard_a&amp;rcid=84b46b28b5874e1388ebca13813d7d3e @gofundme,2020-09-01 16:05:37+00:00,0,0,@gofundme,,,Corpus_noquery
456,1300827149956460544,Thank you to Julio's Easy Stop for sponsoring our 2020-2021 Moody Cheer Squad!!,2020-09-01 16:05:35+00:00,1,6,,,,Corpus_noquery
457,1300826705053925377,It’s Hamilton bitch,2020-09-01 16:03:49+00:00,0,1,,,,Corpus_noquery
458,1300826492214149126,not to brag but I’ve already earned 28 cents from investing in Tesla. This money shit too easy,2020-09-01 16:02:58+00:00,0,15,,,,Corpus_noquery
459,1300826242200076288,mine to little hommie!! Yayer!!,2020-09-01 16:01:58+00:00,0,0,,,,Corpus_noquery
460,1300826165721149446,Omg omg OMGG I wasn’t emotionally prepared for this bullshit today ,2020-09-01 16:01:40+00:00,1,1,,,,Corpus_noquery
461,1300826133173358592,i literally don’t feel 20 at all lol,2020-09-01 16:01:32+00:00,0,0,,,,Corpus_noquery
462,1300826106736652289,I thought I was dreaming when I opened a Seagrams and chugged it at 3 am... it wasn’t a dream... the can is empty by my bed. College is something y’all,2020-09-01 16:01:26+00:00,0,12,,,,Corpus_noquery
463,1300825312641589249,"Hi Everyone ! Join us in wishing Dr Alyssa Gamez a very Happy Birthday! Happy, Happy Birthday! We hope you have a wonderful day with us and an even better evening with your family! @Drs McIntyre, Garza,… https://www.instagram.com/p/CEmYuXfBaC_/?igshid=1jsta5ci9y3hk",2020-09-01 15:58:17+00:00,0,0,,,,Corpus_noquery
464,1300824805000785920,you can’t even take me on a mini road trip because i have the bladder of a ant and have to pee so frequently,2020-09-01 15:56:16+00:00,0,1,,,,Corpus_noquery
465,1300824320122523649,hit me up for my OnlyFans ,2020-09-01 15:54:20+00:00,0,1,,,,Corpus_noquery
466,1300824081500168193,as i should,2020-09-01 15:53:23+00:00,0,1,,,,Corpus_noquery
467,1300823894891339782, ,2020-09-01 15:52:39+00:00,2,18,,,,Corpus_noquery
468,1300823540896325633,One week until season starts!!!!,2020-09-01 15:51:14+00:00,2,8,,,,Corpus_noquery
469,1300823126075473921,I have this written on my mirror ,2020-09-01 15:49:36+00:00,0,3,,,,Corpus_noquery
470,1300822787230138370,Windswept caramel balayage ,2020-09-01 15:48:15+00:00,0,1,,,,Corpus_noquery
471,1300821927137771521,@Murk361 &amp; his @OnlyFans subscription - #leavemealone,2020-09-01 15:44:50+00:00,0,2,@Murk361 @OnlyFans,#leavemealone,,Corpus_noquery
472,1300821782098829315,Day 3 of my partner and I living together and the two things we’ve had to *discuss* is which direction the toilet paper roll goes and if the silverware faces up or down in the dishwasher ... who knew these were important decisions ,2020-09-01 15:44:15+00:00,0,10,,,,Corpus_noquery
473,1300821346927161344,"A photo of you in January 2020 without imagining what was to come - fresh after midnight January 1st... hahahaha hahahaha Although I will say that while 2020 has been WILD, it’s been good to me & my now growing family ",2020-09-01 15:42:31+00:00,0,5,,,,Corpus_noquery
474,1300820558024712195,“But what if she had aids” ,2020-09-01 15:39:23+00:00,0,1,,,,Corpus_noquery
475,1300820282060476416,And health workers work harder,2020-09-01 15:38:17+00:00,5,20,,,,Corpus_noquery
476,1300819524611080192,iced chai tea latte with almond milk & a shot of espresso... phew ,2020-09-01 15:35:17+00:00,0,2,,,,Corpus_noquery
477,1300818093975965697,I’d say Ciara is a top tier competitor there.,2020-09-01 15:29:36+00:00,0,0,,,,Corpus_noquery
478,1300818093707595779,“Keke lightsss”,2020-09-01 15:29:36+00:00,0,1,,,,Corpus_noquery
479,1300817920587714560,Forever and always ,2020-09-01 15:28:54+00:00,0,0,,,,Corpus_noquery
480,1300817589703258114,"Hmmmmm...I guess Leftists forgot how abusive Booker was to his ex-girlfriend and how deranged and angery he got during Congressional hearings, to the point spittle was coming out of his frothing mouth. Spartacus with bulging neck veins and jazz hands.",2020-09-01 15:27:36+00:00,1,0,,,,Corpus_noquery
481,1300817308282216448,this actually made me sad FUCK,2020-09-01 15:26:28+00:00,7,46,,,,Corpus_noquery
482,1300816339888726016,Over 175 Million live streamed from different sources because TV Pundits wouldn't shut up and we wanted to watch ALL of RNC without disruption.,2020-09-01 15:22:38+00:00,0,0,,,,Corpus_noquery
483,1300816128223182855,"I literally am the voice memo queen, I use it on a daily. ",2020-09-01 15:21:47+00:00,0,0,,,,Corpus_noquery
484,1300815849239048194,LEAVE THEM ALONE. LEAVE WOMEN ALONE. DONT FUCKING TALK TO US,2020-09-01 15:20:41+00:00,0,0,,,,Corpus_noquery
485,1300815809758060545,No hate or anything but I really don’t understand my generation... like how do you talk to multiple people at once and have all of them feeling special without it meaning anything? And how do you not feel bad:(,2020-09-01 15:20:31+00:00,1,8,,,,Corpus_noquery
486,1300815317590069251,From your tweet to Cole’s . These guys forget why they play the game,2020-09-01 15:18:34+00:00,0,1,,,,Corpus_noquery
487,1300815239324237824,Is mine not good enough??!!,2020-09-01 15:18:15+00:00,0,1,,,,Corpus_noquery
488,1300814881168470017,started looking at engagement rings & i found the perfect one showed it to daniel & he says “find something more expensive.” like okay but i want THIS one. ,2020-09-01 15:16:50+00:00,0,1,,,,Corpus_noquery
489,1300814722099544066,"Marriage, beach, vodka ",2020-09-01 15:16:12+00:00,0,3,,,,Corpus_noquery
490,1300814704886132739,"Screw you MSNBC! Fascist News Network says Republicans and Trump supporters don't have a right to peacefully rally/protest in their own cities and states! Antifa/BLM can Riot, Burn, Destroy, Murder with impunity! Imagine if Democrats controlled everything?",2020-09-01 15:16:08+00:00,1,2,,,,Corpus_noquery
491,1300814637701771266,Some kid told my son the tooth fairy brings a new Lego set for the first tooth.,2020-09-01 15:15:52+00:00,0,1,,,,Corpus_noquery
492,1300814478897025025,Oooo ! That’s tasty !,2020-09-01 15:15:14+00:00,0,1,,,,Corpus_noquery
493,1300813839001415681,that’s my baby ,2020-09-01 15:12:41+00:00,1,2,,,,Corpus_noquery
494,1300812842250240004,Everyone send positive vibes to the Fashion King @SaceAlmxghty - You’ll be back brother ,2020-09-01 15:08:44+00:00,1,2,@SaceAlmxghty,,,Corpus_noquery
495,1300812209166192640,Y’all it’s not even lunch yet and this guy called yelling at me saying he will get his attorney on me ,2020-09-01 15:06:13+00:00,0,1,,,,Corpus_noquery
496,1300811573146071045,Fake propaganda !!,2020-09-01 15:03:41+00:00,0,0,,,,Corpus_noquery
497,1300811523150012416,"Always together, never apart. Maybe in distance but never in heart.",2020-09-01 15:03:29+00:00,0,0,,,,Corpus_noquery
498,1300811237471780865,They’re bonkers,2020-09-01 15:02:21+00:00,0,1,,,,Corpus_noquery
499,1300810676341026816,I just want the new madden,2020-09-01 15:00:07+00:00,0,0,,,,Corpus_noquery
500,1300810517393661952,All aboard! Hogwarts Express departs sharply at 11am ,2020-09-01 14:59:29+00:00,0,0,,,,Corpus_noquery
501,1300809530696232964,i hope he forgets to put water in his ramon when he puts it in the microwave,2020-09-01 14:55:34+00:00,3,17,,,,Corpus_noquery
502,1300809263540064256,Always gotta be that ballpoint ,2020-09-01 14:54:30+00:00,0,5,,,,Corpus_noquery
503,1300808014182715392,Just because.,2020-09-01 14:49:33+00:00,1,1,,,,Corpus_noquery
504,1300807057411637251,"Happy Birthday, James and Thank You for Your Service! ",2020-09-01 14:45:44+00:00,0,2,,,,Corpus_noquery
505,1300806728318152704,Who are they trying to fool. No fraud? Pffffftttt,2020-09-01 14:44:26+00:00,0,0,,,,Corpus_noquery
506,1300806291627995137,FACTS.,2020-09-01 14:42:42+00:00,0,1,,,,Corpus_noquery
507,1300806263895478272,I applaud those of u who actually tune in2 the bs the impeached non president shits out his mouth. I can't even stand 2hear his voice. I have that name muted on here. I dnt have 2hear his talking ball sack voice2 know he is a dotard. #TrumpIsNotWell,2020-09-01 14:42:35+00:00,0,1,,#TrumpIsNotWell,,Corpus_noquery
508,1300806056675872768,FUCKING GROSS,2020-09-01 14:41:46+00:00,0,2,,,,Corpus_noquery
509,1300805863356194817,No you don’t cause you wouldn’t know me ,2020-09-01 14:41:00+00:00,1,1,,,,Corpus_noquery
510,1300805856565567493,"After President Trump's Ingraham interview last night, I'm fairly positive they've been quietly working on it for months and they've got the goods on multiple wealthy Elites funding Antifa and BLM. I pray Soros is on the list.",2020-09-01 14:40:58+00:00,10,18,,,,Corpus_noquery
511,1300805640835694592,a goal,2020-09-01 14:40:07+00:00,2,9,,,,Corpus_noquery
512,1300804842022109184,We can go together ,2020-09-01 14:36:56+00:00,0,1,,,,Corpus_noquery
513,1300804750011752449,Omg I forgot my card ,2020-09-01 14:36:34+00:00,0,0,,,,Corpus_noquery
514,1300804256170151939,"i have availability this week, BOOK with me at Kosmo Salon in Corpus Christi, Tx. i’ll be there 11-7 mon-fri & 9-6 Saturday ",2020-09-01 14:34:37+00:00,4,7,,,,Corpus_noquery
515,1300804209110134786,"So,So, true",2020-09-01 14:34:25+00:00,0,0,,,,Corpus_noquery
516,1300804086300803072,Gotta love the South,2020-09-01 14:33:56+00:00,0,0,,,,Corpus_noquery
517,1300803941232447488,"I'm at @IHOP in Portland, TX",2020-09-01 14:33:22+00:00,0,0,@IHOP,,,Corpus_noquery
518,1300803440344469504, We have an order of @nutrition53 n53lean1 #lean1 #vanilla #fatburning #mealreplacement #protein powder coming in tomorrow! @GET A GRIP! https://www.instagram.com/p/CEmOxlzj7fs/?igshid=osw8bdvq5mcy,2020-09-01 14:31:22+00:00,0,0,@nutrition53,#lean1 #vanilla #fatburning #mealreplacement #protein,,Corpus_noquery
519,1300803077952462848,Applying to law-schools today I want all the smoke!,2020-09-01 14:29:56+00:00,0,5,,,,Corpus_noquery
520,1300803036303036418,"Jesus said in Matthew 10:39 “ He who finds his life will lose it, and he who loses his life for My sake will find it.",2020-09-01 14:29:46+00:00,0,1,,,,Corpus_noquery
521,1300802697545887744,A lady at Starbucks called me “Katherine” and I’ve never been so sad in my life:(,2020-09-01 14:28:25+00:00,0,3,,,,Corpus_noquery
522,1300801283432099844,"I agree. I honestly don't know why y'all like us so much. Coolest part about us, y'all can buy in a special store. Hell, you can even make it light up!",2020-09-01 14:22:48+00:00,0,1,,,,Corpus_noquery
523,1300800902484430849,"Right, because liberals want to tell you how to think.",2020-09-01 14:21:17+00:00,0,0,,,,Corpus_noquery
524,1300800892107665409,Can It Be December Already?,2020-09-01 14:21:15+00:00,0,2,,,,Corpus_noquery
525,1300800409305571330, ,2020-09-01 14:19:19+00:00,0,1,,,,Corpus_noquery
526,1300799606520000517, Here’s how @123VetsBaseball feels about the new District 29-5A. He’s not wrong.,2020-09-01 14:16:08+00:00,0,7,@123VetsBaseball,,,Corpus_noquery
527,1300799221793280000,Bro I be feeling like a pro,2020-09-01 14:14:36+00:00,0,0,,,,Corpus_noquery
528,1300799208186875907,YESSSSSSS SIRRRRRRRRRRRRR,2020-09-01 14:14:33+00:00,0,0,,,,Corpus_noquery
529,1300799053991677952,"Así, aquí. Para siempre @Maui, Hawaii https://www.instagram.com/p/CEmMvOQhusM/?igshid=1oab11bht9d6u",2020-09-01 14:13:56+00:00,0,1,,,,Corpus_noquery
530,1300798239977795584,"Cuddle time @Corpus Christi, Texas https://www.instagram.com/p/CEmMaeNA9Ue/?igshid=4y6e3nynr370",2020-09-01 14:10:42+00:00,0,0,,,,Corpus_noquery
531,1300796976582340609,Ambition is priceless it’s something that’s in your veins.,2020-09-01 14:05:41+00:00,0,0,,,,Corpus_noquery
532,1300796258349703168,#DumpTrump2020,2020-09-01 14:02:50+00:00,0,0,,#DumpTrump2020,,Corpus_noquery
533,1300795409841958912,What ,2020-09-01 13:59:27+00:00,0,0,,,,Corpus_noquery
534,1300795361779429381,Don’t need an alarm anymore with a puppy. Allie wakes me up at 6am sharp ,2020-09-01 13:59:16+00:00,0,0,,,,Corpus_noquery
535,1300795301612093440,"Get that bread, that head, then leave. Or whatever that song says!!!! Designer thingzzzzzz!",2020-09-01 13:59:02+00:00,0,0,,,,Corpus_noquery
