date,username,to,replies,retweets,favorites,text,geo,mentions,hashtags,id,permalink
2020-03-25 16:39:48,solidchocbunny,,0,0,0,"#AbortionIsHealthcare Texas Gov fails to act to reduce the spread of Covid-19, but he's laser-focused on blocking abortions. Ohio Gov did respond by ordering Stay At Home action, but he seized opportunity to block abortions as non-essential medical care: ",,,#AbortionIsHealthcare,1242853701833953280,https://twitter.com/solidchocbunny/status/1242853701833953280
2020-03-25 16:37:28,HanksKendyl,,0,8,7,"“Employees at Amazon warehouses in New York City, Kentucky, Florida, Texas, Michigan and Oklahoma City have tested positive for COVID-19” ",,,,1242853113767383040,https://twitter.com/HanksKendyl/status/1242853113767383040
2020-03-25 16:35:57,jae28ppr,,0,2,1,"Dickey’s has been there through tough times with our guests: 1973 OPEC Embargo, 1980’s Recession, 1987 Black Monday, 2001 Dot Com Crash, 2008 – The Great Recession, and now Living Alongside of our Guests through Covid 19 – We are Texas Tough!! https://www.dickeys.com/franchise/qualifications",,,,1242852732849082368,https://twitter.com/jae28ppr/status/1242852732849082368
2020-03-25 16:35:37,Coeleborn,,0,0,0,"Texas VA: ""If any other lab was required for him they would have placed the order but currently because of the corona virus issue, everything is being limited or cancelled"". Letting everyone die of everything else, 'cause it's not COVID-19. #HypocraticOathMyAss",,,#HypocraticOathMyAss,1242852649327869952,https://twitter.com/Coeleborn/status/1242852649327869952
2020-03-25 16:33:54,AlannaNBC5,,0,2,1,"UPDATE: COVID-19 cases in Dallas County took a massive jump from Tuesday to Wednesday with 78 new cases of the virus confirmed along with the county's sixth death. We now have 440 cases across North Texas. DETAILS http://on.nbcdfw.com/0XESdqw",,,,1242852217272651776,https://twitter.com/AlannaNBC5/status/1242852217272651776
2020-03-25 16:32:43,ChanDannyTse2,,0,0,0,"Coronavirus: What this crisis reveals about US - and its president https://www.bbc.com/news/world-us-canada-52012049 America,s 3 engines that drive the economy down. California, New York &amp; Texas. That's why Trump want COVID 19 go away. He does not want to be a one &amp; done. SARS-Cv 2, doesn't give a dame.",,,,1242851920680603653,https://twitter.com/ChanDannyTse2/status/1242851920680603653
2020-03-25 16:31:52,RCastleberry259,,0,0,0,"Excuse me .... I am not willing to let my grandparents or parents be sacrificed .... that is not what our country is about ... Older people would rather die than let Covid-19 harm US economy – Texas official ",,,,1242851704187621378,https://twitter.com/RCastleberry259/status/1242851704187621378
2020-03-25 16:31:15,TomFerree4,,0,0,1,"Calling all Texas residents! How is your telecom provider responding to the coronavirus pandemic? Here is a synopsis of telecommunications and cable television provider responses to COVID-19: https://bit.ly/39dP6hK #ConnectedNation",,,#ConnectedNation,1242851549832937472,https://twitter.com/TomFerree4/status/1242851549832937472
2020-03-25 16:31:02,LilyMcCoyCN,,0,0,0,"Calling all Texas residents! How is your telecom provider responding to the coronavirus pandemic? Here is a synopsis of telecommunications and cable television provider responses to COVID-19: https://bit.ly/39dP6hK #ConnectedNation",,,#ConnectedNation,1242851496640819200,https://twitter.com/LilyMcCoyCN/status/1242851496640819200
2020-03-25 16:30:57,pamela_pmlpatt,,0,0,0,"Texas Gov. Abbott Halts Abortions in COVID-19 Order; Says AG Paxton | Texas Values ",,,,1242851476927643648,https://twitter.com/pamela_pmlpatt/status/1242851476927643648
2020-03-25 16:30:48,ConnectedTX,,0,1,2,"Calling all Texas residents! How is your telecom provider responding to the coronavirus pandemic? Here is a synopsis of telecommunications and cable television provider responses to COVID-19: https://bit.ly/39dP6hK #ConnectedNation",,,#ConnectedNation,1242851438482665475,https://twitter.com/ConnectedTX/status/1242851438482665475
2020-03-25 16:30:37,connectednation,,0,0,1,"Calling all Texas residents! How is your telecom provider responding to the coronavirus pandemic? Here is a synopsis of telecommunications and cable television provider responses to COVID-19: https://bit.ly/39dP6hK #ConnectedNation",,,#ConnectedNation,1242851389962887171,https://twitter.com/connectednation/status/1242851389962887171
2020-03-25 16:30:17,ConnectedCEP,,0,0,0,"Calling all Texas residents! How is your telecom provider responding to the coronavirus pandemic? Here is a synopsis of telecommunications and cable television provider responses to COVID-19: https://bit.ly/39dP6hK #ConnectedNation",,,#ConnectedNation,1242851308593389576,https://twitter.com/ConnectedCEP/status/1242851308593389576
2020-03-25 16:30:03,how_sustainable,,0,1,2,"University of Texas Medical Branch at Galveston &amp; Moleculin Biotech Gear up for COVID-19 Research #UniversityofTexas #Galveston #MoleculinBiotech #COVID19 https://www.trialsitenews.com/university-of-texas-medical-branch-at-galveston-moleculin-biotech-gear-up-for-covid-19-research/",,,#UniversityofTexas #Galveston #MoleculinBiotech #COVID19,1242851248396697602,https://twitter.com/how_sustainable/status/1242851248396697602
2020-03-25 16:25:36,TxWesCareerServ,,0,0,0,"Are you out of work in Texas because of COVID-19? Here's a direct link to the Texas Workforce Commission's website. You can apply online for benefits. @TexasWesleyan @TxwesStudent @txwes_life https://twc.texas.gov/jobseekers/unemployment-benefits-services#applyForBenefits",,@TexasWesleyan @TxwesStudent @txwes_life,,1242850131147476997,https://twitter.com/TxWesCareerServ/status/1242850131147476997
2020-03-25 16:25:25,whenpigsflyyy,,0,1,1,"TEXAS Amazon worker in Katy warehouse tests positive for covid-19 ",,,,1242850082371878918,https://twitter.com/whenpigsflyyy/status/1242850082371878918
2020-03-25 16:24:39,DixisBlue2,,0,0,0,"TEXAS, Dallas County reports 78 confirmed COVID-19 coronavirus cases on Wednesday, one more death. 03-25-2020 ",,,,1242849889249353728,https://twitter.com/DixisBlue2/status/1242849889249353728
2020-03-25 16:23:20,PeriodicoZocalo,,0,1,2,"#Mundo: Tras revelar el Gobierno de Laredo, Texas, nueve casos confirmados de Covid-19, el Alcalde de Nuevo Laredo, Enrique Rivas, ordenó reforzar el cerco sanitario en los puentes internacionales. ",,,#Mundo,1242849558041935872,https://twitter.com/PeriodicoZocalo/status/1242849558041935872
2020-03-25 16:22:22,CorinaVasilopou,,2,5,3,"Older people would rather die than let Covid-19 harm US economy – Texas official https://www.theguardian.com/world/2020/mar/24/older-people-would-rather-die-than-let-covid-19-lockdown-harm-us-economy-texas-official-dan-patrick?CMP=share_btn_tw",,,,1242849314528952321,https://twitter.com/CorinaVasilopou/status/1242849314528952321
2020-03-25 16:22:21,MikeZiemer,,0,2,8,"If you operate a business in the state of Texas, the Comptroller sent an email out today about helping businesses affected by COVID-19 with relief for sales tax payments. If you didn’t get the email DM me and I’ll forward it to you.",,,,1242849311056113665,https://twitter.com/MikeZiemer/status/1242849311056113665
2020-03-25 16:22:14,Antonio13337,,0,0,1,"Texas Gov. Abbott Halts Abortions in COVID-19 Order; Says AG Paxton | Texas Values https://txvalues.org/2020/03/23/texas-gov-abbott-halts-abortions-in-covid-19-order-says-ag-paxton/#.XnuE7w1E7pg.twitter. All states should do this!!! Killing babies is most definitely not essential!! God protect our most vulnerable!",,,,1242849282836881411,https://twitter.com/Antonio13337/status/1242849282836881411
2020-03-25 16:22:00,ForganySarah,,2,0,22,"Watch it now on Facebook: Great interview with Dr. Anil Mangla- He joined the Texas Disaster Response Team as an infectious disease and public health epidemiologist... now researching #covid_19 @kens5 https://www.facebook.com/kens5/videos/205808554040408?sfns=mo",,@KENS5,#covid_19,1242849224900972546,https://twitter.com/ForganySarah/status/1242849224900972546
2020-03-25 16:21:14,_NorrisLeal_,,0,1,0,"NL Principal’s Message #TXWater #covid_19 #watersystem #watertreatment #waterpurifier #waterpurification #Texas #WaterConservation #WaterNews #USWater #Water #municipalities #waterleader #WaterIsLife",,,#TXWater #covid_19 #watersystem #watertreatment #waterpurifier #waterpurification #Texas #WaterConservation #WaterNews #USWater #Water #municipalities #waterleader #WaterIsLife,1242849029970694144,https://twitter.com/_NorrisLeal_/status/1242849029970694144
2020-03-25 16:21:03,KurtisQuillin,dekotagregory,0,0,3,"Oklahoma’s pulled the trigger: distance learning, no more HS sports for 2019-20 to curb the spread of COVID-19. Latest from the UIL is May 4th is the earliest we’d see HS sports return in Texas, but like I said when they extended it to there, that even seems optimistic ",,,,1242848985875914753,https://twitter.com/KurtisQuillin/status/1242848985875914753
2020-03-25 16:20:23,MarcelMcClinton,PatrickSvitek,1,1,1,"Please ask what he thinks about this Trump comment from ‘14 & if he’d travel with Trump to “visit and embrace” every COVID-19 patient in Texas. ",,,,1242848816803516416,https://twitter.com/MarcelMcClinton/status/1242848816803516416
2020-03-25 16:19:59,tatogarsa,,0,0,0,"trump, el vice gobernador de texas.... sobran las evidencias de que en EEUU el COVID va a ser un desastre",,,,1242848713665581056,https://twitter.com/tatogarsa/status/1242848713665581056
2020-03-25 16:18:58,JeremySWallace,,0,2,2,"President Donald Trump has issued major disaster declarations thru FEMA for Iowa and Louisiana for COVID-19 over last two days, to go with Calif, NY and Washington previously. Gov. Greg Abbott submitted his request to Trump for Texas earlier this week and awaiting approval.",,,,1242848460338053125,https://twitter.com/JeremySWallace/status/1242848460338053125
2020-03-25 16:18:35,poppy_northcutt,DrDGrossman,1,6,27,"Telemedicine for medication abortion & for consultation rather than waiting periods for other abortion procedures is what Texas needs. NOT CLINIC CLOSURES. TX govnr and AG should work to preserve access; not use covid-19 as pretext to rob Texans of their condtitutional right. ",,,,1242848365316055041,https://twitter.com/poppy_northcutt/status/1242848365316055041
2020-03-25 16:15:40,samwesleyesq,,0,2,0,"Noncustodial parents, if COVID-19 has dramatically reduced your net resources, ask the Texas Attorney General to review your file. #yourewelcome",,,#yourewelcome,1242847630469795840,https://twitter.com/samwesleyesq/status/1242847630469795840
2020-03-25 16:14:59,steve_hesse2,,0,0,0,"Texas COVID-19 local status. https://txdshs.maps.arcgis.com/apps/opsdashboard/index.html#/ed483ecd702b4298ab01e8b9cafc8b83",,,,1242847455697424384,https://twitter.com/steve_hesse2/status/1242847455697424384
2020-03-25 16:14:19,Ibrahinreyeaval,,0,0,0,"Muy buenos Días Casa Facebook JAJAJAJAJA El nuevo lema: Quédate en casa.... Covid-19 ha permitido poner al mundo en acción. Sólo Dios sabrá su propósito FELIZ DÍA y que Dios nos proteja. en Houston, Texas https://www.instagram.com/p/B-KbXpjh34v/?igshid=nzgo2bwrgobw",,,,1242847289015783426,https://twitter.com/Ibrahinreyeaval/status/1242847289015783426
2020-03-25 16:12:26,MissAmericaPie,,0,0,0,"#VONLAYNE - GREATEST OVERLAND BUS SERVICE IN #TEXAS — like a private jet that travels by Interstate! Vonlane Covid-19 Operational Update https://mailchi.mp/vonlane/covid-19?e=3f06d35f48",,,#VONLAYNE #TEXAS,1242846814790987777,https://twitter.com/MissAmericaPie/status/1242846814790987777
2020-03-25 16:11:48,NateGartrell,,2,1,7,"Damn, New York has about half the confirmed cases of COVID-19 in the US, while other heavily populated states have way less. California, by contrast, has about 5 percent. Texas and Florida combined have another +/- 5 percent,",,,,1242846656170577922,https://twitter.com/NateGartrell/status/1242846656170577922
2020-03-25 16:09:36,crocoquiet,joyce_devivre,0,0,0,"i wonder why ny is doing so poorly with covid-19? ",,,,1242846104317722624,https://twitter.com/crocoquiet/status/1242846104317722624
2020-03-25 16:08:42,ShahiBahman,ChrisCuomo,0,0,0,"Hi Chris, I live in Houston, Texas; but, I am so glad that New York is the epicenter of COVID-19. I am saying this not out of selfishness; but, because governor Cuomo is such a competent person. I am watching his news briefing and I am overjoyed by his methodological approach.",,,,1242845875124174851,https://twitter.com/ShahiBahman/status/1242845875124174851
2020-03-25 16:06:58,RobertA85402295,,0,0,0,"Other have said maybe, but it's still close to ruthless, the whole world's on pause, definitely not the older humans fault. We got here late. Microscopic life been here 3.5 billion year. Also US could look in mirror or Texas for COVID-19 sauce. Hush hush. Blame others? ",,,,1242845440707567616,https://twitter.com/RobertA85402295/status/1242845440707567616
2020-03-25 16:06:01,wcconnections,,0,0,0,"California, Texas Announce Changes Due to COVID-19 Outbreak ",,,,1242845201766461445,https://twitter.com/wcconnections/status/1242845201766461445
2020-03-25 16:05:21,MorePAIN,,0,0,0,"Lightweight prospect from Midland, Texas Michael Dutchover talks COVID-19 https://www.fightbookmma.com/lightweight-prospect-from-midland-texas-michael-dutchover-talks-covid-19/",,,,1242845033142923266,https://twitter.com/MorePAIN/status/1242845033142923266
2020-03-25 16:05:04,Nomad_Health,,0,0,3,"Many states are passing expansion measures that will enable more nurses to join the fight against COVID-19. For a full list of updates, including recent licensure changes for nurses in #Florida, #Texas, and #Alabama, please refer to this @NCSBN link: https://bit.ly/33PdZPF",,@NCSBN,#Florida #Texas #Alabama,1242844961160167424,https://twitter.com/Nomad_Health/status/1242844961160167424
2020-03-25 16:04:34,BennettNedy,,0,0,0,"I just want to know why some of these “ stupid” Fox people and the LT. Gov of Texas feel people over 65 no longer have value? Who makes this decision? Wise up people, because people of all ages are getting Covid-19 and unfortunately dying.",,,,1242844837298274307,https://twitter.com/BennettNedy/status/1242844837298274307
2020-03-25 16:04:15,Irving_Action,,0,0,0,"It is with great regret that Grey Matters To Firefighters™-Fighting for a cure for Brain Cancer, must cancel its 2020 North Texas Firefighters Agility Challenge due to the ongoing uncertainty of COVID-19 issues. Visit https://facebook.com/ToFirefighters/ Donate at https://paypal.com/donate/?token=uXtYHlJbp1W0aCD-KQljDXGSONYrY0xIvTrN5ksYM5l4y1hasdXDh-vRcBSZIvZg7dRZ5m&amp;country.x=US&amp;locale.x=US",,,,1242844755920371712,https://twitter.com/Irving_Action/status/1242844755920371712
2020-03-25 16:03:31,ToFirefighters,,0,0,0,"It is with great regret that Grey Matters To Firefighters™-Fighting for a cure for Brain Cancer, must cancel its 2020 North Texas Firefighters Agility Challenge due to the ongoing uncertainty of COVID-19 issues. Visit https://facebook.com/ToFirefighters/ Donate at https://paypal.com/donate/?token=uXtYHlJbp1W0aCD-KQljDXGSONYrY0xIvTrN5ksYM5l4y1hasdXDh-vRcBSZIvZg7dRZ5m&amp;country.x=US&amp;locale.x=US",,,,1242844572889288706,https://twitter.com/ToFirefighters/status/1242844572889288706
2020-03-25 16:02:49,American_Trades,,0,0,0,"It is with great regret that Grey Matters To Firefighters™-Fighting for a cure for Brain Cancer, must cancel its 2020 North Texas Firefighters Agility Challenge due to the ongoing uncertainty of COVID-19 issues. Visit https://facebook.com/ToFirefighters/ Donate at https://paypal.com/donate/?token=uXtYHlJbp1W0aCD-KQljDXGSONYrY0xIvTrN5ksYM5l4y1hasdXDh-vRcBSZIvZg7dRZ5m&amp;country.x=US&amp;locale.x=US",,,,1242844394040053763,https://twitter.com/American_Trades/status/1242844394040053763
2020-03-25 16:02:14,ntdaily,,0,1,2,"MAP: Take a look at where COVID-19 is in Texas: ",,,,1242844249533689858,https://twitter.com/ntdaily/status/1242844249533689858
2020-03-25 16:02:03,jparkABC,,0,0,0,"Texas Democrat @RepGonzalez says he's tested negative for COVID-19 after coming ""in close contact"" w/ a House colleague two weeks ago (McAdams or Diaz Balart) who contracted COVID-19. Gonzalez had been in self-quarantine.",,@RepGonzalez,,1242844202364477441,https://twitter.com/jparkABC/status/1242844202364477441
2020-03-25 16:01:57,marrcooo13,,0,0,2,"Students: Get Texas A&amp;M Kingsville classes to be a pass/fail for rest of semester due to COVID-19 - Sign the Petition! http://chng.it/2PzYCqLk via @Change",,@Change,,1242844177857159168,https://twitter.com/marrcooo13/status/1242844177857159168
2020-03-25 16:01:22,mike_aikman,,0,0,0,"COVID-19 March 24 | Greta Thunberg, Trump opens US by Easter, Texas, Con... https://youtu.be/_L0QV8oQ6ak via @YouTube",,@YouTube,,1242844032520208385,https://twitter.com/mike_aikman/status/1242844032520208385
2020-03-25 16:01:19,The_Mugg_Shop,,0,0,0,"It is with great regret that Grey Matters To Firefighters™-Fighting for a cure for Brain Cancer, must cancel its 2020 North Texas Firefighters Agility Challenge due to the ongoing uncertainty of COVID-19 issues. Visit https://facebook.com/ToFirefighters/ Donate at https://paypal.com/donate/?token=uXtYHlJbp1W0aCD-KQljDXGSONYrY0xIvTrN5ksYM5l4y1hasdXDh-vRcBSZIvZg7dRZ5m&amp;country.x=US&amp;locale.x=US",,,,1242844018406559745,https://twitter.com/The_Mugg_Shop/status/1242844018406559745
2020-03-25 16:01:19,newspapercup,,0,0,0,"Texas Supercomputer Joins COVID-19 Fight - https://newspapercup.com/texas-supercomputer-joins-covid-19-fight/",,,,1242844018083614722,https://twitter.com/newspapercup/status/1242844018083614722
2020-03-25 16:00:35,TheMuggShop,,0,0,0,"It is with great regret that Grey Matters To Firefighters™-Fighting for a cure for Brain Cancer, must cancel its 2020 North Texas Firefighters Agility Challenge due to the ongoing uncertainty of COVID-19 issues. Visit https://facebook.com/ToFirefighters/ Donate at https://paypal.com/donate/?token=uXtYHlJbp1W0aCD-KQljDXGSONYrY0xIvTrN5ksYM5l4y1hasdXDh-vRcBSZIvZg7dRZ5m&amp;country.x=US&amp;locale.x=US",,,,1242843834721206275,https://twitter.com/TheMuggShop/status/1242843834721206275
2020-03-25 15:59:44,MuggShop,,0,0,0,"It is with great regret that Grey Matters To Firefighters™-Fighting for a cure for Brain Cancer, must cancel its 2020 North Texas Firefighters Agility Challenge due to the ongoing uncertainty of COVID-19 issues. Visit https://facebook.com/ToFirefighters/ Donate at https://paypal.com/donate/?token=uXtYHlJbp1W0aCD-KQljDXGSONYrY0xIvTrN5ksYM5l4y1hasdXDh-vRcBSZIvZg7dRZ5m&amp;country.x=US&amp;locale.x=US",,,,1242843619708583937,https://twitter.com/MuggShop/status/1242843619708583937
2020-03-25 15:59:01,CeliaBobo,,0,0,0,"Former Texas A&amp;M basketball player David Edwards dies after battling COVID-19 | TexAgs #SmartNews",,,#SmartNews,1242843439542263813,https://twitter.com/CeliaBobo/status/1242843439542263813
2020-03-25 15:58:40,YourShotPhotos,,0,0,0,"It is with great regret that Grey Matters To Firefighters™-Fighting for a cure for Brain Cancer, must cancel its 2020 North Texas Firefighters Agility Challenge due to the ongoing uncertainty of COVID-19 issues. Visit https://facebook.com/ToFirefighters/ Donate at https://paypal.com/donate/?token=uXtYHlJbp1W0aCD-KQljDXGSONYrY0xIvTrN5ksYM5l4y1hasdXDh-vRcBSZIvZg7dRZ5m&amp;country.x=US&amp;locale.x=US",,,,1242843350891446272,https://twitter.com/YourShotPhotos/status/1242843350891446272
2020-03-25 15:58:13,TheCriticalUp,,0,0,0,"Texas State Comptroller #COVID-19 News http://ow.ly/kjam30qsDAx #salestax #compliance",,,#COVID #salestax #compliance,1242843237515177984,https://twitter.com/TheCriticalUp/status/1242843237515177984
2020-03-25 15:57:34,allisoncierra_,,0,0,0,"Students: Get Texas A&amp;M Kingsville classes to be a pass/fail for rest of semester due to COVID-19 - Sign the Petition! http://chng.it/yBDLXdgF via @Change",,@Change,,1242843074549686272,https://twitter.com/allisoncierra_/status/1242843074549686272
2020-03-25 15:57:34,militaria_shirt,,0,0,0,"It is with great regret that Grey Matters To Firefighters™-Fighting for a cure for Brain Cancer, must cancel its 2020 North Texas Firefighters Agility Challenge due to the ongoing uncertainty of COVID-19 issues. Visit https://facebook.com/ToFirefighters/ Donate at https://paypal.com/donate/?token=uXtYHlJbp1W0aCD-KQljDXGSONYrY0xIvTrN5ksYM5l4y1hasdXDh-vRcBSZIvZg7dRZ5m&amp;country.x=US&amp;locale.x=US",,,,1242843073488527361,https://twitter.com/militaria_shirt/status/1242843073488527361
2020-03-25 15:56:44,Sporting_Shirts,,0,0,0,"It is with great regret that Grey Matters To Firefighters™-Fighting for a cure for Brain Cancer, must cancel its 2020 North Texas Firefighters Agility Challenge due to the ongoing uncertainty of COVID-19 issues. Visit https://facebook.com/ToFirefighters/ Donate at https://paypal.com/donate/?token=uXtYHlJbp1W0aCD-KQljDXGSONYrY0xIvTrN5ksYM5l4y1hasdXDh-vRcBSZIvZg7dRZ5m&amp;country.x=US&amp;locale.x=US",,,,1242842864138301441,https://twitter.com/Sporting_Shirts/status/1242842864138301441
2020-03-25 15:56:31,AscentCPAGroup,,0,0,0,"State of Texas, s&amp;u tax compliance/pmts &amp; other biz resources: COVID-19: Help is Available https://content.govdelivery.com/accounts/TXCOMPT/bulletins/282fea7#.Xnt-ITV97-o.twitter via @Granicus",,@Granicus,,1242842811965284356,https://twitter.com/AscentCPAGroup/status/1242842811965284356
2020-03-25 15:56:01,marygeorgelncln,,0,0,0,"Texas Supercomputer Joins COVID-19 Fight http://dlvr.it/RSXlcX",,,,1242842686211547142,https://twitter.com/marygeorgelncln/status/1242842686211547142
2020-03-25 15:54:59,undessinparjour,,0,0,0,"aux fous! > Older people would rather die than let Covid-19 harm US economy – Texas official | World news | The Guardian ",,,,1242842422863958016,https://twitter.com/undessinparjour/status/1242842422863958016
2020-03-25 15:53:13,onahunttoday,GwenGraham,0,2,1,"@Florida *Texas @NCarolina @SCarolina @Georgia @Alabama @RealDonaldTrump *During Spring Break, Any Beaches, Bars, Hotels, Airline Flights, Restaurants That Were Open, During Spring Break, Unfortunately: Things Will Explode With Coronavirus &amp; COVID-19 IN TWO WEEKS! ",,@Florida @ncarolina @scarolina @georgia @ALABAMA @realDonaldTrump,,1242841980939501569,https://twitter.com/onahunttoday/status/1242841980939501569
2020-03-25 15:53:06,prisonfellowshp,,2,5,12,"Praying for all incarcerated men and women, correctional staff, and their families! ""COVID-19 has hit Texas prison system after inmate tests positive for coronavirus"" ",,,,1242841948412620800,https://twitter.com/prisonfellowshp/status/1242841948412620800
2020-03-25 15:52:20,ServeNow,,0,1,1,"The Texas Process Servers Association (TPSA) is offering an 8-Hour Continuing Education webinar free of charge to provide financial relief to process servers impacted by COVID-19. @TxCourts https://lawgic.al/2y8WqOW",,@TxCourts,,1242841757592805376,https://twitter.com/ServeNow/status/1242841757592805376
2020-03-25 15:50:42,FightBookMMA,,0,0,0,"Lightweight prospect from Midland, Texas Michael Dutchover talks COVID-19 https://www.fightbookmma.com/lightweight-prospect-from-midland-texas-michael-dutchover-talks-covid-19/",,,,1242841345317797888,https://twitter.com/FightBookMMA/status/1242841345317797888
2020-03-25 15:49:22,revward5,stephenrmoss,0,0,0,"Allergies are sop in central Texas in the spring. I’ve been dealing with them for weeks. No one would confuse them with COVID or the flu though.",,,,1242841011837194241,https://twitter.com/revward5/status/1242841011837194241
2020-03-25 15:47:21,lyle_schott,,0,0,0,"Texas Bans Abortions during COVID-19 Pandemic, Threatens Doctors with Jail - Michael Foust https://www.christianheadlines.com/contributors/michael-foust/texas-bans-abortions-during-covid-19-pandemic-threatens-doctors-with-jail.html via @christianhlines",,@christianhlines,,1242840504280236032,https://twitter.com/lyle_schott/status/1242840504280236032
2020-03-25 15:46:42,EvanOgdenMusic,,0,0,1,"Going Live tomorrow over on Facebook. Y’all come on! I’ve got new merch and new songs for you to check out! #covid_19 #livemusic #starvingartist #austintexas #bmitexas @Austin, Texas https://www.instagram.com/p/B-KYNWCJZLj/?igshid=uiul8fzpij8p",,,#covid_19 #livemusic #starvingartist #austintexas #bmitexas,1242840339318280195,https://twitter.com/EvanOgdenMusic/status/1242840339318280195
2020-03-25 15:45:18,Al_Solzhenitsyn,JohnCornyn,0,0,0,"YOU are not a Senator...you are a DISGRACE! A disgrace to Texas, to America, and to your mama! Just resign! Older people would rather die than let Covid-19 harm US economy – Texas official | Coronavirus outbreak | The Guardian ",,,,1242839986317164548,https://twitter.com/Al_Solzhenitsyn/status/1242839986317164548
2020-03-25 15:44:26,WInCStrongWomen,,0,0,0,"Locate community health centers, health center networks and other providers serving the uninsured in Texas. To prevent the spread of COVID-19, many centers are asking patients to call first before coming in. https://www.tachc.org/find-healthcare-center",,,,1242839768511188992,https://twitter.com/WInCStrongWomen/status/1242839768511188992
2020-03-25 15:44:11,HoustoninAction,,0,1,3,"Stuck at home?... Fill out the #2020Census form! ONLINE! http://my2020census.gov https://bit.ly/2QLk0HN #HTownCounts #HiA #Texas #Censo2020 #HazteContar #Cuentame #EveryoneCounts #StayHome #COVID #CensusChat #CensusChallenge #YesToTheCensus #SiAlCenso",,,#2020Census #HTownCounts #HiA #Texas #Censo2020 #Censo2020 #HazteContar #Cuentame #EveryoneCounts #StayHome #StayHome #COVID #CensusChat #CensusChallenge #YesToTheCensus #SiAlCenso,1242839705873534977,https://twitter.com/HoustoninAction/status/1242839705873534977
2020-03-25 15:43:58,Lucio_Nava60,,0,0,0,"Students: Get Texas A&amp;M Kingsville classes to be a pass/fail for rest of semester due to COVID-19 - Sign the Petition! http://chng.it/XP5QgcQZ via @Change",,@Change,,1242839653633458176,https://twitter.com/Lucio_Nava60/status/1242839653633458176
