date,username,to,replies,retweets,favorites,text,geo,mentions,hashtags,id,permalink
2020-05-16 15:28:50,fortenewsonline,,0,0,0,"PADECEN COVID-19 Temen Síndrome Kawasaki en 25 niños https://bit.ly/2WAZdtN #LaredoTexas #LaredoTx #Laredo #Texas #NuevoLaredo #MiguelAleman #RioBravo #McAllen #BrownsvilleTx #ElPaso",,,#LaredoTexas #LaredoTx #Laredo #Texas #NuevoLaredo #MiguelAleman #RioBravo #McAllen #BrownsvilleTx #ElPaso,1261680013725720577,https://twitter.com/fortenewsonline/status/1261680013725720577
2020-05-16 15:28:42,Trishanduke,,0,1,1,"Texas cases of COVID-19 increasing by thousands since reopening - ABC News https://abcnews.go.com/US/texas-cases-covid-19-increasing-thousands-reopening/story?id=70720497 (via @ABC)",,@ABC,,1261679979215179776,https://twitter.com/Trishanduke/status/1261679979215179776
2020-05-16 15:23:20,Meding001,nytimes,0,0,0,"Gov. Cuomo shall be impeached ! The latest Covid 19 death per million residents by states: New York 1410 New Jersey 1120 Connecticut 903 Massachusetts 795 Louisiana 520 Michigan 479 Illinois 310 Georgia 145 Florida 87 California 77 Texas 43",,,,1261678629920149507,https://twitter.com/Meding001/status/1261678629920149507
2020-05-16 15:23:05,DBChirpy,realsirignano,0,0,0,"@DBChirpy USA has 350 million people. It will take 87,000,000 to die before herd immunity. If sunshine was the key, Florida, California, Texas would have no Covid deaths. Covid doesn’t care if you are liberal or not. Covid want any lungs it can get.",,@DBChirpy,,1261678564987920385,https://twitter.com/DBChirpy/status/1261678564987920385
2020-05-16 15:22:17,vicksiern,,8,127,86,"FAUCI DOESN'T WANT PEOPLE TO USE HYDROXYCHLOROQUINE, EVEN THOUGH. DR. LOZANO, FROM TEXAS, HAS 100% CURE RATE FOR COVID-19. Pharmacists weren't wanting to give Dr. LOZANO the prescriptions. She called R State Senator, Bob Hall. The State Pharmacy Board backed down. IT WORKS!",,,,1261678365175472128,https://twitter.com/vicksiern/status/1261678365175472128
2020-05-16 15:20:38,Khanoisseur,Khanoisseur,3,26,25,"6. States like Texas and Georgia (which is adding 500-1000 new coronavirus cases a day) are building the “second wave” that is already spilling over their borders and will soon sweep back over New York, which will see a spike in Covid-19 infections much earlier than projected. ",,,,1261677949746655235,https://twitter.com/Khanoisseur/status/1261677949746655235
2020-05-16 15:20:04,Enrique67715039,,0,1,0,"Dr. Ivette Lozano speaking in Dallas, Texas about COVID-19/Corona Virus ... https://youtu.be/Bho803qRmkk vía @YouTube",,@YouTube,,1261677808226570242,https://twitter.com/Enrique67715039/status/1261677808226570242
2020-05-16 15:19:39,bloody_scandal,MtnMediaHouse,0,2,2,"There was a guy killed in a motorcycle wreck in Texas who died from COVID-19 according to the death certificate. It’s all lies mate. Calm down before you have a stroke and do your own research.",,,,1261677701880000513,https://twitter.com/bloody_scandal/status/1261677701880000513
2020-05-16 15:18:46,brayc2,,0,0,1,"I suspect all states are over-reporting COVID19 deaths. I know of only one person here in Texas who even had it, and she is recovered. Colorado amends coronavirus death count - says fewer have died of COVID-19 than previously reported ",,,,1261677479896535040,https://twitter.com/brayc2/status/1261677479896535040
2020-05-16 15:17:58,StephanieA2527,loveingtruenews,0,0,1,"Remember everyone tagging on Texas? We have 25 million ppl and less deaths. And the cdc helped covid spread here by real easing someone who was positive.",,,,1261677277814968324,https://twitter.com/StephanieA2527/status/1261677277814968324
2020-05-16 15:16:56,debraj112,tedcruz,0,1,7,"If I were you, I would care about the testing rates in Texas and the reports on deaths from COVID-19. States will similar infection rates have higher death tolls. Is the count being suppressed? If it is, we'll find out eventually.",,,,1261677018036482048,https://twitter.com/debraj112/status/1261677018036482048
2020-05-16 15:16:18,Khanoisseur,Khanoisseur,2,11,20,"5. At this rate, Texas will lose tens of thousands of workers to quarantines due to Covid-19 spreading from the “reopen”. Will workers be forced to work through the quarantine? Will employers be able to quickly replace them? Will workers have jobs to return to post-quarantine? ",,,,1261676856841048068,https://twitter.com/Khanoisseur/status/1261676856841048068
2020-05-16 15:13:55,talkinghead3,,0,0,0,"Hospitalizations, Daily Cases Stable in Texas After Phased Reopening https://www.breitbart.com/politics/2020/05/15/coronavirus-hospitalizations-daily-cases-stable-in-texas-after-phased-reopening/ via @BreitbartNews More good news about the decline of COVID-19 cases in a large state that that has opened up for business",,@BreitbartNews,,1261676260062662658,https://twitter.com/talkinghead3/status/1261676260062662658
2020-05-16 15:13:51,MRCANNIZZARO23,,0,0,0,"Texas cases of COVID-19 increasing by thousands since reopening",,,,1261676241419210752,https://twitter.com/MRCANNIZZARO23/status/1261676241419210752
2020-05-16 15:13:45,Kathiec14,Amy_Siskind,0,0,1,"El Paso’s Republican mayor had many many many disagreements with Greg Abbott about opening us up since we had not peaked. We have surged 60% in two weeks. Thanks Governor. Way to represent. #COVID19 #Texas #Abbott #COVID ",,,#COVID19 #Texas #Abbott #COVID,1261676216458805251,https://twitter.com/Kathiec14/status/1261676216458805251
2020-05-16 15:13:34,moo_jam1,i_am_mr_krabs,1,0,0,"But this assumes the pro-Trump admin is reporting COVID deaths at such homes accurately. Again, Texas has high rates of diabetes and obesity, which COVID death rates, yet its death rates are remarkably low compared to other likewise unhealthy states. Still unexplained.",,,,1261676169633525760,https://twitter.com/moo_jam1/status/1261676169633525760
2020-05-16 15:13:04,ABC6,,0,0,0,"Texas cases of COVID-19 increasing by thousands since reopening ",,,,1261676043007676416,https://twitter.com/ABC6/status/1261676043007676416
2020-05-16 15:11:14,Mewymeryl,,0,1,1,"Texas Doctor Explains How HCQ (Treament/Cure) Improves COVID-19 Patients in 5 Hours https://www.qmap.pub/read/4245 #Qanon #WeAreTheNewsNow #FactsMatter #WWG1WGA #WakeUpAmerica #UnitedNotDivided #SaveAmerica #GreatAwakening",,,#Qanon #WeAreTheNewsNow #FactsMatter #WWG1WGA #WakeUpAmerica #UnitedNotDivided #SaveAmerica #GreatAwakening,1261675582229630976,https://twitter.com/Mewymeryl/status/1261675582229630976
2020-05-16 15:11:12,covidcharts1,,0,0,1,"New Case and Fatality updates for Texas &amp; Georgia &amp; Tennessee #COVID19 #COVID #coronavirus #C19",,,#COVID19 #COVID #coronavirus #C19,1261675575380512770,https://twitter.com/covidcharts1/status/1261675575380512770
2020-05-16 15:10:19,11thArkansas,,0,1,0,"Covid 19 Per Capita Death Rate by State: #1 New York #47 Texas Just one more reason to live in Texas. And Not New York",,,,1261675351664721920,https://twitter.com/11thArkansas/status/1261675351664721920
2020-05-16 15:07:43,RepKevinBrady,,28,28,54,"TEXAS REOPENING SAFELY Infection rate of positive Covid-19 cases: Down 2/3 from its peak in April. Down 15% since @GovAbbott began reopening Texas. #TexasReopensSafely",,@GovAbbott,#TexasReopensSafely,1261674699966287872,https://twitter.com/RepKevinBrady/status/1261674699966287872
2020-05-16 15:07:39,wayneburnside,steelcitycrazy,1,0,1,"What that commie has done to this state is inexcusable. Not to mention the creep he has as health secretary. He took his mother out of her nursing facility and sentenced our elderly family to death by putting Covid patients in nursing homes.",,,,1261674680621993985,https://twitter.com/wayneburnside/status/1261674680621993985
2020-05-16 15:03:05,robnk863,NASCAR,0,0,0,"David Kelm RN in texas who left home &amp; went to Los Angeles to work in a covid 19 unit for 3 weeks",,,,1261673530799861766,https://twitter.com/robnk863/status/1261673530799861766
2020-05-16 15:02:49,scjdaved,,1,0,0,"In Amarillo Texas local public health officials fully disclosed over 400 positive #COVID__19 cases at a @TysonFoods j",,@TysonFoods,#COVID__19,1261673466387972099,https://twitter.com/scjdaved/status/1261673466387972099
2020-05-16 15:02:49,newtexan503,,0,0,0,"Dwyane Wertz of Rockport Texas has stage 4 cancer! Victoria texas va said that covid 19 is more important! Its time to close down va and get American vetetans the equal treatment as American citizens!",,,,1261673464823525376,https://twitter.com/newtexan503/status/1261673464823525376
2020-05-16 15:02:05,SoCallls,,0,1,2,"#gopgenocide @GovAbbott Two weeks after Gov. Abbott’s ‘reopening,’ Texas reports single-day high COVID deaths ",,@GovAbbott,#gopgenocide,1261673278898180096,https://twitter.com/SoCallls/status/1261673278898180096
2020-05-16 15:01:51,Lori31803773,Amy_Siskind,0,0,0,"Yup governor is really smart isn’t he?? Maybe Texas should have to pay double for ppe and Just stop treating covid cases",,,,1261673219863408640,https://twitter.com/Lori31803773/status/1261673219863408640
2020-05-16 15:00:55,Expungements4u,,0,0,0,"ASK ABOUT THE COVID 19 SPECIAL... DIVORCE EXPUNGEMENTS PARDON WILLS BANKRUPTCY CHAPTER 7 IN KS IS $200 / OKLAHOMA $TEXAS $300 / MISSOURI $150! NO FACE TO FACE APPOINTMENT... CALL AND GET STARTED NOW! 316-210-0773 620-314-6352 ",,,,1261672987692072967,https://twitter.com/Expungements4u/status/1261672987692072967
2020-05-16 14:59:03,Drawitall,,0,0,0,"@alinaselyukh Diary ofa Radio Junkie: 1638Days of Waking Up to the News #coronavirus #COVID19 #CoronavirusUSA #covid_19 #SteveLinick #StateDept #Pompeo #PompeoGate #jcpenney #bankruptcy #depression #ItalyCoronavirus #HouseDems #Pelosi #KevinMcCarthy #Vote #VoteByMail #Texas #art",,@alinaselyukh,#coronavirus #COVID19 #CoronavirusUSA #covid_19 #SteveLinick #StateDept #Pompeo #PompeoGate #jcpenney #bankruptcy #depression #ItalyCoronavirus #HouseDems #Pelosi #KevinMcCarthy #Vote #VoteByMail #Texas #art,1261672517665726466,https://twitter.com/Drawitall/status/1261672517665726466
2020-05-16 14:56:51,Drawitall,,0,0,0,"@michelekelemen Diary of a Radio Junkie: 1638 Days of Waking Up to the News #coronavirus #COVID19 #CoronavirusUSA #covid_19 #SteveLinick #StateDept #Pompeo #PompeoGate #jcpenney #bankruptcy #depression #ItalyCoronavirus #HouseDems #Pelosi #KevinMcCarthy #Vote #VoteByMail #Texas ",,@michelekelemen,#coronavirus #COVID19 #CoronavirusUSA #covid_19 #SteveLinick #StateDept #Pompeo #PompeoGate #jcpenney #bankruptcy #depression #ItalyCoronavirus #HouseDems #Pelosi #KevinMcCarthy #Vote #VoteByMail #Texas,1261671962805485574,https://twitter.com/Drawitall/status/1261671962805485574
2020-05-16 14:56:38,MaxNordau,binarybits,1,0,0,"A set of graphs is an analysis. You concluded: ""Here in the US, some states are doing well. A lot are... not."" You put New York in the middle category, and Texas in the bottom category. But New York has 31x as many COVID deaths per capita as Texas. https://www.realclearpolitics.com/coronavirus/country/united-states/",,,,1261671908308914178,https://twitter.com/MaxNordau/status/1261671908308914178
2020-05-16 14:56:16,MizJette,realTuckFrumper,0,0,0,"I volunteer to help you pack! Go to Texas and go now, California citizens who are doing their best to not spread the deadly covid-19 virus do not need or welcome you here. ",,,,1261671815576842240,https://twitter.com/MizJette/status/1261671815576842240
2020-05-16 14:56:06,MizJette,realTuckFrumper,0,0,0,"I volunteer to help you pack! Go to Texas and go now, California citizens who are doing their best to not spread the deadly covid-19 virus do not need or welcome you here.",,,,1261671775298961408,https://twitter.com/MizJette/status/1261671775298961408
2020-05-16 14:55:31,charleywilkison,,0,7,20,"My first public statement re: COVID-19 was March 13th, that’s 63 days ago. Texas Officers still deserve statewide uniform coverage through a Presumptive Executive Order @GovAbbott @CLEAT @FWPOA @DallasNLLEO @ATXPOA @SAPoliceAssn",,@GovAbbott @CLEAT @FWPOA @DallasNLLEO @ATXPOA @SAPoliceAssn,,1261671626938212353,https://twitter.com/charleywilkison/status/1261671626938212353
2020-05-16 14:54:17,Drawitall,,0,0,1,"@GilesSnyder Diary of a Radio Junkie: 1638 Days of Waking Up to the News #coronavirus #COVID19 #CoronavirusUSA #covid_19 #SteveLinick #StateDept #Pompeo #PompeoGate #jcpenney #bankruptcy #depression #ItalyCoronavirus #HouseDems #Pelosi #KevinMcCarthy #Vote #VoteByMail #Texas #art",,@GilesSnyder,#coronavirus #COVID19 #CoronavirusUSA #covid_19 #SteveLinick #StateDept #Pompeo #PompeoGate #jcpenney #bankruptcy #depression #ItalyCoronavirus #HouseDems #Pelosi #KevinMcCarthy #Vote #VoteByMail #Texas #art,1261671317595664384,https://twitter.com/Drawitall/status/1261671317595664384
2020-05-16 14:53:49,hbecerraLATimes,,0,6,13,"Two great dispatches from hospital COVID-19 units. By ⁦@brittny_mejia⁩ in Victorville, CA https://www.latimes.com/california/story/2020-05-13/coronavirus-test-second-infection-hospital and ⁦@mollyhf⁩ from Texas ",,@brittny_mejia @mollyhf,,1261671200767401989,https://twitter.com/hbecerraLATimes/status/1261671200767401989
2020-05-16 14:53:44,cfanch,,0,0,1,"Every day I look at the Texas Covid data. And, every day, I wonder about these people who are so strong that they don't need masks. What jerks. Their ""strength"" is making the rest of us sick. #wearamask and show your real strength.",,,#wearamask,1261671177552039936,https://twitter.com/cfanch/status/1261671177552039936
2020-05-16 14:53:19,ChristianneQ,CNNnewsroom,0,0,0,"so glad #texas decided to gamble with #COVID first so the rest of the #Usa can watch and see what happens with the #texas guinea pigs.",,,#texas #COVID #Usa #texas,1261671076343447553,https://twitter.com/ChristianneQ/status/1261671076343447553
2020-05-16 14:51:16,vicksiern,,6,140,80,"HYDROXYCHLOROQUINE WORKS TO TREAT COVID-19 100% OF THE TIME according to Dr. IVETTE LOZANO, MD, Founder of Lozano Medical Clinic, Dallas, Texas. If I get Covid-19, I want to",,,,1261670557507973122,https://twitter.com/vicksiern/status/1261670557507973122
2020-05-16 14:50:56,1AreYouKittenMe,,0,4,4,"This small Texas hospital is finding ways to save COVID-19 patients. The doctor has treated 50 patients with the Hydroxychloroquine Cocktail and none have died. #Covid19 #Hydroxychloroquine https://www.latimes.com/world-nation/story/2020-05-15/this-small-texas-hospital-is-finding-ways-to-save-covid-19-patients",,,#Covid19 #Hydroxychloroquine,1261670476545495041,https://twitter.com/1AreYouKittenMe/status/1261670476545495041
2020-05-16 14:49:58,NinaHelsing,,0,0,0,"Covid-19/Coronavirus: 5 States California, Florida, Texas, Connecticut, Louisiana Last 14 days average increase (%) of cases and deaths ",,,,1261670230998343682,https://twitter.com/NinaHelsing/status/1261670230998343682
2020-05-16 14:48:06,NinaHelsing,,0,0,0,"Covid-19/Coronavirus: 5 States California, Florida, Texas, Connecticut, Louisiana Deaths&gt;500, Cases&gt;20000 ",,,,1261669759575343110,https://twitter.com/NinaHelsing/status/1261669759575343110
2020-05-16 14:47:35,RuralOntWoman,CTVNews,0,1,6,"Why are we opening everything up? Texas opened everything up two weeks ago and the last 24 hours have seen their highest covid death rate. And now children are getting sick too. Spanish flu was two years long....",,,,1261669633200762888,https://twitter.com/RuralOntWoman/status/1261669633200762888
2020-05-16 14:47:28,johnpalmay,marcuslemonis,0,0,1,"Marcus do you guys rent RV’s as well? We live in Texas, our daughter and son-in-law expecting 1st grandchild. We want to take gram and papa to baby shower but don’t want to fly them because of covid. Papa (85) has Parkinson’s so very hard on him. But I thought if we could (cont)",,,,1261669600619610113,https://twitter.com/johnpalmay/status/1261669600619610113
2020-05-16 14:46:59,Drawitall,,0,0,3,"Diary of a Radio Junkie: 1638 Days of Waking Up to the News #coronavirus #COVID19 #CoronavirusUSA #covid_19 #SteveLinick #StateDept #Pompeo #PompeoGate #jcpenney #bankruptcy #depression #ItalyCoronavirus #HouseDems #Pelosi #KevinMcCarthy #Vote #VoteByMail #Texas #drawingoftheday",,,#coronavirus #COVID19 #CoronavirusUSA #covid_19 #SteveLinick #StateDept #Pompeo #PompeoGate #jcpenney #bankruptcy #depression #ItalyCoronavirus #HouseDems #Pelosi #KevinMcCarthy #Vote #VoteByMail #Texas #drawingoftheday,1261669480494772224,https://twitter.com/Drawitall/status/1261669480494772224
2020-05-16 14:45:34,NinaHelsing,,0,0,0,"Covid-19/Coronavirus: 5 States California Florida Texas Connecticut Louisiana 2/2 ",,,,1261669125111320579,https://twitter.com/NinaHelsing/status/1261669125111320579
2020-05-16 14:44:57,chaneyfamily7,,0,0,0,"26 companies have furloughed or laid off San Antonio and Texas workers due to COVID-19 ",,,,1261668967594196994,https://twitter.com/chaneyfamily7/status/1261668967594196994
2020-05-16 14:44:23,NinaHelsing,,1,0,0,"Covid-19/Coronavirus: 5 States California Florida Texas Connecticut Louisiana 1/2 ",,,,1261668825210257408,https://twitter.com/NinaHelsing/status/1261668825210257408
2020-05-16 14:42:48,wise_diva,,0,1,1,"This small Texas hospital is finding ways to save COVID-19 patients ",,,,1261668426466164771,https://twitter.com/wise_diva/status/1261668426466164771
2020-05-16 14:42:43,indivisibleATX,,1,15,18,"Is Texas Inflating Its COVID-19 Testing Numbers by Including Antibody Tests? ",,,,1261668407407247360,https://twitter.com/indivisibleATX/status/1261668407407247360
2020-05-16 14:41:38,EngelsAngle,,5,5,11,"As the world pushes to find a COVID-19 vaccine, some immunization experts believe Texas is inadequately prepared to execute a mass vaccination event when one arrives. @KXAN_News #txlege",,@KXAN_News,#txlege,1261668135431737346,https://twitter.com/EngelsAngle/status/1261668135431737346
2020-05-16 14:40:38,TALAPolicy,,0,0,1,"COVID-19 FAQs with HHS for Texas ALF Providers, May 20th 11am HHS is providing on-going opportunities for Texas ALF providers to hear about recent updates and to ask questions relating to COVID-19. May 20, 11 – noon Register at the link below: ",,,,1261667881210839041,https://twitter.com/TALAPolicy/status/1261667881210839041
2020-05-16 14:39:34,priesterpr,,0,0,0,"Texas doctor shares ‘critical’ situation, says ‘alarming’ requirement needed to obtain specific covid meds - ",,,,1261667613077356545,https://twitter.com/priesterpr/status/1261667613077356545
2020-05-16 14:37:16,VictorBlackbu14,,0,1,3,"I'm a Texas veteran with an autoimmune disease that makes me a high risk of dying from COVID-19. I requested a vote-by-mail request a few days ago. I haven't done anything to offend AG Ken Paxton; but he'd apparently rather see me dead than voting.",,,,1261667037295886337,https://twitter.com/VictorBlackbu14/status/1261667037295886337
2020-05-16 14:35:50,coton_luver,,0,3,2,"Covid-19 screening guidelines in GA, OH &amp; PA suggest that workers with temps of 100.4° should be sent home bc of novel coronavirus. But the cutoff is 100° in Texas &amp; in Delaware: 99.5 degrees. Some states don’t suggest temperature screenings at all. ",,,,1261666673687359495,https://twitter.com/coton_luver/status/1261666673687359495
2020-05-16 14:32:33,pvand1,gougis_jr,0,0,0,"We know there is deception going on. No test, no increase. Covid does not exist if there is no diagnosis. So Florida, Georgia, and Texas; do you think we don't know? And Nebraska, you are disgusting. We are on planet Republican Tralfamador. A new and different reality.",,,,1261665849284280322,https://twitter.com/pvand1/status/1261665849284280322
2020-05-16 14:32:04,kenbielicki,RitaLucido,1,0,0,"It's from the Texas Tribune and it represents daily reported #COVID cases for Texas",,,#COVID,1261665725674029057,https://twitter.com/kenbielicki/status/1261665725674029057
2020-05-16 14:29:53,bobpatin,,0,0,0,"Just because demented TX @govabbott decreed that barber shops and restaurants should re-open in Texas, doesn’t mean people should go, any more than an insane person speculating about ingesting poison might be a way to ward off COVID-19.",,@GovAbbott,,1261665176920690694,https://twitter.com/bobpatin/status/1261665176920690694
2020-05-16 14:28:34,TantumVero,rdixon175,1,0,0,"Give it a couple weeks. Texas spiked in both new cases reported (~1K/day) &amp; new deaths (~85/day). Florida has also seen their cases jump despite their admission that they're censoring data. As COVID takes ~14 days to develop, the spikes are a bit delayed. Georgia's is coming.",,,,1261664846405386245,https://twitter.com/TantumVero/status/1261664846405386245
2020-05-16 14:28:06,acfixer2008,Neoavatara,0,0,0,"Texas has 29 million ppl. As of this morning, 1308 total deaths. We clearly in Tx do not have the testing to know how many of us have or have had covid, but 0.000045, or 45 one thousandths of 1% of total pop of texas has died. It is absurd, and cowardly to not reopen fully! ",,,,1261664728474140674,https://twitter.com/acfixer2008/status/1261664728474140674
2020-05-16 14:28:00,peterwsinger,,2,7,9,"The sun came up this morning and, as everyone told @GOP would happen, Texas coronavirus cases escalate after ignoring science. ""For the eighth day in a row, Texas has recorded more than 1,000 new confirmed cases of COVID-19"" ",,@GOP,,1261664701999493126,https://twitter.com/peterwsinger/status/1261664701999493126
2020-05-16 14:26:42,bradktennant,ClayTravis,2,0,21,"Not to mention Texas is still near the lowest COVID rate in North America, and even the surge they’re trying to claim is happening would bring them from a .07% rate to a .075% rate. Hardly something that would test the healthcare system.",,,,1261664377561681921,https://twitter.com/bradktennant/status/1261664377561681921
2020-05-16 14:25:24,DeadLetterBox,AmericanBrit4,1,0,1,"Maybe being a nurse in a hospital in Texas they felt they didn't need to read an article in the Hospital to know what was going on with covid in the state? Just a guess.",,,,1261664048535547905,https://twitter.com/DeadLetterBox/status/1261664048535547905
2020-05-16 14:21:29,MaryWCVB,SteveOweathaguy,0,0,0,"Texas has seen a steady increase in Covid cases since some businesses reopened at 25% 2 weeks ago. The average new cases each day hovers around 1,227.",,,,1261663062458843136,https://twitter.com/MaryWCVB/status/1261663062458843136
2020-05-16 14:21:01,PTSDCOLLAB,,0,0,0,"@BillNeelyNBC BREAKING NEWS : WE MAY LOSE MORE OF OUR EVERYDAY HEROS TO SUICIDE FROM PTSD, THAN WE DID TO COVID-19 IF WE ARE NOT CAREFUL DALLAS; TEXAS;05/13: MORE INFO IN PRESS RELEASE ",,@BillNeelyNBC,,1261662947455066112,https://twitter.com/PTSDCOLLAB/status/1261662947455066112
2020-05-16 14:15:40,razorwirewoman,,0,1,1,"How COVID-19 Upended Texas Prisons ",,,,1261661598827122691,https://twitter.com/razorwirewoman/status/1261661598827122691
2020-05-16 14:15:05,TXHealthCareers,,0,0,1,"We love that our former #employees returned to Texas Health to help with the fight against COVID-19. Eddie Lescure, a registered #nurse, returned to Texas Health Arlington Memorial to lend a helping hand in the ICU. http://ow.ly/QeTi50zFjPo",,,#employees #nurse,1261661453397958656,https://twitter.com/TXHealthCareers/status/1261661453397958656
2020-05-16 14:15:03,mavinga_esther,,0,0,4,"In Texas, people live like they don't know Covid 19. We can go to the mall, go to the restaurant and go to the gymn. They don’t care about covid 19 .",,,,1261661445302992897,https://twitter.com/mavinga_esther/status/1261661445302992897
2020-05-16 14:13:15,wynnnter,wynnnter,1,0,1,"Adding on , it’s crazy how both the Flu and Corona are easily contracted. This winter will be very sad . Even still though Covid has not reached nearly the deaths the flu does in a few months of it being around . Cases of Covid in Texas are going down just a tad bit .",,,,1261660989998665729,https://twitter.com/wynnnter/status/1261660989998665729
2020-05-16 14:12:03,GmsP75930811,,0,0,0,"Turkey-France-A Dr. In Texas, many others using Hydroxychloroquine 2treat COVID-19 successfully, yet, we are told here in NYS /USA It doesnt work Bullshit side effects-bullshit, what the HELL is going on here? population CONTROL? COME ON @realDonaldTrump @WhiteHouse",,@realDonaldTrump @WhiteHouse,,1261660691242549249,https://twitter.com/GmsP75930811/status/1261660691242549249
2020-05-16 14:11:16,annehebert,,1,0,0,"@KVUE the link to your new live blog from this page is broken: Coronavirus updates in Central Texas: Travis County reports 3 new deaths from COVID-19 ",,@KVUE,,1261660494148100096,https://twitter.com/annehebert/status/1261660494148100096
2020-05-16 14:10:55,smokefreepdn,TexasTribune,0,0,0,"Texas COVID-19 Mental Health Support Line: 833-986-1919 #OkayToSay #mentalhealth",,,#OkayToSay #mentalhealth,1261660403928567809,https://twitter.com/smokefreepdn/status/1261660403928567809
2020-05-16 14:09:54,Birb03703217,,0,0,0,"Texas Gov. Knew Reopening State Would Spike COVID-19 Cases | NowThis https://go.pache.co/1077d2c0",,,,1261660148407382017,https://twitter.com/Birb03703217/status/1261660148407382017
2020-05-16 14:08:40,ChuckDeBroder,,0,0,1,"This is a COVID-19 Update provided by the Texas Department of State Health. ",,,,1261659836594429952,https://twitter.com/ChuckDeBroder/status/1261659836594429952
2020-05-16 14:08:38,KayCars05704231,,0,0,0,"Dr. Ivette Lozano speaking in Dallas, Texas about COVID-19/Corona Virus ... https://youtu.be/Bho803qRmkk via @YouTube",,@YouTube,,1261659830592458752,https://twitter.com/KayCars05704231/status/1261659830592458752
2020-05-16 14:07:14,Shadowstalker20,,0,0,0,"Dr. Ivette Lozano speaking in Dallas, Texas about COVID-19 https://www.bitchute.com/video/RVhBPAsUJ8Tz/ #BitChute",,,#BitChute,1261659475406176256,https://twitter.com/Shadowstalker20/status/1261659475406176256
2020-05-16 14:07:03,LizLovesTheUSA,,0,0,0,"""This small Texas hospital is finding ways to save COVID-19 patients"" ",,,,1261659429361070080,https://twitter.com/LizLovesTheUSA/status/1261659429361070080
