date,username,to,replies,retweets,favorites,text,geo,mentions,hashtags,id,permalink
2020-05-16 20:21:21,AngelaJ84884786,,0,0,0,"@JoeBiden @dnc You need to start courting Latinos in Arizona, Texas &amp; Florida!!! Talk healthcare, education, covid! They are a very important voting block! GET OUT THERE! EVERYTHING IS ON THE LINE HERE!!! @MikeBloomberg",,@JoeBiden @DNC @MikeBloomberg,,1261753624864018433,https://twitter.com/AngelaJ84884786/status/1261753624864018433
2020-05-16 20:19:25,apearlpicnic,,0,0,1,"They’ve reopened Texas and we’re “supposed” to be at “25% occupancy” but my job is like what if we functioned exactly the way we did before COVID because restrictions would inconvenience rich people",,,,1261753139188969472,https://twitter.com/apearlpicnic/status/1261753139188969472
2020-05-16 20:19:08,jmills1955,,3,2,9,"Premature re-opening? The data are concerning for #Texas One of 4 states with increasing #COVID cases - 2 weeks after #StayHome policy was allowed to stop by @GovAbbott @LinaHidalgoTX @HarrisCoJudge @SylvesterTurner @DrPaulKlotman @DocWoc71 @TXMedCenter https://twitter.com/Atul_Gawande/status/1258762171078643713",,@GovAbbott @LinaHidalgoTX @HarrisCoJudge @SylvesterTurner @DrPaulKlotman @DocWoc71 @TXMedCenter,#Texas #COVID #StayHome #StayHome,1261753069869686785,https://twitter.com/jmills1955/status/1261753069869686785
2020-05-16 20:19:02,MomNationOfLaws,MomNationOfLaws,0,0,0,"@SenTedCruz I am responding here that doctors in Texas not being able to prescribe HCQ for Covid. It works &amp; president likes it but Fauci doesn't. We need the med it works. A vaccine even a month away is too long. We need to stop it being prohibited nationwide so we can open up. ",,@SenTedCruz,,1261753042719830016,https://twitter.com/MomNationOfLaws/status/1261753042719830016
2020-05-16 20:18:10,lindalouresists,,0,1,1,"Really?? Geeee how the heck did that happen?? When do those shopping malls open?? How about another big demonstration w your AR-15’s??? What could possibly go wrong??? THIS!!!! Texas cases of COVID-19 increasing by thousands since reopening https://abcnews.go.com/US/texas-cases-covid-19-increasing-thousands-reopening/story?id=70720497",,,,1261752825874391040,https://twitter.com/lindalouresists/status/1261752825874391040
2020-05-16 20:17:05,newtexan503,,0,0,0,"I have lost 3 veteran friends since march 2020! Because va wont test for cancer when the veterans asked for test. Now i have another veteran that they refused to test for cancer saying covid 19 is more important! (Victoria Texas Va)",,,,1261752553735442433,https://twitter.com/newtexan503/status/1261752553735442433
2020-05-16 20:15:37,homoticus,MariaPo75485679,1,0,0,"Hay 50 mil médicos mexicanos atendiendo COVID si han muerto 30 o 100 la probabilidad es de 0.08 %, eso es casi cero, es uno en mil mas o menos, me enrolo sin bronca. Un médico de Texas dijo que C**VD es un disparador de decesos que toma el lugar de otras crisis respiratorias.",,,,1261752185588715526,https://twitter.com/homoticus/status/1261752185588715526
2020-05-16 20:15:09,caristocks1,,0,0,0,"International: Texas COVID-19 cases rise, governor’s office says more testing being done #Antigua #CaribbeanNews #covid_19 #covid19 Learn More",,,#Antigua #CaribbeanNews #covid_19 #covid19,1261752068412506114,https://twitter.com/caristocks1/status/1261752068412506114
2020-05-16 20:14:40,Platurn,,0,0,1,"Idiots... Texas COVID-19 cases rise, governor's office says more testing being done - ABC News - https://abcn.ws/3cyIcGi via @ABC",,@ABC,,1261751943623438336,https://twitter.com/Platurn/status/1261751943623438336
2020-05-16 20:14:25,JustASeeker1,,0,0,0,"Texas cases of COVID-19 increasing by thousands since reopening ",,,,1261751879769309184,https://twitter.com/JustASeeker1/status/1261751879769309184
2020-05-16 20:14:13,S85178938,,0,0,0,"Texas Gov. Greg Abbott Is Cracking Down on Cities’ Enforcement of COVID-19 Orders, but Many Already Took a Lax Approach ",,,,1261751830305882112,https://twitter.com/S85178938/status/1261751830305882112
2020-05-16 20:13:34,freedomwurkz,,0,0,0,"Dr. Ivette Lozano speaking in Dallas, Texas about COVID-19/Corona Virus ... https://youtu.be/Bho803qRmkk via @YouTube",,@YouTube,,1261751666677657600,https://twitter.com/freedomwurkz/status/1261751666677657600
2020-05-16 20:11:29,BoDiddlerJr,SaraStoner13,1,0,0,"There's 1791 people in the hospital from Covid-19 in Texas out of 29.9 million people. You can't shut down the economy because of that. 0.0000598997% of the state is in the hospital. There's no way to justify shutting down with that data.",,,,1261751144562462720,https://twitter.com/BoDiddlerJr/status/1261751144562462720
2020-05-16 20:09:21,Ianbinding,,0,0,0,"Texas COVID-19 cases rise, governor's office says more testing being done - ABC News - https://abcn.ws/3cyIcGi via @ABC",,@ABC,,1261750604948336640,https://twitter.com/Ianbinding/status/1261750604948336640
2020-05-16 20:09:13,ScotMackRI,,1,2,2,"Texas COVID-19 cases rise, governor's office says more testing being done - ABC News - https://abcn.ws/3cyIcGi via @ABC",,@ABC,,1261750572719497220,https://twitter.com/ScotMackRI/status/1261750572719497220
2020-05-16 20:08:34,peggynup,,0,1,0,"Texas COVID-19 cases rise, governor's office says more testing being done - ABC News - https://abcn.ws/3cyIcGi via @ABC #coronavirus #pandemic #reopening",,@ABC,#coronavirus #pandemic #reopening,1261750409569480709,https://twitter.com/peggynup/status/1261750409569480709
2020-05-16 20:08:26,Coleshsmartinez,,0,0,0,"Texas COVID-19 cases rise, governor's office says more testing being done https://www.yahoo.com/gma/texas-cases-covid-19-increasing-thousands-since-reopening-150902489--abc-news-topstories.html?soc_src=community&amp;soc_trk=tw via @Yahoo",,@Yahoo,,1261750376497393667,https://twitter.com/Coleshsmartinez/status/1261750376497393667
2020-05-16 20:08:22,wmschlichter,FosterFamTravel,1,0,1,"I want to visit all fifty states at 27 now. But now I am published i want to do a booksigning in all 50. Covid messed up my number as I was to add Vegas(canceled) and maybe texas in July ",,,,1261750358726057987,https://twitter.com/wmschlichter/status/1261750358726057987
2020-05-16 20:05:57,badass1972,,0,0,1,"I warned everyone, watch the recoil!!!! BA Texas sees increase in COVID-19 cases after lifting its lockdown ",,,,1261749751348736000,https://twitter.com/badass1972/status/1261749751348736000
2020-05-16 20:05:52,michelle_sura,,0,0,0,"Texas sees increase in COVID-19 cases after lifting its lockdown https://mol.im/a/8326751 via @MailOnline",,@MailOnline,,1261749731446927360,https://twitter.com/michelle_sura/status/1261749731446927360
2020-05-16 20:05:41,ThomasM09141418,HarrisCoJudge,0,0,4,"Leftist Lina here’s a real report: Texas covid 19 updated numbers 45K confirmed cases 25K recovered 1200 deaths Or a 98.5% recovery rate! Your fear doesn’t overrule our freedom.",,,,1261749685372497922,https://twitter.com/ThomasM09141418/status/1261749685372497922
2020-05-16 20:04:15,Karaoke_God,,0,0,0,"Texas COVID-19 cases rise, governor's office says more testing being done - ABC News - https://abcn.ws/3cyIcGi via @ABC",,@ABC,,1261749325081821185,https://twitter.com/Karaoke_God/status/1261749325081821185
2020-05-16 20:02:25,candy735,,0,0,0,"Texas sees increase in COVID-19 cases after lifting its lockdown https://mol.im/a/8326751 via @MailOnline",,@MailOnline,,1261748862848585733,https://twitter.com/candy735/status/1261748862848585733
2020-05-16 20:02:17,BlueAlertUs,,5,3,7,"Texas sees increase in COVID-19 cases after lifting its lockdown as number of infected tops 45,000 | https://www.dailymail.co.uk/news/article-8326751/Texas-sees-increase-COVID-19-cases-lifting-lockdown-number-infected-tops-45-000.html",,,,1261748827113033729,https://twitter.com/BlueAlertUs/status/1261748827113033729
2020-05-16 20:01:27,Mark_HVP,,0,0,0,"Texas sees increase in COVID-19 cases after lifting its lockdown https://mol.im/a/8326751 via @MailOnline",,@MailOnline,,1261748619134320640,https://twitter.com/Mark_HVP/status/1261748619134320640
2020-05-16 20:00:56,WorksGrill,,0,0,0,"We told you so . . . . . Texas COVID-19 cases rise, governor's office says more testing being done https://abcnews.go.com/US/texas-cases-covid-19-increasing-thousands-reopening/story?id=70720497",,,,1261748487227494400,https://twitter.com/WorksGrill/status/1261748487227494400
2020-05-16 20:00:53,CobraDmd,,0,1,1,"⁦@GregAbbott_TX⁩ Has set Texas up for a health disaster all for his worship of the “almighty” dollar. “Coronavirus: 5 sailors test positive again for COVID on USS Roosevelt.” #GOPDeathCult",,@GregAbbott_TX,#GOPDeathCult,1261748477454954498,https://twitter.com/CobraDmd/status/1261748477454954498
2020-05-16 20:00:53,Expungements4u,,0,0,0,"ASK ABOUT THE COVID 19 SPECIAL... DIVORCE EXPUNGEMENTS PARDON WILLS BANKRUPTCY CHAPTER 7 IN KS IS $200 / OKLAHOMA $TEXAS $300 / MISSOURI $150! NO FACE TO FACE APPOINTMENT... CALL AND GET STARTED NOW! 316-210-0773 NATIONWIDE! ",,,,1261748475739475969,https://twitter.com/Expungements4u/status/1261748475739475969
2020-05-16 19:59:51,mailmansr,,0,0,0,"Texas sees increase in COVID-19 cases after lifting its lockdown https://mol.im/a/8326751 via @MailOnline",,@MailOnline,,1261748217403912194,https://twitter.com/mailmansr/status/1261748217403912194
2020-05-16 19:59:33,jrs4358,,0,0,0,"Texas cases of COVID-19 increasing by thousands since reopening ",,,,1261748139385655298,https://twitter.com/jrs4358/status/1261748139385655298
2020-05-16 19:57:51,deannawds,,0,0,0,"Texas COVID-19 cases rise, governor's office says more testing being done - ABC News - https://abcn.ws/3cyIcGi via @ABC",,@ABC,,1261747713688797184,https://twitter.com/deannawds/status/1261747713688797184
2020-05-16 19:57:46,nunayabeznez,,0,2,1,"My fellow Texans, these are the people who are not allowing pharmacies to fill prescriptions written by Licensed Medical Professionals for treatment of COVID-19. They are the Texas Pharmacy Board and you can find each of their names on the web. They= Hydroxychloroquine scripts ",,,,1261747690012053504,https://twitter.com/nunayabeznez/status/1261747690012053504
2020-05-16 19:57:29,Friochilly,jsolomonReports,0,0,1,"Parkland hospital in Dallas Texas is lying about the number of covid cases!!! They are getting more money to do it!!!!",,,,1261747619094843396,https://twitter.com/Friochilly/status/1261747619094843396
2020-05-16 19:56:45,WPLCSL,NBCDFW,0,0,0,"Meanwhile, Texas has 1000 NEW confirmed POSITIVE tests for Covid-19 EVERY DAY for the past week, and growing as of May 16th",,,,1261747435245907969,https://twitter.com/WPLCSL/status/1261747435245907969
2020-05-16 19:55:37,potentpotis,,0,0,0,"How brave are you?Ask this question on Twitter,I did two days in a row and knows one knows anyone.Just curious, you ask it also,lets see if we can even find anyone who has it,""DOES ANYONE KNOW ANYONE WEST OF TEXAS WHO HAS COVID-19?"" Ask a real Question or spread Fairy-Tales of Q",,,,1261747151551397888,https://twitter.com/potentpotis/status/1261747151551397888
2020-05-16 19:55:37,SocialWorkItOut,,1,8,7,"""...an increase of 1,347 cases from Thursday to Friday... The state also experienced its highest and second-highest daily death toll just a day apart... Texas began reopening after its stay-at-home order was lifted on April 30."" #Covid_19 #Texas https://www.msn.com/en-us/news/us/texas-cases-of-covid-19-increasing-by-thousands-since-reopening/ar-BB14b61B?ocid=sf2",,,#Covid_19 #Texas,1261747150737805314,https://twitter.com/SocialWorkItOut/status/1261747150737805314
2020-05-16 19:55:26,AngelofJustice9,,0,0,0,"NEW: Texas has seen a steady rise in coronavirus cases and fatalities since reopening just over two weeks ago. ABC They are currently at 46,787 covid-19 with 1,308 deaths.",,,,1261747105091194882,https://twitter.com/AngelofJustice9/status/1261747105091194882
2020-05-16 19:52:27,SheripetersonS,,1,0,2,"Texas COVID-19 cases rise, governor's office says more testing being done. The deaths are REALLY going up too by ALOT! #TrumpHasNoPlan but #TrumpHasBloodOnHisHands - ABC News https://abcnews.go.com/US/texas-cases-covid-19-increasing-thousands-reopening/story?id=70720497",,,#TrumpHasNoPlan #TrumpHasBloodOnHisHands,1261746354545668102,https://twitter.com/SheripetersonS/status/1261746354545668102
2020-05-16 19:51:59,RobertaRetrum,,0,0,0,"Texas cases of COVID-19 increasing by thousands since reopening http://a.msn.com/01/en-us/BB14b61B?ocid=st",,,,1261746234257219585,https://twitter.com/RobertaRetrum/status/1261746234257219585
2020-05-16 19:51:24,Anointed62,,0,0,0,"Texas cases of COVID-19 increasing by thousands since reopening http://a.msn.com/01/en-us/BB14b61B?ocid=st",,,,1261746090375884806,https://twitter.com/Anointed62/status/1261746090375884806
2020-05-16 19:49:05,JoeKing3333,,0,0,0,"Is Texas Inflating Its COVID-19 Testing Numbers by Including Antibody Tests? ",,,,1261745507463987201,https://twitter.com/JoeKing3333/status/1261745507463987201
2020-05-16 19:48:13,mburk07,,0,0,1,"Dr. Ivette Lozano speaking in Dallas, Texas about COVID-19/Corona Virus ... https://youtu.be/Bho803qRmkk via @YouTube @realDonaldTrump @SantaSurfing @99freemind @Inevitable_ET @DonaldJTrumpJr @TonyaGaskins6 @0504_505",,@YouTube @realDonaldTrump @SantaSurfing @99freemind @Inevitable_ET @DonaldJTrumpJr @TonyaGaskins6 @0504_505,,1261745288538193922,https://twitter.com/mburk07/status/1261745288538193922
2020-05-16 19:46:07,Jstaskin,,5,1,1,"Texas cases of COVID-19 increasing by thousands since reopening https://abcnews.go.com/US/texas-cases-covid-19-increasing-thousands-reopening/story?id=70720497",,,,1261744760534040577,https://twitter.com/Jstaskin/status/1261744760534040577
2020-05-16 19:46:03,DailyMail,,15,19,35,"Texas sees increase in COVID-19 cases just two weeks after the state lifted its lockdown https://trib.al/ykudDEe",,,,1261744743148589057,https://twitter.com/DailyMail/status/1261744743148589057
2020-05-16 19:45:54,Micwritermcleod,ABC,1,0,1,"I don't believe there's an increase in cases of Covid 19 after Texas reopened. it's hysteria to get people to close up again. all manipulation by the powers that be for power, profit, control and fear which is terrorism to control people. MM arr",,,,1261744707299926016,https://twitter.com/Micwritermcleod/status/1261744707299926016
2020-05-16 19:45:00,Beanzamillion21,FiveThirtyEight,1,0,2,"Allegations aside. Why should I risk getting COVID when voting for Biden in Texas when he has offered me nothing? Couple that with the substantiated assault allegations, him picking on people and ponying up to the worst people with money... give one good reason why hes worth it.",,,,1261744479406559235,https://twitter.com/Beanzamillion21/status/1261744479406559235
2020-05-16 19:44:40,HelpThe99ers,,0,0,0,"No kidding, Texas: be safe out there. Wear a mask, practice social distancing and wash your hands thoroughly! Texas COVID-19 cases rise, governor's office says more testing being done - ABC News - https://abcn.ws/3cyIcGi via @ABC",,@ABC,,1261744395751219201,https://twitter.com/HelpThe99ers/status/1261744395751219201
2020-05-16 19:43:05,kennwickman,,1,0,0,"Texas cases of COVID-19 increasing by thousands since reopening",,,,1261743998516916224,https://twitter.com/kennwickman/status/1261743998516916224
2020-05-16 19:42:38,JonRisinger,,39,149,1339,"This is a graph following Covid-19 cases and deaths in Texas. That pink spike on the right? That's us yesterday beating our previous record of new cases since April when we shutdown. This is what ""opening up"" looks like. Here's an idea: what if we didn't do this? ",,,,1261743881420509184,https://twitter.com/JonRisinger/status/1261743881420509184
2020-05-16 19:42:27,LeftLois,TimInHonolulu,0,0,0,"Texas 2 weeks since opening is now spiking with covid-19 and over 1200+ cases in one day. ",,,,1261743835907977216,https://twitter.com/LeftLois/status/1261743835907977216
2020-05-16 19:40:06,mswalli,,0,0,0,"Texas cases of COVID-19 increasing by thousands since reopening ",,,,1261743247715561473,https://twitter.com/mswalli/status/1261743247715561473
2020-05-16 19:39:18,areyoudrinking,realDonaldTrump,0,0,0,"TEXAS COVID-19 DEATHS INCREASING AFTER REOPENING #COVIDIOTS #Republicans #Conservative",,,#COVIDIOTS #Republicans #Conservative,1261743042945413122,https://twitter.com/areyoudrinking/status/1261743042945413122
2020-05-16 19:35:58,TradeRunnerFX,,0,0,0,"4 days of increasing COVID-19 cases in #NewYork, #California, &amp; #Texas. ",,,#NewYork #California #Texas,1261742206995402753,https://twitter.com/TradeRunnerFX/status/1261742206995402753
2020-05-16 19:34:55,Ylucero9,SenSanders,0,0,0,"Like Texas are letting inmates die from covid- -19 ,",,,,1261741941894438917,https://twitter.com/Ylucero9/status/1261741941894438917
2020-05-16 19:31:36,katie71825,,0,0,0,"Texas COVID-19 cases rise, governor's office says more testing being done #SmartNews https://abcnews.go.com/US/texas-cases-covid-19-increasing-thousands-reopening/story?id=70720497",,,#SmartNews,1261741107001647107,https://twitter.com/katie71825/status/1261741107001647107
2020-05-16 19:30:27,ShawntalBrown,,0,1,2,"How can we better support our Black students and families in Texas during COVID-19? #StateofBlackTX",,,#StateofBlackTX,1261740818802622470,https://twitter.com/ShawntalBrown/status/1261740818802622470
2020-05-16 19:29:18,plazaro13,,0,0,0,"Texas sets record for largest gain of COVID-19 cases over a two-day period since pandemic began #TrumpLiesPeopleDie #TrumpHasNoPlanExceptYouDie #VoteBlue2020 #GoJoeBiden2020 http://www.kvue.com/article/news/health/coronavirus/texas-sets-record-for-most-number-of-new-coronavirus-cases-over-a-two-consecutive-day-period/269-fdf0df61-93c2-45b5-ae42-3cb7b1ab8767?fbclid=IwAR3FJFJZhlyTNGLF0DKXe09hdsqL7SH_F5LQicISP2ArR54CwChA5wPHcmk via @KVUE",,@KVUE,#TrumpLiesPeopleDie #TrumpHasNoPlanExceptYouDie #VoteBlue2020 #GoJoeBiden2020,1261740528691032071,https://twitter.com/plazaro13/status/1261740528691032071
2020-05-16 19:28:24,LadonaHoneaCook,efuseakay,1,0,0,"I think the real concern is not test rates, but mortality rates. Texas 1,272, Calif. 3,108, New York 22,300, Illinois 4,058. Texas ranked one of the lowest in covid 19 deaths. Yet Texas has the 5 largest populated city in the US.",,,,1261740301921763330,https://twitter.com/LadonaHoneaCook/status/1261740301921763330
2020-05-16 19:27:33,furiabibi,,1,1,2,"Vito Antinarella A MUST WATCH: Dr. Yvette Lezano... a medical doctor in Dallas, Texas... blows the lid completely off of the COVID-19 virus hoax. https://www.facebook.com/vito.antinarella/videos/3115660051813075/",,,,1261740085470474242,https://twitter.com/furiabibi/status/1261740085470474242
2020-05-16 19:25:55,MultiRamblings,,0,0,0,"Texas COVID-19 cases rise, governor's office says more testing being done - ABC News - https://abcn.ws/3cyIcGi via @ABC",,@ABC,,1261739675762524161,https://twitter.com/MultiRamblings/status/1261739675762524161
2020-05-16 19:24:10,btsbrasil_offc,,6,66,348,"[INFO] 20.05.16 | O jornal ‘News 4 San Antonio’, noticiou que três enfermeiras de um hospital no Texas, nos Estados Unidos, fizeram um vídeo dançando a música ‘Mic Drop’, do #BTS (@BTS_twt), como forma de apoiar uma paciente de COVID-19, que é uma ARMY! ",,@BTS_twt,#BTS #BTS,1261739234513256449,https://twitter.com/btsbrasil_offc/status/1261739234513256449
2020-05-16 19:23:42,voxrob,,0,1,0,"Texas COVID-19 cases rise, as do deaths. https://abcn.ws/3cyIcGi",,,,1261739117114806274,https://twitter.com/voxrob/status/1261739117114806274
2020-05-16 19:22:38,kerryvwood,,0,0,3,"MSN ""news"" quotes ABC""news"" with the heading ""Texas Cases of COVID increasing by Thousands Since Re-opening"". How deceitful, misleading and downright crooked can you get? Instead of actually comparing the RATE of news cases, they just keep stacking the #s of new +testing. Think!",,,#s,1261738848771506179,https://twitter.com/kerryvwood/status/1261738848771506179
2020-05-16 19:21:31,debraj112,,0,0,0,"""... data is reported on a two-week lag. Currently there are 1,716 people in a Texas hospital, according to the health department."" Texas COVID-19 cases rise, governor's office says more testing being done https://www.yahoo.com/gma/texas-cases-covid-19-increasing-thousands-since-reopening-150902489--abc-news-topstories.html",,,,1261738571117010944,https://twitter.com/debraj112/status/1261738571117010944
2020-05-16 19:20:02,anyalhas,,0,0,0,"Texas COVID-19 cases rise, governor's office says more testing being done - ABC News https://abcnews.go.com/US/texas-cases-covid-19-increasing-thousands-reopening/story?id=70720497",,,,1261738195324219392,https://twitter.com/anyalhas/status/1261738195324219392
2020-05-16 19:19:03,h_soumare,,0,0,0,"Once again Dr. Fauci predicted RIGHT!!! ""Texas cases of COVID-19 increasing by thousands since reopening"" https://flip.it/mpdjJV",,,,1261737947331792896,https://twitter.com/h_soumare/status/1261737947331792896
2020-05-16 19:17:13,BessyReyna7,,0,0,0,"Texas cases of COVID-19 increasing by thousands since reopening http://a.msn.com/01/en-us/BB14b61B?ocid=st",,,,1261737488424546307,https://twitter.com/BessyReyna7/status/1261737488424546307
2020-05-16 19:16:28,BrewviesWthMatt,,0,0,0,"Because DUH.. But you guys just NEEDED to re-open huh? #Texas #Covid19 #StayHomeSaveLives Texas cases of COVID-19 increasing by thousands since reopening http://a.msn.com/01/en-us/BB14b61B?ocid=st",,,#Texas #Covid19 #StayHomeSaveLives,1261737296954417152,https://twitter.com/BrewviesWthMatt/status/1261737296954417152
2020-05-16 19:16:01,TexasBlues6,MalcolmNance,0,0,0,"I was wondering where all the Texas fools spewing covid misinformation got started then I watched this woman and it made sense that reporters like this are playing with peoples lives. 89,000 dead and folks in our state say these numbers are fake ",,,,1261737183473553408,https://twitter.com/TexasBlues6/status/1261737183473553408
2020-05-16 19:13:12,BigLawUS,,0,0,0,"Texas cases of COVID-19 increasing by thousands since reopening ",,,,1261736476162895873,https://twitter.com/BigLawUS/status/1261736476162895873
2020-05-16 19:12:30,EduardoPerez_IE,TexasDSHS,0,1,1,"What is contact tracing? How does it help contain COVID-19? #Texas #DSHS #COVID19",,,#Texas #DSHS #COVID19,1261736299918213122,https://twitter.com/EduardoPerez_IE/status/1261736299918213122
2020-05-16 19:12:25,NikkiTikki_Tavi,NikkiTikki_Tavi,1,0,1,"This is the chart that comes up on a regular Google search for Texas covid. Numbers are taken from wiki. Something is up with the stats that isn't being addressed. They bounce around several times a day, up and down.",,,,1261736278489522176,https://twitter.com/NikkiTikki_Tavi/status/1261736278489522176
2020-05-16 19:11:14,pmbasse,,0,0,0,"@ABC's Fake News About COVID-19 in Texas Goes Viral ",,@ABC,,1261735983118258176,https://twitter.com/pmbasse/status/1261735983118258176
2020-05-16 19:10:29,SalBo89,Spanky325,1,0,0,"As for Texas, it has to do with testing. According to COVID Tracking, they have tested 107,820 people over the last 3 days which is nearly as many as they tested in the 7 days prior. When looking at the testing, the key is infection rate and over the last 3 days, despite",,,,1261735792021471235,https://twitter.com/SalBo89/status/1261735792021471235
2020-05-16 19:10:16,bilblogz,,0,0,0,"Texas COVID-19 cases rise, governor's office says more testing being done - ABC News - https://abcn.ws/3cyIcGi via @ABC",,@ABC,,1261735738888118273,https://twitter.com/bilblogz/status/1261735738888118273
2020-05-16 19:09:15,DogpackCole8,SenSchumer,0,0,0,"Florida and Texas combined have less issues with COVID-19 that even California. New York is a mess, and that’s on you, with your 35 years experience of ineptness. ",,,,1261735482225983497,https://twitter.com/DogpackCole8/status/1261735482225983497
2020-05-16 19:08:26,YvonneKirlew,,0,0,0,"From Texas Observer: Is Texas Inflating Its COVID-19 Testing Results With Antibody Test Numbers? ",,,,1261735275585208321,https://twitter.com/YvonneKirlew/status/1261735275585208321
2020-05-16 19:06:07,otomewang,,0,0,0,"Friday March 6, 2020. It was One act district contest. Woke up at 5am got home at 2am. Monday 9 was spring break, and the week after that Texas Covid cases grew at a rapid rate. Last time I was at school, and saw my friends. #lastnormalphoto",,,#lastnormalphoto,1261734694888103938,https://twitter.com/otomewang/status/1261734694888103938
2020-05-16 19:06:00,kwilsonjb,,0,0,0,"Is Texas Inflating Its COVID-19 Testing Numbers by Including Antibody Tests? ",,,,1261734666157068288,https://twitter.com/kwilsonjb/status/1261734666157068288
2020-05-16 19:05:03,Amerigroup,,0,1,2,"We’ve committed $1 million to support #COVID-19 relief efforts across #Texas: ",,,#COVID #Texas,1261734426184220677,https://twitter.com/Amerigroup/status/1261734426184220677
2020-05-16 19:04:50,CLK_Shortcake,,0,0,0,"Texas COVID-19 cases rise, governor's office says more testing being done - ABC News https://abcnews.go.com/US/texas-cases-covid-19-increasing-thousands-reopening/story?id=70720497&amp;cid=social_fb_abcn&amp;fbclid=IwAR1bqEKD2FYdhFvUxl3c53BA0CFCxFjwT-sBTCKp4SR4V4sVmxZLgXMCzSQ",,,,1261734370479652865,https://twitter.com/CLK_Shortcake/status/1261734370479652865
2020-05-16 19:02:51,GlobalPandemics,,0,0,0,"COVID-ALERT: Coronavirus cases, deaths rise in Texas after state reopens - Global Pandemic News | #Coronavirus #COVID19 - https://globalpandemic.net/news/coronavirus-cases-deaths-rise-in-texas-after-statereopens/",,,#Coronavirus #COVID19,1261733871541944320,https://twitter.com/GlobalPandemics/status/1261733871541944320
2020-05-16 19:02:40,wytchh,,0,0,0,"Fake News About COVID-19 in Texas Goes Viral https://www.breitbart.com/border/2020/05/16/fake-news-about-covid-19-in-texas-goes-viral/ via @BreitbartNews",,@BreitbartNews,,1261733825274617856,https://twitter.com/wytchh/status/1261733825274617856
