date,username,to,replies,retweets,favorites,text,geo,mentions,hashtags,id,permalink
2020-07-06 23:56:06,_gracer40,keithboykin,0,0,0,"For all those people that think COVID is nothing but just the flu Imagine if one of those 10 kids was yours and there was only 3 beds! ",,,,1280289451856576513,https://twitter.com/_gracer40/status/1280289451856576513
2020-07-06 23:37:37,VDIArchitect,melissamvega,1,0,1,"Leaving COVID out of it, children are super spreaders of viruses and bacteria. Now throw COVID in - even if children are not greatly impacted by the virus itself, they might spread it to those who are susceptible which is not acceptable. People who think this is okay are fools.",,,,1280284799689789441,https://twitter.com/VDIArchitect/status/1280284799689789441
2020-07-06 23:34:44,Mules2College,Harvard,0,0,1,"More colleges release plans for the fall semester. @AHHSmules @AHISD @applytoharvard @WeGoPublic #Covid #Covid19 #coronavirus #College #Harvard #WearAMask",,@AHHSmules @AHISD @applytoharvard @WeGoPublic,#Covid #Covid19 #coronavirus #College #Harvard #WearAMask,1280284072523313153,https://twitter.com/Mules2College/status/1280284072523313153
2020-07-06 23:16:12,ravenalexia,ksatnews,0,1,2," 351 new Covid-19 cases &amp; 2 more deaths 15,102 Confirmed Cases in Bexar Co. 132 Total Deaths 1,168 Hospitalized ",,,,1280279410453733378,https://twitter.com/ravenalexia/status/1280279410453733378
2020-07-06 22:42:02,RichardASalas3,mallorys_oracle,2,1,2,"Thank you Ladyred. Stay Safe. My COVID-19 test came back negative ",,,,1280270811815907329,https://twitter.com/RichardASalas3/status/1280270811815907329
2020-07-06 22:22:58,falconfiend2,,0,0,0,"Even if you work at a place that had Covid...and you test negative, they ask you to quarantine also",,,,1280266014157144064,https://twitter.com/falconfiend2/status/1280266014157144064
2020-07-06 21:46:36,parkerandquinoa,Complex,0,1,5,"Apparently she has COVID... her death will likely be blamed on that ",,,,1280256862756184077,https://twitter.com/parkerandquinoa/status/1280256862756184077
2020-07-06 21:39:50,broody_boy_josi,,0,0,0,"I regret being a big smoker I hope I don’t catch covid bruh honestly my lungs ain’t shit I might diee str8 up",,,,1280255160703430659,https://twitter.com/broody_boy_josi/status/1280255160703430659
2020-07-06 21:06:41,havoc_sebastian,,0,0,0,"How Disability services function online? no lab use, gotta buy a computer bcuz the tablet didn’t cut it after the covid semester, the grading system should change.",,,,1280246817444282373,https://twitter.com/havoc_sebastian/status/1280246817444282373
2020-07-06 20:49:02,coachsotopop,,1,4,26,"WIN vs Covid Wear a mask Instigate social distancing No gatherings over 10 people ",,,,1280242375705743361,https://twitter.com/coachsotopop/status/1280242375705743361
2020-07-06 20:28:58,steffann10,,0,0,1,"If a medical office has staff members that have tested positive for covid-19, should the patients be told that there were positive cases in the office?",,,,1280237323578478595,https://twitter.com/steffann10/status/1280237323578478595
2020-07-06 20:10:08,Viva66Che,,0,0,0," Florida teen dies after conspiracy theorist mom takes her to church ‘COVID party’ and tries to treat her with Trump-approved drug: report ",,,,1280232583536750592,https://twitter.com/Viva66Che/status/1280232583536750592
2020-07-06 20:00:04,PastorEBonilla,,1,0,13,"Today we mourn with our first church family to have lost a loved one due to Covid-19. Please pray for the Leon family. This is María De Lourdes a precious lady who served the Lord faithfully especially in our benevolence ministry. She will be missed. ",,,,1280230051997462530,https://twitter.com/PastorEBonilla/status/1280230051997462530
2020-07-06 19:32:14,BoloBoffin,,2,0,1,"There's a story flying around about a young COVID-19 victim whose mother allegedly took her to a COVID-19 party. Its all coming from one person who says she has access to the ""public"" medical examiner report on the kid. But the report is not anywhere I can find it online.",,,,1280223045957963779,https://twitter.com/BoloBoffin/status/1280223045957963779
2020-07-06 19:07:20,Irma_0324,,0,0,0,"I don’t understand how people still think this virus is a hoax. People I love and care for have/had COVID, I know people who have died from COVID. Ignorance is bliss I guess ",,,,1280216782926733313,https://twitter.com/Irma_0324/status/1280216782926733313
2020-07-06 18:50:48,BraddyBarbara,,1,0,0,"Our whole office is out because of Covid. this shit sucks.",,,,1280212621732560896,https://twitter.com/BraddyBarbara/status/1280212621732560896
2020-07-06 18:40:05,JohnP_TTU,,0,0,0,"How are people getting their COVID test results by email or regular mail???",,,,1280209923259936769,https://twitter.com/JohnP_TTU/status/1280209923259936769
2020-07-06 18:20:58,ThatBravesGirl,darnold82,1,0,1,"Just the minor inconvenience otherwise known as COVID-19 ha",,,,1280205113790005248,https://twitter.com/ThatBravesGirl/status/1280205113790005248
2020-07-06 18:20:29,MileHigh_Texan,realDonaldTrump,0,0,0,"COVID DEATHS HIT AN ALL TIME HIGH!",,,,1280204991349903360,https://twitter.com/MileHigh_Texan/status/1280204991349903360
2020-07-06 18:20:20,JordanGhawi,,1,0,9,"Today marks the 150th day of our local COVID-19 response. ",,,,1280204952942579714,https://twitter.com/JordanGhawi/status/1280204952942579714
2020-07-06 17:49:18,Shackattack210,,0,0,0,"@BillMillerBarBQ you should probably cease all refill with customers who bring your reusable plastic mugs. #covid",,@BillMillerBarBQ,#covid,1280197144490708993,https://twitter.com/Shackattack210/status/1280197144490708993
2020-07-06 17:41:19,ThatBravesGirl,ChopOnCorey,0,0,3,"COVID-19 cases, that’s what",,,,1280195135528210438,https://twitter.com/ThatBravesGirl/status/1280195135528210438
2020-07-06 17:20:29,MatttTanaka,,1,2,10,"Fuck covid bro",,,,1280189889217269760,https://twitter.com/MatttTanaka/status/1280189889217269760
2020-07-06 17:04:40,havoc_sebastian,,0,17,20,"in SA the majority of crowded apartments complexes are Black/Latino with workers that haven’t been able to stop working. It’s not difficult to understand how the racial socioeconomic segregation would translate to covid death disparity too",,,,1280185910756364288,https://twitter.com/havoc_sebastian/status/1280185910756364288
2020-07-06 17:01:16,WP4KTF,,0,0,0,"#trumpDeathClock drove around Wash #DC streets on the #4thOfJuly displaying #covid related #American #deaths thanks to the ineptitude of our #incoherent #incompetent #RacistInChief… https://www.instagram.com/p/CCTunqrpzF9FIX4MGVPglnBGzmTWx9AtDBUWLo0/?igshid=vdywoy9l7cc2",,,#trumpDeathClock #DC #4thOfJuly #covid #American #deaths #incoherent #incompetent #RacistInChief,1280185053683867650,https://twitter.com/WP4KTF/status/1280185053683867650
2020-07-06 16:55:44,DatingFckry,,1,0,3,"I need to live stream my face while I’m getting my covid coochie sugared. ",,,,1280183663355924480,https://twitter.com/DatingFckry/status/1280183663355924480
2020-07-06 16:46:49,jakat210,DonaldJTrumpJr,0,0,0,"It's a fken statue. Let's focus on covid now that you know it's real!",,,,1280181420372221952,https://twitter.com/jakat210/status/1280181420372221952
2020-07-06 16:33:36,JoeGalliNews,,0,1,4,"This is Justin Vine. He’s a 40-year-old father, husband & nurse. He’s also on a ventilator after being infected with #Covid_19. His wife &amp; 2 daughters are suffering from COVID symptoms at home while Justin fights for his life. Full story tonight a 6 on @News4SA",,@News4SA,#Covid_19,1280178091713875973,https://twitter.com/JoeGalliNews/status/1280178091713875973
2020-07-06 15:54:00,gofthecooltable,StaceyLRicks,2,0,0,"In his defense they have been diagnosing anything flu like or allergy based as covid",,,,1280168125233860610,https://twitter.com/gofthecooltable/status/1280168125233860610
2020-07-06 15:45:27,Mr_Westmoore,,0,0,0,"Sad to see, but this is just a small sample of firefighters who have died from complications of #Covid. I would've added some ""Fitting"" music to this clip, but Benjamin, Crippin and/or Grame can go ___ themselves! ",,,#Covid,1280165977045504005,https://twitter.com/Mr_Westmoore/status/1280165977045504005
2020-07-06 15:39:56,ashersxo_,,0,0,0,"After working the last 9 days straight in covid land this off day is much needed.",,,,1280164585346039810,https://twitter.com/ashersxo_/status/1280164585346039810
2020-07-06 15:12:36,yukcom12,Yamiche,0,0,0,"Maybe that's why the GOP doesn't give a crap about covid they are racists and as long as it's not white people dying they are ok .",,,,1280157708356923393,https://twitter.com/yukcom12/status/1280157708356923393
2020-07-06 15:06:37,spaaamc,RexChapman,0,0,0,"Alright bitch when you get COVID and start dying don’t be fuckin crying like a little bitch! Why? “Bc tHis iS oVeR” ",,,,1280156200957628420,https://twitter.com/spaaamc/status/1280156200957628420
2020-07-06 14:47:09,emrosey__,,3,0,11,"me, who has covid: “wow, they’re right, you do get shortness of breath” government: “we have the perfect solution! a MASK! that won’t make it harder to breathe at all” me, with a mask on: ",,,,1280151303038042112,https://twitter.com/emrosey__/status/1280151303038042112
2020-07-06 14:37:49,JoshL1220,s_macd32,1,0,0,"Imagine thinking the guy who said covid would die out by April is a genius and riding so hard to defend him for no real reason",,,,1280148956249554946,https://twitter.com/JoshL1220/status/1280148956249554946
2020-07-06 13:53:57,themerk08,,0,0,0,"If Covid deaths were American soldiers on a battlefield would this response be going differently? @realDonaldTrump #MAGA2020",,@realDonaldTrump,#MAGA2020,1280137914375077888,https://twitter.com/themerk08/status/1280137914375077888
2020-07-06 13:44:51,notorious_jod,AQ_SanAntonio,0,0,1,"And I don’t think we can fix all the issue just because COVID. We haven’t been people first for a long time. It’s just tough to be on Zoom calls with folks collecting a paycheck to lead, yet do no leading.",,,,1280135624071294976,https://twitter.com/notorious_jod/status/1280135624071294976
2020-07-06 13:24:55,281momof3,business,0,0,0,"Prayers for our world.... COVID-19, riots and killing innocent people, new strain of swine flu and now cases of blubonic plaque Starting to look pretty evident how the world may end the second time ",,,,1280130608677691394,https://twitter.com/281momof3/status/1280130608677691394
2020-07-06 11:30:51,CJMcKinney,,0,0,0,"Can a Workplace Be Closed by Law as a Covid-19 ""Public Nuisance""? ",,,,1280101904438235136,https://twitter.com/CJMcKinney/status/1280101904438235136
2020-07-06 09:21:39,FrancesManances,,0,0,0,"This is my momma. Her name is Debra Garza. She’ll be 60 years old come this September. She suffers from horrible rheumatoid arthritis, and asthma. Last month she tested positive for COVID… https://www.instagram.com/p/CCS6BnlnLU3AH0wbwrlX1uAv_LL7ORAeIA7X3Y0/?igshid=fo1l4xhls6ws",,,,1280069388184453126,https://twitter.com/FrancesManances/status/1280069388184453126
2020-07-06 08:35:47,LolaSupercat,wspieler,0,0,1,"Start making funeral arrangements! #COVID ",,,#COVID,1280057844860157953,https://twitter.com/LolaSupercat/status/1280057844860157953
2020-07-06 07:46:38,Vela13Emilio,APEntertainment,0,0,0,"COVID-19 is not conspiracy @realDonaldTrump",,@realDonaldTrump,,1280045476709126144,https://twitter.com/Vela13Emilio/status/1280045476709126144
2020-07-06 07:40:10,outuhcontrol,AyyeYoooB,1,0,0,"It sucks. Prior to covid, we only used them for TB patients and not very long. We have to use ONE mask a week for the entire 12hr shift ",,,,1280043849604358144,https://twitter.com/outuhcontrol/status/1280043849604358144
2020-07-06 07:26:50,UrVersaceDreamz,,1,0,2,"I lost a good friend to Covid yesterday .. No words .. Just wear your mask ",,,,1280040493011931138,https://twitter.com/UrVersaceDreamz/status/1280040493011931138
2020-07-06 07:25:30,delagarzaMusic,Ron_Nirenberg,0,0,2,"My mother is a Respiratory Therapists for Methodist in San Antonio. She takes care of COVID patients. It’s unfortunate that the people of SA wait till their families lives are lost or they catch COVID to realize what HAS been going on. Don’t be ignorant. WEAR A MASK!! ",,,,1280040158109278209,https://twitter.com/delagarzaMusic/status/1280040158109278209
2020-07-06 07:03:22,itslandoyo,RexChapman,0,0,0,"Lmfaooo for got Covid huh? ",,,,1280034590527291395,https://twitter.com/itslandoyo/status/1280034590527291395
2020-07-06 06:30:10,__George__007,,0,0,0,"Let’s not forget my job sent a memo saying “don’t believe anything in the news about covid” but “let us know anything about mandates” bro what....",,,,1280026232319553538,https://twitter.com/__George__007/status/1280026232319553538
2020-07-06 06:18:26,markanthonysatx,,0,1,7,"During this covid pandemic I’ve been locked up with you, but I’m so glad it’s with you. Can’t wait to marry you in December fiancé ",,,,1280023282792701953,https://twitter.com/markanthonysatx/status/1280023282792701953
2020-07-06 06:09:20,asperez014,jamar2698,1,2,6,"Imagine just following the rules to keep your family safe but still having to go to work to support them & one day you get a customer who couldn’t stop going out with everyone & who could have COVID! Y’all don’t understand how y’all put so many people &amp; their families at risk! ",,,,1280020989401804800,https://twitter.com/asperez014/status/1280020989401804800
2020-07-06 05:48:43,Cassandra_TV,,8,1,88,"Wow. This is 40. I never imagined spending (our) milestone birthday in quarantine with the unknown circumstances COVID has managed to bring with it; however, if you know me... you know I always look for the silver lining. And there is one. ",,,,1280015804310962178,https://twitter.com/Cassandra_TV/status/1280015804310962178
2020-07-06 04:39:52,JorgetheIbarra,KristenDeLuna,1,0,1,"I still say we shoulda gone to see them right before covid started ",,,,1279998476068192259,https://twitter.com/JorgetheIbarra/status/1279998476068192259
2020-07-06 04:33:38,Thejoeguti,stclairashley,0,0,0,"All these fuckers getting covid. ",,,,1279996908136730624,https://twitter.com/Thejoeguti/status/1279996908136730624
2020-07-06 04:27:49,SteveMedellin,LilyLaneMusic,2,0,1,"I believe in Fear Mongering!! It's when you're told over and over, the same thing, and you start to believe It! Ex:"" 100 new cases of COVID-19 on Monday, The Highest amount of Cases ever! (Tuesday 1 New): 101 New Cases, the Highest amount of Cases Ever! See?",,,,1279995444249182208,https://twitter.com/SteveMedellin/status/1279995444249182208
2020-07-06 03:53:42,goldlis,,0,0,0,"198 new COVID-19 cases in Bexar County, 8 new deaths ",,,,1279986857271595010,https://twitter.com/goldlis/status/1279986857271595010
2020-07-06 03:50:13,jessxrenae,,0,0,0,"Had a pretty great birthday overall! Can’t complain about much, maybe just Covid ruining certain things being open and preventing others from coming out but that’s about it! amber_sharp87 @heetherg http://harper.am… https://www.instagram.com/p/CCSUF_yhuFF/?igshid=1dvk27l9mnmks",,@heetherG,,1279985981509304321,https://twitter.com/jessxrenae/status/1279985981509304321
2020-07-06 03:39:30,segura_dulce,tedcruz,0,0,0,"READ THE ROOM TED, PEOPLE ARE DYING IN OUR STATE WITH RECORD BREAKING COVID HOSPITALIZATIONS ",,,,1279983282294267905,https://twitter.com/segura_dulce/status/1279983282294267905
2020-07-06 03:28:03,markanthonysatx,,0,0,0,"July 4th | covid 19 social distancing @Joeyjv75",,@Joeyjv75,,1279980403105939456,https://twitter.com/markanthonysatx/status/1279980403105939456
2020-07-06 03:22:32,__George__007,,0,0,2,"Should companies be held liable for allowing covid to spread from person to person in their stores ? When we can simply do CURBSIDE",,,,1279979015059771392,https://twitter.com/__George__007/status/1279979015059771392
2020-07-06 03:19:59,falconfiend2,,0,0,0,"Now when I look to examine 2 Chronicles 7:13/14...it says when I shut up the heavens so that there is no rain...it rained here, OR...locust to devour the land...not here...OR SEND A PLAGUE....THATS IT (COVID 19) Pray!!!!",,,,1279978374509801472,https://twitter.com/falconfiend2/status/1279978374509801472
2020-07-06 03:07:56,falconfiend2,,0,0,1,"When there is a plague among us (2 Chronicles 7:13) Covid 19...we humble ourselves, we pray, we seek God while he may be found, and turn from our wicked ways...Then I will forgive their sin, and I will heal their land.",,,,1279975340337700864,https://twitter.com/falconfiend2/status/1279975340337700864
2020-07-06 02:41:44,Rbc3T,stephennotsaint,1,0,0,"Why? Because deblasio and the nyc health commissioner called the covid threat “misinformation from the White House” and encouraged people to go out. Because Cuomo sent old people to die, as did Newsome. Because leftist politicians said protesting wouldn’t lead to a spike. Morons",,,,1279968747017703426,https://twitter.com/Rbc3T/status/1279968747017703426
2020-07-06 02:22:05,garza_demi,jaahmiiin,0,0,3,"irks me that these people are having a literal party, not giving a fk about covid. but also this is funny af. ",,,,1279963801371258880,https://twitter.com/garza_demi/status/1279963801371258880
2020-07-06 02:04:58,YouNOTthefather,NBCNews,0,0,1,"Florida: We’re #1 in new COVID cases! Alabama: Hold my virus... ",,,,1279959495385518080,https://twitter.com/YouNOTthefather/status/1279959495385518080
2020-07-06 01:24:52,freewayfox305,,0,1,0,"I understand hittin one party since the covid shit started but ghadamn every weekend chill out",,,,1279949402459832326,https://twitter.com/freewayfox305/status/1279949402459832326
2020-07-06 01:23:41,tweetcable,nypost,0,0,0," he passed. He fought covid since March ",,,,1279949102697140226,https://twitter.com/tweetcable/status/1279949102697140226
2020-07-06 00:31:54,freewayfox305,ISinkInYoGirl,0,0,0,"That essential workers can’t get covid 19 ",,,,1279936074635194370,https://twitter.com/freewayfox305/status/1279936074635194370
2020-07-06 00:21:55,IsmaelR14399335,jimena_urias,0,0,0,"Al tiro...no valla ser covid ",,,,1279933558610690051,https://twitter.com/IsmaelR14399335/status/1279933558610690051
2020-07-05 23:35:49,TexansRevolt,MNwcmllc,0,0,0,"Annual deaths in the USA 1. Heart disease 648,000 2. Cancer 600,000 3. Accidents 170,000 4. Covid-19 - 4 months-130,000 and growing -projection 500,000 plus. 7. Flu 56,000 Why are trumpians lying about covid? Covid is infectious - cancer and heart disease are not.",,,,1279921956989657088,https://twitter.com/TexansRevolt/status/1279921956989657088
2020-07-05 23:28:35,TexansRevolt,ClarkCardone,0,0,0,"Well - the rest of the world has it under control - so covid-2019 isn’t unbeatable, we just need a competent president. We had that when Obama was president and will when Biden is president. Trump is a con man liar. That’s it. Look at him. That’s it.",,,,1279920140793131008,https://twitter.com/TexansRevolt/status/1279920140793131008
2020-07-05 23:25:36,MiracleLeagueSA,,8,10,61,"We are heartbroken after one of our All-Stars has lost his life to COVID-19. Angels coach Frank Flores says his son Isaac Flores passed away on July 2 at the age of 17. Please join us in extending our thoughts &amp; prayers to everyone in Issac’s family. RIP, Issac... ",,,,1279919389970759681,https://twitter.com/MiracleLeagueSA/status/1279919389970759681
2020-07-05 23:00:48,Danielle_eeee,,3,2,6,"I keep seeing this girl who knowingly has COVID-19 hanging around all these people ",,,,1279913145306357761,https://twitter.com/Danielle_eeee/status/1279913145306357761
2020-07-05 22:55:27,TexansRevolt,ian_carruthers7,1,0,1,"It’s amazing how hard Trumpians work to ignore fact. 1. The rest of the world has covid under control. 2. Trump, Sweden and Brazil ignored science and infections are higher. 3. Even Russia enforced lock down, mask wearing and social distancing. Wake up. Don’t be a sheep.",,,,1279911799958142977,https://twitter.com/TexansRevolt/status/1279911799958142977
2020-07-05 22:46:48,inconsistencyy_,,0,0,0,"can y’all stop traveling to san antonio like it’s a covid hotspot, a majority of our residents are staying in to help stop the spread, and our hospitals are damn near at capacity for covid patients as well. but y’all wanna go to the dirty ass river walk ",,,,1279909625115131904,https://twitter.com/inconsistencyy_/status/1279909625115131904
2020-07-05 22:25:15,haasleedlc,Melanieanneee_,2,0,1,"Just like decided to skip covid and end up at happy hour?? The skip flex is strong ",,,,1279904198444879872,https://twitter.com/haasleedlc/status/1279904198444879872
2020-07-05 22:15:23,DallasHammster,,0,0,0,"How long do neighborhood dive bars last? I remember this one because of its unusual name (currently closed for State COVID reasons). I wasn't a patron, but I did deliver some pizzas here when I worked for the Pizza… https://www.instagram.com/p/CCRtxtHHjc-/?igshid=kbmbjkrx5bue",,,,1279901718910771202,https://twitter.com/DallasHammster/status/1279901718910771202
2020-07-05 21:53:23,impeccableshell,,0,0,0,"Thank you to everyone who has nominated me! I’m trying to do big things for San Antonio and COVID is just messing up everything But, this something y’all can do from the comfort of your home! My friend nominated… https://www.instagram.com/p/CCRrQVdBUMP/?igshid=b6y1xumf80wy",,,,1279896179812098048,https://twitter.com/impeccableshell/status/1279896179812098048
2020-07-05 21:44:33,Dominiq84085818,,0,1,1," WAY 2 GO... GOP!.. SO, MUCH FOR ... LEAD BY EXAMPLE... ORANGE TYPHOID MARY... LEAD..BY FOLLOWING THE COVID-19.. EVERFLOWING PERPETUAL, FOUNTAIN OF MEDICAL MISINFORMATION, BLATANT F*KN PROVABLE IN COURT LIES, PROPAGANDA N OBFUSCATION SPEWING, VILLAGE IDIOT#45 MAGA: U DIE ",,,,1279893956696911875,https://twitter.com/Dominiq84085818/status/1279893956696911875
2020-07-05 21:42:36,TexansRevolt,realDonaldTrump,0,0,0,"Trump is trying to distract racists by making them think Chicago has a black crime problem. Trump is doing nothing it protect us from covid, protect soldiers from our enemies or get people back to work. High covid infections = high unemployment. Why isn’t trump acting? ",,,,1279893467418804225,https://twitter.com/TexansRevolt/status/1279893467418804225
2020-07-05 21:36:15,Dominiq84085818,,0,0,1," REMEMBER, REMEMBER IN NOV. TODAY IS JULY 5TH,2020, MORE PPL HAVE DIED FROM COVID-19 THAN IN WWI. STATES ARE REPORTING COVID-19 SPIKES, HOSPITALS OVERWHELMED W/COVID-19 PATIENTS, ETC. WHO IS COVID-19 MOST DANGEROUS LIAR)DENIER WHO SPEWS PROVABLE IN COURT COVID-19 LIES? ",,,,1279891870320070657,https://twitter.com/Dominiq84085818/status/1279891870320070657
2020-07-05 21:26:11,bulldogholmes,,0,0,4,"Exclusive: Covid-19 may not have originated in China, Oxford University expert believes however, many believe he is being paid by Chinese propaganda machine and there are many more highly qualified experts ",,,,1279889336566272001,https://twitter.com/bulldogholmes/status/1279889336566272001
2020-07-05 21:25:34,TexansRevolt,realDonaldTrump,0,0,0,"Focus on America Donny - 44 million unemployed, higher unemployment than the Great Depression, 11.1% of workers are not working. 45,000 new covid infections yesterday. 130,000 + dead. Russia put bounties on the heads of our soldiers and soldiers died. Any plans to act?",,,,1279889181527941130,https://twitter.com/TexansRevolt/status/1279889181527941130
2020-07-05 21:25:25,LaDeFrank210,LetitiaMontana,0,0,2,"Check this pendeja out. So you don’t give a fuck about infecting people? You can be ASYMPTOMATIC and have COVID. Yeah, wearing a mask is totally nonsensical in a hospital setting. (SARCASM) But what do I know? I’m only a low level LVN. Fuck me, right? Hope she blocks me ",,,,1279889141753352194,https://twitter.com/LaDeFrank210/status/1279889141753352194
2020-07-05 20:13:41,analesagg,,0,0,14,"If you test positive for Covid-19 and don’t tell the people you were recently around, you’re a living piece of shit. Period.",,,,1279871090454663169,https://twitter.com/analesagg/status/1279871090454663169
2020-07-05 19:42:36,falconfiend2,,0,0,0,"Covid 19 exposed a lot of men on this earth.",,,,1279863266383147010,https://twitter.com/falconfiend2/status/1279863266383147010
2020-07-05 19:37:35,MaiDai__,Jaimito_16,0,0,1,"Stimulus checks and unemployment with an additional $600 COVID payment lol",,,,1279862007307677701,https://twitter.com/MaiDai__/status/1279862007307677701
2020-07-05 19:32:33,falconfiend2,,0,0,0,"You better stop blaming Covid 19 for your problems. How many Americans are overweight! DATA PLEASE",,,,1279860737075302405,https://twitter.com/falconfiend2/status/1279860737075302405
2020-07-05 19:30:20,JOEYASTEROID,,0,1,5,"Scared of what’s to come in a week from now when all the 4th of July covid cases start piling up ",,,,1279860180822433793,https://twitter.com/JOEYASTEROID/status/1279860180822433793
2020-07-05 19:17:09,falconfiend2,,0,0,0,"Covid 19 is a novel virus — even nurses and doctors are dead from it. The data is not the truth. It’s false evidence appearing real. Did we even Ask God about this! No! We became holier than Thou! And trying to play God on our own. Lord, help us.",,,,1279856863719424000,https://twitter.com/falconfiend2/status/1279856863719424000
2020-07-05 19:14:38,VDIArchitect,cwhit0307,1,0,0,"Are you here in TX? In Bexar County? Where our COVID cases are off the chart? It's open, but it *shouldn't* be. Do you get it?",,,,1279856231927230465,https://twitter.com/VDIArchitect/status/1279856231927230465
2020-07-05 18:54:52,zaddychrisss,,0,0,0,"My friend has covid wthhhhh",,,,1279851257604247552,https://twitter.com/zaddychrisss/status/1279851257604247552
2020-07-05 18:44:02,jackkuub,,0,0,0,"my whole fam got covid that shit crazy",,,,1279848527414407168,https://twitter.com/jackkuub/status/1279848527414407168
2020-07-05 18:38:26,SandiGEstrada1,SarahKSilverman,0,0,0,"A bunch of Covid idiots! ",,,,1279847118820212740,https://twitter.com/SandiGEstrada1/status/1279847118820212740
