date,username,to,replies,retweets,favorites,text,geo,mentions,hashtags,id,permalink
2020-07-05 18:33:32,Rbc3T,secupp,0,0,0,"I don’t need permission to have freedom. Further, wearing a mask that is less capable than an N95 is worthless for the wearer if they want to avoid contracting covid. Wearing a mask doesn’t stop you from getting the virus, but might keep you from spreading it. Science.",,,,1279845888865828864,https://twitter.com/Rbc3T/status/1279845888865828864
2020-07-05 18:25:07,falconfiend2,,0,0,0,"Covid 19 is supposed to be for hazard of illness not an order to tell citizens what they can and cannot do! I would not tell bar owners you are closed. I would find a solution for them to stay open. Temp checks at the door, have you had Covid 19 or around anyone that has...",,,,1279843769513316352,https://twitter.com/falconfiend2/status/1279843769513316352
2020-07-05 18:15:15,swisd_finearts,SAReport,0,0,0,"Incredible article about our friend and musician Ron Wilkins’ struggle recovering from COVID-19 and the mixed emotions of this holiday among our ongoing race problems in this country. ",,,,1279841284044263425,https://twitter.com/swisd_finearts/status/1279841284044263425
2020-07-05 18:07:54,Ozxyy,,1,0,6,"my mom sent me the symptoms for covid and now i have one of them and she says its allergies",,,,1279839437204176896,https://twitter.com/Ozxyy/status/1279839437204176896
2020-07-05 17:35:33,TEXSZN,,0,1,9,"One thing I miss since this covid has happened, is going on Yelp and finding new restaurants to dine in at. The last time we sat in a restaurant was back in March. Miss trying new places :(",,,,1279831294990573573,https://twitter.com/TEXSZN/status/1279831294990573573
2020-07-05 15:24:36,TexansRevolt,J_Mei21,0,0,3,"@DonaldJTrumpJr has to do something. He and his girlfriend are quarantining and Trump prefers family who does have a covid-19 infection. @EricTrump moved 4 steps closer to Trump at the 4th rally. Jr could be out of the will soon.",,@DonaldJTrumpJr @EricTrump,,1279798340436328449,https://twitter.com/TexansRevolt/status/1279798340436328449
2020-07-05 14:58:04,TexansRevolt,PeteButtigieg,0,0,0,"Well, that is a frightening thought and why 130,000 Americans have died of covid, covid infections are increasing at 50,000 + a day, 40mm are out of work, our economy is in recession...",,,,1279791662789771265,https://twitter.com/TexansRevolt/status/1279791662789771265
2020-07-05 14:54:58,imaynotbefromla,,0,0,1,"My best friend’s daughters’ God-father passed away from COVID last night. He was 37.",,,,1279790882347237376,https://twitter.com/imaynotbefromla/status/1279790882347237376
2020-07-05 14:28:53,CountOnCampo,,0,0,0,"The Texas Military will be hosting FREE COVID-19 testing at 3 different locations this week - July 6th-10th from 9 am - 5 pm. You MUST make an appointment before arriving. To make an appt visit:… https://www.instagram.com/p/CCQ4Y6-HVa0/?igshid=i07d0l7biu88",,,,1279784319477743616,https://twitter.com/CountOnCampo/status/1279784319477743616
2020-07-05 14:05:51,falconfiend2,,0,0,0,"Protests caused the spike in Covid cases all over America.",,,,1279778522895192065,https://twitter.com/falconfiend2/status/1279778522895192065
2020-07-05 14:02:51,AmazingGraceTX,RexChapman,0,1,1,"The beach ball is an accurate representation of the covid.",,,,1279777768218275842,https://twitter.com/AmazingGraceTX/status/1279777768218275842
2020-07-05 13:01:59,bloodfan98,,4,0,14,"Maaaaan I really be having the wildest summer; got an internship, got another job! Got COVID! came back from COVID; and now apendicitis GOD why do you forsake me ",,,,1279762449835704321,https://twitter.com/bloodfan98/status/1279762449835704321
2020-07-05 12:33:24,theorycoffee,,0,1,3,"Good morning! In response to the rising number of Covid-19 infections in our city, we have decided to temporarily modify our service. We’ve decided to remove Saturday from our hours until further notice, in order… https://www.instagram.com/p/CCQrLECne3j/?igshid=dtbdrwb0mokm",,,,1279755257522814976,https://twitter.com/theorycoffee/status/1279755257522814976
2020-07-05 11:55:19,SanAntoGuera,dallasnews,0,0,0,"COVID exploding in DALLAS. Texas-sized deadly fireworks. ",,,,1279745673907314688,https://twitter.com/SanAntoGuera/status/1279745673907314688
2020-07-05 10:36:16,Dominiq84085818,,0,1,1," #45/GOP, GOV. ABBOTT SOLUTION TO THEIR EPIC COVID-19 PLETHORA OF LIES, PROPAGANDA, MEDICAL MISINFORMATION, BOTCHING COVID-19 CONTAINMENT? WHEN ALL ELSE FAILS USE AMERICAN'S AS ""COVID-19 GUINEA PIGS"", WHAT DO YOU GOT TO LOSE? MAGA SACRIFICING N KILLING U, 1DAY AT A TIME ",,,,1279725780155670530,https://twitter.com/Dominiq84085818/status/1279725780155670530
2020-07-05 07:12:47,Boricua2150,,0,0,0,"#COVID #COVIDー19 #COVID19TX #masks watch it til the end. #DontShamePeople",,,#COVID #COVID #COVID19TX #masks #DontShamePeople,1279674572040790017,https://twitter.com/Boricua2150/status/1279674572040790017
2020-07-05 05:32:11,Rbc3T,stephennotsaint,1,0,0,"Doesn’t matter what the shelf life is. Plenty of money and time went by over two decades to have enough on hand. NYC SOLD their ventilator stockpile instead of keeping up with maintenance. Cuomo sent covid patients to nursing facilities and caused thousands of deaths.",,,,1279649255590854661,https://twitter.com/Rbc3T/status/1279649255590854661
2020-07-05 04:15:26,TiimmyG,,2,7,24,"Work is POPPIN POPPINNN tonight. So many people are out here having COVID parties. These COVID case numbers are going to SKYROCKET after this weekend. Brace yourselves San Antonio!!! ",,,,1279629940372234241,https://twitter.com/TiimmyG/status/1279629940372234241
2020-07-05 02:26:47,woodsonsjones,,0,0,0,"The COVID Flotilla - Bring your own tube rule doesn't stop people from flocking to the Guadalupe River ",,,,1279602594588090373,https://twitter.com/woodsonsjones/status/1279602594588090373
2020-07-05 02:10:50,AbrazoAdoption,,0,0,0,"It’s a Fourth of July unlike nearly any others, due to Covid-19, but the values we Americans hold dear guide and unite us still. Happy #IndependenceDay to all our Abrazo friends and families, from coast to coast!… https://www.instagram.com/p/CCPj7RqBXsX/?igshid=19bo1qzniaywc",,,#IndependenceDay,1279598582283276288,https://twitter.com/AbrazoAdoption/status/1279598582283276288
2020-07-05 01:45:26,IllDoPeYOu,,0,3,1,"Texas about to embarrass us and be the last state that has covid",,,,1279592190981873664,https://twitter.com/IllDoPeYOu/status/1279592190981873664
2020-07-05 01:43:18,ldelao76,KimRuxton,0,0,2,"Perhaps this will REALLY backfire on #TrumpVirus . He is fine w Black, Brown people dying. Seniors Dying. But THESE maga morins will be dead, too, if COVID stays as it is. #TrumpOwnsEveryDeath #TrumpDeathToll132K",,,#TrumpVirus #TrumpOwnsEveryDeath #TrumpDeathToll132K,1279591652445782016,https://twitter.com/ldelao76/status/1279591652445782016
2020-07-05 00:56:42,KingComplex26,,1,7,16,"I FUCKING HATE COVID-19 I FUCKING HATE COVID-19 I FUCKING HATE COVID-19 I FUCKING HATE COVID-19 I FUCKING HATE COVID-19 I FUCKING HATE COVID-19 I FUCKING HATE COVID-19 I FUCKING HATE COVID-19 I FUCKING HATE COVID-19",,,,1279579926329466889,https://twitter.com/KingComplex26/status/1279579926329466889
2020-07-05 00:55:11,TexansRevolt,CNNPolitics,0,0,1,"She would have done better in every way. She didn’t coluded with Russia and isn’t their puppet. She wouldn’t have given a needless tax cut to the top 1% and created 5 trillion plus in debt. She would have worked a solid plan to stop covid like Germany’s president. @HillaryClinton",,@HillaryClinton,,1279579545851617280,https://twitter.com/TexansRevolt/status/1279579545851617280
2020-07-05 00:08:38,Esmerlndaa,,1,2,7,"The only positive thing I’ve had this year is my damn covid results ",,,,1279567830124560385,https://twitter.com/Esmerlndaa/status/1279567830124560385
2020-07-04 23:54:51,yaaaabass,,0,0,3,"Bro screw covid, I was actually happy. Screw yall for not wearing masks.",,,,1279564362601160704,https://twitter.com/yaaaabass/status/1279564362601160704
2020-07-04 23:34:59,AlysonAlonzo,,3,20,26,"Im taking submissions for queervibes yawl. I’ve been off the air cuz covid but I’ll be recording from home now. We need visibility. KRTU in SATX exclusively has a platform For lgbtqia+ recording artists. Email your songs in MP3 format(please just MP3s)to Queervibes91.7@gmail.com",,,,1279559360671252480,https://twitter.com/AlysonAlonzo/status/1279559360671252480
2020-07-04 23:12:47,UTHealthGME,,0,3,10,"This is the sign of teamwork! The Department of Surgery and our Surgical Residents’ improvised workspace where they are taking care of critically ill COVID patients. – at University Hospital",,,,1279553775527747586,https://twitter.com/UTHealthGME/status/1279553775527747586
2020-07-04 22:55:51,TexansRevolt,bexters99,0,0,1,"Except it doesn’t at all - covid hasn’t resulted from people exercising their constitutional rights in masks ",,,,1279549511694761984,https://twitter.com/TexansRevolt/status/1279549511694761984
2020-07-04 22:55:07,TexansRevolt,jbuck0,0,0,0,"Well actually - protests don’t seem to have caused covid 19 infections - it’s been weeks so we’d know",,,,1279549330274373632,https://twitter.com/TexansRevolt/status/1279549330274373632
2020-07-04 22:53:44,thisism4rio,IAmSalsaVerde,1,0,0,"Torn feelings, I’ve been there. Someone close to my gf and I was continuously talking shit about Covid and people wearing masks saying it was stupid, and last night they were checked into the ER to get on a ventilator after testing positive. part of me cares, part of me doesnt",,,,1279548982646185985,https://twitter.com/thisism4rio/status/1279548982646185985
2020-07-04 22:46:07,TexansRevolt,RawStory,0,0,3,"Yea - republicans seem to want to be infected by covid-19. For Trump, that’s corona virus 2019. Everybody but Trump knows that.",,,,1279547065605988360,https://twitter.com/TexansRevolt/status/1279547065605988360
2020-07-04 22:37:00,HausOf_Michael,,0,0,3,"Interesting how the White House is having a celebration and I see no one wearing mask. How has the president not been exposed to Covid already?",,,,1279544770482917376,https://twitter.com/HausOf_Michael/status/1279544770482917376
2020-07-04 22:29:42,Dominiq84085818,paulsperry_,0,0,0,"FACT: 4 COVID-19 SPREADING MASKLESS, REPUBS COVID-19 HAS KILLED MORE AMERICAN'S THAN VIETNAM WAR, N NOW MORE THAN WWI.YET, U DENY PROVABLE IN COURT FACTS, FROM CDC/WHO/EPIDEMIOLOGIST N TWEET, IRRESPONSIBLE, NEGLIGENT, MEDICAL MISINFORMATION ON COVID-19, LIKE F*KN BADGE OF HONOR ",,,,1279542932962455552,https://twitter.com/Dominiq84085818/status/1279542932962455552
2020-07-04 22:09:42,VDIArchitect,cwhit0307,1,0,0,"It's a mistake at this point to put people into high concentrations because of COVID. There are always idiots. Now you have idiots that give you liability on your property. THIS is why we can't have nice things.",,,,1279537900590444545,https://twitter.com/VDIArchitect/status/1279537900590444545
2020-07-04 22:01:25,mterrig,thomaskaine5,0,0,1,"Please, please God let the rest of the family catch Covid-19 and may DJT get it the worst",,,,1279535816142925824,https://twitter.com/mterrig/status/1279535816142925824
2020-07-04 21:56:45,mterrig,Julius_Kim,0,0,0,"I want @realDonaldTrump to get the bad case of Covid that killed my wonderful husband. No one deserves COVID-19 more than trump and his disgusting family",,@realDonaldTrump,,1279534638860570624,https://twitter.com/mterrig/status/1279534638860570624
2020-07-04 21:55:17,BoloBoffin,catvalente,0,0,0,"This is clearly Abbott's policy for any elections during the time of COVID-19 without a vaccine: Kill them all. Anyone who dares to vote. Kill them. ",,,,1279534270344761348,https://twitter.com/BoloBoffin/status/1279534270344761348
2020-07-04 21:21:44,JellyMontes,,0,2,8,"As someone who hates change, one thing I know I can always rely on is checking the latest news headlines and still being able to see “Highest Record Number of COVID cases in One Day” ",,,,1279525829945499649,https://twitter.com/JellyMontes/status/1279525829945499649
2020-07-04 21:03:17,cgreenbartlett,,1,0,13,"Hearing my mom say “I wish I could hug you” hit me hard. I hate COVID-19. I want to hug my mom, y’all.",,,,1279521183420030978,https://twitter.com/cgreenbartlett/status/1279521183420030978
2020-07-04 20:39:56,TexansRevolt,BernardKerik,0,0,0,"It’s really Trump and his continued collusion with Russia and failure to reign in covid-19 like other countries have. You seem out of touch Bernard.",,,,1279515307477028867,https://twitter.com/TexansRevolt/status/1279515307477028867
2020-07-04 20:11:41,Jacob_MJay,,1,2,5,"All this covid-19 bs don’t add up bro..",,,,1279508198249168896,https://twitter.com/Jacob_MJay/status/1279508198249168896
2020-07-04 19:48:23,TexansRevolt,AZachParkinson,0,0,0,"Lol - 11.1% unemployment, 50,000 + covid cases a day, America is in a recession, 4 million people returned to work after a Great Depression type job loss... This guy is lying.",,,,1279502335023202308,https://twitter.com/TexansRevolt/status/1279502335023202308
2020-07-04 19:21:31,Aleeethecreator,maidmer_,0,1,9,"I wish COVID would just kill off every racist, rapist, and just evil person. That would really fix a lot of our problems. ",,,,1279495575205969922,https://twitter.com/Aleeethecreator/status/1279495575205969922
2020-07-04 19:19:11,El_Verde_91,,3,0,1,"Time for a COVID 19 test",,,,1279494985897906176,https://twitter.com/El_Verde_91/status/1279494985897906176
2020-07-04 19:07:50,TEXSZN,CNN,0,3,6,"San Antonio has been in the news a lot recently for COVID-19 and police issues. ",,,,1279492132282216448,https://twitter.com/TEXSZN/status/1279492132282216448
2020-07-04 18:57:49,_JimmyLujan_,philosopping,2,0,1,"Protesting is a first amendment right and most protesters wear mask and take COVID 19 safety precautions. Plus what news outlets are bias like can you put a list together; and then add the ones you like on it because the medias always been biased in some way, shape, or form.",,,,1279489608296943618,https://twitter.com/_JimmyLujan_/status/1279489608296943618
2020-07-04 17:48:40,alecb69,,0,0,2,"i have survived covid 19",,,,1279472209623482368,https://twitter.com/alecb69/status/1279472209623482368
2020-07-04 17:17:49,RebelT210,HopeAAKH,3,0,3,"At least you're not in Texas rn..over 100°F and full of COVID-19 ",,,,1279464445236969473,https://twitter.com/RebelT210/status/1279464445236969473
2020-07-04 17:09:03,tanya_gaytan,,0,0,0,"The stats show that we are not defeating covid like the other countries ...these stats are calculated and the information collected is by doctors,scientists and leading health organizations..so who are you going to believe the doctors or the guy who fires everyone he don't like?? ",,,,1279462239314075650,https://twitter.com/tanya_gaytan/status/1279462239314075650
2020-07-04 16:39:51,Rachell79810881,texasgirl1776,1,1,1,"Ur a damn fool , don't come at me with political rhetoric with the covid 19 cases",,,,1279454889513492480,https://twitter.com/Rachell79810881/status/1279454889513492480
2020-07-04 16:17:49,TexansRevolt,RichardGrenell,0,0,0,"Epic stupidity. We know 130,000 Americans have died and 2.8 milliom have become infected because Trump lied about covid &amp; did nothing to stop it. We know infections are 50,000 + a day. + 11.1% unemployed But Richard has a conspiracy theory lie he’d like to distract you with.",,,,1279449343859339264,https://twitter.com/TexansRevolt/status/1279449343859339264
2020-07-04 15:29:02,WP4KTF,,0,0,0,"Almost 130,000 Americans #covid related #deaths, and this #POS is worried about some #confederate statues. WTF is going on in this man's head? And his blind #followers? Embarrased to… https://www.instagram.com/p/CCOaep1nTSI9QM0AeDmg8eR1iomZ1nNroIBK6I0/?igshid=75r9v5u0pakf",,,#covid #deaths #POS #confederate #followers,1279437068264001536,https://twitter.com/WP4KTF/status/1279437068264001536
2020-07-04 15:19:30,markshuffler,,0,0,0,"Dear friends and family in the USA: Happy Independence Day! Now listen to this nurse ... #usa #america #july4th #happyjuly4th #happyindependenceday #covid19 #covid_19 #covid #coronavirus #corona… https://www.instagram.com/p/CCOXQ_iARTN/?igshid=1pxe8j4kb93hz",,,#usa #america #july4th #happyjuly4th #happyindependenceday #covid19 #covid_19 #covid #coronavirus #corona,1279434669331812354,https://twitter.com/markshuffler/status/1279434669331812354
2020-07-04 15:08:58,christovar_rsa,iLLtwin84,0,0,1,"Great shot indeed! Hope some of this COVID stuff calms a little so I can catch a game! ",,,,1279432018502258691,https://twitter.com/christovar_rsa/status/1279432018502258691
2020-07-04 14:19:57,Hyperslw4Trump,,0,0,0,"@realDonaldTrump Any ATTEMPT At COVID Vaccine ""Certification "" to enter Society MUST NOT BE IMPLEMENTED!!! @BillGates #DeepState SICKOS!!!!",,@realDonaldTrump @BillGates,#DeepState,1279419684736192515,https://twitter.com/Hyperslw4Trump/status/1279419684736192515
2020-07-04 14:11:39,AllenMeallen20,GovAbbott,0,0,0,"@GregAbbott_TX This is not about Covid-19, safety, or high death rates. Go read the Constitution. This mandate crosses the line &amp; I am one who has stayed in &amp; wears a mask in public. Stop pandering to the left. #AmericaStrong #SilentNoMore #PatriotsUnited",,@GregAbbott_TX,#AmericaStrong #SilentNoMore #PatriotsUnited,1279417593162579974,https://twitter.com/AllenMeallen20/status/1279417593162579974
2020-07-04 13:17:49,SandiGEstrada1,FigenSports,0,0,0,"Lol... COVID is making people crazy ! LOL... hahahaha... . I hope she’s ok! ",,,,1279404046823174144,https://twitter.com/SandiGEstrada1/status/1279404046823174144
2020-07-04 12:44:11,ldelao76,,1,1,3,"My god, WH new messaging for COVID is... ""We Have To Live With it."" In other words, become complacent. Oh, and take the Trump stockpile of Hydroqoroquine. NO!!!! We need to FIGHT C19 with MASKS, DISTANCE &amp; NO CROWD gatherings ! More TESTING! &amp;Tracing! #TrumpOwnsEveryDeath",,,#TrumpOwnsEveryDeath,1279395583665623040,https://twitter.com/ldelao76/status/1279395583665623040
2020-07-04 10:48:55,Tophrrr,,0,0,2,"I know the US is struggling with COVID infections on the rise with tens of thousands of people dead and our hospitals overrun beyond capacity but I just want to remind you... that ALL countries matter. Now. Do you see how dumb you fucking look?",,,,1279366572830851072,https://twitter.com/Tophrrr/status/1279366572830851072
2020-07-04 07:38:54,shawnashleyfoto,,0,0,0,"@hannibalburess you down for changing COVID-19 to Buress-19? Just curious...",,@hannibalburess,,1279318756515368960,https://twitter.com/shawnashleyfoto/status/1279318756515368960
2020-07-04 07:28:42,KGAL1626,,0,0,1,"COVID-19 v. Texas ",,,,1279316188372369408,https://twitter.com/KGAL1626/status/1279316188372369408
2020-07-04 06:37:02,Always_FightOn,,0,0,0,"Two total USC student-athletes test positive for COVID-19 https://247sports.com/college/usc/Article/covid-19-usc-football-trojans-2020-student-athletes--148805325/ via @247sports TWO TOO MANY! We love sports, @USC_Athletics @USC @PresidentFolt @USC_mikebohn @USCCoachHelton #TrojanLivesMatter For ALL athletes, THEIR HEALTH IS FAR MORE IMPORTANT! #SHUTDOWN",,@247Sports @USC_Athletics @USC @PresidentFolt @USC_mikebohn @USCCoachHelton,#TrojanLivesMatter #SHUTDOWN,1279303184549281794,https://twitter.com/Always_FightOn/status/1279303184549281794
2020-07-04 06:07:53,phelix676,realDonaldTrump,0,0,0,"I hope you and all of your trump holes catch covid",,,,1279295851614085120,https://twitter.com/phelix676/status/1279295851614085120
2020-07-04 06:03:15,Dominiq84085818,MELANIAJTRUMP,0,5,13,"COLOR THIS TWEET DESPICABLE ""INSENSITIVE"", ""SELF SERVING"" , ""CRUEL"".... PPL ARE DYING, COVID-19 HAS OVERWHELMED HOSPITALS, TEXAS GOV. ABBOTT #AbottFailedTexas FYI; NOBODY, GIVES A RATS A$$, WHAT DESIGNER THE ICE QUEEN CRUELA DEVILLE IS WEARING GTFO BE BEST ""ME"" LANIA",,,#AbottFailedTexas,1279294682745442304,https://twitter.com/Dominiq84085818/status/1279294682745442304
2020-07-04 05:39:26,emrosey__,MagicOnMainSt,1,0,3,"don’t worry about it girl. if you look at stats, there’s basically no difference in amount of covid cases that have had stay at home orders vs those that haven’t. keep your head up, i’m really happy disney is reopening :)",,,,1279288689600970753,https://twitter.com/emrosey__/status/1279288689600970753
2020-07-04 04:10:34,Rbc3T,NadezhdaRossi,0,0,0,"For what? Your pretend covid infection? Either you didn’t have covid, or you had a mild case because anyone with a 6 month course and kind and heart damage would have said SOMETHING about it while sending out four or five tweets daily.",,,,1279266324594769927,https://twitter.com/Rbc3T/status/1279266324594769927
2020-07-04 03:41:52,NQWilliamson,,0,0,3,"The SECOND time I saw HAMILTON with my teacher/daughter @BrownWarrens at the beautiful Majestic Theatre in San Antonio! This summer would have been my third time but you know.....COVID.… https://www.instagram.com/p/CCNJjK-gHciB9gsomVZ5STzoJKxPkwfyBmnVio0/?igshid=1vas53tstixr5",,@BrownWarrens,,1279259103064469504,https://twitter.com/NQWilliamson/status/1279259103064469504
2020-07-04 03:39:02,Jerry_HZN,,0,0,0,"Fuck COVID &amp; The System .",,,,1279258389068029952,https://twitter.com/Jerry_HZN/status/1279258389068029952
2020-07-04 03:20:57,falconfiend2,,0,0,0,"How many players got Covid man. They should have been gone to...just the playoff teams",,,,1279253840215322624,https://twitter.com/falconfiend2/status/1279253840215322624
2020-07-04 03:11:45,jasmynmarie_,,0,1,4,"All of this has hit close to home that’s why i’m so frustrated so if you are still anti-mask and believe COVID is not real please unfollow me.",,,,1279251522665230336,https://twitter.com/jasmynmarie_/status/1279251522665230336
2020-07-04 03:08:31,falconfiend2,,0,0,0,"Educate people. A woman said kids can’t get sick from Covid! That person is uninformed that some children have asthma symptoms, but children are the most vulnerable groups from the common cold and flu, because they have to wash their hands and cover their mouths coughing",,,,1279250710564163585,https://twitter.com/falconfiend2/status/1279250710564163585
2020-07-04 03:06:53,miahashlee,,2,0,4,"The worst fear has hit me this past week..starting with my dad not feeling good (he is waiting on his test results) and now my grandma has covid with pneumonia..she is ok..I pray it does not get any worse... I’m trying to stay so positive..this is so scary..",,,,1279250301137141761,https://twitter.com/miahashlee/status/1279250301137141761
2020-07-04 03:06:01,jasmynmarie_,,1,1,11,"Being quarantined in march was absolutely pointless, we are literally back to square 1. Governor Abbott made the biggest mistake deciding to open up when things were still bad. Those who have taken every precaution to be safe will be affected by those thinking COVID-19 is fake.",,,,1279250081120759814,https://twitter.com/jasmynmarie_/status/1279250081120759814
2020-07-04 02:31:50,falconfiend2,,0,0,0,"Satan knows Covid is not really hurting the church, so he has a plan to shut the church down!!! No! To shut the church up!!!!",,,,1279241481035841541,https://twitter.com/falconfiend2/status/1279241481035841541
2020-07-04 02:29:08,Rbc3T,Rbc3T,2,0,3,"I scanned your feed. You’ve been posting multiple times daily for months. Not once did I see anything about you having covid.",,,,1279240801982255105,https://twitter.com/Rbc3T/status/1279240801982255105
2020-07-04 02:27:54,MColeman210,,0,4,0,"COVID Monday ",,,,1279240488034459649,https://twitter.com/MColeman210/status/1279240488034459649
2020-07-04 02:16:14,jessgonza_12,,1,0,11,"I’m confused. You think you have covid but yet you’re still taking your kid to practice/tournaments?! What the hell?! ",,,,1279237554454310912,https://twitter.com/jessgonza_12/status/1279237554454310912
2020-07-04 01:28:08,nan,AndrewSandersSA,1,0,0,"I’ve asked for more ridiculous. I like it. I’ll ask @ThisIsRobThomas, too. Rob, can you and Santana join us for a block party when COVID is over? It would be amazing.",,@ThisIsRobThomas,,1279225449713930240,https://twitter.com/nan/status/1279225449713930240
2020-07-04 01:12:58,GMENFORLIFE,EricTrump,0,0,1,"Hope you get Covid-19 motherfucker ",,,,1279221630875688961,https://twitter.com/GMENFORLIFE/status/1279221630875688961
2020-07-04 01:08:31,nan,,1,0,12,"Deya has befriended a teen girl who rides her bike in the neighborhood during our dinner time. Tonight the rider took the relationship to the next level by waving and blowing Deya a kiss. This is one of the joys of COVID-19. ",,,,1279220512149962755,https://twitter.com/nan/status/1279220512149962755
2020-07-04 00:37:41,EddietheGreat84,,0,0,1,"@funnyfelipe told you bro! At Least Two Comics Test Positive For COVID-19 After Tour Stop at LOL Comedy Club in San Antonio ",,@funnyfelipe,,1279212753828405250,https://twitter.com/EddietheGreat84/status/1279212753828405250
2020-07-04 00:37:17,TexansRevolt,DPRK_News,0,0,0,"We all hope it goes as well as Middle East peace and Covid 19 solution because neither of those things actually worked",,,,1279212652615565313,https://twitter.com/TexansRevolt/status/1279212652615565313
2020-07-04 00:31:39,MokeDawg,,0,3,4,"FUCK COVID-19",,,,1279211233640620034,https://twitter.com/MokeDawg/status/1279211233640620034
2020-07-04 00:26:26,LisaSeaman8,,4,0,8,"Here in San Antonio we broke a record of 1,334 cases of Covid 19 today. Staying my ass at home. ",,,,1279209920760602625,https://twitter.com/LisaSeaman8/status/1279209920760602625
2020-07-03 23:49:13,ofthekaren,,0,0,0,"Every time I get exposed to COVID its getting closer and closer like I can feel it encroaching on my body does that make sense?",,,,1279200553613111302,https://twitter.com/ofthekaren/status/1279200553613111302
2020-07-03 23:49:08,boominbesta,,0,0,3,"I feel like if covid-19 wasn’t happening right now then i’d have a bf like it’s totally covid not me",,,,1279200535195914240,https://twitter.com/boominbesta/status/1279200535195914240
