date,username,to,replies,retweets,favorites,text,geo,mentions,hashtags,id,permalink
2020-07-03 23:27:07,meganjuliann_,,1,0,0,"honestly i love my job but the fact that 3 people tested positive within 1 week i feel they need to close our location and do a deep cleaning. but instead they’re overworking the people that don’t have covid (YET) ",,,,1279194994247680001,https://twitter.com/meganjuliann_/status/1279194994247680001
2020-07-03 23:14:50,theOGalexd,,1,4,41,"if you’re one of these people that says shit like “stay home save lives!! fuck the 4th of july” but you were out protesting for weeks and not saying a peep about covid suck a fuckin dick ",,,,1279191901774774279,https://twitter.com/theOGalexd/status/1279191901774774279
2020-07-03 23:09:46,jamyemryan1,TheDailyShow,1,0,0,"I have a guy that works where I live who actually believes COVID-19 is a part of the new world order and, we’ve all ALL THE WORLD, been brainwashed into THINKING PEOPLE ARE GETTING SICK AND DYING!",,,,1279190629260673024,https://twitter.com/jamyemryan1/status/1279190629260673024
2020-07-03 23:02:02,TexansRevolt,PadmaLakshmi,0,0,1,"Yea - that was so days ago - now he’s cool with Russia kill american soldiers and still ok with Americans becoming infected and dying of corona virus 2019 - covid-19 while he spends another day - 365 days - 1 year and counting - golfing and lying and tweeting and not working",,,,1279188682013126656,https://twitter.com/TexansRevolt/status/1279188682013126656
2020-07-03 22:02:10,TexSandra210,disclosetv,0,0,1,"Over 25% of the world record Covid-19 cases yesterday were right here in the US. We are a disease on the world. ",,,,1279173614697418752,https://twitter.com/TexSandra210/status/1279173614697418752
2020-07-03 21:55:17,ktrob18,melrob66,0,0,13,"I have yet to regain feeling in my face where my mask is for 12+ hours. COVID-19 is real. Stay home, wear a mask, wash your hands, etc. This is not something to mess with. ",,,,1279171882210729986,https://twitter.com/ktrob18/status/1279171882210729986
2020-07-03 21:43:17,toryjcarr,,0,1,12,"why does getting a covid test feel like winning the lottery rn....",,,,1279168863528157184,https://twitter.com/toryjcarr/status/1279168863528157184
2020-07-03 21:40:02,ebeam120,,1,0,0,"@Mucinex my wife and I are both Covid positive and are using your fast max liquid instead of Tylenol. It’s helped so much. Always loved using it whenever I feel under the weather.",,@Mucinex,,1279168044686770190,https://twitter.com/ebeam120/status/1279168044686770190
2020-07-03 21:39:54,CheeyeahBoy,,0,0,1,"As a reminder, just because people ARENT working during COVID doesn’t mean they’re receiving unemployment. Stfu if you consider yourself essential and complain about nOt gEtTiNg extra money. People got laid off then denied unemployment, too. ",,,,1279168011526639618,https://twitter.com/CheeyeahBoy/status/1279168011526639618
2020-07-03 21:19:28,Mariedo33989203,,0,0,0,"Just saw on news that protesting did not make covid #’s spike after study places tested only protesters found low % in many states most wore masks &amp; marches were outside so that avoided any spread! If it was different it would be told for sure in SA the bars did it no protests",,,,1279162867715989505,https://twitter.com/Mariedo33989203/status/1279162867715989505
2020-07-03 21:03:26,DrEstebanLopez,,0,2,2,"Every patient in ER is #COVID - now we are running out of reagent to rapidly test. We will quickly fill up with boarded patients if we don’t know where to place them. Things aren’t looking too good - I don’t want to infect a presumptive positive who is really negative.",,,#COVID,1279158834800533504,https://twitter.com/DrEstebanLopez/status/1279158834800533504
2020-07-03 20:50:00,SamChristineM,,0,0,0,"I don’t understand people on airplanes bitching about all the people on airplanes like they aren’t on the damn airplane #Covid",,,#Covid,1279155453046542343,https://twitter.com/SamChristineM/status/1279155453046542343
2020-07-03 20:39:22,JohnP_TTU,DylansRawTake,0,0,0,"Xbox let’s do this I’m already in self quarantine due to COVID this would help me get through the weekend",,,,1279152777055350792,https://twitter.com/JohnP_TTU/status/1279152777055350792
2020-07-03 20:32:35,Esmerlndaa,,0,0,1,"I didnt work out at all through quarantine. But now that I have covid, I choose to workout wow girl",,,,1279151070917394437,https://twitter.com/Esmerlndaa/status/1279151070917394437
2020-07-03 20:12:41,__George__007,GregAbbott_TX,0,0,1,"COVID DEATHS!!! PREVENTABLE!!! NEGLECT!!! RESIGN!!! ",,,,1279146063836917760,https://twitter.com/__George__007/status/1279146063836917760
2020-07-03 19:34:52,beldonstevens,drfyne,0,2,3,"A composite photo of thousands of healthcare workers who have died from COVID-19, made by @milenio",,@Milenio,,1279136544322961408,https://twitter.com/beldonstevens/status/1279136544322961408
2020-07-03 19:10:50,pridecares,,0,0,1,"Compassionate care must not take a backseat to COVID-19! So, when we heard that our client, Maria Lopez, was turning 104, we decided she deserved a parade. Several generations of her family joined us for the celebration. Happy Birthday Ms. Lopez - You’re a blessing &amp; inspiration! ",,,,1279130497201905664,https://twitter.com/pridecares/status/1279130497201905664
2020-07-03 19:01:49,Esmerlndaa,,1,0,3,"I came to SA to quarantine alone on 06/23 since I was the only one in my fam that came out (-). Got retested on 06/27 and I have COVID-19.",,,,1279128230432313344,https://twitter.com/Esmerlndaa/status/1279128230432313344
2020-07-03 18:32:43,1_judson,,0,1,6,"We really the only country still having major issues with covid that shit is embarrassing",,,,1279120904891568132,https://twitter.com/1_judson/status/1279120904891568132
2020-07-03 18:32:43,TashaLHendricks,,0,0,0,"In the Covid-19 economy, you can have a kid or a job. Not both. ",,,,1279120904782589952,https://twitter.com/TashaLHendricks/status/1279120904782589952
2020-07-03 18:24:29,SirLordStacks,AoverK,0,0,1,"pre covid 95% were retarded post covid 99%",,,,1279118833056391168,https://twitter.com/SirLordStacks/status/1279118833056391168
2020-07-03 18:22:24,PizzaFranny,,0,0,0,"Businesses need to be more consistent on their rules and regulations for COVID-19. Everyone has different procedures and it’s just an inconvenience #ShutItDown",,,#ShutItDown,1279118310106431488,https://twitter.com/PizzaFranny/status/1279118310106431488
2020-07-03 17:57:44,satxgirlygirl,,0,0,0,"@realDonaldTrump @4MoreYears2020 8 attendees to a COVID party caught and subpoenaed for questioning. Party host cooperating. But, Trump holds a virus fest and YOU are paying to go! #happyfourth",,@realDonaldTrump @4MoreYears2020,#happyfourth,1279112101131423744,https://twitter.com/satxgirlygirl/status/1279112101131423744
2020-07-03 17:44:01,jra011464,,0,0,0,"Well looks like it’s definitely official. #maskup #covid #texas @Villa of the El Jefe https://www.instagram.com/p/CCMFIThJ5sT/?igshid=grfat0vfsku9",,,#maskup #covid #texas,1279108650548764672,https://twitter.com/jra011464/status/1279108650548764672
2020-07-03 17:26:19,theorycoffee,,0,0,0,"Half done, other half on the way!! Stay safe y’all, Covid is hitting the hospital system here in town pretty hard. We’re going to roll out what you should expect from Theory’s coffee service starting next week,… https://www.instagram.com/p/CCMDGxoHYOw/?igshid=a6r34iei0pzo",,,,1279104193643655168,https://twitter.com/theorycoffee/status/1279104193643655168
2020-07-03 17:23:18,soyMurdox,,1,0,13,"I’ll never forgive my one professor who asked me to write an essay on how COVID affected my life and SHE GAVE ME A FUCKING 85. WHAT MORE DO U WANT FROM ME",,,,1279103435544109058,https://twitter.com/soyMurdox/status/1279103435544109058
2020-07-03 17:14:24,Valerie_Romo,DCFANSM,1,0,1,"For everyone’s sake I hope it helps. San Antonio is just about to capacity at local Hospitals treating covid patients.",,,,1279101198633762816,https://twitter.com/Valerie_Romo/status/1279101198633762816
2020-07-03 17:13:54,selah_trevino,,0,0,0,"COVID-19 has been here since January or February I can’t even remember at this point But the fact that they are finally posting it now... Like they could’ve posted it back then, this would’ve saved lives but they’re going to post it now.... they could do a lot more but don't ",,,,1279101068811665410,https://twitter.com/selah_trevino/status/1279101068811665410
2020-07-03 17:03:24,TheBradSowder,,1,0,5,"EAS alerts for COVID-19 in San Antonio ",,,,1279098428170088448,https://twitter.com/TheBradSowder/status/1279098428170088448
2020-07-03 17:03:07,RobertPriceTV,,5,34,87,"For the second time now, San Antonio has sent out a COVID-19 emergency alert to all wireless users in Bexar County. ",,,,1279098356665651201,https://twitter.com/RobertPriceTV/status/1279098356665651201
2020-07-03 17:01:44,Hondeezy_FIJI,,1,0,6,"Just got that COVID emergency alert... Texas we suck. Wear your damn mask ",,,,1279098007657603072,https://twitter.com/Hondeezy_FIJI/status/1279098007657603072
2020-07-03 16:54:47,marisac721,,1,0,3,"I'm really not in the mood to work today. My family are headed to the lake house but I can't since I work. This weekend is going to be so depressing. I wish life could be back to nonormal pretty covid. #FridayFeeling",,,#FridayFeeling,1279096260893474818,https://twitter.com/marisac721/status/1279096260893474818
2020-07-03 16:52:48,flowisslowiss,,1,0,6,"Since Covid started I have become a gamer. ",,,,1279095761909829632,https://twitter.com/flowisslowiss/status/1279095761909829632
2020-07-03 16:07:59,Mariedo33989203,C_Krum,1,0,3,"I sure have been but with peoples free will to do as they please they don’t stay home so it won’t go away till people listen which is why we have covid. I have been praying for all the world regardless &amp; my fam. &amp; all my fam is fine I thank Him &amp; praise Him I need for nothing ",,,,1279084484411957251,https://twitter.com/Mariedo33989203/status/1279084484411957251
2020-07-03 16:03:12,esstiffany,,0,0,2,"I’m grateful I have a job don’t get me wrong. But you legit do not understand how crazy it has been due to COVID. We are so behind on paperwork, &amp; no one else can seem to do their job, so it just keeps piling up. I’m gonna lose it on someone soon.",,,,1279083280323788800,https://twitter.com/esstiffany/status/1279083280323788800
2020-07-03 15:14:49,TexansRevolt,samstein,0,0,1,"Do they not understand people are not dumb enough to think 4 million people returning to work when we lost 44 million jobs and still have 11.1% employment and fast rising covid 19 infections means things are better? Things are going to get worse while trump golfs.",,,,1279071101600096256,https://twitter.com/TexansRevolt/status/1279071101600096256
2020-07-03 15:09:43,jaykubbbbb,,0,0,3,"i got my covid test yesterday and now i’ve been exposed again and have to take another one please help",,,,1279069817249677312,https://twitter.com/jaykubbbbb/status/1279069817249677312
2020-07-03 14:43:47,goldlis,,0,0,1,"I’m helping to fight #COVID19 – 48440 people are estimated to have COVID symptoms in Bexar County today. Please help by taking 1 min daily to report how you feel . You also get an estimate of COVID in your area. Download the app https://covid.joinzoe.com/us #health",,,#COVID19 #health,1279063293886332929,https://twitter.com/goldlis/status/1279063293886332929
2020-07-03 14:42:20,elisa_chavez_,,0,1,0,"This girl is really complaining about COVID messing up her traveling plans ",,,,1279062927228710912,https://twitter.com/elisa_chavez_/status/1279062927228710912
2020-07-03 13:39:47,abbyalv_xoxo,,0,0,4,"Got my covid test results, still Negative ",,,,1279047186299396097,https://twitter.com/abbyalv_xoxo/status/1279047186299396097
2020-07-03 13:35:24,Mr_Westmoore,,0,1,0,"CoronaVirus weekend is upon us. Keep them Covid infection cases going UP ladies and gentlemen! ",,,,1279046081666519047,https://twitter.com/Mr_Westmoore/status/1279046081666519047
2020-07-03 13:29:12,rachnavara,,0,98,266,"People have missed witnessing the birth of their child, missed saying goodbye to loved ones, missed their graduations/proms/weddings/etc. because of COVID, yet others can’t fathom not going out for the 4th of July",,,,1279044524820566022,https://twitter.com/rachnavara/status/1279044524820566022
2020-07-03 13:00:08,estradaabby48,,2,11,37,"tired of seeing everyone collecting their $600 a wk unemployment check & not wanting to go back to work. work has not stopped for me throughout this entire covid time and I in no way have been compensated for my efforts. we deserve hazardous pay since our healths been at risk.",,,,1279037209270779905,https://twitter.com/estradaabby48/status/1279037209270779905
2020-07-03 12:33:52,SirLordStacks,,1,0,4,"covid fucking ppl up built like this... ",,,,1279030597726408704,https://twitter.com/SirLordStacks/status/1279030597726408704
2020-07-03 11:10:31,cmcdonaldMD,,3,0,17,"Time to step out of the OR and up to the plate #COVID #MaskUpTexas #DoYourPart #MedTwitter – at University Hospital",,,#COVID #MaskUpTexas #DoYourPart #MedTwitter,1279009622469357569,https://twitter.com/cmcdonaldMD/status/1279009622469357569
2020-07-03 10:28:58,Dominiq84085818,,1,0,1,"REMEMBER, REMEMBER IN NOV. HOW GOV. ABBOTT N FLORIDA GOV. DESANTIS CHOSE TO BOW DOWN N KISS, TYPHOID MARY A$$, VS. KEEPING AMERICAN CITIZENS SAFE BY ENFORCING CDC COVID-19 PROTOCOL THEY SAT WHINED N W/OUT SHAME, BLAMED DEMS, PROTESTERS, N EVERYBODY N THEIR GRANDMA 4 COVID19 RISE ",,,,1278999164127531008,https://twitter.com/Dominiq84085818/status/1278999164127531008
2020-07-03 09:38:07,elimiah_87,Shynessie,1,0,1,"COVID thoooo ",,,,1278986370216755200,https://twitter.com/elimiah_87/status/1278986370216755200
2020-07-03 07:23:45,angle3246,,0,1,4,"This is because the response was designed for the rich, not the working class. They provided a one size fits all solution with no thought for variations for economic disparities. ""In the Covid-19 economy, you can have a kid or a job. Not both."" ",,,,1278952552973897729,https://twitter.com/angle3246/status/1278952552973897729
2020-07-03 06:44:44,Lmartinez344,DailyCaller,0,0,2,"Idiots. These are the same people that come in to the hospital with a slight cough and demand covid-19 test. ",,,,1278942734368288769,https://twitter.com/Lmartinez344/status/1278942734368288769
2020-07-03 05:18:34,ldelao76,sdr_medco,0,2,22,"Has HE given America a hand up, when we most needed it against COVID? No. In fact, has he EVER ""given"" anyone a hand up? Only his Papa Putin, it seems. #ComradeTrump",,,#ComradeTrump,1278921049657278464,https://twitter.com/ldelao76/status/1278921049657278464
2020-07-03 05:00:58,JayTrainNYC,MySMFM,0,3,4,"@MySMFM always keeping us up to date with these changing times #mfm #obgyn #WearADamnMask #COVID19TX #covid ",,@MySMFM,#mfm #obgyn #WearADamnMask #COVID19TX #covid,1278916623626309632,https://twitter.com/JayTrainNYC/status/1278916623626309632
2020-07-03 04:12:12,Rbc3T,MayorJenny,0,0,0,"Plenty of time left for you to send seniors with covid to their deaths like Newsome and Cuomo. I hear it’s a big thing these days on your side of the aisle",,,,1278904348630831112,https://twitter.com/Rbc3T/status/1278904348630831112
2020-07-03 04:07:17,lauraelizabethm,,0,1,8,"Me watching the first episode of the (new) Unsolved Mysteries and coming to the conclusion that Porter Stansberry did it AND THEN discovering he wrote a post about COVID being a lie ",,,,1278903110698704896,https://twitter.com/lauraelizabethm/status/1278903110698704896
2020-07-03 03:55:47,markous02,,0,0,1,"is it me, or has this summer been pretty mild? i was hoping the texas heat bake covid away LOL",,,,1278900217165873152,https://twitter.com/markous02/status/1278900217165873152
2020-07-03 02:48:07,BYU_craiggers,GoodishIntent,1,2,23,"One of the saddest things about this whole thing is having to try and scream words of comfort through face shields and n95s at my covid patients who just need a friend",,,,1278883187347927041,https://twitter.com/BYU_craiggers/status/1278883187347927041
2020-07-03 02:47:55,longhorn85pcb,smeesq,0,0,0,"A friend’s family member stayed home, only did take out and they believe that their teenaged daughter got COVID because of the take out. . Its like a lose/lose situation!!",,,,1278883139587395584,https://twitter.com/longhorn85pcb/status/1278883139587395584
2020-07-03 02:41:26,CobyMancillas,,0,0,2,"Covid gave me a new bodiieeeeeeee",,,,1278881507550081024,https://twitter.com/CobyMancillas/status/1278881507550081024
2020-07-03 02:21:01,aybarraaa,Boontail1,0,0,1,"Still living out there fam. This covid shit started blowing up out there so I made the executive decision to come home for a bit. Lol",,,,1278876368730820609,https://twitter.com/aybarraaa/status/1278876368730820609
2020-07-03 02:19:55,ashersxo_,,0,1,1,"When I say these covid patients are dropping like flies... just stay in the house y’all and wear your freaking mask.",,,,1278876094276517890,https://twitter.com/ashersxo_/status/1278876094276517890
2020-07-03 02:03:42,Clubnewcasino,,0,0,0,"@AEW @AEWrestling I really used to look up to Taz growing up now it seems like COVID-19 is a joke to him. How would he like it if he had COVID-19. I lost many friends to COVID-19! Shame on him. Karma is a bitch, and she keeps receipts. #AEWDynamite #COVIDー19",,@AEW @AEWrestling,#AEWDynamite #COVID,1278872011062812673,https://twitter.com/Clubnewcasino/status/1278872011062812673
2020-07-03 02:01:02,starfishncoffee,danielradosh,1,1,6,"I see a lot of people framing it in this way “gotta get back to normal!” As if COVID-19 is just gonna magically disappear cause you want it to go back to normal real bad and you stomp your feet and send your kids back to school. It boggles the mind. ",,,,1278871341719080962,https://twitter.com/starfishncoffee/status/1278871341719080962
2020-07-03 01:59:10,Ix_Nuk3m_xI,AkaElga,0,0,0,"How bout you go into a ER full of Covid-19 patients with no mask and then come back and tell me that. Or better yet tell some of the family members of the over hundred thousand people that have died SMH but you voted for Trump so I know not all life matters to you smh so sad",,,,1278870871927672832,https://twitter.com/Ix_Nuk3m_xI/status/1278870871927672832
2020-07-03 01:58:24,Clubnewcasino,GifSkullIV,0,0,1,"Jon Moxley isn’t afraid of Brian cage Taz. He’s protecting Taz and Brian from getting COVID-19. He is at his wife side who has COVID-19. Many people died from Covid-19 @AEWrestling @AEW how would Taz like it if he had Covid-19. So insensitive taz. ",,@AEWrestling @AEW,,1278870676825427969,https://twitter.com/Clubnewcasino/status/1278870676825427969
2020-07-03 01:57:52,Autym_BbyHulk_3,Mashana_,1,1,1,"I don’t make the rules covid does it’s above us now",,,,1278870541449994240,https://twitter.com/Autym_BbyHulk_3/status/1278870541449994240
2020-07-03 01:57:48,quemeanswhat,,0,1,1,"Immigration: #FREETHEFAMILIES NOW IN ICE DETENTION AND PROTECT THEM DURING THE COVID-19 PANDEMIC - Sign the Petition! http://chng.it/j8TXLfys via @Change",,@Change,#FREETHEFAMILIES,1278870525708771329,https://twitter.com/quemeanswhat/status/1278870525708771329
2020-07-03 01:34:06,Autym_BbyHulk_3,Mashana_,1,1,1,"Due to covid 19 your order has been put on back order and delayed. If you would like to speak to a representative please write an email and someone will get back to you in 2021 ",,,,1278864564050894848,https://twitter.com/Autym_BbyHulk_3/status/1278864564050894848
2020-07-03 01:25:54,Mr_Westmoore,,0,0,0,"It's like a #Covid ghost town here at work I swear.. ",,,#Covid,1278862499643883525,https://twitter.com/Mr_Westmoore/status/1278862499643883525
2020-07-03 01:07:45,TFrenchican,Meg4Congress,1,0,0,"I 've got Covid because this idiot is president. ",,,,1278857929182138371,https://twitter.com/TFrenchican/status/1278857929182138371
2020-07-03 00:49:13,TFrenchican,realhahnsolo,1,0,1,"I always do too, but because of all the idiots out there, I ended up suck w/ Covid. (Got tests results today )",,,,1278853267053780992,https://twitter.com/TFrenchican/status/1278853267053780992
2020-07-03 00:49:03,DankofMark,,0,0,0,"@RobMaaddi @AP_NFL The @NFL ought to consider putting all the names of Chronic Traumatic Encephalopathy (CTE) victims on the helmets and jersey patches. As far as I’m concerned, @NFL @MLB @NHL @NBA @NASCAR are all on Roman Empire COVID-19 respirators. To hell with them. https://twitter.com/AP_NFL/status/1278816182989193216",,@RobMaaddi @AP_NFL @NFL @NFL @MLB @NHL @NBA @NASCAR,,1278853226251649024,https://twitter.com/DankofMark/status/1278853226251649024
2020-07-03 00:40:40,TFrenchican,joshua_mastel,0,0,0,"It's quite late now... I am an essential worker and if he mandated this earlier, I wouldn't be in bed w/ Covid bc some people thought it was fine not to wear masks... ",,,,1278851117263314947,https://twitter.com/TFrenchican/status/1278851117263314947
2020-07-03 00:16:21,GMENFORLIFE,realDonaldTrump,0,0,0,"Hey governor your good president DUMP is full of shit. Glad he is taking it to the asshole Governor Deshits state there all full of dickstain Republicans hope they all get COVID-19 can’t vote if your dead ",,,,1278844994519027712,https://twitter.com/GMENFORLIFE/status/1278844994519027712
2020-07-02 23:49:29,ldelao76,Mike_Pence,0,1,2,"#GOPCowards #GOPComplicitTraitors #GOPCorruptionOverCountry #TrumpVirus #TrumpOwnsEveryDeath #TrumpDeathToll130K Yes...certainly ARE! You're ALL Complicit in killing America w COVID thru LIES, CORRUPTION and being UNFIT for office! ",,,#GOPCowards #GOPComplicitTraitors #GOPCorruptionOverCountry #TrumpVirus #TrumpOwnsEveryDeath #TrumpDeathToll130K,1278838234315984897,https://twitter.com/ldelao76/status/1278838234315984897
2020-07-02 23:31:38,TexansRevolt,realDonaldTrump,0,0,0,"Trump thinks ratings matter while Americans are becoming sick and dying die to the absence of any trump covid response. FYI - trump has done nothing to Russia or Putin for paying our enemies to kill american soldiers.",,,,1278833743529226241,https://twitter.com/TexansRevolt/status/1278833743529226241
2020-07-02 23:09:51,RichardASalas3,mallorys_oracle,2,1,3,"Thank you Ladyred. Just got my COVID-19 results back its negative. One of my nephews had came by 3 weeks ago and he's positive so we all had to go get tested.",,,,1278828261246672896,https://twitter.com/RichardASalas3/status/1278828261246672896
2020-07-02 23:06:37,arielnmac,insidehismind,0,1,3,"Please, stay home & wear your mask if you have to go out!!! There’s people still dying of Covid, and residents of nursing homes who haven’t seen their loved ones in 4 months now. Healthcare workers are exhausted!!! ",,,,1278827449078501376,https://twitter.com/arielnmac/status/1278827449078501376
2020-07-02 22:59:32,TexansRevolt,TexansRevolt,0,0,0,"Ronna says Trump is leading the recovery but isn’t saying truth: Trump caused the record job losses and recession. Trump took us back to the Bush recession unemployment numbers, eliminating all of Obama’s job growth. Trump’s failure to lead a covid-2019 response caused this",,,,1278825665924562944,https://twitter.com/TexansRevolt/status/1278825665924562944
2020-07-02 22:44:53,r0ckssss_,radicole__,1,0,0,"Shit they are going to Covid hot spot as it is, why not SA ",,,,1278821979542507520,https://twitter.com/r0ckssss_/status/1278821979542507520
2020-07-02 22:36:12,onemoregabriel,,0,0,0,"Texas Governor Abbott issued statewide order requiring a mask or face cover in public. Order applies to counties with 20 or more Covid-19 cases. The text of the executive order says that failing to comply is punishable by a fine. ",,,,1278819792586244100,https://twitter.com/onemoregabriel/status/1278819792586244100
2020-07-02 21:52:34,princeafe,,0,0,0,"Sec­ond-quar­ter earn­ings are likely to be bru­tal across the U.S. oil patch be­cause global oil de­mand fell by some approximately 18% as a result of COVID-19. Oil and gas prices will continue to plunged along with con­sump­tion.",,,,1278808812439441410,https://twitter.com/princeafe/status/1278808812439441410
2020-07-02 21:50:10,Rachell79810881,KAYLEEBURRIS,0,0,0,"Good hope she gets covid in jail",,,,1278808208937824257,https://twitter.com/Rachell79810881/status/1278808208937824257
2020-07-02 21:16:14,dvald11,,0,0,3,"Restarting the NBA when Covid-19 is at its worst than it was when the season first got suspended might the the dumbest thing I’ve ever seen. Can’t believe the NBA is risking the lives of these players just to salvage this lost season.",,,,1278799667992592386,https://twitter.com/dvald11/status/1278799667992592386
2020-07-02 21:13:04,starfishncoffee,,1,0,5,"Maybe it’s because my nurse sister works in a hospital that is pushed to the brink with COVID cases and I hear about how some of them got there....",,,,1278798872308076546,https://twitter.com/starfishncoffee/status/1278798872308076546
2020-07-02 21:06:10,raposo_joyce,chrispmurphy,0,0,1,"I wonder how he feels about masks now? Lol These idiots who think they are immune to the virus and that masks are some overblown “democratic” constraint on their freedom are landing themselves on the growing list COVID-19 casualties!",,,,1278797134540820480,https://twitter.com/raposo_joyce/status/1278797134540820480
2020-07-02 20:50:29,Joeycules,,3,23,31,"BREAKING: There are 374 new COVID-19 cases in San Antonio and Bexar County today Total: 12,878 4 new deaths - 115 total Open hospital beds countywide is at 13% (!!!!) COVID Hospitalizations: 1074. +55 from yesterday 332 are in ICU (+8) 180 are on ventilators. (+5) @TPRNews",,@TPRNews,,1278793188325691393,https://twitter.com/Joeycules/status/1278793188325691393
