date,username,to,replies,retweets,favorites,text,geo,mentions,hashtags,id,permalink
2020-06-09 14:15:01,DMcComasOB,,0,5,6,"Never too early to talk Texas at #LSU. @BrodyAMiller joined me on The Dustin Show podcast. Topics: how LSU is handling workouts/COVID-19; fans in the stands; same offense in 2020?; new DC; covering a title team, Ed O; 3rd-and-17. Listen: https://bit.ly/3fjgezx #HookEm",,@BrodyAMiller,#LSU #HookEm,1270358745739079680,https://twitter.com/DMcComasOB/status/1270358745739079680
2020-06-09 14:14:51,KTNV,,1,0,3,"COVID-19 drive-thru testing available in North Las Vegas at Texas Station on June 9 &amp; 10 ",,,,1270358704378900481,https://twitter.com/KTNV/status/1270358704378900481
2020-06-09 14:10:46,GonzalesKristie,,5,6,10,"Just a few weeks after social distancing measures were eased in #Texas, the state is now reporting the highest number of COVID-19 hospitalizations yet. ",,,#Texas,1270357676762050560,https://twitter.com/GonzalesKristie/status/1270357676762050560
2020-06-09 14:09:57,otcprwire,,0,0,0,"$PURA @Puration710 PURA Restocks EVERx CBD Sports Water Inventory To Sustain Growth In Long Haul https://bit.ly/37dQCAY #PURA #Puration #CBD #EveryX #CBDWater #Dallas #Texas #COVID__19 #otcprwire #PressRelease #Beverage #OTC #OTCStocks #OTCMarkets",,@Puration710,#PURA #Puration #CBD #EveryX #CBDWater #Dallas #Texas #COVID__19 #otcprwire #PressRelease #Beverage #OTC #OTCStocks #OTCMarkets,1270357470028890117,https://twitter.com/otcprwire/status/1270357470028890117
2020-06-09 14:08:09,DealingPhelan,,2,0,2,"Texas Reports Record-Breaking COVID-19 Hospitalizations As State Reopens https://www.npr.org/sections/coronavirus-live-updates/2020/06/08/872660425/texas-reports-record-breaking-covid-19-hospitalizations-as-state-reopens?utm_campaign=storyshare&amp;utm_source=twitter.com&amp;utm_medium=social",,,,1270357017505476608,https://twitter.com/DealingPhelan/status/1270357017505476608
2020-06-09 14:08:03,yogialb2,,0,0,0,"Texas Reports Record-Breaking COVID-19 Hospitalizations As State Reopens https://www.npr.org/sections/coronavirus-live-updates/2020/06/08/872660425/texas-reports-record-breaking-covid-19-hospitalizations-as-state-reopens?utm_campaign=storyshare&amp;utm_source=twitter.com&amp;utm_medium=social",,,,1270356991626612737,https://twitter.com/yogialb2/status/1270356991626612737
2020-06-09 14:07:59,StevenWrightLaw,,0,0,2,"With COVID-19 disrupting Texas businesses significantly, owners are losing revenue and suffering added costs. If you have business interruption insurance, filing a claim for these types of losses is the next practical step. #AskSteven #StevenWrightLaw",,,#AskSteven #StevenWrightLaw,1270356973658214405,https://twitter.com/StevenWrightLaw/status/1270356973658214405
2020-06-09 14:07:10,ChristoZT,,0,0,0,"Texas Reports Record-Breaking COVID-19 Hospitalizations As State Reopens https://www.npr.org/sections/coronavirus-live-updates/2020/06/08/872660425/texas-reports-record-breaking-covid-19-hospitalizations-as-state-reopens?utm_campaign=storyshare&amp;utm_source=twitter.com&amp;utm_medium=social",,,,1270356768963600388,https://twitter.com/ChristoZT/status/1270356768963600388
2020-06-09 14:07:00,WPSU,,0,0,0,"Texas Reports Record-Breaking COVID-19 Hospitalizations As State Reopens https://radio.wpsu.org/post/texas-reports-record-breaking-covid-19-hospitalizations-state-reopens",,,,1270356726269620225,https://twitter.com/WPSU/status/1270356726269620225
2020-06-09 14:06:22,peggyjags,,0,0,0,"#Texas , #NorthCarolina, #Arizona see rising cases as they reopen | TheHill. Deaths rise to critical levels b/c they took orders from Trump, not prfs, #COVID__19",,,#Texas #NorthCarolina #Arizona #COVID__19,1270356566915645440,https://twitter.com/peggyjags/status/1270356566915645440
2020-06-09 14:05:49,James_E_White,,0,0,0,"COVID-19 pandemic has made mental health care more available in rural Texas | The Texas Tribune ",,,,1270356427811454976,https://twitter.com/James_E_White/status/1270356427811454976
2020-06-09 14:05:15,Turner6767,,0,0,0,"Texas Reports Record-Breaking COVID-19 Hospitalizations As State Reopens https://www.npr.org/sections/coronavirus-live-updates/2020/06/08/872660425/texas-reports-record-breaking-covid-19-hospitalizations-as-state-reopens?utm_campaign=storyshare&amp;utm_source=twitter.com&amp;utm_medium=social",,,,1270356288208322560,https://twitter.com/Turner6767/status/1270356288208322560
2020-06-09 14:04:55,billjoh59544573,,0,0,0,"Texas reports a record number of hospitalized coronavirus patients after state reopened early https://www.cnbc.com/2020/06/08/texas-reports-a-record-high-number-of-hospitalized-coronavirus-patients-after-state-reopened-early.html?__source=sharebar|twitter&amp;par=sharebar .27000 people died from cancer yest..nearly 20 deadly shootings in Chi-twn overnight! Yet CNBC playing the covid card as usual..this isn't the news its the agenda",,,,1270356200908042242,https://twitter.com/billjoh59544573/status/1270356200908042242
2020-06-09 14:03:56,TLCWeber,KathleenChu5,0,0,2,"Didn’t you hear? The pandemic is over. On a separate note, Texas now has its highest number of COVID hospitalizations to date.",,,,1270355957445525504,https://twitter.com/TLCWeber/status/1270355957445525504
2020-06-09 14:02:41,arianapekary,,0,7,5,"14 states and Puerto Rico hit their highest-ever 7-day average for new covid cases WP: Alaska, Arizona, Arkansas, California, Florida, Kentucky, New Mexico, North Carolina, Mississippi, Oregon, South Carolina, Tennessee, Texas and Utah. ",,,,1270355640448409601,https://twitter.com/arianapekary/status/1270355640448409601
2020-06-09 14:02:29,herchgroup,,0,0,0,"Casos COVID-19, las hospitalizaciones continúan aumentando en el Condado de Harris y Texas . ",,,,1270355590838173697,https://twitter.com/herchgroup/status/1270355590838173697
2020-06-09 14:02:18,txoph,,0,0,0,"As Texas businesses reopen, COVID-19 case totals are rising. The state says hot spots like prisons and meatpacking plants are key factors. https://www.texastribune.org/2020/06/08/texas-coronavirus-cases-prisons-meatpacking-plants/?utm_campaign=trib-social-buttons&amp;utm_source=twitter&amp;utm_medium=social via @TexasTribune",,@TexasTribune,,1270355543312433152,https://twitter.com/txoph/status/1270355543312433152
2020-06-09 14:02:07,drmaggiesa,JeremySWallace,0,0,1,"Let’s say there is a hospital in Texas that has 25 ICU beds and 20 are Covid-19 cases. Beds are slowly and quietly filling up w Covid without reporting as the governor keeps opening the state.",,,,1270355497355546626,https://twitter.com/drmaggiesa/status/1270355497355546626
2020-06-09 14:01:50,TxEMSA,,0,0,0,"As Texas businesses reopen, COVID-19 case totals are rising. The state says hot spots like prisons and meatpacking plants are key factors. https://www.texastribune.org/2020/06/08/texas-coronavirus-cases-prisons-meatpacking-plants/?utm_campaign=trib-social-buttons&amp;utm_source=twitter&amp;utm_medium=social via @TexasTribune",,@TexasTribune,,1270355428367634436,https://twitter.com/TxEMSA/status/1270355428367634436
2020-06-09 14:00:46,htownsmitty,impeachqueen,5,0,0,"Umm. I don't think @abc13houston is going to retread that. How about let's give them something to go off for this Texas COVID coverup? @imkimaaron -- let's start this thread and I'll get the appropriate attention on it if you've got good sources and info.",,@abc13houston @imkimaaron,,1270355158367600641,https://twitter.com/htownsmitty/status/1270355158367600641
2020-06-09 14:00:03,kfxkfox51,,0,0,0,"The University of Texas at Austin will require all students, faculty and staff to wear face masks in campus buildings next fall to prevent the spread of COVID-19. https://bit.ly/2XOuDOe?utm_medium=social&amp;utm_source=twitter_kfxkfox51",,,,1270354977194729473,https://twitter.com/kfxkfox51/status/1270354977194729473
2020-06-09 14:00:02,KETK,,0,1,3,"The University of Texas at Austin will require all students, faculty and staff to wear face masks in campus buildings next fall to prevent the spread of COVID-19. https://bit.ly/2XOuDOe?utm_medium=social&amp;utm_source=twitter_KETK",,,,1270354975751917569,https://twitter.com/KETK/status/1270354975751917569
2020-06-09 14:00:01,McGovernMed,,0,1,3,"Texas Reports Record-Breaking COVID-19 Hospitalizations As State Reopens. ",,,,1270354969007403008,https://twitter.com/McGovernMed/status/1270354969007403008
2020-06-09 13:58:21,PS_AWIC,,0,1,0,"We must keep battling the senseless loss of life! Texas Covid-19 Massacre - In These Times: ",,,,1270354552022347779,https://twitter.com/PS_AWIC/status/1270354552022347779
2020-06-09 13:56:44,keithjones1969,,0,0,0,"Texas Reports Record-Breaking COVID-19 Hospitalizations As State Reopens https://apple.news/A8iex9eWcRXCOL8oNKXqimA",,,,1270354144013008897,https://twitter.com/keithjones1969/status/1270354144013008897
2020-06-09 13:56:05,JanaeHawley,,0,0,0,"Oh my god Public health expert urges caution as COVID-19 numbers rise in Texas ",,,,1270353980430987264,https://twitter.com/JanaeHawley/status/1270353980430987264
2020-06-09 13:53:29,ForensicPsyMD,,0,0,0,"Texas Reports Record-Breaking COVID-19 Hospitalizations As State Reopens : NPR https://www.npr.org/sections/coronavirus-live-updates/2020/06/08/872660425/texas-reports-record-breaking-covid-19-hospitalizations-as-state-reopens",,,,1270353325326729221,https://twitter.com/ForensicPsyMD/status/1270353325326729221
2020-06-09 13:52:48,MessiahTheories,,1,0,3,"""Texas Reports Record-Breaking COVID-19 Hospitalizations As State Reopens ""- NPR Ruh Roh!",,,,1270353154043936770,https://twitter.com/MessiahTheories/status/1270353154043936770
2020-06-09 13:52:06,ArtsJournalNews,,0,0,0,"Texas Governor Finally Gives Performing Arts Groups Guidelines On Operating Under COVID: Gov. Greg Abbott’s Phase III reopening guidelines covering “performance halls,” effective June 10, allow audiences up to 50% of capacity at indoor venues; there’s … ",,,,1270352977656778752,https://twitter.com/ArtsJournalNews/status/1270352977656778752
2020-06-09 13:51:01,JoshuaMBlank,,0,0,0,"As Texas businesses reopen, COVID-19 case totals are rising. The state says hot spots like prisons and meatpacking plants are key factors. https://buff.ly/3h43CxE by @carla_astudi #txlege",,@carla_astudi,#txlege,1270352703659573250,https://twitter.com/JoshuaMBlank/status/1270352703659573250
2020-06-09 13:50:52,_JuanTRT,,0,0,3,"My team and I miss in person outreach but we are here and available via digital outreach! If you are in need of crisis counseling due to COVID 19 Just reach out to us we can schedule a lifesize meeting @ieshaTRT @ReyesPury #Texas #Houston #COVID__19 #COVID ",,@ieshaTRT @ReyesPury,#Texas #Houston #COVID__19 #COVID,1270352665797636096,https://twitter.com/_JuanTRT/status/1270352665797636096
2020-06-09 13:50:27,GonzalezRafael,,0,4,2,"Texas Reports Record-Breaking COVID-19 Hospitalizations As State Reopens https://www.npr.org/sections/coronavirus-live-updates/2020/06/08/872660425/texas-reports-record-breaking-covid-19-hospitalizations-as-state-reopens?utm_campaign=storyshare&amp;utm_source=twitter.com&amp;utm_medium=social",,,,1270352561464360960,https://twitter.com/GonzalezRafael/status/1270352561464360960
2020-06-09 13:50:05,savetheboxers,,0,0,3,"Thank you to everyone that donated & shared, liked, & commented on LBR's posts on North Texas Giving Tuesday last month! It's goal was to help non profits with the strain from COVID &amp; is similar to North Texas Giving Day in September. We received a total of $8,713.62. ",,,,1270352471660146693,https://twitter.com/savetheboxers/status/1270352471660146693
2020-06-09 13:47:28,EricBernicker,,0,0,1,"Not a good trend.....As Texas businesses reopen, COVID-19 case totals are rising. #Covid19 https://www.texastribune.org/2020/06/08/texas-coronavirus-cases-prisons-meatpacking-plants/?utm_campaign=trib-social-buttons&amp;utm_source=twitter&amp;utm_medium=social via @TexasTribune",,@TexasTribune,#Covid19,1270351809643712512,https://twitter.com/EricBernicker/status/1270351809643712512
2020-06-09 13:46:45,angrycoffeeguy,GovMikeDeWine,0,0,0,"Thank you for you leadership and staying diligent to the severity of covid 19. Glad we are not like Texas. Yet.....",,,,1270351631683641345,https://twitter.com/angrycoffeeguy/status/1270351631683641345
2020-06-09 13:44:06,JDJC6251,realDonaldTrump,0,0,0,"What does this even mean? You are nuts. You'd better start paying attention to COVID. It's on the rise in states that opened too early because of you-like Texas and Arizona. Bring the task force back and put them front and center.",,,,1270350962419531777,https://twitter.com/JDJC6251/status/1270350962419531777
2020-06-09 13:43:55,stephendaniel,NPR,0,0,1,"Texas reported a record-breaking number of #COVID hospitalizations. New figures show 1,935 people were admitted to the hospital for #coronavirus (up from a prior record of 1,888 on May 5). Everyone continue to be safe. Practice social distancing and wear a mask in public.",,,#COVID #coronavirus,1270350918907822082,https://twitter.com/stephendaniel/status/1270350918907822082
2020-06-09 13:42:05,htownsmitty,htownsmitty,1,0,0,"I noticed when we went over non COVID pnemonia fatalities that showed New York is the only state that was disproportionate. How do you explain that? Top 4 states by population - 2020 non COVID pnemonia deaths, CDC California = 9095 Texas = 5441 New York = 17455 Florida = 5997",,,,1270350457769267203,https://twitter.com/htownsmitty/status/1270350457769267203
2020-06-09 13:41:36,WNDU,,0,2,5,"After not being able to see her mother for a few months due to COVID-19, a Texas woman got a job at the nursing home where her mother lives. ",,,,1270350336167948293,https://twitter.com/WNDU/status/1270350336167948293
2020-06-09 13:40:56,pfikac,,0,2,1,"In rural Texas, the COVID-19 pandemic has brought more accessible mental health care https://www.texastribune.org/2020/06/09/coronavirus-texas-rural-mental-health-telehealth/?utm_campaign=trib-social-buttons&amp;utm_source=twitter&amp;utm_medium=social via @TexasTribune",,@TexasTribune,,1270350167313612804,https://twitter.com/pfikac/status/1270350167313612804
2020-06-09 13:40:00,8NewsNow,,0,1,0,"WALK-UP WELCOME: Free COVID-19 testing at Texas Station is Tuesday and Wednesday, and walk-ups are welcome along with drive-thru https://www.8newsnow.com/news/local-news/free-covid-19-testing-at-texas-station-offers-drive-thru-and-walk-up-options/?utm_medium=social&amp;utm_source=twitter_8NewsNow #coronavirus #8NN",,,#coronavirus #8NN,1270349932491411457,https://twitter.com/8NewsNow/status/1270349932491411457
2020-06-09 13:39:21,aeiouxyz,GregAbbott_TX,0,0,0,"Hmmm. Seems like you want Texans killed. Hmmm! Yesterday saw Texas highest number of Covid 19 hospitalizations. Last four days, four of the top five. You are not following guidelines. $$over lives. So Texas #SoTexas @realdonaldtrump @tedcruz @johncornyn @DanPatrick #TrumpPlague",,@realDonaldTrump @tedcruz @JohnCornyn @DanPatrick,#SoTexas #TrumpPlague,1270349767684521984,https://twitter.com/aeiouxyz/status/1270349767684521984
2020-06-09 13:39:08,chad3006,,0,0,0,"Texas Reports Record-Breaking COVID-19 Hospitalizations As State Reopens ",,,,1270349715952066560,https://twitter.com/chad3006/status/1270349715952066560
2020-06-09 13:38:15,trstdtravlr,,0,0,0,"why COVID-19 cases spike throughout South Texas border region",,,,1270349493750333440,https://twitter.com/trstdtravlr/status/1270349493750333440
2020-06-09 13:37:04,TCIDA2,,0,0,1,"On 6/8, Dallas County reported 254 new COVID-19 cases. Tarrant County reported 219 cases. Since the start of June, Texas has recorded its highest-ever 7 day avg of new COVID cases since the pandemic began. This coincides with the lifting of restrictions.#COVID19 #KeepTheCurveFlat",,,#COVID19 #KeepTheCurveFlat,1270349194075811841,https://twitter.com/TCIDA2/status/1270349194075811841
2020-06-09 13:36:16,dalmal,,0,0,0,"Texas Reports Record-Breaking COVID-19 Hospitalizations As State Reopens https://flip.it/XsGIQq",,,,1270348994745470976,https://twitter.com/dalmal/status/1270348994745470976
2020-06-09 13:35:25,icannmove,,0,0,1,"COVID Testing to keep our movers and our customers safe . . . #icann #moving #Movers #movingday #move #movingcompany #packers #movingtips #company #moving @icannmove.com @Tyler, Texas https://www.instagram.com/p/CBN1YlIg0Jq/?igshid=m20xttou9oib",,@icannmove,#icann #moving #Movers #movingday #move #movingcompany #packers #movingtips #company #moving,1270348777950310400,https://twitter.com/icannmove/status/1270348777950310400
2020-06-09 13:35:04,MeAndMyOBG,,0,1,0,"Texas Reports Record-Breaking COVID-19 Hospitalizations, As State Reopens https://n.pr/3cKWl2v",,,,1270348691090673664,https://twitter.com/MeAndMyOBG/status/1270348691090673664
2020-06-09 13:34:55,happykt,,0,0,0,"Texas Reports Record-Breaking COVID-19 Hospitalizations As State Reopens https://www.kut.org/post/texas-reports-record-breaking-covid-19-hospitalizations-state-reopens",,,,1270348652922515461,https://twitter.com/happykt/status/1270348652922515461
2020-06-09 13:33:56,TBBusiness,,0,0,0,"Texas Governor Announces Statewide COVID-19 Test Collection Online Map ",,,,1270348405324333057,https://twitter.com/TBBusiness/status/1270348405324333057
2020-06-09 13:33:34,laaaishaaa,,0,0,2,"How do u open Texas back up and everyone’s in public acting normal but be surprised when covid rates go up? make it make sense!",,,,1270348311485190144,https://twitter.com/laaaishaaa/status/1270348311485190144
2020-06-09 13:28:12,hollyfirestone,,0,0,0,"Texas Reports Record-Breaking COVID-19 Hospitalizations As State Reopens https://www.kut.org/post/texas-reports-record-breaking-covid-19-hospitalizations-state-reopens",,,,1270346964899704832,https://twitter.com/hollyfirestone/status/1270346964899704832
2020-06-09 13:27:51,antifashyst,JimInhofe,0,0,4,"What Republican economic plan? Reopening prematurely? Claiming that existing jobs that were on hold, are now ""new""? Can't wait to see how you'll try to spin the job openings that Texas's increase in COVID-19 cases is creating. ""Texas is ripe with opportunity, 'cuz we're dying!""",,,,1270346873224728576,https://twitter.com/antifashyst/status/1270346873224728576
2020-06-09 13:26:34,JCoralHouse,,0,0,0,"#News COVID-19 The Texas A&amp;M System Responds – Episode 9 https://bit.ly/3dLEuK0 #covid2010 #spdc",,,#News #covid2010 #spdc,1270346550842208257,https://twitter.com/JCoralHouse/status/1270346550842208257
2020-06-09 13:25:51,morganluxy,KXAN_News,1,0,2,"Nope. Pictures from the protests of all the cities of people shoulder to shoulder, screaming in faces (germs flying around), pushing, touching...and the small group of folks gathering asking to reopen Texas a couple weeks back were called killers and Covid spreaders...Done.",,,,1270346369560166400,https://twitter.com/morganluxy/status/1270346369560166400
2020-06-09 13:23:06,TheRealRazielah,,0,0,0,"No wonder God spiked your covid-19 Texas. Your satanic, hiding behind church membership...",,,,1270345680641548288,https://twitter.com/TheRealRazielah/status/1270345680641548288
2020-06-09 13:23:02,misener_patti,laughing_all,1,0,1,"So many rural red state hospitals have closed down in the last 10 years that as COVID becomes entrenched there many will die because there will be no beds for them. This article is from last year. Tennessee with 10 closures and Texas with 17 lead. https://beckershospitalreview.com/finance/state-by-state-breakdown-of-102-rural-hospital-closures.html",,,,1270345661402288131,https://twitter.com/misener_patti/status/1270345661402288131
2020-06-09 13:22:13,markf_wallace,,0,0,0,"Texas Governor Finally Gives Performing Arts Groups Guidelines On Operating Under COVID ",,,,1270345457231953921,https://twitter.com/markf_wallace/status/1270345457231953921
2020-06-09 13:21:38,thekaceykasem,,1,1,9,"This is interesting. I'll leave this here. Hey, at least Texas doesn't have that many Covid related deaths... Wonder why... ",,,,1270345311479828482,https://twitter.com/thekaceykasem/status/1270345311479828482
2020-06-09 13:20:24,GRB_01,JeremySWallace,0,0,0,"Correction: Texas has 15,000 hospital beds and ventilators available for people WITH health insurance. Texas has 4.3 million uninsured Texas citizens. Anyone paying out of pocket can expect to pay $30-$35K for COVID treatment.",,,,1270345000254148608,https://twitter.com/GRB_01/status/1270345000254148608
2020-06-09 13:16:50,ShepardMedical,,0,0,0,"Texas Reports Record-Breaking COVID-19 Hospitalizations As State Reopens ",,,,1270344102035501056,https://twitter.com/ShepardMedical/status/1270344102035501056
2020-06-09 13:16:42,imkimaaron,impeachqueen,2,1,4,"The fact that Texas, Florida, and a few other republican states are magically immune to covid. It is DEFINITELY not them calling covid deaths pneumonia so they can hide the actual number of deaths from the people.",,,,1270344067952467968,https://twitter.com/imkimaaron/status/1270344067952467968
2020-06-09 13:16:29,UkieLenia,,0,0,0,"Texas Reports Record-Breaking COVID-19 Hospitalizations As State Reopens https://www.npr.org/sections/coronavirus-live-updates/2020/06/08/872660425/texas-reports-record-breaking-covid-19-hospitalizations-as-state-reopens?utm_campaign=storyshare&amp;utm_source=twitter.com&amp;utm_medium=social",,,,1270344012512313348,https://twitter.com/UkieLenia/status/1270344012512313348
2020-06-09 13:16:06,RobeChamJr,,0,1,0,"Texas Reports Record-Breaking COVID-19 Hospitalizations, As State Reopens https://n.pr/2MHpoJJ",,,,1270343918870237185,https://twitter.com/RobeChamJr/status/1270343918870237185
2020-06-09 13:15:39,laughing_all,,4,1,4,"COVID REMINDER: Texas reports a record number of hospitalized coronavirus patients after state reopened early ",,,,1270343805766709248,https://twitter.com/laughing_all/status/1270343805766709248
2020-06-09 13:15:06,DrEboniHaynes,,0,1,1,"COVID-19 pandemic has made mental health care more available in rural Texas https://www.texastribune.org/2020/06/09/coronavirus-texas-rural-mental-health-telehealth/ #RuralHealth #COVID19",,,#RuralHealth #COVID19,1270343666767466497,https://twitter.com/DrEboniHaynes/status/1270343666767466497
2020-06-09 13:13:15,ReporterNews,,0,0,0,"On Monday, Texas officials reported 638 new COVID-19 cases, which is the lowest in a week. But, since May 25, the number of hospitalizations statewide has been trending upward, from 1,511 on that day to Monday's new high of 1,935. #COVID19 #Texas ",,,#COVID19 #Texas,1270343199291301888,https://twitter.com/ReporterNews/status/1270343199291301888
2020-06-09 13:12:53,antifashyst,realDonaldTrump,0,0,1,"COVID-19 DEATHS IN THE U.S. HIT AN ALL-TIME HIGH! Over 113,000 Americans are DEAD, Texas is seeing record numbers of hospitalizations because of reopening too early, and the ""president"" is tweeting about rich people getting richer. #VoteBlueToEndThisNightmare",,,#VoteBlueToEndThisNightmare,1270343107129810944,https://twitter.com/antifashyst/status/1270343107129810944
2020-06-09 13:10:15,MarcellaRLamb,,0,0,2,"#COVID__19 the plan to not have visits for nursing home residents &amp; TDCJ inmates &amp; on kept on lockdown is not a plan. They have #HumanRights This is cruel &amp; unusual punishment. #Texas is better than this. #coronavirus #abbot #OpenUp",,,#COVID__19 #HumanRights #Texas #coronavirus #abbot #OpenUp,1270342445398740994,https://twitter.com/MarcellaRLamb/status/1270342445398740994
2020-06-09 13:08:54,greenvilleextra,,0,0,0,"As Texas businesses reopen, COVID-19 case totals are rising. The state says hot spots like prisons and meatpacking plants are key factors. - https://egreenvilleextra.com/regional-news/as-texas-businesses-reopen-covid-19-case-totals-are-rising-the-state-says-hot-spots-like-prisons-and-meatpacking-plants-are-key-factors/",,,,1270342107035729921,https://twitter.com/greenvilleextra/status/1270342107035729921
2020-06-09 13:08:30,mtpleasantextra,,0,0,0,"As Texas businesses reopen, COVID-19 case totals are rising. The state says hot spots like prisons and meatpacking plants are key factors. - http://emtpleasantextra.com/2020/06/as-texas-businesses-reopen-covid-19-case-totals-are-rising-the-state-says-hot-spots-like-prisons-and-meatpacking-plants-are-key-factors/",,,,1270342005336522752,https://twitter.com/mtpleasantextra/status/1270342005336522752
2020-06-09 13:07:58,misener_patti,Sabrina_McDa,0,1,2,"So many rural red state hospitals have closed down in the last 10 years as COVID becomes entrenched there many will die because there will be no beds for them. This article is from last year. Tennessee with 10 closures and Texas with 17 lead. https://beckershospitalreview.com/finance/state-by-state-breakdown-of-102-rural-hospital-closures.html",,,,1270341872649678848,https://twitter.com/misener_patti/status/1270341872649678848
2020-06-09 13:07:32,imkimaaron,htownsmitty,0,0,1,"What would make you more angry? I'll take that one. Then I'll point out how China is accurately reporting its covid deaths, while Texas (and a few others) appear to receive the grace of god and are basically immune. Republicans lie. But I repeat myself!",,,,1270341763043999745,https://twitter.com/imkimaaron/status/1270341763043999745
2020-06-09 13:07:26,PissedOffDr,,1,1,6,"Everything is bigger in Texas, even Covid.... https://www.npr.org/sections/coronavirus-live-updates/2020/06/08/872660425/texas-reports-record-breaking-covid-19-hospitalizations-as-state-reopens",,,,1270341737714790400,https://twitter.com/PissedOffDr/status/1270341737714790400
2020-06-09 13:07:03,DemocratTree,,0,0,0,"Trump previously told the citizens when the weather warms the virus will go away. The temperature in Texas yesterday was over 100 in many areas and 1,935 people were admitted to hospitals with Covid -19. So much for Dr Donald Quack.",,,,1270341639555493888,https://twitter.com/DemocratTree/status/1270341639555493888
