date,username,to,replies,retweets,favorites,text,geo,mentions,hashtags,id,permalink
2020-06-29 22:26:24,SMyersAZ,,1,0,0,"Follow the numbers, not the news. At the time I write this, Texas alone has 15k beds available for COVID patients. There are just over 32k in the country hospitalized with COVID. Lockdown is a political scam! Track the numbers, not the spin!",,,,1277730163992731648,https://twitter.com/SMyersAZ/status/1277730163992731648
2020-06-29 22:26:19,Masalladeldine1,,0,0,0,"Tips: Emprendimiento y el COVID 19 #rrss #usa #texas #austin #austintexas #credito #finanzas #dinero #creditoyfinanzas #creditoaprobado #creditoenmano #finanzaspersonales #finanzasenusa #dineroseguro #dineroenmano #dinerofeliz #masalladeldinero #emprendimiento #negocios",,,#rrss #usa #texas #austin #austintexas #credito #finanzas #dinero #creditoyfinanzas #creditoaprobado #creditoenmano #finanzaspersonales #finanzasenusa #dineroseguro #dineroenmano #dinerofeliz #masalladeldinero #emprendimiento #negocios,1277730140252930048,https://twitter.com/Masalladeldine1/status/1277730140252930048
2020-06-29 22:26:15,korol_koshek,,0,0,1,"US Texas Hospital System Pulls ICU Data From Website as Beds Reach COVID-19 Capacity : https://sputniknews.com/us/202006291079750971-us-texas-hospital-system-pulls-icu-data-from-website-as-beds-reach-covid-19--capacity-/ via @SputnikInt",,@SputnikInt,,1277730125367463938,https://twitter.com/korol_koshek/status/1277730125367463938
2020-06-29 22:25:47,AndyEtnyre,,0,0,1,"@AlexBerenson according to the NYT June 28 new deaths due to COVID: NY - 32 Tx - 9 FL - 29 Yet the crisis is in Texas???? @BretBaier - maybe report on this??",,@AlexBerenson @BretBaier,,1277730008673464321,https://twitter.com/AndyEtnyre/status/1277730008673464321
2020-06-29 22:25:40,nicolecobler,DSTARNOW,2,0,0,"As I said in the story, these are COVID-19 patients in Texas hospitals. You can view the Texas DSHS dashboard here: https://txdshs.maps.arcgis.com/apps/opsdashboard/index.html#/0d8bdf9be927459d9cb11b9eaef6101f",,,,1277729976645795840,https://twitter.com/nicolecobler/status/1277729976645795840
2020-06-29 22:25:18,Masalladeldine1,,0,0,0,"Tips: Emprendimiento y el COVID 19 #rrss #usa #texas #austin #austintexas #credito #finanzas #dinero #creditoyfinanzas #creditoaprobado #creditoenmano #finanzaspersonales #finanzasenusa #dineroseguro #dineroenmano #dinerofeliz #masalladeldinero",,,#rrss #usa #texas #austin #austintexas #credito #finanzas #dinero #creditoyfinanzas #creditoaprobado #creditoenmano #finanzaspersonales #finanzasenusa #dineroseguro #dineroenmano #dinerofeliz #masalladeldinero,1277729886044635141,https://twitter.com/Masalladeldine1/status/1277729886044635141
2020-06-29 22:24:34,Masalladeldine1,,0,0,1,"Emprendimiento y el COVID 19, de este tema estaremos hablando este 2 julio con nuestra invitada Larissa Davila quien es consultora de negocios internacional. #rrss #usa #texas #austin #austintexas #credito #finanzas #dinero #creditoyfinanzas #creditoaprobado #creditoenmano",,,#rrss #usa #texas #austin #austintexas #credito #finanzas #dinero #creditoyfinanzas #creditoaprobado #creditoenmano,1277729701256220673,https://twitter.com/Masalladeldine1/status/1277729701256220673
2020-06-29 22:24:04,Stfupppp,,14,547,872,"DONT GO TO TEXAS ROADHOUSE IN CORPUS CHRISTI. ONE OF THE MANAGERS TESTED POSITIVE FOR COVID, WAS WORKING WHILE STILL SICK AND ARE NOT GOING TO SHUT DOWN OR TAKE TIME TO CLEAN.",,,,1277729576320409607,https://twitter.com/Stfupppp/status/1277729576320409607
2020-06-29 22:23:35,BudGothmog44,,3,4,7,"Choir of more than 100 sings unmasked at Mike Pence's 'Freedom' rally as Texas sees COVID-19 spike ",,,,1277729453490221056,https://twitter.com/BudGothmog44/status/1277729453490221056
2020-06-29 22:22:43,TheRealLilXza,,0,0,0,"COVID-19 in Central Texas April 5, 2020 https://youtu.be/uccmdD87tDQ via @YouTube",,@YouTube,,1277729237160603649,https://twitter.com/TheRealLilXza/status/1277729237160603649
2020-06-29 22:21:39,gstuedler,,0,0,0,"Choir of more than 100 sings unmasked at Mike Pence's 'Freedom' rally as Texas sees COVID-19 spike https://www.dailykos.com/story/2020/6/29/1956848/-Texas-deemed-a-coronavirus-epicenter-but-Mike-Pence-didn-t-let-that-stop-megachurch-Freedom-rally",,,,1277728968070873090,https://twitter.com/gstuedler/status/1277728968070873090
2020-06-29 22:21:05,TXCivilRights,,0,3,5,"¡Hoy es el primer día de votación temprana en Texas! Hasta el 10 de julio, puedes participar en la elección temprana para desempates. Si te dan problemas al votar, incluyendo problemas sobre COVID-19, llámanos: 888-VE-Y-VOTA. Nuestros abogados están listxs para ayudarte. ",,,,1277728825556819968,https://twitter.com/TXCivilRights/status/1277728825556819968
2020-06-29 22:20:53,AlphaSuperior15,,0,0,0,"Posted withregram • @traciethoms Dallas, Texas. A state with spiking Covid numbers. These white ladies are really losing their minds. Over masks. Asking them to be considerate of other… https://www.instagram.com/p/CCCRnPSha3ey513weiO2UHJUB_By8JzfdOaXkQ0/?igshid=1h0vmpv5t5cjc",,@traciethoms,,1277728773560041472,https://twitter.com/AlphaSuperior15/status/1277728773560041472
2020-06-29 22:19:32,Angelsfeartogo,LavinyAsocUSA,0,0,1,"Never mind economy..Texas you need to #lockdown. Stop ignoring #covid @realDonaldTrump ..!!!",,@realDonaldTrump,#lockdown #covid,1277728434345709570,https://twitter.com/Angelsfeartogo/status/1277728434345709570
2020-06-29 22:19:19,Mtnjim_SoCal,,0,0,0,"@VP ""Choir of more than 100 sings unmasked at Mike Pence's 'Freedom' rally as Texas sees COVID-19 spike"" Great job Typhoid Mike!",,@VP,,1277728381182697474,https://twitter.com/Mtnjim_SoCal/status/1277728381182697474
2020-06-29 22:19:04,MaryL80138193,senatemajldr,0,0,1,"#PutinsGOP Have you asked yourself how many lives in Texas, Florida and other republican states could have been saved had you been honest about this 3 months ago instead of using Covid-19 to divide us for political gain?",,,#PutinsGOP,1277728315072225285,https://twitter.com/MaryL80138193/status/1277728315072225285
2020-06-29 22:17:26,aw10008,,0,0,0,"Texas Oil Driller Lilis Energy Cites COVID-19 For Ch. 11 Filing ",,,,1277727903980097538,https://twitter.com/aw10008/status/1277727903980097538
2020-06-29 22:16:58,ghhshirley,,2,0,0,"Swift and dangerous turn in Covid-19 cases in Texas. https://apple.news/Ax_cV4EaKQ4CH-zHgxK6yaw",,,,1277727787944685568,https://twitter.com/ghhshirley/status/1277727787944685568
2020-06-29 22:16:06,BiIIyPiIgrim,MinnPatriot,1,0,1,"Are you a real estate expert in addition to being a disaster response expert? They are re-closing restaurants and bars in Texas, Florida and California. Is that what you want? If so, you’ll need that warehouse morgue. You can’t fix the economy without controlling COVID.",,,,1277727571032014850,https://twitter.com/BiIIyPiIgrim/status/1277727571032014850
2020-06-29 22:15:13,IvoryHecker,,64,645,1541,"Texas Medical Center says 445 ICU beds are being used for COVID-19 patients, and 3,148 beds are not currently in use. More here: https://www.tmc.edu/coronavirus-updates/overview-of-tmc-bed-status/",,,,1277727349325410304,https://twitter.com/IvoryHecker/status/1277727349325410304
2020-06-29 22:15:02,KellzBellzzah,,0,4,4,"Texas hospital CEO: COVID inpatient count 'misinterpreted,' level of alarm 'unwarranted' | Just The News ",,,,1277727303716478976,https://twitter.com/KellzBellzzah/status/1277727303716478976
2020-06-29 22:15:02,BrookingsMetro,,0,0,1,"The four-week period between April 27 and May 24 saw greater COVID-19 spread into the South and West, dipping into some smaller areas in all regions and extending into Texas, Virginia, and other parts of the interior South. https://brook.gs/3dfwwIe",,,,1277727302638501888,https://twitter.com/BrookingsMetro/status/1277727302638501888
2020-06-29 22:15:01,iamofdaniel,BuxomDiva,0,0,2,"Texas is actually reporting many covid deaths as something else. Our death counts do not come close to what they should be compared to other states. All to make the numbers look better.",,,,1277727296980488194,https://twitter.com/iamofdaniel/status/1277727296980488194
2020-06-29 22:14:41,LavinyAsocUSA,,1,1,1,"Texas hospitals hit capacity with 35,000 new COVID-19 cases this past week. Experts at @CDCgov agree: masks save lives. People wonder how hard a mask order is to enact. @GovAbbott could mandate face masks with eight words and a stroke of his pen. #txlege",,@CDCgov @GovAbbott,#txlege,1277727214918909960,https://twitter.com/LavinyAsocUSA/status/1277727214918909960
2020-06-29 22:14:32,peace3314,peace3314,0,3,2,"Objectively, that's highly suspect. Pneumonia is a known, common cause of extreme issues among hospitalized covid patients. I don't believe that Texas has a pneumonia epidemic. Do any of you? What's the truth, and how can this be resolved; lying by omission can be fatal?",,,,1277727177711198208,https://twitter.com/peace3314/status/1277727177711198208
2020-06-29 22:14:04,PsyberAttack,AndyShandy14,0,1,1,"Hospitalisations data is interesting... Arizona had a bit of a lag between cases going up and hospitalisations, whilst Texas followed a clearly correlated trajectory I hear the UK is now managing COVID cases through 111 though, and they're keeping people out as much as posisble ",,,,1277727058119086080,https://twitter.com/PsyberAttack/status/1277727058119086080
2020-06-29 22:13:28,UTLONGHORNSNO1,,0,0,0,"#HookEm #Texas https://bit.ly/38dsAXB Tom Herman, Texas governor’s office join forces to remind us of COVID-19 guidelines ",,,#HookEm #Texas,1277726909540061184,https://twitter.com/UTLONGHORNSNO1/status/1277726909540061184
2020-06-29 22:13:26,bmiedema,,0,0,0,"Choir of more than 100 sings unmasked at Mike Pence's 'Freedom' rally as Texas sees COVID-19 spike ",,,,1277726899163344897,https://twitter.com/bmiedema/status/1277726899163344897
2020-06-29 22:12:50,oldlady691,,0,0,0,"@realDonaldTrump do you know Texas Attorney General office is not enforcing child support due to Covid? They hide behind their keyboards and collect their paycheck, but do nothing for us custodial parents who have been the worst hit by lack of support or enforcement. Help!!!",,@realDonaldTrump,,1277726746675163136,https://twitter.com/oldlady691/status/1277726746675163136
2020-06-29 22:12:33,wil_bailey,,0,0,0,"Choir of more than 100 sings unmasked at Mike Pence's 'Freedom' rally as Texas sees COVID-19 spike https://www.dailykos.com/story/2020/6/29/1956848/-Texas-deemed-a-coronavirus-epicenter-but-Mike-Pence-didn-t-let-that-stop-megachurch-Freedom-rally",,,,1277726676663795714,https://twitter.com/wil_bailey/status/1277726676663795714
2020-06-29 22:11:54,spyllit,,0,0,0,"Tom Herman, Texas governor’s office join forces to remind us of COVID-19 guidelines ",,,,1277726512108707843,https://twitter.com/spyllit/status/1277726512108707843
2020-06-29 22:11:46,HNimanFC,,0,0,0,"Texas COVID Cases Increase To 153,011 Deaths To 2,403 - Texas (2019-nCoV) - Recombinomics Inc. Texas COVID Cases Increase To 153,011 Deaths To 2,403 ",,,,1277726481154785285,https://twitter.com/HNimanFC/status/1277726481154785285
2020-06-29 22:11:40,LkpinkLinda,,0,0,0,"Just a bunch of Morons. Choir of more than 100 sings unmasked at Mike Pence's 'Freedom' rally as Texas sees COVID-19 spike https://www.dailykos.com/story/2020/6/29/1956848/-Texas-deemed-a-coronavirus-epicenter-but-Mike-Pence-didn-t-let-that-stop-megachurch-Freedom-rally",,,,1277726453266706432,https://twitter.com/LkpinkLinda/status/1277726453266706432
2020-06-29 22:11:20,UdnSpeak4me,,0,0,0,"#HypocritePence Choir of more than 100 sings unmasked at Mike Pence's 'Freedom' rally as Texas sees COVID-19 spike https://www.dailykos.com/story/2020/6/29/1956848/-Texas-deemed-a-coronavirus-epicenter-but-Mike-Pence-didn-t-let-that-stop-megachurch-Freedom-rally",,,#HypocritePence,1277726370806652928,https://twitter.com/UdnSpeak4me/status/1277726370806652928
2020-06-29 22:10:41,klkolz,,0,0,0,"Choir of more than 100 sings unmasked at Mike Pence's 'Freedom' rally as Texas sees COVID-19 spike https://www.dailykos.com/story/2020/6/29/1956848/-Texas-deemed-a-coronavirus-epicenter-but-Mike-Pence-didn-t-let-that-stop-megachurch-Freedom-rally",,,,1277726208181051405,https://twitter.com/klkolz/status/1277726208181051405
2020-06-29 22:10:41,Corykat1374,RepDanCrenshaw,0,0,0,"Covid doesn’t care if it’s Texas or not or what politicians have to say about it! It’s gonna get worse if people don’t take it seriously...",,,,1277726207174414336,https://twitter.com/Corykat1374/status/1277726207174414336
2020-06-29 22:10:36,notkinz,,0,0,1,"like nj is doing better than georgia, texas and other states who have had some of the worst regulations/rules regarding COVID-19 but that's a pretty low bar compare it to anywhere else in the world and it's ridiculous",,,,1277726187842932736,https://twitter.com/notkinz/status/1277726187842932736
2020-06-29 22:10:16,Christy29567221,mitchellvii,0,0,0,"Just means our bodies are starting to get immune to the virus. Kinda what their supposed to do but I also just read texas was combining the covid test and the antibody test to come up with their numbers.",,,,1277726100752302083,https://twitter.com/Christy29567221/status/1277726100752302083
2020-06-29 22:10:07,FOX26Houston,,14,0,7,"Houston Mayor Sylvester Turner called out three businesses that are on his Wall of Shame for not following COVID-19 guidelines placed forth by Texas Governor Greg Abbott.​ ",,,,1277726062991028224,https://twitter.com/FOX26Houston/status/1277726062991028224
2020-06-29 22:10:02,evanderjoseph,evanderjoseph,0,0,5,"I will accept partial blame for the COVID resurgence in Texas. ",,,,1277726043827310593,https://twitter.com/evanderjoseph/status/1277726043827310593
2020-06-29 22:09:43,Enrique9613,,0,0,1,"If this texas heat doesn’t defeat covid i dont know what will",,,,1277725963103723520,https://twitter.com/Enrique9613/status/1277725963103723520
2020-06-29 22:08:37,sadmamialyssa,ithinkineverwas,0,0,1,"idk why people surprised, especially the ones that clearly give 0 fucks about anybody’s health. we the highest in texas to have covid-19 &amp; mf’s still thought we we’re gon have a festival with A SHIT LOAD of people. ",,,,1277725686011174912,https://twitter.com/sadmamialyssa/status/1277725686011174912
2020-06-29 22:08:31,TheHammerschlag,caterinack,0,0,2,"Claro. Creo que lo que hace más competitiva esta elección de lo que parecía a principio de año es que los estados que debe ganar sí o sí Trump están peleados. Tampoco le ayuda una explosión de covid en Arizona, Florida y Texas (aunque acá muy peleado no esté)",,,,1277725664083353602,https://twitter.com/TheHammerschlag/status/1277725664083353602
2020-06-29 22:07:45,buffaloon,,0,0,1,"Choir of more than 100 sings unmasked at Mike Pence's 'Freedom' rally as Texas sees COVID-19 spike ",,,,1277725467148201984,https://twitter.com/buffaloon/status/1277725467148201984
2020-06-29 22:07:40,PowderPinkVenus,snowmanomics,0,0,1,"He & the rest of the Texas GOP are scared out of their whits about a blue Texas. Harvey in 2017 was the catalyst to turn Harris and Fort Bend County blue (Houston and it’s suburbs), I think they sense a botched response to Covid-19 could be a blue wave event to the state’s scale",,,,1277725447636373505,https://twitter.com/PowderPinkVenus/status/1277725447636373505
2020-06-29 22:07:04,1Tavarius,ShamsCharania,0,0,3,"He was in San Antonio a few weeks ago. COVId-19 is bad in Texas. ",,,,1277725297178226690,https://twitter.com/1Tavarius/status/1277725297178226690
2020-06-29 22:05:53,realJRfromCA,SagamoreJoe,1,1,0,"Not sure who you watch but I hear that mentioned often (CNN, MSNBC, etc). There is no doubt that the protesters added to the covid case load, that's obvious. Is that the only factor for the massive spikes in Texas, Florida, Arizona, So. California, etc? Any other factors?",,,,1277724999638384640,https://twitter.com/realJRfromCA/status/1277724999638384640
2020-06-29 22:05:40,RuserSherry,,0,0,0,"30th Birthday Bash in Texas Leads to COVID Infections in 18 Family Members: ‘...",,,,1277724946832244745,https://twitter.com/RuserSherry/status/1277724946832244745
2020-06-29 22:04:56,KirbyPaola,,0,1,1,"Covid is def coming for Texas hard",,,,1277724761792098304,https://twitter.com/KirbyPaola/status/1277724761792098304
2020-06-29 22:04:51,ProbertSue,,0,0,0,"Choir of more than 100 sings unmasked at Mike Pence's 'Freedom' rally as Texas sees COVID-19 spike https://www.dailykos.com/story/2020/6/29/1956848/-Texas-deemed-a-coronavirus-epicenter-but-Mike-Pence-didn-t-let-that-stop-megachurch-Freedom-rally",,,,1277724738488610818,https://twitter.com/ProbertSue/status/1277724738488610818
2020-06-29 22:04:33,txchristabelle,DanCrenshawTX,0,0,0,"Thank you for your service Congressman, but please stop the politicizing of COVID 19 and do your job for the Texas citizens you were elected to represent. Help make sure the PPE and testing needed is available. The spikes are most likely because a combination of things.",,,,1277724662781349894,https://twitter.com/txchristabelle/status/1277724662781349894
2020-06-29 22:04:20,mo_ur_ad,GregAbbott_TX,0,0,0,"Do your job and protect texas from covid-19 first Your bad decisions must end",,,,1277724607542427648,https://twitter.com/mo_ur_ad/status/1277724607542427648
2020-06-29 22:04:19,TheLeftyNews,,0,0,0,"30th Birthday Bash in Texas Leads to COVID Infections in 18 Family Members: ‘It’s Heartbreaking’​ https://people.com/health/18-members-of-texas-family-get-coronavirus-after-throwing-a-birthday-party-its-heartbreaking/?utm_campaign=peoplemagazine&amp;utm_content=new&amp;utm_medium=social&amp;utm_source=twitter.com&amp;utm_term=5efa655517654f00015aa7fd - @people",,@people,,1277724605587894274,https://twitter.com/TheLeftyNews/status/1277724605587894274
2020-06-29 22:04:17,redheart1900,,1,0,0,"Texas State.6/29/20 casos de Covid-19 J Hopkins U. = 150,851 casos = 4,162 casos nuevos Google News = 152,296 casos = 3,271 casos nuevos CDC = 148,723 casos Worldometer info = 156,745 casos = 5,272 casos nuevos ",,,,1277724596771356672,https://twitter.com/redheart1900/status/1277724596771356672
2020-06-29 22:04:13,TimTaubes,JohnCornyn,0,0,0,"Texas COVID-19 new cases 33,847 6/23-6/28 Job well done",,,,1277724579922874371,https://twitter.com/TimTaubes/status/1277724579922874371
2020-06-29 22:04:05,people,,13,48,70,"30th Birthday Bash in Texas Leads to COVID Infections in 18 Family Members: ‘It’s Heartbreaking’​ https://people.com/health/18-members-of-texas-family-get-coronavirus-after-throwing-a-birthday-party-its-heartbreaking/?utm_campaign=peoplemagazine&amp;utm_content=new&amp;utm_medium=social&amp;utm_source=twitter.com&amp;utm_term=5efa655517654f00015aa7fd",,,,1277724546146226177,https://twitter.com/people/status/1277724546146226177
2020-06-29 22:04:02,beehealingnow,,0,1,0,"New Yorkers who travel to Florida, Texas, and other states with high COVID-19 infection rates will lose paid sick leave benefits https://news.yahoo.com/yorkers-travel-florida-texas-other-200032782.html Wow..First they tell you to stay home. Then they say you cant stay indoors at a restaurant.because the virus is worse indoors?",,,,1277724534095962112,https://twitter.com/beehealingnow/status/1277724534095962112
2020-06-29 22:03:50,DomJollyPoe,tedcruz,0,0,1,"Texas. Covid hotspot.",,,,1277724484552871937,https://twitter.com/DomJollyPoe/status/1277724484552871937
2020-06-29 22:03:19,RbrtWllms,,0,0,0,"Choir of more than 100 sings unmasked at Mike Pence's 'Freedom' rally as Texas sees COVID-19 spike https://www.dailykos.com/story/2020/6/29/1956848/-Texas-deemed-a-coronavirus-epicenter-but-Mike-Pence-didn-t-let-that-stop-megachurch-Freedom-rally",,,,1277724354634080256,https://twitter.com/RbrtWllms/status/1277724354634080256
2020-06-29 22:03:00,TexasStandard,,0,1,3,"Flu season will be here before you know it. So a team at the University of Texas is working on a sensor to test for both COVID-19 and the flu at the same time: ",,,,1277724274548256769,https://twitter.com/TexasStandard/status/1277724274548256769
2020-06-29 22:01:47,TheLeadCNN,,41,49,148,"Dr. Umair Shah in Harris County, Texas, says “we’ve seen in increase in everything” from people admitted to hospitals for Covid-19, to those trying to get tested. https://cnn.it/3g76pVy",,,,1277723966216351744,https://twitter.com/TheLeadCNN/status/1277723966216351744
2020-06-29 22:01:23,RonSupportsYou,,0,0,1,"""A Sun Belt time bomb threatens Trump’s reelection. Rising Covid-19 caseloads in Florida, Arizona and Texas raise fresh doubts about the president's reelection prospects"": ",,,,1277723867281121280,https://twitter.com/RonSupportsYou/status/1277723867281121280
2020-06-29 22:01:22,WSWS_Updates,,0,15,10,"Pandemic surpasses 10 million COVID-19 cases and over 500,000 deaths globally #COVID19 cases in the United States have careened out of control, with health care systems in Texas, Florida and Arizona nearing collapse #coronavirus",,,#COVID19 #coronavirus,1277723861757374468,https://twitter.com/WSWS_Updates/status/1277723861757374468
2020-06-29 22:01:15,ChiTownSidBrown,DanCrenshawTX,0,0,0,"There's an error in your tense: ""While NY HAD 20X the death rate of Texas.."" Here's some truth for Texas and fuck all the spin; hospitalizations in Texas are SURGING. It matters because a health system choked with Covid patients make all illnesses deadly. ",,,,1277723832409882625,https://twitter.com/ChiTownSidBrown/status/1277723832409882625
2020-06-29 22:01:06,ICyou88505988,mattgaetz,0,0,0,"In MY TEXAS these idiots would have been shot DEAD BY ME for pointing a gun at me. You’re disgusting really! Parading you’re perversion as a pedophile &amp; calling him adopted from a place who NEVER WOULD ADOPT TO YOU FACTUALLY! You OWN COVID DEATHS too &amp; ur POTUS is a threat ",,,,1277723796812648448,https://twitter.com/ICyou88505988/status/1277723796812648448
2020-06-29 22:00:26,ButchBrobst15,,0,0,0,"Choir of more than 100 sings unmasked at Mike Pence's 'Freedom' rally as Texas sees COVID-19 spike ",,,,1277723629959237632,https://twitter.com/ButchBrobst15/status/1277723629959237632
2020-06-29 22:00:13,starlocalmedia,,0,1,0,"Garland ISD recently announced that due to the rise of COVID-19 cases across Texas, and Dallas County being one of the hardest hit, with the focus of continuing to keep the safety of students and staff its top priority the district has decided to... ",,,,1277723573612883968,https://twitter.com/starlocalmedia/status/1277723573612883968
2020-06-29 22:00:13,Rowlett_News,,0,0,0,"Garland ISD recently announced that due to the rise of COVID-19 cases across Texas, and Dallas County being one of the hardest hit, with the focus of continuing to keep the safety of students and staff its top priority the district has decided to... https://starlocalmedia.com/rowlettlakeshoretimes/news/garland-isd-puts-strength-conditioning-programs-on-hold/article_d32dc764-ba45-11ea-8df6-cf642a915458.html#utm_campaign=blox&amp;utm_source=twitter&amp;utm_medium=social",,,,1277723572610519044,https://twitter.com/Rowlett_News/status/1277723572610519044
2020-06-29 22:00:03,XianJaneway,GovHowardDean,3,0,9,"Daaaaamn. :( But....if you're already *in* Florida, or Texas, or AZ, ""getting out"" probably isn't a good option, since you could just take COVID with you. :( ",,,,1277723533058158593,https://twitter.com/XianJaneway/status/1277723533058158593
2020-06-29 21:58:41,madukes529,,0,0,2,"It took over 6,000 covid cases in one day in TEXAS for ⁦@GregAbbott_TX⁩ to protect Texans! After 500,000 deaths, WHO warns worst of coronavirus pandemic is ""yet to come"" WAKE UP PEOPLE! #WearADamnMask",,@GregAbbott_TX,#WearADamnMask,1277723187183267840,https://twitter.com/madukes529/status/1277723187183267840
2020-06-29 21:58:39,AnybuddyUSA,DanPatrick,0,0,2,"Listened to them all. Dan, as Texas Republican, please stop the crazy BS about vote-by-mail fraud and please apologize to and tell your misinformed followers that you've been facile on COVID. Encourage them to do their part. Stop being a Covidiot. It's embarrassing.",,,,1277723178526277634,https://twitter.com/AnybuddyUSA/status/1277723178526277634
2020-06-29 21:58:08,SonjaNorman16,,0,1,0,"Texas had 143,371 Covid 19 cases yesterday. 2366 fatalities. Today, Texas has 153,011 cases and 2403 fatalities. Wtf Abbott!!!! Shut it down. ",,,,1277723049727582209,https://twitter.com/SonjaNorman16/status/1277723049727582209
2020-06-29 21:57:27,jimleforgeii,,0,0,0,"Pence Praises Texas Governor for Reopening That Fueled Massive Surge in Covid-19 Cases and Hospitalizations https://dailysoundandfury.com/pence-praises-texas-governor-for-reopening-that-fueled-massive-surge-in-covid-19-cases-and-hospitalizations/ via @dailysoundnfury",,@dailysoundnfury,,1277722878742536208,https://twitter.com/jimleforgeii/status/1277722878742536208
2020-06-29 21:57:23,Onavwerohojosep,,0,0,0,"Texas hospital CEO: COVID inpatient count 'misinterpreted,' level of alarm 'unwarranted' ",,,,1277722860799344649,https://twitter.com/Onavwerohojosep/status/1277722860799344649
2020-06-29 21:56:42,TMFtx,,3,36,74,"Texas hospitals hit capacity with 35,000 new COVID-19 cases this past week. Experts at @CDCgov agree: masks save lives. People wonder how hard a mask order is to enact. @GovAbbott could mandate face masks with eight words and a stroke of his pen. #txlege",,@CDCgov @GovAbbott,#txlege,1277722689625612289,https://twitter.com/TMFtx/status/1277722689625612289
2020-06-29 21:55:15,akuma_river,Westygal,1,0,4,"Ummm...Texas also started early voting today for Primary Runoff races. Election Day is July 14th. I'm going to be working it too. We are supposed to have special Covid training too.",,,,1277722323592896515,https://twitter.com/akuma_river/status/1277722323592896515
2020-06-29 21:54:35,RicksterRicks,,0,1,0,"Alex Jones leads anti-masker Texas rally as COVID-19 infections rise ",,,,1277722156420550663,https://twitter.com/RicksterRicks/status/1277722156420550663
