date,username,to,replies,retweets,favorites,text,geo,mentions,hashtags,id,permalink
2020-06-29 20:48:14,ScamHookers,,1,0,3,"Good night, pretty sure I have #covidtexas and very likely for the third time if that's even possible. Same exact symptoms 100% the same and cough just started. Please stay safe everybody! I haven't even left the house any of the times I got sick. SO HOW!?!?!? ",,,#covidtexas,1277705457277304833,https://twitter.com/ScamHookers/status/1277705457277304833
2020-06-29 20:47:05,RayShotz_,,1,0,0,"Texas, Florida &amp; Arizona getting slammed with Covid-19 is a prime example of why you should listen to logical/factual/ science when you’re told and not dismiss it like if it’s magical fairytales. All republicans governors btw. Idiots ",,,,1277705168684044296,https://twitter.com/RayShotz_/status/1277705168684044296
2020-06-29 20:47:01,MurphMFTbbcRGV,,0,0,0,"Marriage counseling couples therapy mental health counseling, addictions counseling. Licensed in Texas, all services and group sessions online due to COVID-19 safety precautions. @Beyond Boundaries Counseling RGV… https://www.instagram.com/p/CCCG3DVBYsz/?igshid=12bown98udthp",,,,1277705150681972739,https://twitter.com/MurphMFTbbcRGV/status/1277705150681972739
2020-06-29 20:46:57,mcpli,,1,17,8,"Texas COVID hospitalizations climb to another record: 5913 (up 416 from the number reported yesterday). #txlege",,,#txlege,1277705134970208258,https://twitter.com/mcpli/status/1277705134970208258
2020-06-29 20:46:48,MaValentinetti,,0,0,0,"Diamond & Silk: Claiming confusion, Texas Medical Center changes how it reports ICU capacity amid COVID-19 https://www.houstonchronicle.com/news/houston-texas/houston/article/Houston-hospitals-hit-100-base-ICU-capacity-15372256.php?utm_campaign=CMS%20Sharing%20Tools%20(Mobile)&amp;utm_source=t.co&amp;utm_medium=referral via @houstonchron",,@HoustonChron,,1277705096315506690,https://twitter.com/MaValentinetti/status/1277705096315506690
2020-06-29 20:46:46,augustodefranco,,0,5,24,"Já recuaram das medidas de reabertura em meio ao aumento de casos de Covid-19 nas últimas semanas: Arizona, Arkansas, Califórnia, Delaware, Flórida, Idaho, Louisiana, Carolina do Norte, Maine, Nova Jersey, Nevada, Novo México, Texas e Washington.",,,,1277705087796813830,https://twitter.com/augustodefranco/status/1277705087796813830
2020-06-29 20:46:35,dm_ms,Lugverbotszone,1,0,0,"Du vergisst, dass nicht nur COVID-19-Patienten auf Intensivstationen liegen. Anbei mal ein Beispiel aus Texas. @daniel_tronico",,@daniel_tronico,,1277705042255122434,https://twitter.com/dm_ms/status/1277705042255122434
2020-06-29 20:46:08,TexasCovid,,4,33,41,"June 29th, 2020 New Cases - 4,288 New Fatalities - 10 *Hospitalizations - 5,913 (+416 from prior day) Hospital Capacity Usage - 75% *NEW RECORD #covid19 #coronavirus #texas #tx #covidtexas #texascovid #txlege #texas #TexasCovid19",,,#covid19 #coronavirus #texas #tx #covidtexas #texascovid #txlege #texas #TexasCovid19,1277704930963468288,https://twitter.com/TexasCovid/status/1277704930963468288
2020-06-29 20:46:04,kherman,,6,4,9,"Updated Texas COVID report: Today: 4,288 cases. Under 5,000 for first time since June 22. Ten deaths, matching lowest since June 15. ",,,,1277704913125101571,https://twitter.com/kherman/status/1277704913125101571
2020-06-29 20:46:01,deepbarot,,0,0,0,"Republican America pulling its anti-science weight hardcore, looking at the #COVID infection curve, next few weeks will see unchartered exponential growth all over Florida, the South, and South West (Arizona, Texas, and Oklahoma). No new #StayAtHome order yet. #ExponentialGrowth",,,#COVID #StayAtHome #StayAtHome #ExponentialGrowth,1277704898294005768,https://twitter.com/deepbarot/status/1277704898294005768
2020-06-29 20:45:20,cshegarty,TeamTrump,0,0,0,"And you exposed a whole lot of people on your pathetic trip. Lip service is all you have. Be sure and personally take credit for the Covid case increases in Texas and elsewhere in the coming weeks. How do you live with death on your hands? How?",,,,1277704729879932928,https://twitter.com/cshegarty/status/1277704729879932928
2020-06-29 20:45:13,Dodgerfan3131,TommyEubanks9,1,0,3,"Our lockdowns were to ease the burden on hospitals & ICUs specifically. Covid hospitalizations &amp; covid ICU numbers are still declining in Texas. Lockdowns were never to stop the virus (that’s impossible),it was to flatten the curve so hospitals weren’t overwhelmed &amp; limit deaths.",,,,1277704697038565376,https://twitter.com/Dodgerfan3131/status/1277704697038565376
2020-06-29 20:45:03,FaithHosp,,0,0,1,"New COVID-19 cases are still rising in Texas. It is important to continue taking steps to slow the spread in our community, including wearing masks in public, social distancing and washing hands frequently. Are you staying safe? ",,,,1277704657855483905,https://twitter.com/FaithHosp/status/1277704657855483905
2020-06-29 20:45:03,BioportfolioS,,0,0,0,"Luminex Submits Emergency Use Authorization Request to U.S. FDA for COVID-19 Antibody Test: AUSTIN, Texas, June 29, 2020 /PRNewswire via http://BioPortfolio.co.uk/ -- Luminex Corporation (NASDAQ: LMNX) today announced that the company has submitted an…",,,,1277704657356259329,https://twitter.com/BioportfolioS/status/1277704657356259329
2020-06-29 20:44:59,EofLosAngeles,HurryWakeUpNow,2,0,0,"Except it ignores those cities have the densest populations hence the early wide outbreaks there and the most diverse populations hence largest demonstrations. Now look at states that Covid protocols like Texas and fla. keep dreaming",,,,1277704642017677312,https://twitter.com/EofLosAngeles/status/1277704642017677312
2020-06-29 20:43:33,NTXProgressive,maddow,0,2,1,"And in Texas and other places the results were mixed in with Covid testing to boost testing numbers ",,,,1277704280082919426,https://twitter.com/NTXProgressive/status/1277704280082919426
2020-06-29 20:43:32,mattinamarica,RepDanCrenshaw,0,0,0,"This is why we are increasing in Covid cases - because lawmakers are lying to you! has a population of 83Mil and just 195k cases with 9k deaths and their cases are declining! Texas has a population of 29Mil and 149k cases, 2.3k deaths and cases are spiking! #COVIDIOTS #COVID19",,,#COVIDIOTS #COVID19,1277704275611672576,https://twitter.com/mattinamarica/status/1277704275611672576
2020-06-29 20:43:28,arieusss,,0,0,2,"covid cases went up 818% in childcare across texas since reopening",,,,1277704259056918528,https://twitter.com/arieusss/status/1277704259056918528
2020-06-29 20:43:07,cshegarty,Mike_Pence,0,0,0,"Pathetic Pence. Did you check in on the kids in cages while in Texas? No, you let an unmasjed choir sing for you without social distancing, exposing all of them to Covid.",,,,1277704168585609216,https://twitter.com/cshegarty/status/1277704168585609216
2020-06-29 20:43:01,KAG11816,,0,0,0,"Happening now on Infowars, report to follow later today! Reports from Texas that increase in Covid-19 are due to a positive/false positive being multiplied by as much as 15x due to theory that those around that person will be positive! 5000 “new” cases / 15 = 333 actual cases!",,,,1277704145252814849,https://twitter.com/KAG11816/status/1277704145252814849
2020-06-29 20:42:32,AmerHoy,,0,0,0,"US: dozens of cars line up at a COVID-19 testing site in Houston, Texas | AFP ",,,,1277704024716795904,https://twitter.com/AmerHoy/status/1277704024716795904
2020-06-29 20:42:07,amy67746703,,0,0,1,"VIDEO: Texas Rep Louis Gohmert Targets NY’s Cuomo: ‘We Don’t Have A Governor Sending People With COVID To Our Nursing Homes’ I love ⁦@replouiegohmert⁩",,@replouiegohmert,,1277703919343415296,https://twitter.com/amy67746703/status/1277703919343415296
2020-06-29 20:42:06,strieker_toni,TexasTribune,0,0,0,"I wonder how Abbott's Texas swagger will look in Sept when is COVID numbers spike.... again.",,,,1277703916453576704,https://twitter.com/strieker_toni/status/1277703916453576704
2020-06-29 20:40:13,StevenTDennis,,70,336,518,"TEXAS COVID hospitalizations resume their upward march, hitting another record high. Now 5,913 (+416) from yesterday.",,,,1277703439808704513,https://twitter.com/StevenTDennis/status/1277703439808704513
2020-06-29 20:39:34,MonicaLamb20,,0,0,0,"In my county we have had no covid deaths. Texas started re-closing some businesses yesterday because of the spike in CASES.A small winery in my county that is 40 miles out in the country was closed because it is “similar to a bar”.Picture below #ItsNotAboutAVirus https://twitter.com/tedcruz/status/1277343541669158913",,,#ItsNotAboutAVirus,1277703278801948672,https://twitter.com/MonicaLamb20/status/1277703278801948672
2020-06-29 20:39:24,WillSmirk4Food,,0,2,0,"Choir of more than 100 sings unmasked at Mike Pence's 'Freedom' rally as Texas sees COVID-19 spike ",,,,1277703235202158593,https://twitter.com/WillSmirk4Food/status/1277703235202158593
2020-06-29 20:38:45,deblarsontietz,SenTedCruz,0,0,0,"Really Ted. You read his opinion? Get off your horsey! Do something about our covid 19 problem in your state of Texas! Haircuts are so important?! Willing to die for one?",,,,1277703072505114624,https://twitter.com/deblarsontietz/status/1277703072505114624
2020-06-29 20:38:13,TimothyFranzen,,0,0,0,"Satanic Choir of more than 100 sings unmasked at Mike Pence's 'Freedom' rally as Texas sees COVID-19 spike ",,,,1277702935884042242,https://twitter.com/TimothyFranzen/status/1277702935884042242
2020-06-29 20:37:56,texasspoonie,,1,0,1,"@AusPublicHealth in Travis County #Texas#COVID forgot to update this chart. This chart still shows Stage 4 as 20-70, instead of the new chart showing Stage 4 as 40-(70-123). Why the change in Staging parameters with no explanation to the public? Moving the goal posts? ",,@AusPublicHealth,,1277702864224346114,https://twitter.com/texasspoonie/status/1277702864224346114
2020-06-29 20:37:53,col9994,JohnCornyn,0,0,0,"oh was wearing Mask's Lastweeks Political Football but this week its important ? I could of sworn Covid was a Hoax a month ago when Florida and Texas and Arizona Opened up ..Least that's what Stupid GOP was saying Why does GOP seem to have Problems sticking to 1 story",,,,1277702854128611328,https://twitter.com/col9994/status/1277702854128611328
2020-06-29 20:37:31,Raswell1,GOP,0,0,0,"If we must we can go one state at a time till each is certified COVID free. Start with the big states first, Texas is one.",,,,1277702759236714497,https://twitter.com/Raswell1/status/1277702759236714497
2020-06-29 20:37:19,WendyMeer11,SouthGALeeAnn,0,21,19,"Reality is a medically vulnerable USAF Vet in DANGER of #Covid in a Texas Prison. She is serving her 4th yr. DOJ is fighting her plea for #CompassionateRelease We need public pressure &amp; lots of voices to get the attention of our elected officials. It shouldn’t be this way...",,,#Covid #CompassionateRelease,1277702709932630016,https://twitter.com/WendyMeer11/status/1277702709932630016
2020-06-29 20:36:38,blackcoug,,0,0,0,"The MEDIA IS LYING ABOUT THE SECOND WAVE AND IT BETTER STOP. ICU beds in Texas only have 27% Covid cases. This country has to stop these Radicals",,,,1277702537009696768,https://twitter.com/blackcoug/status/1277702537009696768
2020-06-29 20:36:07,Gratitude4air,,0,0,0,"If this massive uptick in Covid infections in Texas is primarily linked to indoor gatherings then I guess Trump's Okla &amp; Arizona rallys with a combined total of over 10K UNMASKED in the last 8 days has the foregone conclusion to have infected thousands that are lurking out there",,,,1277702410941739009,https://twitter.com/Gratitude4air/status/1277702410941739009
2020-06-29 20:36:00,Hey_xTay,gregark7,0,0,1,"Our health system is overwhelmed, and lacking PPE. Look at Texas right now. OVERWHELMED WITH COVID 19 CASES.",,,,1277702379018825728,https://twitter.com/Hey_xTay/status/1277702379018825728
2020-06-29 20:35:54,MaryPaton15,DanCrenshawTX,0,0,0,"Like you did when blaming Texas’s rise in Covid cases on #BLM protests? #ComplicitCorruptGOP",,,#BLM #ComplicitCorruptGOP,1277702355451031552,https://twitter.com/MaryPaton15/status/1277702355451031552
2020-06-29 20:35:36,basta_itmfa,Janetspics,1,0,2,"Having a Governor who doesn’t want people to die of COVID-19 is a bad thing? Move to Texas.",,,,1277702278196219907,https://twitter.com/basta_itmfa/status/1277702278196219907
2020-06-29 20:35:35,UTexas4Biden,,0,3,8,"Now more than ever it is extremely important to wear face masks, especially in Texas where our COVID-19 cases are increasing at an alarming rate. Be like Bevo and Hook ‘Em, wear a face mask to save lives! ",,,,1277702274786242573,https://twitter.com/UTexas4Biden/status/1277702274786242573
2020-06-29 20:34:57,superteeswork,,0,0,0,"New Tie-dye Check out http://linktr.ee in the bio #covid_19 #shop #shirts #men #children #donaldtrump #usa #florida #miami #hollywood #palmbeach #texas #mexico #sunnyislesbeach #doral #coral #miamibeach #dallas en Miami… https://www.instagram.com/p/CBdh2J5Ap94/?igshid=ihxvq9cjcghf",,,#covid_19 #shop #shirts #men #children #donaldtrump #usa #florida #miami #hollywood #palmbeach #texas #mexico #sunnyislesbeach #doral #coral #miamibeach #dallas,1277702113720664066,https://twitter.com/superteeswork/status/1277702113720664066
2020-06-29 20:34:44,Rocker_Fox,,3,0,1,"The fucked thing going though my head is, would have this man lived if Texas wasn't currently struggling to keep up with the Covid demand? On any normal day would he have been ok? All you ""i don't need to wear a mask"" types basically killed this man if that's the case.",,,,1277702061015142400,https://twitter.com/Rocker_Fox/status/1277702061015142400
2020-06-29 20:31:56,RBannon1,,0,0,0,"Les divisions politiques renaissent aux USA sur de nouvelles restrictions et l’obligation de porter des masques, alors que la flambée de l’épidémie de COVID-19 dans certains États dont le Texas et la Floride provoque une ruée vers les sites de dépistage. ",,,,1277701354518188032,https://twitter.com/RBannon1/status/1277701354518188032
2020-06-29 20:30:32,ScienceOfficerQ,,0,0,3,"#Texas is one of the worst hotspots in the country for #Covid right now. Can someone please explain that to #TWC so those of us relying on #unemployment due to being furloughed w/no return date don't have to put ourselves and loved ones at risk? #AbbottResign #AbbottFailedTexas",,,#Texas #Covid #TWC #unemployment #AbbottResign #AbbottFailedTexas,1277701004478296064,https://twitter.com/ScienceOfficerQ/status/1277701004478296064
2020-06-29 20:30:06,meghas,,23,0,125,"folks, i'm out of the office for a while. we have a new resident at house unicorn. for all your covid needs, follow @cenmag. my colleagues are doing amazing work for deep thoughts, pics of dogs, and life in texas, stay here never fear, tho, i'll be back to reporting soon. ",,@cenmag,,1277700895107579904,https://twitter.com/meghas/status/1277700895107579904
2020-06-29 20:30:05,meatballzforu,,0,0,0,"The most Texas thing I've seen all day. #Texas #Brisket #COVID ",,,#Texas #Brisket #COVID,1277700891785801728,https://twitter.com/meatballzforu/status/1277700891785801728
2020-06-29 20:29:30,bentonarnold5,,0,0,0,"Texas hospital CEO: COVID inpatient count 'misinterpreted,' level of alarm 'unwarranted' | Just The News ⁦@GovAbbott⁩",,@GovAbbott,,1277700745354260483,https://twitter.com/bentonarnold5/status/1277700745354260483
2020-06-29 20:29:11,Discordia42,KPlorable,2,0,0,"Your Newsweek article was on Houston. You do realize that Abbott forced everywhere in Texas to reopen too soon don't you? Houston had protests, large protests, the graph proves COVID was never under control even before, this not because of mostly masked protestors.",,,,1277700662223142913,https://twitter.com/Discordia42/status/1277700662223142913
2020-06-29 20:28:39,dennismlong,,0,0,0,"New Yorkers who travel to Florida, Texas, and other states with high COVID-19 infection rates will lose paid sick leave benefits ",,,,1277700528995270665,https://twitter.com/dennismlong/status/1277700528995270665
2020-06-29 20:28:31,tonistark4real,tomgreenlive,0,0,2,"Texas has lost its damn mind! Soon as Phase 2 opened bars/clubs it was like COVID nvr happened. 1 comment here was “it’s just the flu”! The anti-masker brigades r out n force here. Go ahead idiots! #MaskItOrCasket #COVIDisNoHoax or get outta my way. TY @least U have sense",,,#MaskItOrCasket #COVIDisNoHoax,1277700497068249088,https://twitter.com/tonistark4real/status/1277700497068249088
2020-06-29 20:28:04,TexasMonthly,,4,12,19,"The Republican Party of Texas seems hell-bent on holding a convention of more than seven thousand delegates next month in Houston, which is a national epicenter of COVID-19. As @cd_hooks puts it, the event ""seems like a pretty bad idea.""",,@cd_hooks,,1277700384929308673,https://twitter.com/TexasMonthly/status/1277700384929308673
2020-06-29 20:25:54,mmajestic58,,0,0,0,"This lockdown is a FRAUD, Governor! There is NO SUCH THING as “essential businesses”! ALL businesses ARE ESSENTIAL! They ALL pay the bills for someone! STOP this MADNESS! Texas Gov. Abbott orders bars to close amid COVID-19 spike - Business Insider ",,,,1277699837752991746,https://twitter.com/mmajestic58/status/1277699837752991746
2020-06-29 20:25:35,seacaptim,,0,0,0,"""In fact, there has been much reporting that the “spike” in Texas cases is not due to a resurgence of the virus but to hospital practices of Covid-testing every patient coming in for any procedure at all. If it’s a positive, well that counts as a “Covid hospitalization.”",,,,1277699758010875904,https://twitter.com/seacaptim/status/1277699758010875904
2020-06-29 20:25:29,LamarEsq,davidmcswane,1,0,2,"Holy crap. This thread — on Covid-19 profiteering and the potential peril in which it's putting healthcare workers in Texas... ",,,,1277699730949185536,https://twitter.com/LamarEsq/status/1277699730949185536
2020-06-29 20:24:58,RohinaIqbal,PhillyMayor,0,0,0,"Since philly has a surge of cases, per latest covid numbers, can we reconsider the green phase opening this week? I’m okay limiting activities for a bit if it avoids us from becoming Texas.",,,,1277699603618582531,https://twitter.com/RohinaIqbal/status/1277699603618582531
2020-06-29 20:24:41,krystyna4450,,0,0,0,"Texas Head Coach Tom Herman Posts Video Urging COVID-19 Safety ",,,,1277699532562849793,https://twitter.com/krystyna4450/status/1277699532562849793
2020-06-29 20:24:10,HubcapDave69,GeraldoRivera,0,0,0,"I have someone I follow who lives in a more rural area of Texas and their hospitals are filling up rather quickly with COVID patients. Also, if that were a factor, why are Minnesota and NYC not experiencing spikes?",,,,1277699403319369728,https://twitter.com/HubcapDave69/status/1277699403319369728
2020-06-29 20:23:48,x2Darkk,,5,0,13,"All these people in Walmart. But barely any masks in sight, people in Texas wonder why COVID is so bad here. Just look around bro",,,,1277699310545711107,https://twitter.com/x2Darkk/status/1277699310545711107
2020-06-29 20:23:29,percyhoward_,Barkofatree,0,0,3,"Texas deaths all causes, weeks 14-20 2019 - 27,006 2020 - 29,573 diff +2,567 Covid deaths weeks 14-20 1,277 1,290 non-Covid excess deaths for this time period in 2020. With +2% population over last year ≈1,270 more deaths. Undercount is 1,120-1,420 for those 7 weeks *alone*",,,,1277699228341592065,https://twitter.com/percyhoward_/status/1277699228341592065
2020-06-29 20:23:17,LilyCrue,PatrikD,0,0,1,"This my first covid-19 emergency alert, ever. This is from Saturday, June 27. They opened Texas too soon. Better leadership is needed to combat this. ",,,,1277699180262305795,https://twitter.com/LilyCrue/status/1277699180262305795
2020-06-29 20:23:03,ksannews,,0,0,0,"Curbside voting is not new to the Texas Election Code, but more voters may opt in to the drive-by method of casting ballots, as well as other alternative approaches to voting, as the COVID-19 pandemic continues. ",,,,1277699119814004739,https://twitter.com/ksannews/status/1277699119814004739
2020-06-29 20:23:02,klstnews,,0,0,1,"Curbside voting is not new to the Texas Election Code, but more voters may opt in to the drive-by method of casting ballots, as well as other alternative approaches to voting, as the COVID-19 pandemic continues. https://trib.al/3G5P9kx",,,,1277699118081720320,https://twitter.com/klstnews/status/1277699118081720320
2020-06-29 20:22:57,sharrij,TheNolaGirl,0,0,2,"And in Texas, since they opened up, more people are having elective surgeries. They aren’t telling us that a lot of those ICU beds are from elective surgeries not Covid.",,,,1277699095772225537,https://twitter.com/sharrij/status/1277699095772225537
2020-06-29 20:22:56,FlintGravelston,TheHangingChads,0,0,2,"Hey Mathmagician, here's the top 10 states by population: California Texas Florida New York Pennsylvania Illinois Ohio Georgia North Carolina Michigan The moral of the story: More people, more COVID-19. And for @TheHangingChads Less education, more racism. The End",,@thehangingchads,,1277699092370644992,https://twitter.com/FlintGravelston/status/1277699092370644992
2020-06-29 20:22:39,LynnRucker8,JohnCornyn,0,0,0,"To quote the great Willie Nelson-Mommas, don’t let your babies grow up to be sell-outs! The COVID Republic of Texas ",,,,1277699021390438400,https://twitter.com/LynnRucker8/status/1277699021390438400
2020-06-29 20:22:21,stillbigo,,0,0,0,"Claiming confusion, Texas Medical Center changes how it reports ICU capacity amid COVID-19 - http://HoustonChronicle.com",,,,1277698942331957256,https://twitter.com/stillbigo/status/1277698942331957256
2020-06-29 20:21:33,adegbenro61,RepDanCrenshaw,0,0,0,"Doesn’t help when Texas Governor Abbott, says COVID cases has “taken a very swift and very dangerous turn in Texas over just the past few weeks.” Alarmist much?",,,,1277698741068353542,https://twitter.com/adegbenro61/status/1277698741068353542
2020-06-29 20:21:18,patriciae1988,,1,0,0,"@DiscountTire I am inquiring about a store in Portland Texas that had several Covid cases at the store. Will that store be closing down for deep cleaning?",,@DiscountTire,,1277698678451470342,https://twitter.com/patriciae1988/status/1277698678451470342
2020-06-29 20:21:16,buffaloquinn,Barkofatree,0,0,0,"Absolutely! Primarily Red States like Florida & Texas. Part of the problem is nobody actually dies from Covid-19 per se, so figures get fudged both ways. People die from whatever weakened system the virus destroyed. For most it's the lungs, pneumonia like. Others it's the heart.",,,,1277698671505805320,https://twitter.com/buffaloquinn/status/1277698671505805320
2020-06-29 20:21:14,HardeepSinghMD,,1,1,2,"Updated ICU capacity numbers just out from Texas Medical center - good to see daily data being shared with transparency COVID growth rate 6.1% for Med-Surg beds and 3.5% for ICU means Phase 2 in 3 days 1/2 https://www.tmc.edu/coronavirus-updates/overview-of-tmc-icu-bed-capacity-and-occupancy/",,,,1277698662655840259,https://twitter.com/HardeepSinghMD/status/1277698662655840259
2020-06-29 20:20:15,ohioincrisis,,11,5,46,"I to blast @GovMikeDeWine @MikeDeWine on twitter everyday but when he does the right thing, I should at least acknowledge it. He didnt fall into the Texas/Florida trap hole yet AND he acknowledged the protestors hav cause In covid cases. More balls than most politicians",,@GovMikeDeWine @MikeDeWine,,1277698416269721603,https://twitter.com/ohioincrisis/status/1277698416269721603
2020-06-29 20:20:11,kristinwill11,ChrisFerr2,1,0,0,"There is no way anyone seriously interested in the data could look at the US as a monolith when this has been a highly regional problem since the beginning (same with the EU). NYCs covid story vs. Texas vs California are all VERY different.",,,,1277698400927076353,https://twitter.com/kristinwill11/status/1277698400927076353
2020-06-29 20:20:06,JoeKing3333,,0,0,0,"Choir of more than 100 sings unmasked at Mike Pence's 'Freedom' rally as Texas sees COVID-19 spike ",,,,1277698376990146565,https://twitter.com/JoeKing3333/status/1277698376990146565
2020-06-29 20:19:29,hollywoodjd2001,,0,1,0,"@GregAbbott_TX @JudgeClayJ @JohnCornyn @SenTedCruz TELL THE TRUTH ABOUT TEXAS COVID HOSPITALIZATIONS!! No need to panic. No need to shut down! So tired of the fear mongering! Houston hospital CEO’s speak the truth! ",,@GregAbbott_TX @JudgeClayJ @JohnCornyn @SenTedCruz,,1277698224363626497,https://twitter.com/hollywoodjd2001/status/1277698224363626497
2020-06-29 20:19:03,jbmath1972,kikijotexas,2,0,0,"No, your to stupid to make your own decisions. That’s why Texas is #1 is covid.",,,,1277698113424297984,https://twitter.com/jbmath1972/status/1277698113424297984
2020-06-29 20:18:33,kgounews,,1,2,2,"Texas has paused its reopening because of a spike in COVID-19 cases. Will the recent uptick in Oklahoma's cases trigger a similar change in the state's approach? @LtGovPinnell discusses the impact of coronavirus on the state with Capitol Insider ",,@LtGovPinnell,,1277697989331517440,https://twitter.com/kgounews/status/1277697989331517440
2020-06-29 20:18:29,Basedpapicarlos,,0,1,1,"TEXAS** one call center. That’s what the state has. One for the entire state. And a state AS BIG AS IT IS. Come on guys the way you are running it is embarrassing. CVS and Walmart are doing a better job than yall. #covid #testing",,,#covid #testing,1277697973070237697,https://twitter.com/Basedpapicarlos/status/1277697973070237697
2020-06-29 20:17:44,SinEmbargoTR,,0,2,0,"Mike Pence culpa a los “jóvenes indisciplinados” por el repunte de casos de COVID-19 en Florida y Texas ",,,,1277697782623744005,https://twitter.com/SinEmbargoTR/status/1277697782623744005
