date,username,to,replies,retweets,favorites,text,geo,mentions,hashtags,id,permalink
2020-04-01 05:22:16,BAILONANGELICAM,,2,11,32,"Texas Health and Human Services launches COVID-19 mental health support line ",,,,1245219913062473734,https://twitter.com/BAILONANGELICAM/status/1245219913062473734
2020-04-01 05:20:27,Ahighervision,,0,0,1,"28 University of Texas spring breakers test positive for #COVID-19 after group trip to Mexico #covidiots https://www.nbcnews.com/news/us-news/least-28-texas-spring-breakers-test-positive-covid-19-after-n1173231",,,#COVID #covidiots,1245219453023006721,https://twitter.com/Ahighervision/status/1245219453023006721
2020-04-01 05:18:45,themeaningofme1,,0,0,0,"@druidDUDE get @DiannaAgron to recap one! It would make this shitty year a little better! I am working 10 hour days and I had to send one of my ma’s home becuz she might have covid 19 we are scared! We don’t have PPE in Texas!",,@druidDUDE @DiannaAgron,,1245219027263389697,https://twitter.com/themeaningofme1/status/1245219027263389697
2020-04-01 05:17:40,anthonyantonid2,,0,0,1,"@JHUSystems it looks like Houston (Harris County) Texas no longer shows up on the map tab on the Covid-19 dashboard. I hope that isn’t affecting the accuracy of Texas’ overall numbers being reported",,@JHUSystems,,1245218753555677185,https://twitter.com/anthonyantonid2/status/1245218753555677185
2020-04-01 05:15:21,TONYAPARNELL2,,0,0,0,"Tracking COVID-19: Southeast Texas coronavirus tracking maps http://www.12newsnow.com/article/news/health/coronavirus/tracking-covid-19-southeast-texas-coronavirus-tracking-maps/502-297723ce-485d-48a2-b7fd-1a39cc0bbd17 via @12NewsNow",,@12NewsNow,,1245218169075249152,https://twitter.com/TONYAPARNELL2/status/1245218169075249152
2020-04-01 05:12:45,TONYAPARNELL2,,0,0,0,"Tracking COVID-19: Southeast Texas coronavirus tracking maps http://www.12newsnow.com/article/news/health/coronavirus/tracking-covid-19-southeast-texas-coronavirus-tracking-maps/502-297723ce-485d-48a2-b7fd-1a39cc0bbd17 via @12NewsNow",,@12NewsNow,,1245217513996087296,https://twitter.com/TONYAPARNELL2/status/1245217513996087296
2020-04-01 05:08:13,cadencecarol,,0,0,0,"Breaking! Texas Governor PROHIBITS Counties &amp; Cities from BANNING Religious Services during COVID-19 http://disq.us/t/3ndy88s",,,,1245216374672297984,https://twitter.com/cadencecarol/status/1245216374672297984
2020-04-01 05:06:50,AIIAmericanGirI,,1,0,0,"Pro-choice advocates say Texas is using COVID-19 pandemic to block access to abortions https://video.foxnews.com/v/6146191544001/ @FoxNews #AAG #AAG2020",,@FoxNews,#AAG #AAG2020,1245216025538375681,https://twitter.com/AIIAmericanGirI/status/1245216025538375681
2020-04-01 05:00:38,AndreaKPadilla1,_JEWEL_C,1,0,0,"My county in Central Texas is only slightly smaller than Rhode Island, has 28,000 people, &amp; maybe 4 head of livestock per person. However, we have only 2 reported/confirmed cases of covid-19. But there are 5 other comparably sized counties next to us that have 0 cases.",,,,1245214468738551812,https://twitter.com/AndreaKPadilla1/status/1245214468738551812
2020-04-01 04:57:11,janasemler,,0,0,0,"""Breaking! Texas Governor PROHIBITS Counties &amp; Cities from BANNING Religious Services during COVID-19."" ",,,,1245213598978379776,https://twitter.com/janasemler/status/1245213598978379776
2020-04-01 04:56:58,SSmederovac,,0,0,0,"Texas Roadhouse CEO gives up salary to pay front-line employees during COVID-19 outbreak ",,,,1245213545307897857,https://twitter.com/SSmederovac/status/1245213545307897857
2020-04-01 04:56:02,d_cdh952,,0,0,0,"28 University of Texas spring breakers test positive for COVID-19 after group trip to Mexico https://www.nbcnews.com/news/us-news/least-28-texas-spring-breakers-test-positive-covid-19-after-n1173231 via @nbcnews",,@NBCNews,,1245213308531195910,https://twitter.com/d_cdh952/status/1245213308531195910
2020-04-01 04:52:01,indiemusicplus,,0,0,1,"COVID-19 Quarantine Playlist: Mark Moody Picks His Favorite Texas Tunes http://www.undertheradarmag.com/news/covid-19_quarantine_playlist_mark_moody_picks_his_favorite_texas_tunes/",,,,1245212297129320449,https://twitter.com/indiemusicplus/status/1245212297129320449
2020-04-01 04:49:41,vvivianasenn,,0,0,3,"Covid-19, Quarantine till April 30th, 5.0 earthquake in Texas, 6.5 earthquake in Idaho... My brain: ",,,,1245211711889477639,https://twitter.com/vvivianasenn/status/1245211711889477639
2020-04-01 04:48:11,FitKitt,ScottGottliebMD,0,0,0,"Texas 45k tested 41 deaths, 16k available COVID beds with 98% capacity available. NJ 45k tested 267 deaths, CT 16k tested 68 deaths, NY... worry about the tri-state and back off of Texas. We have the financial resources and biggest med center in the world . From a liberal.",,,,1245211334033227777,https://twitter.com/FitKitt/status/1245211334033227777
2020-04-01 04:46:44,Lorena1Chavez,,0,0,0,"28 turistas de Texas que viajaron a Cabo San Lucas tienen COVID-19 ",,,,1245210968491274240,https://twitter.com/Lorena1Chavez/status/1245210968491274240
2020-04-01 04:45:20,Peacekeeper876,Acosta,1,0,0,"I know Texas is different than the rest of the country and I thought I read Texas governor Greg Abbott issues a state-wide execution order. I thought to myself this will end the spread of covid-19 and a goddamn hurry. ",,,,1245210617960706048,https://twitter.com/Peacekeeper876/status/1245210617960706048
2020-04-01 04:44:46,rowlandville,leftcoastbabe,2,4,7,"Honestly, even if ""W"" or Perry had been governor... @GovAbbott is an utter waste. Estimated cumulative dead (in Texas) from Covid. This is best case scenario. (That means total lockdown.) : 2,321 - May 1 5,768 - June 1 6,029 - July 1 ",,@GovAbbott,,1245210473991221248,https://twitter.com/rowlandville/status/1245210473991221248
2020-04-01 04:36:49,mikeoax,,1,0,0,"La diferencia entre hacer y no hacer pruebas. 28 jóvenes de Texas llegan de spring break a Cabo San Lucas, BCS y ahora, ya en Austin, dan positivo a COVID-19 ",,,,1245208473991655429,https://twitter.com/mikeoax/status/1245208473991655429
2020-04-01 04:34:48,symone__kayla,,0,0,0,"Somebody said Texas and Florida not invited to Mardi Gras anymore since they wanna single out Louisiana during covid ",,,,1245207967093448706,https://twitter.com/symone__kayla/status/1245207967093448706
2020-04-01 04:33:35,MavrikSochill,,1,0,0,"28 University of Texas spring breakers test positive for COVID-19 after group trip to Mexico https://www.nbcnews.com/news/us-news/least-28-texas-spring-breakers-test-positive-covid-19-after-n1173231 via @nbcnews",,@NBCNews,,1245207657360896000,https://twitter.com/MavrikSochill/status/1245207657360896000
2020-04-01 04:29:07,TopherPerkins,,0,0,0,"How Beloved Texas Grocery Store H-E-B Prepared for COVID-19 for Months ",,,,1245206535594221569,https://twitter.com/TopherPerkins/status/1245206535594221569
2020-04-01 04:28:24,tkod2001,tkod2001,0,0,0,"The hospitals don’t need them yet. The hospitals aren’t at their apex. The hospitals have enough ventilators today. But the numbers (of hospitalizations from COVID-19) are going up. We’re planning for an apex, a high point in about 21 days. That’s when we need the 30,000",,,,1245206356560207873,https://twitter.com/tkod2001/status/1245206356560207873
2020-04-01 04:20:29,Coast933,,0,0,0,"28 Spring Breakers From Texas Test Positive For COVID-19 After Mexico Trip ",,,,1245204363263475712,https://twitter.com/Coast933/status/1245204363263475712
2020-04-01 04:19:15,aeoost,,0,0,0,"Welcome to Texas… Where they at least understand the Constitution: Governor PROHIBITS Counties &amp; Cities from BANNING Religious Services during COVID-19 | ⁦@dreverettpiper⁩ ⁦@PC1170⁩ https://www.texasgopvote.com/family/breaking-texas-governor-prohibits-counties-cities-banning-religious-services-0012476",,@dreverettpiper @PC1170,,1245204051370946560,https://twitter.com/aeoost/status/1245204051370946560
2020-04-01 04:11:08,BtoBoomerTravel,,0,0,0,"28 University of Texas spring breakers test positive for COVID-19 after group trip to Mexico #Coronavirus #covid19 https://nbcnews.to/2QYXZ8L",,,#Coronavirus #covid19,1245202008321204226,https://twitter.com/BtoBoomerTravel/status/1245202008321204226
2020-04-01 04:07:07,wateruno,davequast,1,0,0,"Florida, Georgia, Miss, Alabama Louisiana and Texas are about to get toasted big time ... the COVID-19 missile has been launched and they are not prepared! That are rapidly matching or exceeding WA state with no end in sight and very delayed social isolation. ",,,,1245200998051667970,https://twitter.com/wateruno/status/1245200998051667970
2020-04-01 04:03:00,torybennett,Bill_Gross,0,1,0,"Wanna know why Texas is reporting so few Covid cases? Well..... ",,,,1245199963937742854,https://twitter.com/torybennett/status/1245199963937742854
2020-04-01 04:02:16,CindyReynolds,AlexBoyerFox4,0,0,0,"A #coronavirus patient at Texas Health Harris Methodist Hospital Fort Worth is being treated with the same life-saving measure that helped during the #Ebola outbreak. Doctors are injecting the patient with plasma that came from someone who has recovered from COVID-19. ",,,#coronavirus #Ebola,1245199777324847105,https://twitter.com/CindyReynolds/status/1245199777324847105
2020-04-01 04:00:04,YoungMartinKE,TheLorinLee,0,0,0,"Fuck covid 19. I'm going to Texas ",,,,1245199222942597121,https://twitter.com/YoungMartinKE/status/1245199222942597121
2020-04-01 04:00:02,TradingProdigy,,0,0,0,"https://goo.gl/xm320Z 'Texas Miracle' ""On Ice For Time Being"" As Crude-Carnage &amp; COVID-Chaos Double-Whammy Strikes Lone-Star State http://dlvr.it/RSxT0m",,,,1245199216915263488,https://twitter.com/TradingProdigy/status/1245199216915263488
2020-04-01 04:00:01,KTSMtv,,0,0,10,"The number of COVID-19 cases in South Texas jumped dramatically in a week, prompting the Hidalgo County judge to consider implementing stricter travel restrictions — that he might or might not be able to do — to get traffic off area roads. ",,,,1245199212901543936,https://twitter.com/KTSMtv/status/1245199212901543936
2020-04-01 03:59:04,Big2News,,0,0,1,"COVID-19’s impact on Texas’ U.S. Senate primary runoff ",,,,1245198975021572096,https://twitter.com/Big2News/status/1245198975021572096
2020-04-01 03:56:52,tylerblack32,,1,2,4,"This is why Texas Governor @GregAbbott_TX and his LT-Governor @LtGovTX will be seen as so short-sighted when it comes to not issuing a statewide stay-at-home order. Not to mention the attempt to take advantage of COVID for their ""perverted obsession"" w/women's health. #COVID19",,@GregAbbott_TX @LtGovTX,#COVID19,1245198419221602304,https://twitter.com/tylerblack32/status/1245198419221602304
2020-04-01 03:56:20,itcjdh,,0,0,0,"Austin Texas Federal Judge ruled abortion an essential service that Covid-19 shelter in place orders can't stop when other elective surgical procedures are. No regard for all life. Projected USA Covid-19 deaths 100k. Projected Abortions 867K in 2020 https://bit.ly/3aKDl3K",,,,1245198286325153792,https://twitter.com/itcjdh/status/1245198286325153792
2020-04-01 03:55:09,TheBackSaver,,0,0,2,"Texas, largest pop. state without mandatory stay at home orders, pop of 30 million, currently has only 40 deaths. Makes sense that stay at home makes NO statistically significant difference because covid, although potentially deadly, is NOT nearly as CONTAGIOUS as the flu.",,,,1245197987904729090,https://twitter.com/TheBackSaver/status/1245197987904729090
2020-04-01 03:55:00,tmotor1641,,0,0,0,"At least 28 Texas spring breakers test positive for COVID-19: https://www.aol.com/article/news/2020/03/31/at-least-28-texas-spring-breakers-test-positive-for-covid-19/23966542/?a_dgi=aolshare_twitter via @AOL",,@AOL,,1245197951443533825,https://twitter.com/tmotor1641/status/1245197951443533825
2020-04-01 03:54:58,tmotor1641,,0,0,0,"At least 28 Texas spring breakers test positive for COVID-19: https://aol.it/39qX7jy via @AOL",,@AOL,,1245197942279081985,https://twitter.com/tmotor1641/status/1245197942279081985
2020-04-01 03:51:26,UNICAESRADIO,,1,0,1,"EN VIVO: Conferencia del Gobernador de Texas sobre los esfuerzos contra el Covid-19 ",,,,1245197051719286784,https://twitter.com/UNICAESRADIO/status/1245197051719286784
2020-04-01 03:49:47,etxleadership,,0,0,0,"Due to the current pandemic spread of COVID-19 virus, we have decided to postpone the 2020 East Texas Leadership Summit for a later date this year. It's up to all of us to slow the spread of the virus. Everyone,… https://www.instagram.com/p/B-bHu3JnEhb/?igshid=crax1vnmukhu",,,,1245196636751564800,https://twitter.com/etxleadership/status/1245196636751564800
2020-04-01 03:47:34,FGC_ElTigre,,3,1,6,"Officially COVID bodies all my plans and my savings I spend for the tournaments Norcal Texas Showdown and Combo Breaker :( dead ",,,,1245196078758141955,https://twitter.com/FGC_ElTigre/status/1245196078758141955
2020-04-01 03:47:31,realLukeKelley,,0,0,0,"Breaking! Texas Governor PROHIBITS Counties &amp; Cities from BANNING Religious Services during COVID-19 | TexasGOPVote. ⁦@GovStitt⁩ we need to protect our 1st amendment rights now! Enough of this! Churches are essential!",,@GovStitt,,1245196065932021761,https://twitter.com/realLukeKelley/status/1245196065932021761
2020-04-01 03:45:52,Joduan,,0,1,0,"That judge's decision to make abortions still available in Texas is whacked. People are dying from covid-19 and they still wanna kill babies!! WE SURE ARE MISSING A LOT OF AMERICANS",,,,1245195649492140032,https://twitter.com/Joduan/status/1245195649492140032
2020-04-01 03:41:40,rgv_weekly,,0,2,1,"INSIDER: @HidalgoCounty Tax Offices have made operational changes due to COVID-19. All county tax offices will rotate availability bi-weekly. Operating hours will be Monday - Friday, 8 a.m. - 4:30 p.m. #RGV #Texas - http://www.facebook.com/2543223395904656/posts/2914287355464923",,@HidalgoCounty,#RGV #Texas,1245194595190878215,https://twitter.com/rgv_weekly/status/1245194595190878215
2020-04-01 03:39:33,mporter_uark,,0,0,0,"Gov. Greg Abbott of Texas has extended COVID-19 protocols into April, and Texas schools will not return until May 4.",,,,1245194059737632770,https://twitter.com/mporter_uark/status/1245194059737632770
2020-04-01 03:39:15,rgv_media_corp,,0,0,0,"INSIDER: @HidalgoCounty Tax Offices have made operational changes due to COVID-19. All county tax offices will rotate availability bi-weekly. Operating hours will be Monday - Friday, 8 a.m. - 4:30 p.m. #RGV #Texas - http://www.facebook.com/202030733171247/posts/3772344179473200",,@HidalgoCounty,#RGV #Texas,1245193987377573888,https://twitter.com/rgv_media_corp/status/1245193987377573888
2020-04-01 03:38:26,Squirrel_MA,,0,0,0,"Texas offers support line to assist with COVID-19 related stress, anxiety ",,,,1245193779826565121,https://twitter.com/Squirrel_MA/status/1245193779826565121
2020-04-01 03:38:23,nikkib25,,0,0,0,"Hidalgo County judge says ‘tsunami is coming’ regarding COVID-19 cases South Texas heed the warnings. #Social_Distancing",,,#Social_Distancing,1245193769923862529,https://twitter.com/nikkib25/status/1245193769923862529
2020-04-01 03:38:23,HealthCareers2,,0,0,0,"Austin TX USA - COVID SWAT Team - Long Term Care - Health care team members needed for assisting sis: Health care team members needed for assisting sister locations across the state of Texas include Nurses Nurse Aides M http://dld.bz/jbkE8",,,,1245193766287413253,https://twitter.com/HealthCareers2/status/1245193766287413253
2020-04-01 03:36:21,IndivisibleNet,,4,4,1,"A federal appeals court has temporarily reinstated the controversial Texas abortion ban inspired by and, as the state argues, justified by the novel Coronavirus (COVID-19) pandemic and response. ",,,,1245193254317903873,https://twitter.com/IndivisibleNet/status/1245193254317903873
2020-04-01 03:34:38,way_liberty,,0,0,0,"'Texas Miracle' ""On Ice For Time Being"" As Crude-Carnage &amp; COVID-Chaos Double-Whammy Strikes Lone-Star State | Zero Hedge https://www.zerohedge.com/commodities/texas-miracle-ice-time-being-crude-carnage-covid-chaos #texas #oil",,,#texas #oil,1245192822212395008,https://twitter.com/way_liberty/status/1245192822212395008
2020-04-01 03:34:32,ThePiedmontCafe,,0,0,1,"Stay informed in EP with this El Paso, Texas COVID-19 Tracker https://elpasocovid19tracker.com/",,,,1245192800653754368,https://twitter.com/ThePiedmontCafe/status/1245192800653754368
2020-04-01 03:32:44,JANETLINDSTROM,,0,0,0,"Breaking! Texas Governor PROHIBITS Counties &amp; Cities from BANNING Religious Services during COVID-19 | TexasGOPVote https://www.texasgopvote.com/family/breaking-texas-governor-prohibits-counties-cities-banning-religious-services-0012476",,,,1245192347895377927,https://twitter.com/JANETLINDSTROM/status/1245192347895377927
2020-04-01 03:32:22,iNoSports_,,0,0,0,"@TampaBayTre &amp; @BenjaminSolak Fan Friday material? If COVID-19 happened during last Nov. With wins over: #9 Texas #7 Florida #9 Auburn #2 Bama But no Heisman awarded, SEC championship, or CFB Playoff. Would Burrow still be the first pick? If not how steep is the fall?",,@TampaBayTre @BenjaminSolak,,1245192252995047424,https://twitter.com/iNoSports_/status/1245192252995047424
2020-04-01 03:32:19,newsy_lover,,0,0,1," Per the @CovidActNow model, Texas will see a &gt;70% infection rate and 583,000 deaths if no action is taken. Hospitals will overload on 4/16. Look up your state and contact your officials before it's too late. Tap https://twitter.com/messages/compose?recipient_id=835740314006511618&amp;text=covidactnow or Text COVID ACT to 50409",,@CovidActNow,,1245192241636876289,https://twitter.com/newsy_lover/status/1245192241636876289
2020-04-01 03:32:15,Natsecuritynews,,1,2,1,"At least 28 Texans test positive for COVID-19 after spring break in Mexico #Mexico #Texas #COVIDー19",,,#Mexico #Texas #COVID,1245192223781609472,https://twitter.com/Natsecuritynews/status/1245192223781609472
2020-04-01 03:32:08,ArielVilchisA,,0,0,0,"Da seguimiento autoridades de Salud de BCS a caso de jóvenes de Texas que dieron positivo a COVID-19 http://rostrosyperfiles.com/2020/03/31/da-seguimiento-autoridades-de-salud-de-bcs-a-caso-de-jovenes-de-texas-que-dieron-positivo-a-covid-19/",,,,1245192194127953920,https://twitter.com/ArielVilchisA/status/1245192194127953920
2020-04-01 03:29:48,marianoruiz_b,,0,0,0,"https://www.animalpolitico.com/2020/03/turistas-cabo-san-lucas-spring-break-covid19/ Grupo de 28 turistas de Texas que vacacionó en Cabo San Lucas dio positivo a COVID-19",,,,1245191606254346243,https://twitter.com/marianoruiz_b/status/1245191606254346243
2020-04-01 03:28:31,lachristygreen,,0,0,0,"The 5th Circuit lets Texas exploit COVID-19 to ban abortions. ",,,,1245191283620052992,https://twitter.com/lachristygreen/status/1245191283620052992
2020-04-01 03:28:01,marypugabeauty,,0,0,0,"Under direct orders from our state governor all salons in Texas must close until April 30th. I just want everyone to do your part in helping not spread this virus Covid-19 so we can all get back to work and live our… https://www.instagram.com/p/B-bFPS5hy_7/?igshid=pv1hx98qw627",,,,1245191158847897600,https://twitter.com/marypugabeauty/status/1245191158847897600
2020-04-01 03:27:48,Myinfo79910026,TXBonnieJean,0,0,1,"Many lifes will be saved in Texas because of Covid-19 The innocents. ",,,,1245191104481374210,https://twitter.com/Myinfo79910026/status/1245191104481374210
2020-04-01 03:27:42,bryanmepstein,,0,0,0,"28 University of Texas spring breakers test positive for COVID-19 - ",,,,1245191080188030979,https://twitter.com/bryanmepstein/status/1245191080188030979
2020-04-01 03:26:28,SamSubramanian,,0,0,1,"Houston Methodist Hospital transfusing donated plasma from a recovered COVID-19 patient to a critically-ill one. The FDA approved the treatment as investigational protocol.https://buff.ly/3dMoyHJ #Houston #Texas #MethodistHospital #stayhome #corona #covid19 #coronavirus",,,#Houston #Texas #MethodistHospital #stayhome #stayhome #corona #covid19 #coronavirus,1245190768437886985,https://twitter.com/SamSubramanian/status/1245190768437886985
2020-04-01 03:24:17,rociojimenez15,,1,3,1,"Un grupo de 28 vacacionistas de EE UU da positivo por Covid-19 tras un viaje a México. Texas pone en cuarentena y bajo observación a decenas de pasajeros de un vuelo privado a Cabo San Lucas. Cuatro de los infectados no presentaban síntomas ",,,,1245190219550339073,https://twitter.com/rociojimenez15/status/1245190219550339073
2020-04-01 03:23:14,YuliyaSummers,,0,0,1,"Schools in Texas have been closed since March 16 to combat the COVID-19. Teachers will continue to provide online instruction through at least May 1.",,,,1245189956928253953,https://twitter.com/YuliyaSummers/status/1245189956928253953
2020-04-01 03:21:28,94HJY,,0,1,2,"28 Spring Breakers From Texas Test Positive For COVID-19 After Mexico Trip ",,,,1245189510629122048,https://twitter.com/94HJY/status/1245189510629122048
2020-04-01 03:21:12,PEK40,,0,0,1,"PaigePotPie ChitChat https://youtu.be/vEfLUkpYwL8 Hey, I was just feeling like talking. @commonspirit @CHIStJoseph @CHI_Updates @chisaintjoseph @CHIStLukesNews @CHIStLukesJobs @DignityHealth @DJMorissette #livestreaming #COVID #WashToCare #Texas #GreatAwakening #TrumpPressConf",,@commonspirit @CHIStJoseph @CHI_Updates @chisaintjoseph @CHIStLukesJobs @DignityHealth @DJMorissette,#livestreaming #COVID #WashToCare #Texas #GreatAwakening #TrumpPressConf,1245189442274549761,https://twitter.com/PEK40/status/1245189442274549761
2020-04-01 03:20:49,UtopiaSeeker,,0,0,0,"‘Perfectly healthy’ Texas dad with coronavirus dies from COVID-19, family says http://a.msn.com/05/en-us/BB11NKVJ?ocid=st",,,,1245189345629196290,https://twitter.com/UtopiaSeeker/status/1245189345629196290
2020-04-01 03:20:00,jmgabriel02,,0,0,0,"https://photos.app.goo.gl/8vBNZt81L1KswVfZ7 Lubbock, Texas during COVID-19.",,,,1245189142826409984,https://twitter.com/jmgabriel02/status/1245189142826409984
2020-04-01 03:19:56,PrisGalstaun,,1,0,0,"[The Van Zandt Regional Medical Center in Grand Saline shut its doors in August, leaving a county of more than 55,000 people with no hospital at all. Just 70 miles from Dallas, Van Zandt is one of many rural Texas counties now facing the COVID-19 crisis ",,,,1245189123222253569,https://twitter.com/PrisGalstaun/status/1245189123222253569
2020-04-01 03:19:34,JazzyCoCoBelle,,0,0,0,"When you live like the world is yours.... 28 University of Texas spring breakers test positive for COVID-19 after group trip to Mexico https://www.nbcnews.com/news/us-news/least-28-texas-spring-breakers-test-positive-covid-19-after-n1173231 via @nbcnews",,@NBCNews,,1245189031375319040,https://twitter.com/JazzyCoCoBelle/status/1245189031375319040
2020-04-01 03:17:57,RJKelley1,,0,0,0,"833-986-1919 Texas CoViD-19 Mental Health Support Line ",,,,1245188624074801153,https://twitter.com/RJKelley1/status/1245188624074801153
2020-04-01 03:17:34,OneOfMa35917389,SidneyPowell1,19,50,149,"Everyone please pray for John Prine. Only the greatest singer/ songwriter ever in the history of Texas abd the world. Covid's put him in intensive care. He and his wife, Fiona have both contracted it and he is not looking good. #PrayForJohnPrine #FindTheCure",,,#PrayForJohnPrine #FindTheCure,1245188529300418561,https://twitter.com/OneOfMa35917389/status/1245188529300418561
2020-04-01 03:15:10,goqivana,,0,0,1,"Breaking! Texas Governor PROHIBITS Counties &amp; Cities from BANNING Religious Services during COVID-19 | TexasGOPVote https://www.texasgopvote.com/family/breaking-texas-governor-prohibits-counties-cities-banning-religious-services-0012476",,,,1245187926218039296,https://twitter.com/goqivana/status/1245187926218039296
2020-04-01 03:13:57,StephenGlahn,,2,16,15,"Beware of UT Greeks bearing gifts. 28 University of Texas spring breakers test positive for COVID-19 after group trip to Mexico https://www.nbcnews.com/news/us-news/least-28-texas-spring-breakers-test-positive-covid-19-after-n1173231 via @nbcnews",,@NBCNews,,1245187620633817090,https://twitter.com/StephenGlahn/status/1245187620633817090
2020-04-01 03:13:00,TaraLOGrady,GovSisolak,0,0,0,"FDA approved less cost Here's a solution to your ventilator shortage Texas business flooded with orders for helmet ventilators amid coronavirus crisis Sea-Long Medical Systems offers alternatives in treating COVID-19 patients amid a ventilator shortage. ",,,,1245187380413267973,https://twitter.com/TaraLOGrady/status/1245187380413267973
2020-04-01 03:12:54,Fengxian,,0,2,2,"Recent earthquakes in the USA — Utah, Texas, Idaho plus COVID? 2020 said imma end all you hoes ",,,,1245187355134308354,https://twitter.com/Fengxian/status/1245187355134308354
2020-04-01 03:12:51,inforadiomx,,0,1,1,"Llama Gobernador de Tamaulipas @fgcabezadevaca a implementar medidas en la frontera ante COVID- 19 http://inforadio-test.com/DetallesNota?Nota=Llama-Gobernador-de-Tamaulipas-a-implementar-medidas-en-la-frontera- #NuevoLAredo @ERivas72 #Matamoros #Reynosa @MakiOrtizD #MiguelAleman #Tamaulipas #Texas ",,@fgcabezadevaca @ERivas72 @MakiOrtizD,#NuevoLAredo #Matamoros #Reynosa #MiguelAleman #Tamaulipas #Texas,1245187343608406017,https://twitter.com/inforadiomx/status/1245187343608406017
2020-04-01 03:12:21,dmraci,techreview,0,0,0,"The great genius, Dr. Trump, don’t sweat the details. https://politico.com/news/2020/03/31/pence-task-force-coronavirus-aid-157806?cid=apn… #CoronavirusNewYork #COVIDー19 #COVID #ohiocoronavirus #Ohio #Texas #Floridacoronavirus",,,#CoronavirusNewYork #COVID #COVID #ohiocoronavirus #Ohio #Texas #Floridacoronavirus,1245187216550301697,https://twitter.com/dmraci/status/1245187216550301697
2020-04-01 03:12:06,dmraci,business,0,0,0,"The great genius, Dr. Trump, don’t sweat the details. https://politico.com/news/2020/03/31/pence-task-force-coronavirus-aid-157806?cid=apn… #CoronavirusNewYork #COVIDー19 #COVID #ohiocoronavirus #Ohio #Texas #Floridacoronavirus",,,#CoronavirusNewYork #COVID #COVID #ohiocoronavirus #Ohio #Texas #Floridacoronavirus,1245187153501605890,https://twitter.com/dmraci/status/1245187153501605890
