date,username,to,replies,retweets,favorites,text,geo,mentions,hashtags,id,permalink
2020-04-09 19:05:06,SpicysFiles,nytimes,1,3,3,"A lot of these rural counties are understaffed & do not have equipment needed to REALLY care for COVID 19 patients. You can thank @GovKemp @GovRonDeSantis &amp; Governors in #Arkansas #Kansas #Alabama #Texas #Mississippi for NOT doing what is best for their citizens. #SlowTheSpread",,@GovKemp @GovRonDeSantis,#Arkansas #Kansas #Alabama #Texas #Mississippi #SlowTheSpread,1248326084895993856,https://twitter.com/SpicysFiles/status/1248326084895993856
2020-04-09 19:04:51,TexasGOP,,2,3,10,"Watch TX RNC National Committeeman, Dr. Robin Armstrong on ABC’s “Inside Edition today @3:30pm CT & then with Shannon Bream tonight on her national news show “FOX News @Night” tonight @10 pm CT as he discusses how he’s leading in Texas with healthcare solutions to COVID-19! ",,,,1248326023764213760,https://twitter.com/TexasGOP/status/1248326023764213760
2020-04-09 19:04:14,PopMaticsProf,evanasmith,0,0,0,"I learned Ch 81 (#Texas Health &amp; Safety Code) doesn’t apply to those who chose to purposefully ignore quarantine orders from an ER doc as long as they’re traveling w/ a virus symptomatic of #COVID to a small #TX town 5 hours away @GregAbbott_TX @SupremeCourt_TX @TXlege @TxCourts",,@GregAbbott_TX @SupremeCourt_TX @TXlege @TxCourts,#Texas #COVID #TX,1248325868130390016,https://twitter.com/PopMaticsProf/status/1248325868130390016
2020-04-09 19:04:06,WfordDemo,,0,1,1,"Parker County is up to nine positive COVID-10 cases, according to the latest count from the Texas Health and Human Services. ",,,,1248325837100851200,https://twitter.com/WfordDemo/status/1248325837100851200
2020-04-09 19:02:16,BaylorBears2008,,1,0,0,"@MassageEnvy I’m a client of the Colleyville,Texas location. Please advise if they’re going to stop charging membership dues because of #Covid_19 #shutdown.",,@MassageEnvy,#Covid_19 #shutdown,1248325372242022400,https://twitter.com/BaylorBears2008/status/1248325372242022400
2020-04-09 19:01:07,nandi_naira,,0,2,1,"We are not positioned equally to weather this storm. And we are not all in the same boat. That's a lie! Ozlem Altiok on what she's learnt from her students in rural Texas https://www.opendemocracy.net/en/5050/how-my-north-texas-students-taught-me-were-all-in-the-same-boat-is-a-lie/ @5050oD @openDemocracy #COVID",,@5050oD @openDemocracy,#COVID,1248325085695545345,https://twitter.com/nandi_naira/status/1248325085695545345
2020-04-09 19:00:40,kellyhutchCRE,,0,0,0,"Texas City, La Marque offer grants to COVID-affected businesses https://www.galvnews.com/news/free/article_c901941f-0845-5f21-9523-94127491c8c6.html?utm_medium=social&amp;utm_source=twitter&amp;utm_campaign=user-share via @GalvNews",,@GalvNews,,1248324971245588481,https://twitter.com/kellyhutchCRE/status/1248324971245588481
2020-04-09 19:00:12,crauch,,1,0,4,"Oldest child is going to college! I know COVID-19 has really trampled on the class of 2020, but Grace has persisted, and after mulling over some fantastic offers from some fantastic schools, Grace picked her #1 hope, the University of Texas! #hookem https://instagr.am/p/B-xVP52hkfJSeS476KMDjdZ485JPzcCLe1XfE80/",,,#hookem,1248324853603667972,https://twitter.com/crauch/status/1248324853603667972
2020-04-09 19:00:04,12NewsNow,,0,3,3,"Bread, eggs and meat might be hard to find at the grocery stores, but these local restaurants have you covered! Here’s a list of Southeast Texas restaurants now selling grocery items amid the COVID-19 pandemic. ",,,,1248324821705990147,https://twitter.com/12NewsNow/status/1248324821705990147
2020-04-09 18:58:55,ESMcIntyre,,0,6,0,"As of today, 32 people in ICE custody had FORMALLY tested positive for COVID-19, ICE self-reported. That #jumped by 13 cases in one day. Eleven staffers at facilities in Colorado, Louisiana, New Jersey, Ohio and Texas have been diagnosed with the virus. ",,,,1248324530377900032,https://twitter.com/ESMcIntyre/status/1248324530377900032
2020-04-09 18:57:21,chrisduehring,,0,0,0,"#stopkillingtheeconomy #covid #covid_19 #overhypedbullshit #EnufAlready #wherearethegrownups @realdonaldtrump @realjameswoods @Dallas, Texas https://www.instagram.com/p/B-xV9FylcPhiR6OSzUdOQ3nSVDXhjefgzB9uok0/?igshid=15yjjffnipgnx",,@realDonaldTrump @RealJamesWoods,#stopkillingtheeconomy #covid #covid_19 #overhypedbullshit #EnufAlready #wherearethegrownups,1248324136730071045,https://twitter.com/chrisduehring/status/1248324136730071045
2020-04-09 18:56:53,thefactsnews,,0,5,3,"Three Rosharon units are on a list of locked down Texas prisons because of confirmed COVID-19 cases. ",,,,1248324017012060161,https://twitter.com/thefactsnews/status/1248324017012060161
2020-04-09 18:55:43,bratecchouston,,0,0,0,"NEWS | Rice establishes COVID-19 research fund, offers nearby hospitals housing on campus for health care workers Via @RiceUniversity -April 6, 2020 Read more: https://bit.ly/3b0hxBm #BRATECC #Coronavirus #COVID19 #Rice #University #Funds #Healthcare #Research #Houston #Texas",,@RiceUniversity,#BRATECC #Coronavirus #COVID19 #Rice #University #Funds #Healthcare #Research #Houston #Texas,1248323726380335114,https://twitter.com/bratecchouston/status/1248323726380335114
2020-04-09 18:54:17,cnare,,0,0,1,"Old White men blame women that they are more at risk of death from Covid-19, so they put women at risk as payback. Whaaaat?! Texas blames abortion for virus but it’s the state that has put millions at risk https://interc.pt/2Rngbc8 by @chronic_jordan",,@chronic_jordan,,1248323365946916874,https://twitter.com/cnare/status/1248323365946916874
2020-04-09 18:52:49,RestaurantNews1,,0,1,1,"Dallas-Based Bottoms Up Cocktails Offering Ready-to-Go Cocktail Solution to #Texas Restaurants during COVID-19 Stay-At-Home Order #RestaurantNews https://bit.ly/2yNNn6k",,,#Texas #RestaurantNews,1248322995803865088,https://twitter.com/RestaurantNews1/status/1248322995803865088
2020-04-09 18:52:11,crizm01,kinsellawarren,0,0,0,"Donating for trials is evil?!? 1M doses to Texas + “The company has previously said it donated 2 million tablets to New York, and in Detroit, Henry Ford Health System announced it would lead a 3,000-person U.S. study to determine the effectiveness of the drug against COVID-19.”",,,,1248322835660996608,https://twitter.com/crizm01/status/1248322835660996608
2020-04-09 18:51:54,CarePharmacies,,0,1,3,"The Liu group at Texas A&amp;M University, led by chemist Wenshe Ray Liu, PhD, identified the antiviral drug remdesivir as a viable treatment for coronavirus disease 2019 (COVID-19) in January. Click below to learn more. ",,,,1248322764148260868,https://twitter.com/CarePharmacies/status/1248322764148260868
2020-04-09 18:49:04,JASaxton1,,0,0,0,"Police arrest Texas teen accused of threatening to spread COVID-19 https://abc7.com/police-arrest-teen-accused-of-threatening-to-spread-covid-19/6084853/ via @abc7",,@ABC7,,1248322051477291008,https://twitter.com/JASaxton1/status/1248322051477291008
2020-04-09 18:48:32,SanAntonioSucks,COSAGOV,0,0,0,"Funny how @COSAGOV doesn't follow its own rules in its BS council meeting today. #SanAntonio #Texas #COVID #Coronavirus",,@COSAGOV,#SanAntonio #Texas #COVID #Coronavirus,1248321917150429184,https://twitter.com/SanAntonioSucks/status/1248321917150429184
2020-04-09 18:47:45,piratecounsel,,0,1,2,"Texas launches a free, 24/7 mental health support line for COVID-19 concerns. ",,,,1248321719519137792,https://twitter.com/piratecounsel/status/1248321719519137792
2020-04-09 18:46:22,KMarkRealtor,,0,0,0,"It’s Thursday in case anyone was wondering #whatdayisit #covid #shelterinplace #kmarkrealtor #era #workweek #staysafe @Oak Point, Texas https://www.instagram.com/p/B-xUssKnGDu/?igshid=ui8fx9fl3pz7",,,#whatdayisit #covid #shelterinplace #kmarkrealtor #era #workweek #staysafe,1248321373052841989,https://twitter.com/KMarkRealtor/status/1248321373052841989
2020-04-09 18:43:25,TMAC_org,,0,0,0,"Texas Manufacturers, tell us about the effects of COVID-19 on your business and how we can help by taking this quick 3-question survey. We are here to connect business with each other during critical medial supplies manufacturing. Contact us today. https://www.surveymonkey.com/r/TMAC_COVID19_Survey",,,,1248320628647759874,https://twitter.com/TMAC_org/status/1248320628647759874
2020-04-09 18:41:39,KSadyLady,samstein,0,1,2,"Look into Texas COVID numbers, A LOT of people are getting false negatives in their tests.",,,,1248320185687302147,https://twitter.com/KSadyLady/status/1248320185687302147
2020-04-09 18:40:45,UNTPride,,0,3,2,"BTAC Texas is now accepting applications online for the Black Trans COVID-19 Community Response Grant Program. Trans individuals impacted by the corona virus in the United States are eligible to apply for a one time Micro Grant of $125. Apply or donate! https://blacktrans.org/covid19-grant-application/",,,,1248319957554823169,https://twitter.com/UNTPride/status/1248319957554823169
2020-04-09 18:38:32,hobsknob,,0,0,0,"BTAC Texas is now accepting applications online for the Black Trans COVID-19 Community Response Grant Program. Trans individuals impacted by the corona virus in the United States are eligible to apply for a one time Micro Grant of $125. Apply or donate! https://blacktrans.org/covid19-grant-application/",,,,1248319400559640576,https://twitter.com/hobsknob/status/1248319400559640576
2020-04-09 18:35:24,Dbrook2013,,2,0,7,"Bitch you have rode every hard dick in east Texas, and you are worried about covid-19 all that meth you put up your nose, your good sis I promise ",,,,1248318612454211589,https://twitter.com/Dbrook2013/status/1248318612454211589
2020-04-09 18:34:46,ElPitazoTV,,0,3,1,"#Migración | ¿Te enteraste? #EEUU liberó a los 23 venezolanos que permanecían detenidos en el centro de Joe Corley Transitional Center, en Texas, ante el riesgo de contagio por #COVID_19 #9abr",,,#Migraci #EEUU #COVID_19 #9abr,1248318454790270982,https://twitter.com/ElPitazoTV/status/1248318454790270982
2020-04-09 18:34:18,Dian_Farmer_,,0,1,4,"North Texas Ford Dealers thank healthcare workers at Baylor Scott &amp; White hospitals treating COVID-19 patients in North Texas as a small way to say thanks! Thanks to our partners @RaisingCanes @Raising_Canes and @Favor @BSWhealth #Plano @ntxford #ford #FordTX #BuiltToLendAHand",,@RaisingCanes @Raising_Canes @Favor @bswhealth @ntxford,#Plano #ford #FordTX #BuiltToLendAHand,1248318335533621248,https://twitter.com/Dian_Farmer_/status/1248318335533621248
2020-04-09 18:32:23,_CJGonzalez_,,0,0,0,"Current COVID-19 cases in Texas. A 877 cases increase from yesterday. 10,230 total cases confirmed today. ",,,,1248317853167730691,https://twitter.com/_CJGonzalez_/status/1248317853167730691
2020-04-09 18:32:23,Dian_Farmer_,,0,1,2,"North Texas Ford delivered 542 meals to Baylor Scott &amp; White hospitals treating COVID-19 patients as a small way to say thank you to healthcare workers on the front lines! Thanks to our partners @Whataburger and @Favor @BSWhealth #Irving @ntxford #ford #FordTX #BuiltToLendAHand",,@Whataburger @Favor @bswhealth @ntxford,#Irving #ford #FordTX #BuiltToLendAHand,1248317851460669440,https://twitter.com/Dian_Farmer_/status/1248317851460669440
2020-04-09 18:30:46,tiosam_com,,0,0,0,"Jovem do Texas afirma nas redes sociais que está com COVID-19 e vai transmitir para todos: Lorraine Maradiaga em foto divulgada pela polícia de Carrollton . Policiais em... - #TioSam",,,#TioSam,1248317446248902658,https://twitter.com/tiosam_com/status/1248317446248902658
2020-04-09 18:30:35,oscarleirbag,,0,0,2,"les presento a mi hermano Dr. Sergio Preciado Campos #Pedriata trabajando pese a la contingencia del COVID-19 en McAllen Texas.... pero sobre todo con buena actitud y coraje..... #AndTheForceBeWithYouAlways ",,,#Pedriata #AndTheForceBeWithYouAlways,1248317398769438720,https://twitter.com/oscarleirbag/status/1248317398769438720
2020-04-09 18:30:01,KETK,,0,0,0,"#BORDERREPORT: $4.8M going to South Texas clinics to help with COVID-19. ",,,#BORDERREPORT,1248317256532217863,https://twitter.com/KETK/status/1248317256532217863
2020-04-09 18:30:01,Newschannel6Now,,0,0,0,"A 72-year-old is first Texas state inmate reported to be a possible COVID-19 fatality during the new coronavirus pandemic. ",,,,1248317256477609985,https://twitter.com/Newschannel6Now/status/1248317256477609985
2020-04-09 18:25:16,brentbooze,chuckwoolery,0,0,0,"Is this a BOT account? I can’t chuck, what world are you living in? People are dying by the hundreds throughout the country every day, and it’s a hoax? Please walk into a NY emergency room and then say that. I am from Texas. Don’t let your tone spread like Covid.",,,,1248316064221368322,https://twitter.com/brentbooze/status/1248316064221368322
2020-04-09 18:21:20,pzapata85,,0,0,0,"Have you wondered if... Coronavirus In Texas: Does Heat, Humidity Kill COVID-19? https://www.newsbreakapp.com/n/0OhQwgno?pd=02bocl5y&amp;s=i2",,,,1248315074210643970,https://twitter.com/pzapata85/status/1248315074210643970
2020-04-09 18:16:38,IsobellaJade,MJSchulman,0,0,0,"Being in Texas now, I miss NYC all the time, but I miss it even more during COVID-19. I was there for 9/11, the black out, hurricane Sandy, 36 blizzards, okay 30. This piece is my afternoon read during lunch today. ",,,,1248313889084903425,https://twitter.com/IsobellaJade/status/1248313889084903425
2020-04-09 18:15:00,kwtx,,0,1,2,"Sixth COVID-19 death reported in Central Texas. ",,,,1248313478672273413,https://twitter.com/kwtx/status/1248313478672273413
2020-04-09 18:12:04,HarlingenEDC,,0,0,1,"The Texas Workforce Commission (TWC) is working with federal, state and local government officials and agencies to help manage the Coronavirus (COVID-19) pandemic. Here are resources for employers: https://bit.ly/34tdETi",,,,1248312738969014274,https://twitter.com/HarlingenEDC/status/1248312738969014274
2020-04-09 18:11:32,SourcePublicity,,0,0,1,"Quarantine makes marketing your business more difficult than it's ever been--so quit! Talk with us to see how we can get into the PR while you get into those PJ's! . . . . . #marketing #business #dallas #texas #corona #covid #quarantine #public #relations #social #media #pr",,,#marketing #business #dallas #texas #corona #covid #quarantine #public #relations #social #media #pr,1248312606806466562,https://twitter.com/SourcePublicity/status/1248312606806466562
2020-04-09 18:10:54,TheMattBeebe,TheMattBeebe,0,0,0,"""My Grandpa's doctor checked with me & my sister before they changed his blood pressure meds, so obviously if Dr Armstrong didn't consult w/ the families in advance, he's Dr Mengele"" this is what people are pushing in Texas against a Doctor treating COVID patients. Because Trump. ",,,,1248312448609894401,https://twitter.com/TheMattBeebe/status/1248312448609894401
2020-04-09 18:10:09,EASTCounseling,,0,1,2,"Texas Health &amp; Human Services has implemented a free mental health support line. If you or someone you know is feeling overwhelmed by the COVID-19 pandemic, help is available. Call the toll-free COVID-19 Mental Health Support Line @833-986-1919. ",,,,1248312259186737153,https://twitter.com/EASTCounseling/status/1248312259186737153
2020-04-09 18:08:05,FeedDallas,,0,0,0,"CBS Dallas: Coronavirus In Texas: Fort Worth Televangelist Kenneth Copeland Calls Out COVID-19, ‘You Are Destroyed Forever’ https://ift.tt/2yOgdDD #dallas",,,#dallas,1248311738765901824,https://twitter.com/FeedDallas/status/1248311738765901824
2020-04-09 18:04:49,1200WOAI,,0,7,4,"Texas health officials are now reporting more than 10,000 confirmed coronavirus cases in the state, with 199 deaths. COVID-19 is now being reported in 170 of the state's 254 counties. ",,,,1248310914539012097,https://twitter.com/1200WOAI/status/1248310914539012097
2020-04-09 18:04:06,elpasotimes,,1,0,2,"A look inside Texas churches during COVID-19 ",,,,1248310735777693702,https://twitter.com/elpasotimes/status/1248310735777693702
2020-04-09 18:02:28,dallasnews,,0,4,3,"Information is the first line of defense. Stay informed on the latest COVID-19 news and how it affects North Texas and beyond. Sign up to receive these alerts directly to your inbox: https://buff.ly/2XpoNTJ",,,,1248310324308127746,https://twitter.com/dallasnews/status/1248310324308127746
2020-04-09 18:01:08,NeptuneFlood,,0,0,3,"In an effort to slow the spread of COVID-19 and facilitate secure payments, we ask that premium payments be made via ACH/e-check or credit card. If a paper check is the only option for you, please mail the check to the Dallas, Texas address listed within your policy packet. ",,,,1248309989183238145,https://twitter.com/NeptuneFlood/status/1248309989183238145
2020-04-09 18:01:02,_jacob_sanchez,,1,1,1,"Dr. Ahmad is about to speak about AdventHealth Central Texas’ state of readiness. “We obviously have COVID-19 in our backyard,” he said.",,,,1248309963992301569,https://twitter.com/_jacob_sanchez/status/1248309963992301569
2020-04-09 18:00:04,SpecNewsATX,,0,0,0,"Over the last month, nearly 6,000 Texans have contacted the Texas Attorney General’s Consumer Protection division with complaints of price gouging related to the COVID-19 crisis. ",,,,1248309721133613058,https://twitter.com/SpecNewsATX/status/1248309721133613058
2020-04-09 17:59:22,Teenlivesmatte2,,0,0,0,"Coronavirus In Texas: Does Heat, Humidity Kill COVID-19? https://www.newsbreakapp.com/n/0OhQwgno?s=a2&amp;pd=03OT9nKl",,,,1248309543714598914,https://twitter.com/Teenlivesmatte2/status/1248309543714598914
2020-04-09 17:59:18,TeenLif14910208,,0,0,0,"Coronavirus In Texas: Does Heat, Humidity Kill COVID-19? https://www.newsbreakapp.com/n/0OhQwgno?s=a2&amp;pd=03OT9nKl",,,,1248309527403008001,https://twitter.com/TeenLif14910208/status/1248309527403008001
2020-04-09 17:59:17,jeremybmazur,,0,0,2,"The Railroad Commission of Texas continues its work to protect public health and safety and the environment throughout the COVID-19 pandemic. April's RRC Energy Minute includes several updates on how we are working with oil and gas, pipeline, and alterna…",,,,1248309522445279232,https://twitter.com/jeremybmazur/status/1248309522445279232
2020-04-09 17:59:14,worldhabbits,,0,0,0,"Coronavirus In Texas: Does Heat, Humidity Kill COVID-19? https://www.newsbreakapp.com/n/0OhQwgno?s=a2&amp;pd=03OT9nKl",,,,1248309510290186240,https://twitter.com/worldhabbits/status/1248309510290186240
2020-04-09 17:59:09,ProtectPay,,0,0,0,"Coronavirus In Texas: Does Heat, Humidity Kill COVID-19? https://www.newsbreakapp.com/n/0OhQwgno?s=a2&amp;pd=03OT9nKl",,,,1248309489532575744,https://twitter.com/ProtectPay/status/1248309489532575744
2020-04-09 17:59:05,getupradio,,0,0,0,"Coronavirus In Texas: Does Heat, Humidity Kill COVID-19? https://www.newsbreakapp.com/n/0OhQwgno?s=a2&amp;pd=03OT9nKl",,,,1248309471182495749,https://twitter.com/getupradio/status/1248309471182495749
2020-04-09 17:58:32,trstdtravlr,,0,0,0,"in the air Texas DPS begins COVID-19 checkpoints at Louisiana border",,,,1248309334825721856,https://twitter.com/trstdtravlr/status/1248309334825721856
2020-04-09 17:58:08,previtera1892,,0,0,0,"Appeals court gives Texas green light on banning abortion as nonessential during COVID-19 fight ",,,,1248309235290648576,https://twitter.com/previtera1892/status/1248309235290648576
2020-04-09 17:55:29,NewBlackMan,,0,5,2,"'A vaccine for the novel coronavirus is likely at least a year away, but the state’s large anti-vaccine community is ready to resist it.' Texas Anti-Vaxxers Fear Mandatory COVID-19 Vaccines More Than the Virus Itself https://www.texasmonthly.com/news/texas-anti-vaxxers-fear-mandatory-coronavirus-vaccines/ via @TexasMonthly",,@TexasMonthly,,1248308566332772355,https://twitter.com/NewBlackMan/status/1248308566332772355
2020-04-09 17:54:42,Commit2Dallas,,0,5,8,"Are you a licensed childcare professional who is out of work as a result of Covid-19? The State of Texas &amp; @CareDotCom are working to help frontline parents find in-home care for their children. Sign-up today: https://www.care.com/vis/covid19MunicipalProviderPage?facility=TEXAS",,@CareDotCom,,1248308371075235840,https://twitter.com/Commit2Dallas/status/1248308371075235840
2020-04-09 17:51:35,Truthers4USA,TheSheepSayBaa,0,0,0,"Texas Hospital Child Abuse Cases Rise in COVID-19 Outbreak ",,,,1248307585326997506,https://twitter.com/Truthers4USA/status/1248307585326997506
2020-04-09 17:48:17,Alex_Lara10,,0,0,8,"I’m proud to announce that I have just received an email stating that I am now officially a State Delegate and will participate in the Texas State Democratic Convention. Huge shame the COVID-19 pandemic has caused it to become completely online, but I’m sure it will still be fun!",,,,1248306755114684416,https://twitter.com/Alex_Lara10/status/1248306755114684416
2020-04-09 17:46:24,juliemeasure,,0,3,2,".@ntxford dealers deliver 542 meals to @BSWhealth hospitals treating COVID-19 patients in North Texas as a small way to say thank you to healthcare workers on the front lines! Thanks to our partners @Whataburger and @Favor #Irving @ntxford #ford #FordTX #BuiltToLendAHand",,@ntxford @bswhealth @Whataburger @Favor @ntxford,#Irving #ford #FordTX #BuiltToLendAHand,1248306279313018880,https://twitter.com/juliemeasure/status/1248306279313018880
2020-04-09 17:45:46,jsr72748,,0,0,0,"Stop Undermining Texans' Safety We're asking Governor Abbott to rescind his recent executive order to prevent an outbreak of the COVID-19 coronavirus in Texas carceral facilities. ",,,,1248306123142246400,https://twitter.com/jsr72748/status/1248306123142246400
2020-04-09 17:45:14,txbiz,,0,1,1,"Governor Abbott recently announced that the State of Texas is seeking supplies of PPE and other resources to aid Texas’ response to COVID-19. If you have products and equipment available for donation or procurement, please visit: https://texas.gov/covid19",,,,1248305986303070208,https://twitter.com/txbiz/status/1248305986303070208
2020-04-09 17:45:07,TexasDeptofAg,,0,0,0,"An 18-year-old Texas woman is charged with making terroristic threats after she posted on social media that she tested positive for COVID-19 and was ""willfully spreading it"" #FightAganistCOVID19",,,#FightAganistCOVID19,1248305956771020800,https://twitter.com/TexasDeptofAg/status/1248305956771020800
2020-04-09 17:43:53,SimienProp,,0,0,0,"Harris County Does Not Need to Become the Epicenter of the COVID-19 Pandemic in Texas http://www.houstonpress.com/news/harris-county-judge-urges-residents-to-stay-home-over-easter-weekend-11464086 via @houstonnews_",,@houstonnews_,,1248305646333759488,https://twitter.com/SimienProp/status/1248305646333759488
2020-04-09 17:43:27,texanajan,,0,0,0,"@MSNBC Look at Dallas County Judge Clay Jenkins and his proactive response to covid-19 in North Texas",,@MSNBC,,1248305539479736323,https://twitter.com/texanajan/status/1248305539479736323
2020-04-09 17:43:05,NNBNewsLocal,,0,0,1,"JUST IN: COVID-19 related patients already account for 25% of ICU beds in the Texas Medical Center and between 80-90% of those in ICU require a ventilator.",,,,1248305444822700033,https://twitter.com/NNBNewsLocal/status/1248305444822700033
2020-04-09 17:42:50,TexasNonCompete,,0,0,0,"COVID-19 Texas Employer Guide – CDC Recommends Safety Measures for Critical Infrastructure Employees Exposed to COVID-19 http://northtexaslegalnews.com/2020/04/09/covid-19-texas-employer-guide-cdc-recommends-safety-measures-for-critical-infrastructure-employees-exposed-to-covid-19/",,,,1248305382251999232,https://twitter.com/TexasNonCompete/status/1248305382251999232
2020-04-09 17:42:12,texanajan,,0,0,0,"@JoeBiden Look at Dallas County Judge Clay Jenkins and his proactive response to covid-19 in North Texas",,@JoeBiden,,1248305225162768387,https://twitter.com/texanajan/status/1248305225162768387
2020-04-09 17:42:07,DiDi2009,,1,0,0,"Texas in the “Top” 10 of COVID cases, in spite of dearth of testing ",,,,1248305202152824833,https://twitter.com/DiDi2009/status/1248305202152824833
2020-04-09 17:42:00,cbs11jack,,0,1,2,"#NEW #Texas DSHS: Positive cases of Covid-19 statewide rose by 877 from 9353 to 10,230 in 170/254 counties. Number of deaths rose by 22 to 199. Total ppl tested rose by 9,876 from 96,258 to 106,134. 1,101 ppl statewide recovered from virus. 1,439 now treated in hospital. @CBSDFW",,@CBSDFW,#NEW #Texas,1248305175456108546,https://twitter.com/cbs11jack/status/1248305175456108546
2020-04-09 17:41:46,tobonpaola,,0,0,0,"#covid19 #CoronavirusPandemic #COVIDー19 In Texas: Does Heat, Humidity Kill COVID-19? https://www.newsbreakapp.com/n/0OhQwgno?s=a2&amp;pd=04K4Pp5T",,,#covid19 #CoronavirusPandemic #COVID,1248305116941254657,https://twitter.com/tobonpaola/status/1248305116941254657
2020-04-09 17:41:30,texanajan,,0,0,0,"@Lawrence Look at Dallas County Judge Clay Jenkins and his proactive response to covid-19 in North Texas",,@Lawrence,,1248305046539980800,https://twitter.com/texanajan/status/1248305046539980800
2020-04-09 17:41:22,EnergyDeborah,,0,0,0,"Hey @JohnCornyn @GovAbbott Texas hospitals test for coronavirus with veterinary supplies repurposed by Texas A&amp;M https://www.star-telegram.com/news/coronavirus/article241880041.html #COVIDー19 #COVID #TexansHelpingTexans",,@JohnCornyn @GovAbbott,#COVID #COVID #TexansHelpingTexans,1248305016538050563,https://twitter.com/EnergyDeborah/status/1248305016538050563
2020-04-09 17:40:34,HenryJo51615828,,0,0,0,"Coronavirus In Texas: Does Heat, Humidity Kill COVID-19? https://www.newsbreakapp.com/n/0OhQwgno?s=a2&amp;pd=01AEWC8v",,,,1248304811218370561,https://twitter.com/HenryJo51615828/status/1248304811218370561
2020-04-09 17:40:29,rozharlem45,,0,0,0," COVID-19 is spreading in nursing homes. Texas won't share details. ",,,,1248304793665314818,https://twitter.com/rozharlem45/status/1248304793665314818
2020-04-09 17:40:07,Katj512,,0,0,0,"Texas county judge said he was on conf calls in JANUARY for COVID-19. Yt they did nothing. ",,,,1248304701675900930,https://twitter.com/Katj512/status/1248304701675900930
