date,username,to,replies,retweets,favorites,text,geo,mentions,hashtags,id,permalink
2020-04-01 23:59:53,TheShaqsfeet,,2,0,1,"These stupid mother fuckers that live in this city are out driving, walking, shopping, doing laundry at the laundry mat, standing in line at baskin Robbins... like nothing’s wrong. Where I live has the highest covid cases in Texas. Morons",,,,1245501169889349633,https://twitter.com/TheShaqsfeet/status/1245501169889349633
2020-04-01 23:59:34,TexasBingoPlex,,0,0,0,"Texas Bingo COVID-19 Re-Opening Update - ",,,,1245501090411548676,https://twitter.com/TexasBingoPlex/status/1245501090411548676
2020-04-01 23:56:41,USAjobs4all,,0,0,0,"Funeral Director or Embalmer urgently hiring during COVID-19-Quinlan -Dual license is a plus and could offer more pay. This position requires a licensed Funeral Director in the state of Texas. - https://tinyurl.com/st82uvu",,,,1245500361965740035,https://twitter.com/USAjobs4all/status/1245500361965740035
2020-04-01 23:55:57,BillWadell,,15,12,9,"We're seeing lots of people out in the sun at Town Lake Metro Park in Austin, Texas. #COVIDー19 #COVID @accuweather",,@accuweather,#COVID #COVID,1245500176766205952,https://twitter.com/BillWadell/status/1245500176766205952
2020-04-01 23:54:30,MiradoraLa,Texas_Rose52,0,0,0,"Trump has been bashing China as a cheater, a thief and a liar for 3 years. Are we really supposed to believe that the Trump administration relied on China as its sole source for info on COVID and that they were “duped” because China underreported cases ? #bullshit",,,#bullshit,1245499812646191106,https://twitter.com/MiradoraLa/status/1245499812646191106
2020-04-01 23:52:35,AlexBoyerFox4,,0,0,2,"North Texas doctor turns 2 @SinaiCare urgent clinics into drive-thru COVID-19 testing centers @FOX4",,@SinaiCare @FOX4,,1245499330594844673,https://twitter.com/AlexBoyerFox4/status/1245499330594844673
2020-04-01 23:51:25,Joy105com,,0,2,0,"28 Univ. Of Texas Austin Students Have Tested COVID-19 Positive After Spring Break Trip http://joy105.com/28-univ-of-texas-austin-students-have-tested-covid-19-positive-after-spring-break-trip/",,,,1245499035953188864,https://twitter.com/Joy105com/status/1245499035953188864
2020-04-01 23:51:13,DavidWCook1,,0,0,0,"Overview of State Relief Efforts in Response to COVID-19 @Vorys #Ohio #pennsylvania #Texas #washingtondc",,@vorys,#Ohio #pennsylvania #Texas #washingtondc,1245498987215491072,https://twitter.com/DavidWCook1/status/1245498987215491072
2020-04-01 23:51:01,Macgyver2921,,0,0,0,"As thy should! The stupid bastards should be put in jail as soon as they get better,they should also pay for the treatment Dozens of Texas spring breakers test positive for COVID-19 - ",,,,1245498935575281666,https://twitter.com/Macgyver2921/status/1245498935575281666
2020-04-01 23:50:25,CaGarciaP,,0,0,0,"Mientras tanto, en el imperio.... ""At least 28 Texas spring breakers test positive for COVID-19"" ",,,,1245498787054960650,https://twitter.com/CaGarciaP/status/1245498787054960650
2020-04-01 23:49:15,nietzstar,,1,0,0,"so my bf's brother and step mom in texas might have covid..",,,,1245498493155729408,https://twitter.com/nietzstar/status/1245498493155729408
2020-04-01 23:43:34,trassens,,1,1,2,"#WR: Why Florida is in the middle of the COVID-19’ scene? After we read the news, a lot of questions come. Who is the responsible? Did Florida’s governor and cities' mayors make the right work to prevent the COVID-19 outbreak? Why #Florida more cases than Texas. Georgia? #COVID19",,,#WR #Florida #COVID19,1245497062319407111,https://twitter.com/trassens/status/1245497062319407111
2020-04-01 23:39:51,johnisvoting,,0,0,0,"Texas Health and Human Services @TexasHHSC has launched a 24/7 COVID-19 Mental Health Support Line to help #Texans experiencing anxiety, stress or emotional challenges due to the #COVID19 pandemic. Toll-free at 833-986-1919.",,@TexasHHSC,#Texans #COVID19,1245496126939238404,https://twitter.com/johnisvoting/status/1245496126939238404
2020-04-01 23:38:42,MundoHispanico,,0,0,0,"#AlertaCORONAVIRUS Así están lo casos de Covid-19 hoy miércoles 1 de abril de 2020, en Estados Unidos, Georgia, Florida, Nueva York y Texas, según reportan los sitios web del departamento de salud de cada estado y el… https://www.instagram.com/p/B-dPytxB-VO/?igshid=e3vp8beh2cjx",,,#AlertaCORONAVIRUS,1245495837985312768,https://twitter.com/MundoHispanico/status/1245495837985312768
2020-04-01 23:34:07,shannon_d_young,,0,0,0,"Don’t catch it... Dr. Maria Elena Bottazzi, co-director of the Texas Children's Hospital Center for Vaccine Development, believes a previously stated 12- to 18-month timeline may be too optimistic. The race for a COVID-19 vaccine: Fast, but fast enough? ",,,,1245494684211916801,https://twitter.com/shannon_d_young/status/1245494684211916801
2020-04-01 23:32:23,BigFatMediaBom1,BigFatMediaBom1,0,0,0,"If that does not convince you, look at this: http://www.unacast.com/covid19/social-distancing-scoreboard/ This application tracks mobile phone movement across the country. Most of Texas is graded an ""F"" in social distancing! And Covid-19 cases are steadily and rapidly rising in the state of Texas as well. ",,,,1245494249296211969,https://twitter.com/BigFatMediaBom1/status/1245494249296211969
2020-04-01 23:32:05,GlobalPandemics,,0,0,1,"COVID-ALERT: 28 University of Texas Students Positive for Coronavirus After Spring Break Trip - Global Pandemic News | #Coronavirus #COVID19 - https://globalpandemic.net/news/28-university-of-texas-students-positive-for-coronavirus-after-spring-break-trip/",,,#Coronavirus #COVID19,1245494172343316487,https://twitter.com/GlobalPandemics/status/1245494172343316487
2020-04-01 23:30:15,policeofficer,,0,13,14,"Montgomery County Sheriff’s Office staffers help boost blood supply during COVID-19 #Texas ",,,#Texas,1245493712899248128,https://twitter.com/policeofficer/status/1245493712899248128
2020-04-01 23:30:03,ILSAinc,,0,0,1,"Texas DOI Encourages Alternative Health Plans to Waive Consumer Costs for COVID-19 Testing and Treatment #COVID19 #texas #insurance ",,,#COVID19 #texas #insurance,1245493660826980352,https://twitter.com/ILSAinc/status/1245493660826980352
2020-04-01 23:29:55,mmedeirosri,,0,0,1,"What did we do before Skype meetings?? #wfh #covid-19 #thelifemedeiros #conferencecall @Boerne, Texas https://www.instagram.com/p/B-dOycDhpeR/?igshid=15mt5hd42ztct",,,#wfh #covid #thelifemedeiros #conferencecall,1245493628660854787,https://twitter.com/mmedeirosri/status/1245493628660854787
2020-04-01 23:29:02,EMS1,,0,0,0,"Texas paramedic says EMS unfairly told to leave fire station over COVID-19 concerns https://buff.ly/2JI2L6B",,,,1245493404525568002,https://twitter.com/EMS1/status/1245493404525568002
2020-04-01 23:27:30,SarahSaysS0,,0,0,0,"North Texas Girls Track Coach Dies of COVID-19 Long-time track coach Orlando McDaniel, 59, died after contracting the coronavirus. ",,,,1245493020511920129,https://twitter.com/SarahSaysS0/status/1245493020511920129
2020-04-01 23:24:57,TwitterMoments,,1,10,40,"""I can help people because of baseball and I want to give back,"" Shin-Soo Choo said in a conference call. The outfielder donated $1,000 to Texas Rangers minor leaguers to help with expenses during the COVID-19 pandemic. ",,,,1245492378707701767,https://twitter.com/TwitterMoments/status/1245492378707701767
2020-04-01 23:24:28,iamdjlolo818,,0,0,1,"#Repost mixxgangdjs ・・・ Available now on Mixcloud Dropping Soon on all platforms ... link in bio — mixxgangdjs #mixxgangdjs #mixxgangnation #mixxgangdjsapprove #dj #statetostate #coronavirus #covid @Houston, Texas https://www.instagram.com/p/B-dOKclnHbu/?igshid=1h80oc7t65esg",,,#Repost #mixxgangdjs #mixxgangnation #mixxgangdjsapprove #dj #statetostate #coronavirus #covid,1245492257098272768,https://twitter.com/iamdjlolo818/status/1245492257098272768
2020-04-01 23:24:17,openletterbot,,0,0,0," I delivered “COVID-19” from Debbie, a constituent in Mason, Texas, to @JohnCornyn, @ConawayTX11 and @SenTedCruz #TX11 #TXpolitics Write your own: https://twitter.com/messages/compose?recipient_id=835740314006511618&amp;text=resist",,@JohnCornyn @ConawayTX11 @SenTedCruz,#TX11 #TXpolitics,1245492207966015488,https://twitter.com/openletterbot/status/1245492207966015488
2020-04-01 23:23:50,USAjobs4all,,0,0,0,"Funeral Director or Embalmer urgently hiring during COVID-19-Dallas -Dual license is a plus and could offer more pay. This position requires a licensed Funeral Director in the state of Texas. - https://tinyurl.com/trsxgm4",,,,1245492096598974464,https://twitter.com/USAjobs4all/status/1245492096598974464
2020-04-01 23:22:33,Llancojudge,,1,1,4,"Llano County COVID-19 Status as of 6:00 PM 4/1/20 We remain at THREE confirmed cases. DSHS reports COVID-19 135 counties have confirmed cases of COVID-19 with 3,997 confirmed cases and 58 fatalities in Texas. Updated Llano County order can be found at http://www.co.llano.tx.us",,,,1245491771259400192,https://twitter.com/Llancojudge/status/1245491771259400192
2020-04-01 23:18:25,MarkDershowitz,texasgov,0,0,0,"How about getting more COVID test sites and kits into Texas?",,,,1245490734159089666,https://twitter.com/MarkDershowitz/status/1245490734159089666
2020-04-01 23:17:35,GregMontague8,RealCandaceO,0,0,0,"My president @GregAbbott_TX said Texas hospitals are currently at 2.5% capacity. To the other 49 states STAY OUT. Leave us alone. And this could also apply to post COVID-19. Now to be sure I love y'all's president @realDonaldTrump",,@GregAbbott_TX @realDonaldTrump,,1245490523063889921,https://twitter.com/GregMontague8/status/1245490523063889921
2020-04-01 23:13:49,jscurry44,,0,0,0,"@rolandsmartin Watching local news in Houston. Just saw a segment that stated Texas rank 49th for COVID-19 testing. Gov Abbott should be embarrassed. In the case of testing ‘ its small in Texas ‘. SMDH",,@rolandsmartin,,1245489575272873985,https://twitter.com/jscurry44/status/1245489575272873985
2020-04-01 23:13:22,LUCKLEE91,,0,0,0,"Covid-19 ain’t hitting Texas forreal cause we still gotta deal with hurricanes ",,,,1245489460269264897,https://twitter.com/LUCKLEE91/status/1245489460269264897
2020-04-01 23:12:59,Dbcgez,,0,0,0,"Don’t play with covid shit taking my fam... @Killeen, Texas https://www.instagram.com/p/B-dM2eMlJwB/?igshid=1fs6vcxii6g5j",,,,1245489365771567106,https://twitter.com/Dbcgez/status/1245489365771567106
2020-04-01 23:04:40,Tito10464327,AaronBlake,0,0,0,"Los religiosos en Florida y Texas son inmunes al #CoVID-19 pues están exentos de la orden de quedarse en casa y puede realizar sus reuniones y cultos como de costumbre. ",,,#CoVID,1245487273879179264,https://twitter.com/Tito10464327/status/1245487273879179264
2020-04-01 23:03:09,Flabbergast2017,GarrettHaake,0,1,10,"Garrett can you ask @GovAbbott how testing .15% of our population is enough to show how widespread this is? Ask him if someone dies w COVID-19 symptoms but is denied a test does it get marked as a COVID-19 death. Ask him how could he know how rural Texas is doing w/out testing.",,@GovAbbott,,1245486890620420097,https://twitter.com/Flabbergast2017/status/1245486890620420097
2020-04-01 23:02:37,CityOfMissionTX,,1,23,59,"COVID-19 is spreading faster in Texas. To protect our staff and citizens, park water fountains, basketball courts and tennis courts are CLOSED in Mission. Please stay home as much as possible. #MissionReady #StayHomeStaySafe",,,#MissionReady #StayHomeStaySafe,1245486758873182210,https://twitter.com/CityOfMissionTX/status/1245486758873182210
2020-04-01 23:02:07,ppausky78,,0,0,0,"3 30 20 Career Advice in a COVID 19 Environment https://youtu.be/TClNo0xtsrc via @YouTube From Former Student Career Services Team at Texas A&amp;M",,@YouTube,,1245486630875607042,https://twitter.com/ppausky78/status/1245486630875607042
2020-04-01 23:01:31,cclovephd,Black2thBone,0,0,4,"Wear a mask when out in public. Wash your hands. Stay at home. The equivocation on masks is about; a) fear of people hoarding & reducing supplies, b) fear of assuring people that masks are foolproof. You can still contract #COVID with masks from hand to mucous membrane contact.",,,#COVID,1245486481797304320,https://twitter.com/cclovephd/status/1245486481797304320
2020-04-01 23:01:24,jameskmin,,0,0,0,"HOW COVID-19 KILLS--Texas Educated Surgeon Dr. Vuong explaining how the disease works and how our health system will be overwhelmed -- https://youtu.be/4J0d59dd-qM #CoronaVirus #NotTheFlu #ARDS",,,#CoronaVirus #NotTheFlu #ARDS,1245486451128586240,https://twitter.com/jameskmin/status/1245486451128586240
2020-04-01 23:01:02,Baba9773,,1,0,1,"5) abortions during COVID-19. The ruling from the Fifth Circuit is in response to a lawsuit from Planned Parenthood and the Center for Reproductive Rights, both of whom sued the state of Texas for the governor's order. The order followed suit of the state of Ohio, on account of",,,,1245486358304624641,https://twitter.com/Baba9773/status/1245486358304624641
2020-04-01 22:58:16,TPRSource,,0,3,1,"#ICYMI: Today's show about the preparedness of Texas hospitals, should we see a sharp increase in covid-19 patients is now online. Thanks to our guests: Carrie Kroll from @texashospitals, Serena Bumpus @TexasNursesAssn and @eepley from @STRAC https://bit.ly/3bGoGXB",,@texashospitals @TexasNursesAssn @eepley @STRAC,#ICYMI,1245485660305309701,https://twitter.com/TPRSource/status/1245485660305309701
2020-04-01 22:58:06,Stars252525,,0,1,2,"Lubbock health officials have confirmed the third death from COVID-19, with 108 confirmed coronavirus cases in Lubbock County, a significant number related to an outbreak at Whisperwood Nursing Facility. #Texas",,,#Texas,1245485619880607749,https://twitter.com/Stars252525/status/1245485619880607749
2020-04-01 22:58:05,MaritimeAb,,0,0,0,"Follow me here on twitter https://twitter.com/MaritimeAb for the latest updates about covid-19 viruses.We cover the most important newschannels #London #Paris #Monaco #Newyork #NYC #Losangeles #Miami #Florida #texas #California #Losangeles #washingtondc #Vegas #Lasvegas #Hawaii #US",,,#London #Paris #Monaco #Newyork #NYC #Losangeles #Miami #Florida #texas #California #Losangeles #washingtondc #Vegas #Lasvegas #Hawaii #US,1245485617833787393,https://twitter.com/MaritimeAb/status/1245485617833787393
2020-04-01 22:56:02,SWHouNews,,0,0,0,"4000 price-gouging complaints have been filed in Texas during COVID-19 emergency http://dlvr.it/RT0bQl",,,,1245485101040807938,https://twitter.com/SWHouNews/status/1245485101040807938
2020-04-01 22:54:43,tejaschaos,Jillian08675309,1,0,0," , temper. Here’s your homework, check out: https://www.worldometers.info/coronavirus/country/us/ and find your way down to Texas. 29.44 million people, 4,068 COVID-19 cases, 60 deaths. All elective procedures shut down. Ask any hospital where their income comes from. They’re not bringing in $, they close.",,,,1245484767535083521,https://twitter.com/tejaschaos/status/1245484767535083521
2020-04-01 22:52:55,KLTV7,,0,3,1,"What we know about the 109 confirmed cases of COVID-19 in East Texas https://www.kltv.com/2020/03/16/what-we-know-about-confirmed-cases-covid-east-texas/",,,,1245484317125554178,https://twitter.com/KLTV7/status/1245484317125554178
2020-04-01 22:52:50,CALVIND64288435,,0,0,0,"UNT in denton texas is making there students move during a covid 19 lock down, can you believe that, be out by April 3rd, are they crazy",,,,1245484294023319555,https://twitter.com/CALVIND64288435/status/1245484294023319555
2020-04-01 22:52:27,AndyWeiss11,,0,0,0,"Texas business' helmets requested for COVID-19 treatment ",,,,1245484199072710656,https://twitter.com/AndyWeiss11/status/1245484199072710656
2020-04-01 22:51:24,Horadelaverdad,,1,1,1,"#Noticias en #LHDLV 28 estudiantes de la Universidad de Texas resultaron positivos con el Covid-19. http://www.lahoradelaverdad.com.co/28-estudiantes-de-la-universidad-de-texas-resultaron-positivos-con-el-covid-19/",,,#Noticias #LHDLV,1245483934433017856,https://twitter.com/Horadelaverdad/status/1245483934433017856
2020-04-01 22:49:38,USAjobs4all,,0,0,0,"Funeral Director or Embalmer urgently hiring during COVID-19-Terrell -Dual license is a plus and could offer more pay. This position requires a licensed Funeral Director in the state of Texas. - https://tinyurl.com/wrdxxyl",,,,1245483487819415564,https://twitter.com/USAjobs4all/status/1245483487819415564
2020-04-01 22:48:50,PsRobertMorris,,2,21,216,"When COVID-19 reached the States, we could no longer go into the prisons to host church services. With the help of our volunteers and other Gateway ministries, our prison ministry can now send full worship sets, sermons, and classes to 120 prisons across Texas! #GatewayTogether",,,#GatewayTogether,1245483288124416002,https://twitter.com/PsRobertMorris/status/1245483288124416002
2020-04-01 22:48:39,TheAngelaOjeda,,0,2,2,"For Landlords and tenants Texas REALTORS have come up with a Covid-19 Lease Payment Plan Agreement! #texasrealtor #texaslandlords #texasrenters #houstonrealestate #texasrealestate #yourrealtor #househunting #callme #homes #homeownership #realestateagent #sold #topagent",,,#texasrealtor #texaslandlords #texasrenters #houstonrealestate #texasrealestate #yourrealtor #househunting #callme #homes #homeownership #realestateagent #sold #topagent,1245483243408941058,https://twitter.com/TheAngelaOjeda/status/1245483243408941058
2020-04-01 22:44:49,WorldHealthTips,,0,0,0,"Texas business’ helmets requested for COVID-19 treatment https://www.ngospelmedia.net/news/texas-business-helmets-requested-for-covid-19-treatment/",,,,1245482276290473994,https://twitter.com/WorldHealthTips/status/1245482276290473994
2020-04-01 22:44:47,juliusasu2016,,0,0,0,"Texas business’ helmets requested for COVID-19 treatment https://www.ngospelmedia.net/news/texas-business-helmets-requested-for-covid-19-treatment/",,,,1245482269780979718,https://twitter.com/juliusasu2016/status/1245482269780979718
2020-04-01 22:44:42,NgospelMedia,,0,0,0,"Texas business’ helmets requested for COVID-19 treatment https://www.ngospelmedia.net/news/texas-business-helmets-requested-for-covid-19-treatment/",,,,1245482248566169601,https://twitter.com/NgospelMedia/status/1245482248566169601
2020-04-01 22:44:35,JuliaMorales,,9,62,625,"The Astros Foundation, with Crane Worldwide, is providing funding, logistics & transportation support for medical equipment to serve those impacted by the COVID-19 pandemic in Houston. The foundation also donated $400,000 to support the hospitals within the Texas Medical Center.",,,,1245482218753007621,https://twitter.com/JuliaMorales/status/1245482218753007621
2020-04-01 22:42:11,mariluvsmarilyn,JeffreeStar,0,0,0,"@JeffreeStar you have such an amazing heart! My family &amp; I could really use the help. We live in south Texas by the Mexican border and things have gotten bad here economically due to COVID-19. If we were struggling before we are struggling even more now. Thank you for considering ",,@JeffreeStar,,1245481612806103045,https://twitter.com/mariluvsmarilyn/status/1245481612806103045
2020-04-01 22:41:40,HowertonNews,,4,30,51,"Just got done doing an interview with the Texas Workforce Commission. -In the last 18 days, they've helped 500k people file for unemployment. -In all of 2019, they handled 700k claims. -Average daily call load before COVID-19 was 13,000. -Now, it hovers around 1.5M.",,,,1245481484665999360,https://twitter.com/HowertonNews/status/1245481484665999360
2020-04-01 22:38:43,veenomous,,2,0,0,"@jeffdaile57 Hi Jeff, i happened to have gotten your Covid-19 response via email as my print and mail small biz serviced one of your larger agent in Texas. He has refused to pay for our services, which are mostly postage fees that we pre-paid, while every $$matters for us.",,@jeffdaile57,,1245480744140582916,https://twitter.com/veenomous/status/1245480744140582916
2020-04-01 22:37:18,Kessunberber,Mzr_islem,1,0,2,"#Covid_19 #Ramadane Okay dans un instant les gars je vais vous donner un lien, un vrai #joujou.. avec le mode d'emploi et les différents #systèmes compatibles. Vous allez pouvoir #modeler vous même différents #scénarios par rapport à cette #pandémie...Enjoy &amp; hope you like it!",,,#Covid_19 #Ramadane #joujou #syst #modeler #sc #pand,1245480383606599681,https://twitter.com/Kessunberber/status/1245480383606599681
2020-04-01 22:36:29,sj_pete,,0,1,1,"Texas 'mom and pop' business flooded with orders for helmet ventilators. Sea-Long Medical Systems has drawn huge interest from hospitals and foreign countries seeking alternatives in treating COVID-19 patients amid a ventilator shortage. ",,,,1245480180967243776,https://twitter.com/sj_pete/status/1245480180967243776
2020-04-01 22:35:53,desototx,,0,0,0,"State of Texas COVID Situation Report for April 1st https://nextdoor.com/city/post/142988047 via @Nextdoor",,@Nextdoor,,1245480030945325056,https://twitter.com/desototx/status/1245480030945325056
2020-04-01 22:35:39,VoteBlue4Us,,0,1,2,"North Texas doctor turns urgent care clinics into drive-thru COVID-19 testing centers ",,,,1245479970031403010,https://twitter.com/VoteBlue4Us/status/1245479970031403010
2020-04-01 22:34:11,PV76227,,0,0,0,"Due to the continuing increase in the number of COVID-19 cases in the region, and in alignment with Executive Order GA-14 issued by Texas Governor Greg Abbott, which goes into effect April 2, 2020 and extends the statewide public health disaster to April 30, 2020",,,,1245479601935179781,https://twitter.com/PV76227/status/1245479601935179781
2020-04-01 22:31:05,Che_Elaine,,0,0,0,"Me: when COVID-19 sit his ass down I want to go to Juicy Crab and Texas Roadhouse. Babe: okay queen whatever you want. ",,,,1245478820473421825,https://twitter.com/Che_Elaine/status/1245478820473421825
2020-04-01 22:30:04,Openroadrvadv,,0,0,5,"Texas State Parks are open during the COVID-19 pandemic but before you head out to go camping, be sure to visit @TPWDparks or @TPWDnews for park alerts and information. Most are open and some are not but alerts will keep you informed on closures and rules.",,@TPWDparks @TPWDnews,,1245478564415315970,https://twitter.com/Openroadrvadv/status/1245478564415315970
2020-04-01 22:29:50,bwdisd,,0,1,2,"View our COVID-19 April 1 COVID-19 Update. On March 31, Governor Abbott closed all Texas schools through May 1. This closure will affect some of our planned Senior activities. We are still committed to give our Seniors a wonderful final experience at BHS. http://ow.ly/L6KV30quB8K",,,,1245478507322527751,https://twitter.com/bwdisd/status/1245478507322527751
2020-04-01 22:29:34,KevinDaleyDC,,1,4,2,"Federal judges in three states (Alabama, Ohio, and Texas) have sided with clinics in legal challenges to Covid-related abortion restrictions. But Texas prevailed Tuesday in the 5th Circuit, which temporarily blocked a trial court victory for the clinics. ",,,,1245478440133963779,https://twitter.com/KevinDaleyDC/status/1245478440133963779
2020-04-01 22:27:21,txchristianlife,,0,0,0,"Texas Guidance for Houses of Worship During the COVID-19 Crisis https://christianlifegospel.org/?p=563",,,,1245477883092578305,https://twitter.com/txchristianlife/status/1245477883092578305
2020-04-01 22:27:14,BDungan,,0,0,1,"Got both kids with April Fool's Day! #covid #aprilfools @Plano, Texas https://www.instagram.com/p/B-dHnNEnD5_/?igshid=rceupw31p6w8",,,#covid #aprilfools,1245477854302941186,https://twitter.com/BDungan/status/1245477854302941186
2020-04-01 22:25:45,justchilln247,,2,0,4,"It's all fun and games until someone loses an eye or test positive for COVID-19. Idiots....they entire lot of you are IDIOTS!!! #GrowUp 28 University of Texas spring breakers test positive for COVID-19 after group trip to Mexico https://www.nbcnews.com/news/us-news/least-28-texas-spring-breakers-test-positive-covid-19-after-n1173231 via @nbcnews",,@NBCNews,#GrowUp,1245477480410091520,https://twitter.com/justchilln247/status/1245477480410091520
2020-04-01 22:24:36,DaveHA,,0,0,0,"5th circuit uphold Texas’s prioritizing of medical services and supplies during COVID-19 pandemic https://www.nationalrighttolifenews.org/?p=87361 #COVIDー19 #coronavirus #AbortionIsNotEssential",,,#COVID #coronavirus #AbortionIsNotEssential,1245477187718918144,https://twitter.com/DaveHA/status/1245477187718918144
2020-04-01 22:19:54,jaroseii,,0,0,5,"The Comfort Food Care Package (CFCP) program will provide meals to at-risk youth and families in communities across Texas as the state responds to COVID-19. ",,,,1245476005105545216,https://twitter.com/jaroseii/status/1245476005105545216
2020-04-01 22:18:40,pcabbyhauffma59,TexasTribune,0,0,0,"I m asking my House of Rep 2 tell yor Reps in TEXAS -NO-TAXES-PAID--including that SNIVVELING little JUNGLE RAT-Louie GoPervert-that's voted against EVERY COVID-19 Worker Relief BILL that's been passed in the House &amp; Senate--that they will experience a BOYCOTT on TOP of ALL THIS",,,,1245475696018931712,https://twitter.com/pcabbyhauffma59/status/1245475696018931712
2020-04-01 22:17:28,keepwhistling,Texas_MsB2U,1,0,0,"Chemical poisoning is NOT a good alternative to Covid-19.",,,,1245475393848709133,https://twitter.com/keepwhistling/status/1245475393848709133
2020-04-01 22:17:09,SchwartzChron,,0,0,0,"Tomlinson: Texas renters, home owners deserve patience during COVID-19 ",,,,1245475315318652929,https://twitter.com/SchwartzChron/status/1245475315318652929
2020-04-01 22:14:02,CityLakeDallas,,0,0,0,"April 1, 2020 – Denton County Public Health (DCPH) has announced 25 additional laboratory-confirmed cases of COVID-19 in Denton County. For more updates about COVID-19 as they relate to Lake Dallas, Denton County, and Texas, please visit http://lakedallas.com/Coronavirus.",,,,1245474532200153088,https://twitter.com/CityLakeDallas/status/1245474532200153088
2020-04-01 22:14:02,McClureLaw,,0,0,0,"Central Texas therapy center offers at-home tele-counseling during COVID-19 pandemic ",,,,1245474530639982592,https://twitter.com/McClureLaw/status/1245474530639982592
