date,username,to,replies,retweets,favorites,text,geo,mentions,hashtags,id,permalink
2020-04-09 11:39:10,TranZZissioN,,0,0,0,"Expose #BigPharma!!! #covid_19 #coronavirus #Corruption #king2028 @Texas https://www.instagram.com/p/B-wjze5F_DE/?igshid=pmmxgxgn3wq4",,,#BigPharma #covid_19 #coronavirus #Corruption #king2028,1248213864690450434,https://twitter.com/TranZZissioN/status/1248213864690450434
2020-04-09 11:36:57,cyclone_cowgirl,,0,0,0,"@GovAbbott This apartment complex in Victoria Texas is threatening the residence after you said differently. #coronavirus #COVID #lockdown #Corona #SMH",,@GovAbbott,#coronavirus #COVID #lockdown #Corona #SMH,1248213304474042368,https://twitter.com/cyclone_cowgirl/status/1248213304474042368
2020-04-09 11:34:41,Jeh57John,,0,0,0,"Texas teen faces terrorism charges for allegedly threatening to spread COVID-19 https://www.oann.com/texas-teen-faces-terrorism-charges-for-allegedly-threatening-to-spread-covid-19/",,,,1248212736057761794,https://twitter.com/Jeh57John/status/1248212736057761794
2020-04-09 11:32:36,DaTruthofnola,,1,0,1,"Pastor Joel Osteen had a very powerful message on Sunday. I must share. All credits to Pastor Joel Osteen ministry. #JOELOSTEEN #DATRUTHOFNOLA @JoelOsteen #COVID-19 #texas #nola #thebloodofjesus #godgotus #GodIsInControl #pray #PrayTogether",,@JoelOsteen,#JOELOSTEEN #DATRUTHOFNOLA #COVID #texas #nola #thebloodofjesus #godgotus #GodIsInControl #pray #PrayTogether,1248212211706793989,https://twitter.com/DaTruthofnola/status/1248212211706793989
2020-04-09 11:30:01,KCBD11,,0,0,0," WATCH DAYBREAK TODAY Lubbock reports 23 new COVID cases, 1 new death; Texas climbs past 9,000; Congress may give additional money to small business ",,,,1248211559605813250,https://twitter.com/KCBD11/status/1248211559605813250
2020-04-09 11:27:39,pspcisd,,0,0,0,"Texas, remember the importance of social distancing. If you must go out, avoid public spaces and keep your distance from others (at least 6 feet). If we continue to follow valuable public health guidance, fewer of our friends &amp; family will be affected by COVID-19. #StayHomeTexas",,,#StayHomeTexas,1248210966443163654,https://twitter.com/pspcisd/status/1248210966443163654
2020-04-09 11:27:20,Joe13411538,,0,0,0,"#Texas #PeopleofColor #coronavirus #COVID19 The national trend shows black Americans disproportionately getting sick and dying from COVID-19. The same trend may be playing out in Texas' black and Hispanic communities, but sparse data has been collected. ",,,#Texas #PeopleofColor #coronavirus #COVID19,1248210886512332800,https://twitter.com/Joe13411538/status/1248210886512332800
2020-04-09 11:26:04,tdtnews,,0,0,1,"Walgreens is working to expand drive-thru COVID-19 testing to 15 new sites in seven states, the company announced April 7. The states included are Arizona, Florida, Illinois, Kentucky, Louisiana, Tennessee and Texas. ",,,,1248210568017829888,https://twitter.com/tdtnews/status/1248210568017829888
2020-04-09 11:25:38,MyahMcTear,,0,0,0,"""COVID-19 is spreading in nursing homes. Texas won't share details."" ",,,,1248210458382946305,https://twitter.com/MyahMcTear/status/1248210458382946305
2020-04-09 11:13:06,ExpressChiros,,0,0,0,"Keep it clean. Keep it safe. Covid 19 precautions are in full swing at the office. Safety for you and the staff is our top priority as we continue to provide care. @Keller, Texas https://www.instagram.com/p/B-wg0u5g538/?igshid=sbemdm8oxjd8",,,,1248207303989485568,https://twitter.com/ExpressChiros/status/1248207303989485568
2020-04-09 11:11:01,workersworld,,0,1,1,"Migrants in detention in Texas face COVID-19 https://www.workers.org/2020/04/47542/ #via @workersworld",,@workersworld,,1248206781769269248,https://twitter.com/workersworld/status/1248206781769269248
2020-04-09 11:09:18,LaredoHealth,,0,0,0,"Thank you Dr. Pablo Arenaz and Texas A&amp;M International University for your generous donation of 110 COVID-19 sampling kits. The viral sampling kits were rushed to TAMIU by the Texas A&amp;M Veterinary Medical Diagnostic Laboratory in College Station. #WeWillGetThroughThisTogether",,,#WeWillGetThroughThisTogether,1248206346295676929,https://twitter.com/LaredoHealth/status/1248206346295676929
2020-04-09 11:09:02,keepImagining,funder,0,0,0,"National COVID peak is still a week away. Texas and Florida will likely be later and + +. As far as bizzare Trump responses, to an out of control situation go: BABY YOU AIN'T SEEN NOTHIN' YET. Spoiler Alert He'll remind 3 things: it's not wasn't &amp; can't be his fault He lies.",,,,1248206280457695232,https://twitter.com/keepImagining/status/1248206280457695232
2020-04-09 11:08:12,Grenade86,,0,1,0,"We spend time in both TX and RI. Texas population is 27x bigger than Rhode Island. In COVID deaths, TX is just 5x bigger than RI. Thoughts, @ScottGottliebMD?",,@ScottGottliebMD,,1248206071765794819,https://twitter.com/Grenade86/status/1248206071765794819
2020-04-09 11:04:00,12ShootingStars,,0,0,0,"Stop Undermining Texans' Safety We're asking Governor Abbott to rescind his recent executive order to prevent an outbreak of the COVID-19 coronavirus in Texas carceral facilities. ",,,,1248205014910279680,https://twitter.com/12ShootingStars/status/1248205014910279680
2020-04-09 11:04:00,TisaDavis,,0,0,1,"Hey @FOX59 you just did a story on how Texas libraries are making 3D printed COVID-19 masks but many of your own Indiana Libraries are making them as well. Why not feature them!",,@FOX59,,1248205014302146560,https://twitter.com/TisaDavis/status/1248205014302146560
2020-04-09 11:01:21,EddeAlmeida68,lia_mag,0,0,6,"@lia_mag ela não é a primeira que diz que COVID-19 é fraude política e depois adoece. https://www.dailykos.com/stories/2020/4/6/1934731/-Texas-woman-calls-COVID-19-a-hoax-She-is-now-dead-from-her-willful-ignorance Essa aqui, do Texas, morreu depois de adoecer com o COVID-19 que ela dizia que era só para prejudicar o Trump. Vamos mesmo falar de burrice???",,@lia_mag,,1248204346808045571,https://twitter.com/EddeAlmeida68/status/1248204346808045571
2020-04-09 11:01:15,jones410,,1,0,0,"COVID-19 is spreading in nursing homes. Texas won't share details. ",,,,1248204323076673536,https://twitter.com/jones410/status/1248204323076673536
2020-04-09 11:00:50,CliveSSmith,,1,4,11,"A Covid Reprieve (@Reprieve) is much better than a Covid death: Billy Joe Wardlow’s execution postponed from April 29 to July 8. It's the 4th stay in Texas so far...",,@Reprieve,,1248204218781106178,https://twitter.com/CliveSSmith/status/1248204218781106178
2020-04-09 10:55:00,KHOU,,0,6,4,"Some Walgreens will offer 15-minute drive-thru COVID-19 testing in Texas https://www.khou.com/article/news/health/coronavirus/coronavirus-austin-texas-update-cases-gov-greg-abbott-walgreens/269-c333b596-c041-4683-aa8b-83d43d39ba81?Fb-Thursday #KHOU",,,#KHOU,1248202748346142720,https://twitter.com/KHOU/status/1248202748346142720
2020-04-09 10:54:16,scribunda,,0,2,4,"COVID-19 cases in Texas, including cases in Austin, are severely underreported. Hospitals have told the media they can’t divulge the number of coronavirus-related hospitalizations. Are other red states suppressing numbers like this? We demand the truth! ",,,,1248202565818474496,https://twitter.com/scribunda/status/1248202565818474496
2020-04-09 10:50:04,ShortArmOtheLaw,,0,0,0,"Federal appeals court temporarily permits Texas executive order banning most abortions during COVID-19 pandemic - JURIST - News - Legal News &amp; Commentary ",,,,1248201505372545026,https://twitter.com/ShortArmOtheLaw/status/1248201505372545026
2020-04-09 10:45:03,ELLADENMON,,0,0,0,"Coronavirus In Texas: Does Heat, Humidity Kill COVID-19? https://dfw.cbslocal.com/2020/04/08/coronavirus-in-texas-does-heat-humidity-kill-covid-19/ #SmartNews",,,#SmartNews,1248200244694634496,https://twitter.com/ELLADENMON/status/1248200244694634496
2020-04-09 10:42:01,the_texasbob,,0,1,1,"Texas pandemic expert see a resurgence of COVID-19 in autumn. “I wouldn’t say 100%, I really hope that there’s not a second wave, but I would say it’s likely, that’s because there’s a lot of asymptomatic carriers and there’s a lot that we still don’t understand about the virus,”",,,,1248199481839026177,https://twitter.com/the_texasbob/status/1248199481839026177
2020-04-09 10:40:42,abc13houston,,1,10,27,"COVID-19 test launching with 15-minute results, Texas Gov. Abbott says https://abc13.co/2x4yegx",,,,1248199149062950915,https://twitter.com/abc13houston/status/1248199149062950915
2020-04-09 10:35:33,diginota,diginota,0,0,0,"Aquí pueden ver por que aun los EEUU, aun lamentablemente esta lejos de llegar al pico, En un hospital de Texas ayer, hubo 22 muertes por neumonía, solo 4 pasaron a estadísticas covid-19, los otros 18 no entraron en los números. si saben calcular.... ",,,,1248197853245292544,https://twitter.com/diginota/status/1248197853245292544
2020-04-09 10:34:01,RafaLover16,,1,1,0,"@MungoNGusNNigel did u see this? Your gov is engaged in a cover-up. Smh COVID-19 is spreading in nursing homes. Texas won't share details. ",,@MungoNGusNNigel,,1248197467809566724,https://twitter.com/RafaLover16/status/1248197467809566724
2020-04-09 10:32:29,kk131066,PuffDomino,0,3,3,"Thank you VERY much, my friend ... HUGS :) #RemoveTrumpNow #RemoveTrump #TrumpLiedPeopleDied #TrumpLiesAboutCoronavirus #TrumpIsAnIdiot #TrumpCrimesAgainstHumanity #TrumpCoronaDisaster #COVID #COVID19 #VoteBlue2020 #VoteBlueNoMatterWho #StrongerTogether #Resistance #Resist",,,#RemoveTrumpNow #RemoveTrump #TrumpLiedPeopleDied #TrumpLiesAboutCoronavirus #TrumpIsAnIdiot #TrumpCrimesAgainstHumanity #TrumpCoronaDisaster #COVID #COVID19 #VoteBlue2020 #VoteBlueNoMatterWho #StrongerTogether #Resistance #Resist,1248197083229646850,https://twitter.com/kk131066/status/1248197083229646850
2020-04-09 10:26:05,LARZIK,,0,0,0,"COVID-19 is spreading in nursing homes. Texas won't share details. ",,,,1248195473254596612,https://twitter.com/LARZIK/status/1248195473254596612
2020-04-09 10:25:52,LARZIK,,0,0,0,"@LARZIK COVID-19 is spreading in nursing homes. Texas won't share details. https://twitter.com/i/events/1247904561089527810",,@LARZIK,,1248195417675829250,https://twitter.com/LARZIK/status/1248195417675829250
2020-04-09 10:25:04,karynechar,,0,0,0,"Del Río, Tx. El Departamento de Salud del Estado de Texas reportó el séptimo caso confirmado de COVID-19 en esta población, tratándose de una persona que viajó de manera internacional, pero al regresar a Estados Unidos ha permanecido en cuarentena.",,,,1248195214587523073,https://twitter.com/karynechar/status/1248195214587523073
2020-04-09 10:24:57,HJLH2Ocolors,,0,0,0,"Texas teen faces terrorism charges for allegedly threatening to spread COVID-19 - https://www.oann.com/texas-teen-faces-terrorism-charges-for-allegedly-threatening-to-spread-covid-19/",,,,1248195185474859008,https://twitter.com/HJLH2Ocolors/status/1248195185474859008
2020-04-09 10:15:46,DiannaF04991655,,0,1,1,"Central Texas hospitals and officials not releasing COVID-19 suspected case counts, and why that matters https://www.kxan.com/investigations/central-texas-hospitals-and-officials-not-releasing-covid-19-suspected-case-counts-and-why-that-matters/",,,,1248192873666940929,https://twitter.com/DiannaF04991655/status/1248192873666940929
2020-04-09 10:06:14,AdosGrievances,,0,10,12,"HOUSTON (4/9/2020) Confirmed Cases 1380 Active Cases 1234 Deaths 12 Recovered 134 Race/ethnicity of Houston’s current 12 COVID-19 deaths Black/African American: (8) 66.6% Hispanic/Latino: (2) 16.6% White: (2) 16.6% #COVID19 #coronavirus #houston #texas #ados",,,#COVID19 #coronavirus #houston #texas #ados,1248190478069137408,https://twitter.com/AdosGrievances/status/1248190478069137408
2020-04-09 09:49:44,hane_does,,0,1,1,"On @mjfirstlook Texas listed as state with lowest #of tests for #COVID19. @GovAbbott has us on the Trump train, from lowest #of tests given in the entire USA to using a Nursing Home here to do unofficial tests of the Trump drug to cure COVID. He sent masks. #morningjoe",,@mjfirstlook @GovAbbott,#COVID19 #morningjoe,1248186323233574912,https://twitter.com/hane_does/status/1248186323233574912
2020-04-09 09:46:06,noromannet,,1,0,2,"""Church"" in Texas sells products that ""allegedly"" cure ""COVID-19 and other diseases with"" misleading claims "" #California #Chlorinedioxide #Coronavirus #Covid19 #Houston https://noroman.net/coronavirus/church-in-texas-sells-products-that-allegedly-cure-covid-19-and-other-diseases-with-misleading-claims/",,,#California #Chlorinedioxide #Coronavirus #Covid19 #Houston,1248185408573321216,https://twitter.com/noromannet/status/1248185408573321216
2020-04-09 09:33:32,duckm4st3r,,0,0,0,"Coronavirus Texas: 28 people at Park Manor Quail Valley nursing home in Missouri City test positive for COVID-19 https://bestspecialnews.com/coronavirus-texas-28-people-at-park-manor-quail-valley-nursing-home-in-missouri-city-test-positive-for-covid-19-2/",,,,1248182247586508800,https://twitter.com/duckm4st3r/status/1248182247586508800
2020-04-09 09:30:00,BRProudNews,,0,0,0,"Baseball glove company Nokona Ballgloves is asking the state if they can make facemasks during the COVID-19 pandemic in its North Texas factory. ",,,,1248181358268239872,https://twitter.com/BRProudNews/status/1248181358268239872
2020-04-09 09:23:16,SinceDayThree,,0,0,1,"Check out my blog post about some real ladies sewing masks for those on the frontline - especially here in DFW - COMMON THREADS https://sjohnsonartist.wordpress.com/2020/04/09/common-threads/ via @SJohnsonArtist #Maskmaking #Dallas #Texas #DFW #COVID #blog #Writing #Sewing",,,#Maskmaking #Dallas #Texas #DFW #COVID #blog #Writing #Sewing,1248179664566304768,https://twitter.com/SinceDayThree/status/1248179664566304768
2020-04-09 09:19:04,FCS_STATS,,1,4,13,"Texas A&amp;M Chancellor John Sharp: ''In some conversations with SEC officials and NCAA, I think they've come to the conclusion that you can probably start football as late as October and still have a 13-game schedule."" He added there are many unknowns about a season due to COVID-19",,,,1248178608557916160,https://twitter.com/FCS_STATS/status/1248178608557916160
2020-04-09 09:17:49,nushers,,0,0,0,"Stop Undermining Texans' Safety We're asking Governor Abbott to rescind his recent executive order to prevent an outbreak of the COVID-19 coronavirus in Texas carceral facilities. ",,,,1248178293674610690,https://twitter.com/nushers/status/1248178293674610690
2020-04-09 09:17:48,DoloresVanRyn,GregAbbott_TX,0,0,0,"You are falling into Federal Guidelines which are proven to be deadly. DO WHAT IS RIGHT BY TEXAS? Texas has not even reached their COVID-19 peak. We are still sick and dying. Take care of Texas first. Forget Lying Donald, look at Gavin Newsom COVID-19 model. It worked.",,,,1248178288394227712,https://twitter.com/DoloresVanRyn/status/1248178288394227712
2020-04-09 09:14:15,RebusLegalis,,0,0,0,"COVID-19 Pushed Legal Toward Tech, Remote Work. There May Be No Going Back | Legaltech News - Texas Lawyer ",,,,1248177395091243011,https://twitter.com/RebusLegalis/status/1248177395091243011
2020-04-09 09:02:17,LokiplaguEbooks,,0,0,0,"This morning's workout consisted of a chicken are meant to be in Texas for the kids ready for this COVID-19.",,,,1248174382066868224,https://twitter.com/LokiplaguEbooks/status/1248174382066868224
2020-04-09 09:00:49,KarineOmry,,0,24,24,"#Covid_19 is a death sentence behind bars. #iCARE4 #KennethFoster who shouldn't have to face another death sentence! There are now 15 Texas prisons on lockdown. Kenneth's unit is one of them. #IncarceratedPeopleMatter @moodyforelpaso @jarvisjohnsontx @GeneforTexas",,@moodyforelpaso @jarvisjohnsontx @GeneforTexas,#Covid_19 #iCARE4 #KennethFoster #IncarceratedPeopleMatter,1248174015144964096,https://twitter.com/KarineOmry/status/1248174015144964096
2020-04-09 08:58:13,StevenPHD24,,0,0,0,"""COVID-19 is spreading in nursing homes. Texas won't share details."" ",,,,1248173361412239363,https://twitter.com/StevenPHD24/status/1248173361412239363
2020-04-09 08:57:26,ICPSLONDON,,0,0,0,"US (Texas) - First state prison inmate dies of COVID-19, lockdown expands https://www.miamiherald.com/news/article241866291.html",,,,1248173160299745280,https://twitter.com/ICPSLONDON/status/1248173160299745280
2020-04-09 08:46:37,ameer0106,,0,0,0,"Covid-19: Texas police lauds West Bengal officials for handling crisis ",,,,1248170438846320640,https://twitter.com/ameer0106/status/1248170438846320640
2020-04-09 08:23:51,631Lex,,0,0,0,"#onlyinnyc #newyork #funny #haha #fast #gocart #tiktok #covid_19 #challengeaccepted #lol #newyorkcity #nyc #highway #unstoppable #miami #california #usa #texas #arizona @New York, New York https://www.instagram.com/p/B-wNCz-nWl-/?igshid=7jcyhr459a3t",,,#onlyinnyc #newyork #funny #haha #fast #gocart #tiktok #covid_19 #challengeaccepted #lol #newyorkcity #nyc #highway #unstoppable #miami #california #usa #texas #arizona,1248164708932173824,https://twitter.com/631Lex/status/1248164708932173824
2020-04-09 08:21:38,stallion_2000,,0,0,5,"everyone on this base knows damn well the texas sun will better prevent the spread of covid-19 &amp; it’s pesky germs before these flimsy ass surgical masks ever could. bitch it’s 95° at 16:00 with a 15 minute march to the school house &amp; I CAN’T BREATHE",,,,1248164154944491521,https://twitter.com/stallion_2000/status/1248164154944491521
2020-04-09 08:12:19,duckm4st3r,,0,0,0,"Coronavirus Texas: 28 people at Park Manor Quail Valley nursing home in Missouri City test positive for COVID-19 https://bestspecialnews.com/coronavirus-texas-28-people-at-park-manor-quail-valley-nursing-home-in-missouri-city-test-positive-for-covid-19/",,,,1248161809447690241,https://twitter.com/duckm4st3r/status/1248161809447690241
2020-04-09 07:59:51,lmtnews,,0,0,0,"A 72-year-old man on Tuesday became the first Texas prisoner to die with COVID-19, according to the Texas Department of Criminal Justice. https://ift.tt/3e92wiT",,,,1248158671537876992,https://twitter.com/lmtnews/status/1248158671537876992
2020-04-09 07:49:59,RsDarlene,,0,0,0,"COVID-19 is spreading in nursing homes. Texas won't share details. ",,,,1248156189591928837,https://twitter.com/RsDarlene/status/1248156189591928837
2020-04-09 07:48:09,Mondiablue,,0,0,0,"Coronavirus In Texas: 2 Buc-ee’s Workers Test Positive For COVID-19 - CBS Dallas / Fort Worth https://dfw.cbslocal.com/2020/04/08/coronavirus-in-texas-2-buc-ees-workers-tests-positive-for-covid-19/ via @GoogleNews",,@googlenews,,1248155726234689539,https://twitter.com/Mondiablue/status/1248155726234689539
2020-04-09 07:46:11,BitcoinView,,0,0,0,"Texas Regulator Spots Crypto Firm at Fraudulent COVID-19 Charity Claims ",,,,1248155229788536833,https://twitter.com/BitcoinView/status/1248155229788536833
2020-04-09 07:45:35,msnbelgie,,0,0,0,"Texas annuleert door Covid-19 ‘niet-essentiële’ abortussen ",,,,1248155080039096320,https://twitter.com/msnbelgie/status/1248155080039096320
2020-04-09 07:40:15,FeedDallas,,0,0,0,"CBS Dallas: Coronavirus In Texas: Does Heat, Humidity Kill COVID-19? https://ift.tt/3b6RKHG #dallas",,,#dallas,1248153739749478400,https://twitter.com/FeedDallas/status/1248153739749478400
2020-04-09 07:38:16,trustdtravelr,,0,0,0,"COVID-19 screenings may cause backups at Texas border, LSP advises",,,,1248153238693720064,https://twitter.com/trustdtravelr/status/1248153238693720064
2020-04-09 07:37:11,sriharikapu,,0,0,0,"Texas Regulator Spots Crypto Firm at Fraudulent COVID-19 Charity Claims https://ift.tt/3aWGEVE",,,,1248152965996843010,https://twitter.com/sriharikapu/status/1248152965996843010
2020-04-09 07:29:32,CatchTheCrypto,,0,0,0,"Texas Regulator Spots Crypto Firm at Fraudulent COVID-19 Charity Claims https://ift.tt/3aWGEVE",,,,1248151040337338368,https://twitter.com/CatchTheCrypto/status/1248151040337338368
2020-04-09 07:26:21,LAProgressive,,2,2,1,"#RT @theintercept: After Texas declared an abortion ban amid the Covid-19 outbreak, patients across the state were left with few options: Delay the procedure until the ban is lifted, travel out of state to secure services, or “be forced to have a baby.” ",,@theintercept,#RT,1248150241875984385,https://twitter.com/LAProgressive/status/1248150241875984385
2020-04-09 07:26:02,albErtu_Sok,,0,0,0,"Texas Regulator Spots Crypto Firm at Fraudulent COVID-19 Charity Claims http://dlvr.it/RTS10C",,,,1248150161534017538,https://twitter.com/albErtu_Sok/status/1248150161534017538
2020-04-09 07:22:22,DrLee4America,,65,960,1057,"@GregAbbott_TX Dear Gov. Abbott, I am a physician w/practice in Texas. I have greatly admired your leadership of Texas. But with respect, I strongly disagree with the restrictions on physicians in Texas on prescribing #hydroxychloroquine for outpatients at onset of COVID-19 ",,@GregAbbott_TX,#hydroxychloroquine,1248149237524623361,https://twitter.com/DrLee4America/status/1248149237524623361
2020-04-09 07:22:09,pr_venus,,5,17,34,"Texas Woman Who Claimed COVID-19 Was ‘Media Driven’ Hoax Dies From Virus ",,,,1248149184148094976,https://twitter.com/pr_venus/status/1248149184148094976
2020-04-09 07:13:44,utah1896,,0,0,0,"FBI: Man arrested for claiming he paid someone to spread COVID-19 at Texas grocery stores ",,,,1248147063717724161,https://twitter.com/utah1896/status/1248147063717724161
2020-04-09 07:08:22,Airgeadais,,0,0,0,"Texas Regulator Spots Crypto Firm at Fraudulent COVID-19 Charity Claims",,,,1248145716595372032,https://twitter.com/Airgeadais/status/1248145716595372032
2020-04-09 07:08:05,Jugbo,,1,0,3,"""COVID-19 is spreading in nursing homes. Texas won't share details."" ",,,,1248145641886240769,https://twitter.com/Jugbo/status/1248145641886240769
2020-04-09 07:05:02,NewsCryptoBot,,0,0,0,"Texas Regulator Spots Crypto Firm at Fraudulent COVID-19 Charity Claims https://cointelegraph.com/news/texas-regulator-spots-crypto-firm-at-fraudulent-covid-19-charity-claims",,,,1248144877734498305,https://twitter.com/NewsCryptoBot/status/1248144877734498305
2020-04-09 07:04:19,DarkNodeGuru,,0,0,0,"Texas Regulator Spots Crypto Firm at Fraudulent COVID-19 Charity Claims https://ift.tt/3aWGEVE",,,,1248144697551474690,https://twitter.com/DarkNodeGuru/status/1248144697551474690
2020-04-09 07:01:52,VigarooLocal,,0,0,0,"10 Austin Businesses Doing Right by Employees During COVID-19 http://goo.gl/FVFU8Y #AustinTX #tech #Texas",,,#AustinTX #tech #Texas,1248144078543261697,https://twitter.com/VigarooLocal/status/1248144078543261697
2020-04-09 07:01:36,politirazzi,,0,0,0,"COVID-19 May Be Silently Spreading Across Rural Counties, University of Texas Researchers Believe ",,,,1248144011514253312,https://twitter.com/politirazzi/status/1248144011514253312
2020-04-09 07:00:17,AustinsCalendar,,0,0,0,"Notification: Tango Vinyls & Wine - Cancelled due to COVID-19 Closures @Wed Apr 8, 2020 8pm - 10pm (CDT) (Argentine Tango Milongas and Practicas in Austin, Texas)",,,,1248143680545972229,https://twitter.com/AustinsCalendar/status/1248143680545972229
2020-04-09 06:52:29,iGEASmit,,0,1,1,"How At Risk Are You of Getting a Virus on an Airplane? - Latest News - Texas Advanced Computing Center https://www.tacc.utexas.edu/latest-news/-/asset_publisher/rTY3t77Cj5Zq/content/how-at-risk-are-you-of-getting-a-virus-on-an-airplane-#.Xo7GIfQhOlE.twitter #COVID-19 #HPC",,,#COVID #HPC,1248141715724292101,https://twitter.com/iGEASmit/status/1248141715724292101
2020-04-09 06:51:26,TheRealLilXza,,0,0,0,"Stop Undermining Texans' Safety We're asking Governor Abbott to rescind his recent executive order to prevent an outbreak of the COVID-19 coronavirus in Texas carceral facilities. ",,,,1248141452103880704,https://twitter.com/TheRealLilXza/status/1248141452103880704
2020-04-09 06:47:45,Anton_Sorkin,,0,1,2,"“Before the COVID-19 pandemic arrived in Texas, many of the state’s nursing homes had long records of citations related to poor infection control. And now some of those same nursing homes are seeing major outbreaks.” https://www.texastribune.org/2020/04/08/coronavirus-spreads-texas-nursing-homes-officials-withhold-details/ via @TexasTribune",,@TexasTribune,,1248140524420313089,https://twitter.com/Anton_Sorkin/status/1248140524420313089
2020-04-09 06:35:18,FriendcoinS007,,0,0,0,"Texas Regulator Spots Crypto Firm at Fraudulent COVID-19 Charity Claims https://cryptonewsmonitor.com/2020/04/08/texas-regulator-spots-crypto-firm-at-fraudulent-covid-19-charity-claims/ #Top100GlobalCryptoLeaders",,,#Top100GlobalCryptoLeaders,1248137393598799873,https://twitter.com/FriendcoinS007/status/1248137393598799873
2020-04-09 06:34:40,twit2wit,DrRobDavidson,0,1,0,"COVID-19 Pandemic borders olympics #Karma #SweetNight #MLB #hiphop #MAGA #NotMeUs #AOC #ClimateChange #TyphoidRand coronavirus Republican anti-socialism anarchy lack of leadership global warming stimulus #cure #NYC New York California Texas Florida Pope Dunning-Kruger effect ",,,#Karma #SweetNight #MLB #hiphop #MAGA #NotMeUs #AOC #ClimateChange #TyphoidRand #cure #NYC,1248137233615339520,https://twitter.com/twit2wit/status/1248137233615339520
2020-04-09 06:31:15,NajaSide,,0,0,0,"about my state COVID-19 is spreading in nursing homes. Texas won't share details. ",,,,1248136375506960384,https://twitter.com/NajaSide/status/1248136375506960384
2020-04-09 06:29:14,twit2wit,kristjanahronn,1,1,0,"COVID-19 Pandemic borders olympics #Karma #SweetNight #MLB #hiphop #MAGA #NotMeUs #AOC #ClimateChange #TyphoidRand coronavirus Republican anti-socialism anarchy lack of leadership global warming stimulus #cure #NYC New York California Texas Florida Pope Dunning-Kruger effect ",,,#Karma #SweetNight #MLB #hiphop #MAGA #NotMeUs #AOC #ClimateChange #TyphoidRand #cure #NYC,1248135867622756353,https://twitter.com/twit2wit/status/1248135867622756353
2020-04-09 06:25:21,ProtaFin,,0,0,0,"COVID-19 is spreading in nursing homes. Texas won't share details. https://twitter.com/i/events/1247904561089527810 #COVIDー19",,,#COVID,1248134890874458113,https://twitter.com/ProtaFin/status/1248134890874458113
