date,username,to,replies,retweets,favorites,text,geo,mentions,hashtags,id,permalink
2020-04-01 16:02:54,LanaVasquez309,,0,0,1,"HSC Texas mental health support line is available 24/7 statewide. Toll free number: 833-986-1919 Please call if you are experiencing anxiety, stress, or emotional challenges due to COVID-19.",,,,1245381131060510721,https://twitter.com/LanaVasquez309/status/1245381131060510721
2020-04-01 16:01:30,NoticiasETX,,0,0,0,"Lo que sabemos sobre los 93 casos confirmados de COVID-19 en el este de Texas https://bit.ly/2UNDfSo",,,,1245380777606557696,https://twitter.com/NoticiasETX/status/1245380777606557696
2020-04-01 16:01:29,StateSideSix,,0,0,1,"Let's launch them to Mars: ""The City of Austin, Texas, announced the news on Tuesday, saying of the 70 students who chartered the plane to Cabo San Lucas about a week and a half ago, at least 28 of them have tested positive for COVID-19.""",,,,1245380774930665484,https://twitter.com/StateSideSix/status/1245380774930665484
2020-04-01 16:00:42,KVUE,,0,4,4,"#KVUE and other organizations across Central Texas are coming together for a digital telethon on Friday to support those impacted by COVID-19 called All Together ATX http://www.alltogetheratx.org",,,#KVUE,1245380577756397570,https://twitter.com/KVUE/status/1245380577756397570
2020-04-01 16:00:08,KatyTrailWeekly,,0,0,1,"With concerns around COVID-19 increasing in North Texas, Children's Heath hopes their virtual visit app can help families get the help they need safely and conveniently. ",,,,1245380435951190016,https://twitter.com/KatyTrailWeekly/status/1245380435951190016
2020-04-01 15:59:04,GlobalPandemics,,0,0,0,"COVID-ALERT: Texas border town orders residents to cover faces amid coronavirus crisis - Global Pandemic News | #Coronavirus #COVID19 - https://globalpandemic.net/news/texas-border-town-orders-residents-to-cover-faces-amid-coronavirus-crisis/",,,#Coronavirus #COVID19,1245380167888973827,https://twitter.com/GlobalPandemics/status/1245380167888973827
2020-04-01 15:58:00,Rewire_News,,0,0,2," The courts just allowed Texas to exploit the COVID-19 crisis to ban abortion. Effective immediately. ICYMI, #TeamLegal released a rapid reaction episode of Boom! Lawyered last night. ",,,#TeamLegal,1245379899466055680,https://twitter.com/Rewire_News/status/1245379899466055680
2020-04-01 15:57:36,BON_SBNation,,1,0,2,"Bevo’s Daily Roundup: Texas basketball sophomore Charli Collier launches COVID-19 relief fundraiser https://www.burntorangenation.com/2020/4/1/21202934/bevos-daily-roundup-texas-basketball-sophomore-charli-collier-launches-covid-19-fundraiser?utm_campaign=burntorangenation&amp;utm_content=chorus&amp;utm_medium=social&amp;utm_source=twitter",,,,1245379796948914176,https://twitter.com/BON_SBNation/status/1245379796948914176
2020-04-01 15:55:47,FrancaRose33,wendyp4545,0,0,0,"Stay at home prevents overloading our healthcare systems. So if you negligently get COVID-19, you won’t go to the hospital, right?",,,,1245379341153787905,https://twitter.com/FrancaRose33/status/1245379341153787905
2020-04-01 15:53:56,ChPThihrh1X7YCk,,0,0,0,"Texas CBD shop drops prices and donates to COVID relief funds ",,,,1245378873816039425,https://twitter.com/ChPThihrh1X7YCk/status/1245378873816039425
2020-04-01 15:53:50,lilo623,,0,3,2,"#INTERACTIVE: This #Map Shows How Many Have Died From COVID-19 In Each State #coronavirus #COVID19 #COVID_19 #WuhanVirus New York New Jersey California Michigan Florida Massachusetts Illinois Washington Louisiana Pennsylvania Georgia Texas Connecticut Ohio ",,,#INTERACTIVE #Map #coronavirus #COVID19 #COVID_19 #WuhanVirus,1245378850747375616,https://twitter.com/lilo623/status/1245378850747375616
2020-04-01 15:53:32,CivilEats,,1,10,13,"On Monday, amid the rapidly intensifying COVID-19 pandemic, the U.S. Senate quietly approved a controversial scientist from Texas to oversee the safety of the nation’s supply of meat, poultry, and eggs. ",,,,1245378775736557570,https://twitter.com/CivilEats/status/1245378775736557570
2020-04-01 15:52:26,TrinityPh0enix,JulianCastro,1,0,0,"5th Circuit Court of Appeals allowed Gov. Abbott -Ban abortion procedures under his COVID-19 Executive order. Texas women cannot access abortion services, no longer be eligible for medication abortion, seeking 1st trimester abortion will be delayed into 2nd trimester for now 1/2",,,,1245378499667529728,https://twitter.com/TrinityPh0enix/status/1245378499667529728
2020-04-01 15:52:13,WOWDemocrats,,0,1,1,"Texas's ban on abortions during the COVID-19 upheld. Hundreds of procedures already cancelled across #Texas. Contact @GovAbbott now to voice your opposition! #Abortions ARE ESSENTIAL HEALTHCARE!",,@GovAbbott,#Texas #Abortions,1245378441249251328,https://twitter.com/WOWDemocrats/status/1245378441249251328
2020-04-01 15:51:03,AllAboveAll,,0,6,8,"Texas is using COVID-19 as an excuse to ban abortions. Our own Kelsey Ryland sums it up: ""I can’t emphasize enough how shameful it is to take advantage of this pandemic to just further shame women seeking abortion care"". ",,,,1245378150567047168,https://twitter.com/AllAboveAll/status/1245378150567047168
2020-04-01 15:49:33,MePllc,,1,0,0,"Hello and good morning everyone. Please be advised if you live in #Texas and have some mental health concerns related to COVID-19 there is assistance out there: 1-833-986-1919! (PLEASE PLEASE PLEASE share this post.… https://www.instagram.com/p/B-caGkCHD6V/?igshid=cxi6gnw40u36",,,#Texas,1245377771674705921,https://twitter.com/MePllc/status/1245377771674705921
2020-04-01 15:47:40,DavMicRot,,1,0,9,"Florida and Arizona have relatively low support for both President and governor's work on COVID-19. Will keep my eye on Texas as things unfold.",,,,1245377298871857153,https://twitter.com/DavMicRot/status/1245377298871857153
2020-04-01 15:47:20,KF5FUZ,MCTXSheriff,1,0,0,"Bravo @MCTXSheriff: Blood Donation IS an essential activity. #ThankYou for helping US blood supply! Texas First - Methodist Hospital treats COVID-19 with Plasma fm recovered patients! Are you recovered from #Coronavirus #COVID19? see http://RedCrossBlood.org/plasma4covid @MCOEM @RedCrossTXGC",,@MCTXSheriff @MCOEM @RedCrossTXGC,#ThankYou #ThankYou #Coronavirus #COVID19,1245377214323048449,https://twitter.com/KF5FUZ/status/1245377214323048449
2020-04-01 15:47:07,jonmcclellan,,0,0,0,"Inside Texas' Fight to Legalize Cocktail Delivery During COVID-19 @Thrillist",,@Thrillist,,1245377157909676032,https://twitter.com/jonmcclellan/status/1245377157909676032
2020-04-01 15:46:38,brinda_sevak,,2,1,2,"With the COVID-19 cases rising everywhere around the world, this company Sea-Long Medical System Inc. in Texas is building Ventilator Helmets that can help patients in respiratory distress. https://www.uchicagomedicine.org/forefront/patient-care-articles/helmet-based-ventilation-is-superior-to-face-mask-for-patients-with-respiratory-distress #HelmetVentilator #coronavirus #COVIDー19",,,#HelmetVentilator #coronavirus #COVID,1245377036828409856,https://twitter.com/brinda_sevak/status/1245377036828409856
2020-04-01 15:45:24,m7admit,,0,0,0,"Several Texas colleges are altering their academic policies and deadlines this semester due to the many changes made and disruptions that have occurred amid the COVID-19 pandemic. #biology https://www.houstonchronicle.com/news/education/article/Texas-colleges-change-to-pass-fail-grading-during-15160427.php",,,#biology,1245376728471650304,https://twitter.com/m7admit/status/1245376728471650304
2020-04-01 15:45:04,matthewjetthall,,0,0,0,"28 University of Texas spring breakers test positive for COVID-19 after group trip to Mexico ",,,,1245376645290176513,https://twitter.com/matthewjetthall/status/1245376645290176513
2020-04-01 15:42:59,RYHTexas,,0,10,18,"Do you have questions about COVID-19 &amp; its impact on Texas public schools? We are proud to sponsor a live interview with the @TexasTribune's @AliyyaSwaby and @AldineISD Superintendent @drgoffney tomorrow morning at 8 AM. https://bit.ly/3bGmDTx #TxEdRising #TxEd",,@TexasTribune @AliyyaSwaby @AldineISD @drgoffney,#TxEdRising #TxEd,1245376119509041152,https://twitter.com/RYHTexas/status/1245376119509041152
2020-04-01 15:41:36,MikeMehterian,,0,0,0,"Everyone, here is a quick link from the Texas Department of State Health Services to get the latest information on the impact of COVID-19... #Texasstrong #ono #riseabove #covid19 https://lnkd.in/eTk2yJQ",,,#Texasstrong #ono #riseabove #covid19,1245375770970787840,https://twitter.com/MikeMehterian/status/1245375770970787840
2020-04-01 15:39:58,weswilson4,,1,1,1,"There were officially 351 COVID-19 cases in Central Texas in March after 61 new cases on the last day of the month, by far the highest single-day increase. ",,,,1245375361279557634,https://twitter.com/weswilson4/status/1245375361279557634
2020-04-01 15:39:37,soufsidedaze,,0,0,0,"When you ain't got no mask for the #corona #covid-19 #mask #comedy #iamsoufsidedaze @Irving, Texas https://www.instagram.com/p/B-cY90zJR8q/?igshid=1kr4q8ymgaex",,,#corona #covid #mask #comedy #iamsoufsidedaze,1245375273723252736,https://twitter.com/soufsidedaze/status/1245375273723252736
2020-04-01 15:35:44,epicasey,ryanstruyk,0,0,0,"Cool Texas isn't getting covid.! ",,,,1245374294496075777,https://twitter.com/epicasey/status/1245374294496075777
2020-04-01 15:34:13,sim_kern,,14,23,162,"Enraged. We spent all day yesterday sewing masks for our local abortion clinic providers, only to find out a court has upheld Texas’s Covid-related abortion ban. Abortion is essential healthcare ALWAYS. And never more so than during a deadly pandemic! 1/",,,,1245373911832891392,https://twitter.com/sim_kern/status/1245373911832891392
2020-04-01 15:33:34,ladybridge,,1,1,1,"@AlannaSarabiaTV Hello Alanna, We are enjoying watching you work from home. You look great in your cowboy hat ! HAPPY 39th Anniversary Billy Bob's Texas ! Stay safe during this global pandemic coronavirus, COVID-19 #BeSafe",,@AlannaSarabiaTV,#BeSafe,1245373748699713537,https://twitter.com/ladybridge/status/1245373748699713537
2020-04-01 15:32:50,lshenton4,,0,2,8,"Clinic Built By Texas A&amp;M Students Headed To Houston For Battle Against COVID-19 ",,,,1245373565828050944,https://twitter.com/lshenton4/status/1245373565828050944
2020-04-01 15:32:22,LonghornsHive,,0,0,0,"Texas' recruiting efforts adapting on the fly to COVID-19 — Horns 247 #Hookem #Longhorns http://dsh.news/HCV3fjZeJkZJskuyqH7g",,,#Hookem #Longhorns,1245373449129902086,https://twitter.com/LonghornsHive/status/1245373449129902086
2020-04-01 15:31:30,TexasGAL,,0,0,0,"My coworker is sleeping on the job. #workingfromhome #covid #physicaldistancing @Huntsville, Texas https://www.instagram.com/p/B-cYCQopi7C/?igshid=1n5p0a12pz6n1",,,#workingfromhome #covid #physicaldistancing,1245373230707290114,https://twitter.com/TexasGAL/status/1245373230707290114
2020-04-01 15:30:08,SouthTexasISD,,0,3,5,"#STISD accepts the @teainfo COVID-19: ""Stay Well, Texas"" public health campaign two-week challenge. 1: STISD must work together to fight COVID-19. If we stand apart as a community now, we will be together again soon. More: https://loom.ly/fQhRnUg",,@teainfo,#STISD,1245372884916277250,https://twitter.com/SouthTexasISD/status/1245372884916277250
2020-04-01 15:28:45,Tfort9,,0,0,0,"Bracing for COVID-19 in Texas Jails - The Texas Observer. ",,,,1245372536495497217,https://twitter.com/Tfort9/status/1245372536495497217
2020-04-01 15:24:49,TheWarrenCenter,,0,2,3,"Your mental health is very important! Texas Health and Human Services Commission has launched a 24/7 statewide mental health support line to help Texans experiencing anxiety, stress or emotional challenges due to the COVID-19 pandemic. Call toll-free at 833-986-1919. ",,,,1245371547163992066,https://twitter.com/TheWarrenCenter/status/1245371547163992066
2020-04-01 15:23:22,ijustorder,,0,0,0,"To the city of Dallas, and the State of Texas. Lets continue to stick together during COVID-19. ",,,,1245371182800568322,https://twitter.com/ijustorder/status/1245371182800568322
2020-04-01 15:21:39,erinmdouglas23,,1,0,2,"via my email inbox, I report that: - Texas’ service sector is in a deep contraction. @DallasFed indicator dropped to a record low. - Texas may suffer among the steepest job losses due to the COVID-19, @IHSMarkit forecasts - U.S. employment dropped 27K in March, @ADP report shows",,@DallasFed @IHSMarkit @ADP,,1245370750716055554,https://twitter.com/erinmdouglas23/status/1245370750716055554
2020-04-01 15:20:28,LisaGray_HouTX,,4,21,21,"Texas Covid epidemic predicted to peak on May 5. Total deaths (as of Aug. 8): 6,100+ -- modeling by The Institute for Health Metrics and Evaluation ",,,,1245370452459077638,https://twitter.com/LisaGray_HouTX/status/1245370452459077638
2020-04-01 15:20:03,RepublicanRehab,IanLStrain,2,0,0,"Q_E somehow thinks Texas will be immune to COVID-19 because it hasn't reached alarming levels there and governor won't issue stay at home orders. Got news for him. Covid doesn't care if you're a Dem or asshat Republican.",,,,1245370347399991297,https://twitter.com/RepublicanRehab/status/1245370347399991297
2020-04-01 15:19:29,Racheka1,,0,0,0,"28 University of Texas spring breakers test positive for COVID-19 after group trip to Mexico https://www.nbcnews.com/news/us-news/least-28-texas-spring-breakers-test-positive-covid-19-after-n1173231 via @nbcnews",,@NBCNews,,1245370204240125957,https://twitter.com/Racheka1/status/1245370204240125957
2020-04-01 15:17:39,ymediagroup,,0,0,0,"28 spring breakers test positive for COVID-19 in Texas after trip to Mexico @YudhvirJaswal",,@YudhvirJaswal,,1245369742644465668,https://twitter.com/ymediagroup/status/1245369742644465668
2020-04-01 15:16:32,GarfieldsLasgna,UncleChaps,0,0,0,"Texas is projected to be the number one threat area over the next 90 days for Covid. Fed assets are moving now. How is he going to work his balls off the next 90 days to protect against Hurricane/Tornado season &amp; the pandemic &amp; getting aid &amp; moving assets.",,,,1245369461584146432,https://twitter.com/GarfieldsLasgna/status/1245369461584146432
2020-04-01 15:16:09,openletterbot,,0,0,0," I delivered “COVID-19 Response.” from George, a verified voter in Harker Heights, Texas, to @GovAbbott #TXpolitics Write your own: https://twitter.com/messages/compose?recipient_id=835740314006511618&amp;text=resist",,@GovAbbott,#TXpolitics,1245369364901031938,https://twitter.com/openletterbot/status/1245369364901031938
2020-04-01 15:16:07,BlabTron,,0,0,0,"Hello World! (I realize it's not awe inspiring but its customary given the circumstance..no I'm not a bot - twitter has confirmed ) Kicking off post history w/a random image from my lib - Texas /Covid Breakfast #Texas #covidlife #SanAntonio #covidReset #boredinisolation",,,#Texas #covidlife #SanAntonio #covidReset #boredinisolation,1245369358559383553,https://twitter.com/BlabTron/status/1245369358559383553
2020-04-01 15:15:06,prepseer,,2,0,0,"@FoxBusiness @Varneyco It's time for a law that would allow prosecution of people like the 70 Texas students who went to Mexico on spring break, got infected with Covid-19 and flew back on separate commercial flights, putting hundreds of innocent people at risk. #lowlifes",,@FoxBusiness @Varneyco,#lowlifes,1245369103872901120,https://twitter.com/prepseer/status/1245369103872901120
2020-04-01 15:15:00,KWKTFOX44,,0,0,1,"Texas inmates are suing over treatment during COVID-19 pandemic ",,,,1245369077561991168,https://twitter.com/KWKTFOX44/status/1245369077561991168
2020-04-01 15:13:31,Michell19097199,,0,0,0,"Breaking! Texas Governor PROHIBITS Counties &amp; Cities from BANNING Religious Services during COVID-19 | TexasGOPVote ",,,,1245368705204260864,https://twitter.com/Michell19097199/status/1245368705204260864
2020-04-01 15:12:35,PoliticusSarah,,1,22,28,"Former FDA Commissioner Scott Gottlieb has called on Texas and Florida to do more to contain the spread of Covid-19. Dr. Gottlieb told CNBC that the states’ governors needed to take action. https://www.politicususa.com/2020/04/01/former-fda-commissioner-urges-republican-governors-to-be-more-aggressive-against-coronavirus.html via @politicususa",,@politicususa,,1245368468603617281,https://twitter.com/PoliticusSarah/status/1245368468603617281
2020-04-01 15:09:30,politicususa,,3,23,24,"Former FDA Commissioner Scott Gottlieb has called on Texas and Florida to do more to contain the spread of Covid-19. Dr. Gottlieb told CNBC that the states’ governors needed to take action. https://www.politicususa.com/2020/04/01/former-fda-commissioner-urges-republican-governors-to-be-more-aggressive-against-coronavirus.html via @politicususa",,@politicususa,,1245367694792294408,https://twitter.com/politicususa/status/1245367694792294408
2020-04-01 15:09:18,WNCN,,0,0,2,"Texas prisoners suing for soap, hand sanitizer, COVID-19 safety measures https://wncn.tv/2R4kjO7",,,,1245367643026141191,https://twitter.com/WNCN/status/1245367643026141191
2020-04-01 15:09:14,rkzenrage,,0,0,0,"28 University of Texas spring breakers test positive for COVID-19 after group trip to Mexico https://www.nbcnews.com/news/us-news/least-28-texas-spring-breakers-test-positive-covid-19-after-n1173231?cid=googlenews-worldnews",,,,1245367624843907074,https://twitter.com/rkzenrage/status/1245367624843907074
2020-04-01 15:08:00,Keszenman,,1,0,0,"Liderados por Texas, varios estados del sur y centro de los EEUU han incluido los abortos voluntarios en la lista de procedimientos médicos ""no urgentes"" prohibidos mientras continúe la epidemia de Covid-19.",,,,1245367313525870592,https://twitter.com/Keszenman/status/1245367313525870592
2020-04-01 15:05:56,Hanzelmo,BarudJean,0,0,0,"No perder el objetivo de mi tweet, la nota de los contagiados de COVID-19 de Texas y la carta que presenta ""Eri"" no hacen sentido. Los medios no son de confiar, solo que si van a presentar información se aseguren que sea vdd cualquiera sea bot, persona, alien o medio.",,,,1245366793587150853,https://twitter.com/Hanzelmo/status/1245366793587150853
2020-04-01 15:04:28,FriendsOfPipe,,0,0,0,"Bracing for COVID-19 in Texas Jails - The Texas Observer ",,,,1245366424521961472,https://twitter.com/FriendsOfPipe/status/1245366424521961472
2020-04-01 15:04:07,itserickaaa_,,2,10,3,"Texas “closed its borders” to all those places with high covid cases and is requiring anyone flying in to quarantine for 14 days...but they aren’t enforcing it in any way. They’re just telling them at the airport “hey self quarantine for 14 days” and letting them leave......????",,,,1245366340011073545,https://twitter.com/itserickaaa_/status/1245366340011073545
2020-04-01 15:03:49,AdamBennettKHOU,,1,10,11,"Mayor Turner said during a conference call yesterday, Dr. @PeterHotez felt the COVID-19 peak in Texas would happen around May 2, assuming people continue practicing social distancing.",,@PeterHotez,,1245366263326572545,https://twitter.com/AdamBennettKHOU/status/1245366263326572545
2020-04-01 15:02:08,SweetDreamDear,,0,0,0,"【NCBS NEWS】 (April 1, 2020, 4:23 AM JST) ""28 University of Texas spring breakers test positive for COVID-19 after group trip to Mexico"" - Ben Kesslen The group traveled together on a chartered plane to Mexico about a week and a half ago. &lt;https://www.nbcnews.com/news/us-news/least-28-texas-spring-breakers-test-positive-covid-19-after-n1173231&gt;",,,,1245365838900674561,https://twitter.com/SweetDreamDear/status/1245365838900674561
2020-04-01 15:02:07,JWalkNTexas,,0,0,0,"Some type of CoVid hit Texas 6 years ago and overwhelmed our hospitals. It killed an estimated 300k-500k Texans very rapidly; in a matter of twelve to twenty weeks. Alex Jones lost two relatives. It almost killed me by filling my lungs with water. I killed it off with Allicin",,,,1245365835092410370,https://twitter.com/JWalkNTexas/status/1245365835092410370
2020-04-01 15:01:55,CityLakeDallas,,0,0,0,"North Texas Cares is a funder collaborative made up of North Texas foundations &amp; United Ways that have come together to provide support for organizations that work with people and communities who may be most negatively affected by COVID-19. https://www.northtexascares.org/",,,,1245365785305985025,https://twitter.com/CityLakeDallas/status/1245365785305985025
2020-04-01 15:01:49,solisSolja,,1,0,0,"So we are treating covid-19 patients in Texas with survivors plasma. They beat the infection and hopefully will help others beat it and build an immunity for it.",,,,1245365759662055426,https://twitter.com/solisSolja/status/1245365759662055426
2020-04-01 15:00:39,KOYNFM,,0,0,0,"Covid-19 in Texas By The Numbers Through March 31st....Read more here: http://ow.ly/Anf450z1Z5z",,,,1245365464555020294,https://twitter.com/KOYNFM/status/1245365464555020294
2020-04-01 15:00:04,KAMCNews,,0,0,1,"The lawsuit alleges the Texas Department of Criminal Justice (TDCJ) has failed to ""take proper measures to prevent transmission of COVID-19 to some of its most vulnerable inmates."" ",,,,1245365317129437185,https://twitter.com/KAMCNews/status/1245365317129437185
2020-04-01 14:59:43,KevinOlivasMedi,,0,0,0,".@cbsaustin @Mr_JCE: #COVID-19: Love amid the emptiness: Austin, Texas filmmakers give new perspective on social distancing during a time that would have marked the end of SXSW 2020: ",,@cbsaustin @Mr_JCE,#COVID,1245365230265344000,https://twitter.com/KevinOlivasMedi/status/1245365230265344000
2020-04-01 14:58:48,JordanPilarski,,0,0,0,"@JColeNC can you go on another or just come to Texas? In desperate need of another Cole concert. After all this covid stuff ofc. Your health is important to me. ",,@JColeNC,,1245364999217963013,https://twitter.com/JordanPilarski/status/1245364999217963013
2020-04-01 14:57:55,AmarilloPublic,,0,0,2,"Texas Health and Human Services has launched a 24/7 statewide mental health support line to help Texans experiencing anxiety, stress or emotional challenges due to the COVID-19 pandemic. Available toll-free: 833-986-1919.",,,,1245364777146355713,https://twitter.com/AmarilloPublic/status/1245364777146355713
2020-04-01 14:57:19,GURROLAPLUS,,0,0,0,"28 de 70 turistas estadounidenses que viajaron a Cabo San Lucas para pasar el ‘spring break’ dieron positivo a COVID-19 a su regreso, en Texas. https://www.animalpolitico.com/2020/03/turistas-cabo-san-lucas-spring-break-covid19/ vía @pajaropolitico",,@Pajaropolitico,,1245364628126867456,https://twitter.com/GURROLAPLUS/status/1245364628126867456
2020-04-01 14:56:54,mrichtel,,0,1,3,"Talking Covid-19 and An Elegant Defense, The Extraordinary New Science of The Immune System - on @kerathink think, a great NPR and PBS show in Texas. Today, noon CST. ",,@kerathink,,1245364524120604672,https://twitter.com/mrichtel/status/1245364524120604672
2020-04-01 14:55:15,bluetejana,,0,0,0,"Rice researchers create interactive map of COVID cases in Texas http://news.rice.edu/2020/03/31/rice-researchers-covid-map-interactive-coronavirus-dashboard-texas/",,,,1245364108800786432,https://twitter.com/bluetejana/status/1245364108800786432
2020-04-01 14:55:12,SCRAMsystems,,0,1,0,"Read the Recommended Strategies for Sheriffs and Jails to Respond to the COVID-19 Crisis, written by Michele Deitch, senior lecturer at the Lyndon B. Johnson School of Public Affairs at the University of Texas at Austin. http://ow.ly/XLyJ50z1cQu",,,,1245364092703031302,https://twitter.com/SCRAMsystems/status/1245364092703031302
2020-04-01 14:53:10,angus_with,MeeezerM,0,0,0,"The US COVID-19 mortality rate is about half or a third of those socialized healthcare countries. And deaths per million about 1/6th to 1/20th of most of them. This is NOT a 'failure' of Trump or our healthcare system. ",,,,1245363582520475649,https://twitter.com/angus_with/status/1245363582520475649
2020-04-01 14:52:57,RDunhamDPIC,,0,0,1,"More coronavirus impact on potential #deathpenalty cases—COVID-19 delays decision on whether to seek death penalty in #HidalgoCounty (Brownsville) capital murder case. https://www.brownsvilleherald.com/news/valley/covid-19-delays-death-penalty-decision/article_802337a4-73b2-11ea-8e53-93fccf6e8afb.html @BrownsvilleNews @DPInfoCtr #Texas #VictorGodinez",,@BrownsvilleNews @DPInfoCtr,#deathpenalty #HidalgoCounty #Texas #VictorGodinez,1245363527604453383,https://twitter.com/RDunhamDPIC/status/1245363527604453383
2020-04-01 14:51:41,Nardoz___,,0,1,2,"Sindaco di Georgetown (Texas) che durante un meeting sull'emergenza Covid-19 viene colto da un attacco di diarrea e dimentica di spegnere il microfono quando é in bagno. VIDEO DELL'ANNO IN ASSOLUTO ",,,,1245363208996769797,https://twitter.com/Nardoz___/status/1245363208996769797
2020-04-01 14:50:13,MimiMor62245391,,0,0,0,"@doctorgaona buenos días doctor, aquí en Texas se esta pidiendo donaciones de sangre, dicen que están van a tratar con plasma de personas recuperadas del Covid, usted que piensa? Cree que pueden conseguir una cura con el plasma?",,@doctorgaona,,1245362840137011201,https://twitter.com/MimiMor62245391/status/1245362840137011201
2020-04-01 14:49:53,RMFifthCircuit,,1,0,0,"From my perspective as an outsider to these kinds of cases, these arguments seem like one would expect - Texas is allegedly using COVID-19 to eliminate the right to abortion. 2/ ",,,,1245362756313808898,https://twitter.com/RMFifthCircuit/status/1245362756313808898
2020-04-01 14:49:49,tkradio,,0,1,2,"Texas A&amp;M researchers create do-it-yourself protective masks for hospitals battling COVID-19 ",,,,1245362737770872833,https://twitter.com/tkradio/status/1245362737770872833
2020-04-01 14:49:30,gharvart,FuckingAGuys,1,0,0,"Yup. America in DEAD LAST position in a world matchup with all responses to COVID-19. The richest, arguably the smartest and the best equipped country on the planet and they come up in last place. Like so much garbage in America today, this started with person.",,,,1245362661946060805,https://twitter.com/gharvart/status/1245362661946060805
