date,username,to,replies,retweets,favorites,text,geo,mentions,hashtags,id,permalink
2020-04-09 23:58:37,BeeHireThinking,,0,0,0,"@GregAbbott_TX The Texas Unemployed need your help! Endless calls with automated responses, a broken TWC website and a lack of live TWC staff accessible to the volume impacted by COVID; plus the O&amp;G crash is NOT OK! How are you working to change this? FIX this!",,@GregAbbott_TX,,1248399953715531778,https://twitter.com/BeeHireThinking/status/1248399953715531778
2020-04-09 23:57:26,Legal_Voice,,0,2,1,"BREAKING NEWS!!! A victory in Texas on abortion and Covid-19! ",,,,1248399653617328129,https://twitter.com/Legal_Voice/status/1248399653617328129
2020-04-09 23:52:47,HoustonPubMedia,,0,0,2,"A federal court has – yet again – temporarily halted Texas’ ban on abortions during the COVID-19 pandemic. (via @KUT)",,@KUT,,1248398483536482305,https://twitter.com/HoustonPubMedia/status/1248398483536482305
2020-04-09 23:50:02,skarritt,,0,0,0,"Police looking for Texas woman bragging on social media about spreading COVID-19 http://dlvr.it/RTVjn0",,,,1248397792009048064,https://twitter.com/skarritt/status/1248397792009048064
2020-04-09 23:49:42,Texas56,,0,0,0,"These numbers ..smh Texas has 29+ million in population 199 have died We are all in lockdown COVID-19 In Texas (Dashboard) Mobile Optimized https://txdshs.maps.arcgis.com/apps/opsdashboard/index.html#/3f048ced32804271aafe8b9640bcb4a7",,,,1248397709867798528,https://twitter.com/Texas56/status/1248397709867798528
2020-04-09 23:46:17,BrianBernardLaw,,0,0,0,"Former Deputy GC of San Antonio-based Andeavor Joins Cognizant in the Wake of a Bribery Scandal During COVID-19 Outbreak https://ift.tt/2RrJpXl Texas LawyerPhillip Bantzhttps://images.law.com/contrib/content/uploads/sites/401/2020/04/Tesoro_Corporation_headquarters_San_Antonio…",,,,1248396850354241538,https://twitter.com/BrianBernardLaw/status/1248396850354241538
2020-04-09 23:46:05,hemingwaysktn,,0,0,0,"I just signed the petition to support Texas brewers during the COVID-19 crisis by allowing them to temporarily deliver and ship beer to Texans practicing social distancing. Support small businesses &amp; sign the petition! https://p2a.co/rjFggpi #StayHomeTexas #Beer #Coronavirus",,,#StayHomeTexas #Beer #Coronavirus,1248396797602488320,https://twitter.com/hemingwaysktn/status/1248396797602488320
2020-04-09 23:45:49,MamaPaige81,wfaaweather,0,1,0,"Texas allergy sufferers.. ""is it pollen or covid?"" #allergies",,,#allergies,1248396730099326977,https://twitter.com/MamaPaige81/status/1248396730099326977
2020-04-09 23:45:00,theeagle,,0,1,2,"Tune into KAMU at 7 p.m. as experts and officials from the Texas A&amp;M University System will offer insights into the COVID-19 pandemic on a new television series that begins tonight. ",,,,1248396524641533954,https://twitter.com/theeagle/status/1248396524641533954
2020-04-09 23:44:41,Patrici65769241,,0,1,1,"Living w/covid- 19. So we're living off the land w/a delicious saute recipe of wild harvested yucca flowers. Picked 2 times more than we can eat in one day. Pork butt and fried Texas potatoes. Tomorrow we make Easter eggs. CAN NOT WAIT !! God bless America And God bless you. ",,,,1248396448229548034,https://twitter.com/Patrici65769241/status/1248396448229548034
2020-04-09 23:44:20,RavenBluesGeek,,0,0,0,"Texas City COVID-19 patients receive hydroxychloroquine https://www.galvnews.com/news/free/article_b59bab46-543a-5116-8e37-2f330a8fc008.html?utm_medium=social&amp;utm_source=twitter&amp;utm_campaign=user-share via @GalvNews",,@GalvNews,,1248396358593073162,https://twitter.com/RavenBluesGeek/status/1248396358593073162
2020-04-09 23:40:19,EastTexasNow,,0,0,1,"East Texas nurses traveling to New York City to aid in COVID-19 response: https://bit.ly/3c4K4Gc",,,,1248395348805963778,https://twitter.com/EastTexasNow/status/1248395348805963778
2020-04-09 23:40:03,25NewsKXXV,,0,0,1,"MAP: Reported COVID-19 cases in Central Texas, Brazos Valley https://buff.ly/2WqD55I",,,,1248395279226683394,https://twitter.com/25NewsKXXV/status/1248395279226683394
2020-04-09 23:38:18,RyanCol31794030,ABC,0,0,4,"@ABC This video (starting at 1:45) is a University of Texas Professor and ER Doctor that talks about GIAPREZA as a treatment for septic shock due to COVID-19. ",,@ABC,,1248394840435392512,https://twitter.com/RyanCol31794030/status/1248394840435392512
2020-04-09 23:38:11,BernardLawFirm,,0,0,0,"Former Deputy GC of San Antonio-based Andeavor Joins Cognizant in the Wake of a Bribery Scandal During COVID-19 Outbreak Texas LawyerPhillip Bantzhttps://images.law.com/contrib/content/uploads/sites/401/2020/04/Tesoro_Corporation_headquarters_San_Antonio… https://ift.tt/2RrJpXl",,,,1248394808986488832,https://twitter.com/BernardLawFirm/status/1248394808986488832
2020-04-09 23:38:00,tanisaJ,,0,0,0,"Ex-Judge Slams Houston Criminal Judges for Forcing In-Person Appearances Amid COVID-19 Spread | Texas Lawyer ",,,,1248394764174548993,https://twitter.com/tanisaJ/status/1248394764174548993
2020-04-09 23:35:18,mann88,,0,0,0,"Merger of airline-data companies... C.) Home Care assistance of Dallas looking for caregivers, managers... D.) Coronavirus: Texas: Does heat, humidity kill COVID 19? E.) I team: Customers fighting to get money back after canceled trips, events... F.) Zoom privacy and sec.",,,,1248394085951393793,https://twitter.com/mann88/status/1248394085951393793
2020-04-09 23:30:59,cbsaustin,,0,2,2,"Texas COVID-19 cases top 10,000, deaths go past 200 ",,,,1248393000327077890,https://twitter.com/cbsaustin/status/1248393000327077890
2020-04-09 23:30:05,DuncanBanner,,0,0,0,"A man from Fort Worth, Texas, faces accusations from law enforcement that he claimed to have the COVID-19 virus while under arrest as health care workers were administering a blood draw for intoxication. ",,,,1248392773973102593,https://twitter.com/DuncanBanner/status/1248392773973102593
2020-04-09 23:30:00,FOX4,,0,8,64,"Nurses cheer for North Texas COVID-19 survivor as she leaves the hospital ",,,,1248392750296223750,https://twitter.com/FOX4/status/1248392750296223750
2020-04-09 23:26:59,WayneCobb61,,0,0,0,"""COVID-19 is spreading in nursing homes. Texas won't share details."" ",,,,1248391989747265536,https://twitter.com/WayneCobb61/status/1248391989747265536
2020-04-09 23:25:09,ITDRC,,0,4,12,"Small towns are struggling as they respond to a global pandemic. Collecting testing data requires more equipment than the average #HSEM has in house. ITDRC is providing surge resources to assist the Southeast Texas Regional Operations Center in their #COVID response#CommIsAid ",,,#HSEM #COVID,1248391528457728006,https://twitter.com/ITDRC/status/1248391528457728006
2020-04-09 23:22:13,borealwoods,nowthisnews,1,0,0,"Texas. Gov Abbott failed his people. Very damning evidence of that. #COVID #redstate",,,#COVID #redstate,1248390791837278219,https://twitter.com/borealwoods/status/1248390791837278219
2020-04-09 23:21:38,Parker_Rush,,0,0,0,"@Ron_Nirenberg TESTING TESTING TESTING Texas isn't doing enough open testing. Without cases confirmed, our stats mean NOTHING PLEASE do MAIL-IN ballots. Don't let Texas repeat the shameful primary vote in Wisconsin Thank you for extending #StayHome order #coronavirus #COVID",,@Ron_Nirenberg,#StayHome #StayHome #coronavirus #COVID,1248390645456097281,https://twitter.com/Parker_Rush/status/1248390645456097281
2020-04-09 23:21:15,tamukEd,tamusystem,0,0,1,"Tune in to @KAMUTVFM tonight at 7 p.m. to hear about how the Texas A&amp;M System is responding to COVID-19. ",,@KAMUTVFM,,1248390550144684036,https://twitter.com/tamukEd/status/1248390550144684036
2020-04-09 23:19:42,HicksThomasLLP,,0,1,0,"Businesses facing emergency downsizing in the wake of the COVID-19 crisis. Hicks Thomas partner Stewart Hoffer and senior associate Kasi Chadwick walk through the do’s and don’ts in this article published by Texas Lawbook. (subscription required) https://bit.ly/2UVTX35",,,,1248390158346375170,https://twitter.com/HicksThomasLLP/status/1248390158346375170
2020-04-09 23:17:14,Lyz_Holz,AshLopezRadio,1,0,7,"Texas using covid to ban abortions in the entire state?? So we’re just gonna pretend abortion isn’t essential healthcare? ...lame and restrictive ",,,,1248389536737980418,https://twitter.com/Lyz_Holz/status/1248389536737980418
2020-04-09 23:16:16,Nightline,,4,2,3,"Texas governor sued for issuing an executive order banning accused violent offenders from seeking bail to avoid possibly contracting COVID-19. ",,,,1248389293011120131,https://twitter.com/Nightline/status/1248389293011120131
2020-04-09 23:12:16,KLTV7,,0,0,1,"Titus County Judge Brian Lee is reporting the sixth COVID-19-positive case in the past seven days with a plea from help: ""What can we do to stop the spread??"" We have an updated list for cases from all East Texas counties here: https://bit.ly/2Vh1gl1",,,,1248388288626348040,https://twitter.com/KLTV7/status/1248388288626348040
2020-04-09 23:05:38,AnalyticaGlobal,,0,0,1,"CORONAVIRUS As of this week, inmates at The Fort Bend County jail in Texas are now making face masks to help in the fight against the coronavirus. The U.S. has over 465,000 COVID-19 cases and more than 16,000 deaths. (AP) ",,,,1248386617804349440,https://twitter.com/AnalyticaGlobal/status/1248386617804349440
2020-04-09 23:04:34,TXBells,,0,0,0,"#COVIDー19 #HEB #Texas ""Pearland H-E-B worker tests positive for COVID-19"" https://www.houstonchronicle.com/neighborhood/pearland/news/amp/Pearland-H-E-B-worker-tests-positive-for-COVID-19-15190755.php",,,#COVID #HEB #Texas,1248386350371319808,https://twitter.com/TXBells/status/1248386350371319808
2020-04-09 23:04:17,FRC6171,,2,7,41,"We’re doing what we can to support those battling COVID-19 by cutting PPE face guards for @bswhealth in North Texas. #staysafe #helpingothers #omgrobots @PSHSWildcats",,@bswhealth @PSHSWildcats,#staysafe #helpingothers #omgrobots,1248386279110094849,https://twitter.com/FRC6171/status/1248386279110094849
2020-04-09 23:03:40,HelloWoodlands,,0,0,1,"#TheWoodlands @TheTownshipTX COVID-19 Update - April 9: - Board of Directors Special meeting at 6pm - Montgomery County Cases and 76 Recoveries - Harris County - NW Quadrant: 143 Recoveries - Texas Workforce Commission unemployment call times Read more: ",,@TheTownshipTX,#TheWoodlands,1248386124797448192,https://twitter.com/HelloWoodlands/status/1248386124797448192
2020-04-09 23:03:19,TXBells,,0,0,0,"#COVIDー19 #HEB #Houston ""Coronavirus Texas: 2 H-E-B workers in Houston area reportedly test positive for COVID-19 | http://abc13.com"" https://abc13.com/amp/h-e-b-bunker-hill-employees-test-positive-for-coronavirus-covid-19/6081127/",,,#COVID #HEB #Houston,1248386036155047939,https://twitter.com/TXBells/status/1248386036155047939
2020-04-09 23:03:08,palestineherald,,0,0,0,"Officials with the Texas Department of Criminal Justice announced Thursday that any facility that has a positive offender or employee/staff COVID-19 test will be placed on lockdown. The lockdown covers 15 prisons, including the Beto Unit in Anderson… ",,,,1248385987954139139,https://twitter.com/palestineherald/status/1248385987954139139
2020-04-09 23:00:03,klstnews,,0,0,0,"With new recommendations from the U.S. Centers for Disease Control and Prevention around wearing masks or face coverings while in public during the COVID-19 pandemic, some places in Texas are taking it to the next step. ",,,,1248385215220699137,https://twitter.com/klstnews/status/1248385215220699137
2020-04-09 23:00:02,AscensionSeton,,0,1,2,"In a column published by Elgin Courier, Robbie Rabe, hospital administrator at Ascension Seton Bastrop and Ascension Seton Smithville, shares COVID-19 information with rural communities in Central Texas. Read more. http://ascn.io/60131LcGD",,,,1248385210153988097,https://twitter.com/AscensionSeton/status/1248385210153988097
2020-04-09 23:00:02,ksannews,,0,0,0,"With new recommendations from the U.S. Centers for Disease Control and Prevention around wearing masks or face coverings while in public during the COVID-19 pandemic, some places in Texas are taking it to the next step. https://www.conchovalleyhomepage.com/news/cities-and-counties-in-texas-that-require-people-to-wear-a-mask-in-public/",,,,1248385207540969473,https://twitter.com/ksannews/status/1248385207540969473
2020-04-09 23:00:00,VOANews,,4,22,35,"CORONAVIRUS As of this week, inmates at The Fort Bend County jail in Texas are now making face masks to help in the fight against the coronavirus. The U.S. has over 465,000 COVID-19 cases and more than 16,000 deaths. (AP) ",,,,1248385199966208001,https://twitter.com/VOANews/status/1248385199966208001
2020-04-09 22:59:47,jaynegrady25,,0,0,0,"Texas woman claimed COVID-19 is a media hoax &amp; can be stopped by “faith.” Days later she died. / LGBTQ Nation ",,,,1248385147897917448,https://twitter.com/jaynegrady25/status/1248385147897917448
2020-04-09 22:58:14,TheTownshipTX,,0,2,1,"The Woodlands Township #COVID19 Update for April 9, 2020: https://cvcpl.us/3i3NbEp Montgomery Co. &amp; Harris Co. COVID-19 case count as of April 9, 2020 A Guide to Community Service While Social Distancing Information from the Texas Workforce Commission ",,,#COVID19,1248384756032491520,https://twitter.com/TheTownshipTX/status/1248384756032491520
2020-04-09 22:57:19,greeenorg,,0,0,0,"Texas COVID-19 Cases Top 10,000, Deaths Go Past 200 - https://greeen.info/?p=3252294",,,,1248384525526126593,https://twitter.com/greeenorg/status/1248384525526126593
2020-04-09 22:56:10,Ardamora,,1,0,0,"Webb County, home to Laredo, has had 155 cases of COVID-19, including a 4-month-old and 80-year-old who tested positive on Tuesday, officials said Wednesday. The area has had six deaths from the virus — the most in South Texas — and most of the cases are via “community spread,”",,,,1248384236744093703,https://twitter.com/Ardamora/status/1248384236744093703
2020-04-09 22:56:08,UnitedWayDenton,,0,1,2,"We are proud to be part of a collaborative of North Texas funders, foundations &amp; United Ways to provide support for organizations working with people and communities most affected by COVID-19. Learn more at http://www.northtexascares.org. #NorthTexasCares #UNITED4DentonCounty",,,#NorthTexasCares #UNITED4DentonCounty,1248384229873860611,https://twitter.com/UnitedWayDenton/status/1248384229873860611
2020-04-09 22:55:42,TXIrrigation,,0,0,1,"Need info on Texas resources and help as a small businesses and/or as an employee? The Texas Economic Development webpage has updated information and links to help you. Also featured is an opportunity to sign up for COVID-19 updates for small business.",,,,1248384118980669445,https://twitter.com/TXIrrigation/status/1248384118980669445
2020-04-09 22:53:39,skohayes,,0,1,1,"COVID-19 May Be Silently Spreading Across Rural Counties, University of Texas Researchers Believe ",,,,1248383603928530944,https://twitter.com/skohayes/status/1248383603928530944
2020-04-09 22:52:19,covhs,,0,0,0,"At Covenant Health in West Texas and eastern New Mexico, our commitment to safety is unwavering. To learn more about COVID-19, Covenant Health testing locations and more, visit our new COVID-19 webpage: http://spr.ly/60101Lmua",,,,1248383265632735232,https://twitter.com/covhs/status/1248383265632735232
2020-04-09 22:49:13,ifsaal044,HKrassenstein,0,0,0,"From February 1, 2020 - April 4, 2020, pneumonia deaths in Texas are over 2,000 where they did not test the patient for COVID-19. Texas has a much bigger death rate than actually being reported. In all of 2017, texas had close to 3000 deaths attributed to influenza and pneumonia",,,,1248382486322663424,https://twitter.com/ifsaal044/status/1248382486322663424
2020-04-09 22:47:49,thepinkinsidedo,TeamTrump,0,0,0,"https://photos.app.goo.gl/DV8hzNBfK8iEqTK88 More Body Parts are beginning to surface on the coast of Waikiki.....George Quinn Geo OTKO GooEaxe will be fderally prosecuted in Texas for the federal acts of HRS code 187 as the COVID-19 continues to spread in Portland, Washington and Lake Tahoe",,,,1248382133497823240,https://twitter.com/thepinkinsidedo/status/1248382133497823240
2020-04-09 22:45:33,escrow_shout,,0,0,0,"Luxury hotel owner predicts rapid rebound in North Texas after COVID-19 http://dlvr.it/RTVbqx",,,,1248381564246843396,https://twitter.com/escrow_shout/status/1248381564246843396
2020-04-09 22:43:37,QuestoyQueLotro,,0,0,0,"Empleado de HEB de #McAllen, #Texas da positivo a covid-19 https://elmanana.com.mx/empleado-de-h-e-b-de-mcallen-texas-da-positivo-a-covid-19/ #Laredo #NuevoLaredo",,,#McAllen #Texas #Laredo #NuevoLaredo,1248381077208444931,https://twitter.com/QuestoyQueLotro/status/1248381077208444931
2020-04-09 22:42:42,TXRightToLife,,1,4,10,"UPDATE: A District Judge just granted another TRO allowing for certain chemical and late abortions, days after the Fifth Circuit Court ruled in favor of Texas' Executive Order prohibiting elective abortions to preserve PPEs during COVID pandemic. Stay tuned for updates.",,,,1248380847243137024,https://twitter.com/TXRightToLife/status/1248380847243137024
2020-04-09 22:41:33,swaGGerscan,,0,4,10," NEW MUSIC RELEASE: “Corona Blues” by #JaboTheTexasPrince *View Full Version here https://www.instagram.com/tv/B-xp4sUgobQ/?igshid=1gcake56peurd ——— #Texas #Corona #Houston #CorinaBlues #COVIDIDIOTS #Coronavirus #COVIDー19 #COVID19 #COVID #swaG",,,#JaboTheTexasPrince #Texas #Corona #Houston #CorinaBlues #COVIDIDIOTS #Coronavirus #COVID #COVID19 #COVID #swaG,1248380558918299654,https://twitter.com/swaGGerscan/status/1248380558918299654
2020-04-09 22:38:27,BernardLawFirm,,0,0,0,"Ex-Judge Slams Houston Criminal Judges for Forcing In-Person Appearances Amid COVID-19 Spread Texas LawyerAngela Morrishttps://images.law.com/contrib/content/uploads/sites/401/2020/04/Lawyers-Houston-Coronavirus-Article-202004091600.jpgState and Local Go… ",,,,1248379779847311361,https://twitter.com/BernardLawFirm/status/1248379779847311361
2020-04-09 22:37:06,allisamiller,,0,1,2,"Texas Tech is hoping to increase COVID-19 testing in Amarillo by making supplies needed to test. @NewsChannel10",,@NewsChannel10,,1248379436635832325,https://twitter.com/allisamiller/status/1248379436635832325
2020-04-09 22:36:46,drjasonness,,0,0,1,"@KidsAreInCharge A kid driven pop-up school (grades 4-5) that started when the schools closed b/c of Covid-19. Run by kids, for kids. Check out the lesson by @mkonnikova on Texas No-limit Hold’em Poker! Fun for kids and parents! #gamenight",,@KidsAreInCharge @mkonnikova,#gamenight,1248379354838523907,https://twitter.com/drjasonness/status/1248379354838523907
2020-04-09 22:35:07,cindylgeorge,,0,2,2,"Will the #virus that causes COVID-19 illness wane in warmer weather? It's unlikely according to a @NASEM panel. Read more in today's continuing #coronavirus update from the Texas Medical Center News in #Houston — https://www.tmc.edu/news/2020/04/coronavirus-connection-a-texas-medical-center-continuing-update/ #COVID19",,@nasem,#virus #coronavirus #Houston #COVID19,1248378937660465153,https://twitter.com/cindylgeorge/status/1248378937660465153
2020-04-09 22:31:46,elizawally,,0,0,0,"Stop Undermining Texans' Safety We're asking Governor Abbott to rescind his recent executive order to prevent an outbreak of the COVID-19 coronavirus in Texas carceral facilities. ",,,,1248378094680866816,https://twitter.com/elizawally/status/1248378094680866816
2020-04-09 22:31:17,drwolfe3,,0,0,1,"Texas covid ain’t nothing but a thing!!! #@realDonaldTrump ",,,,1248377973914255360,https://twitter.com/drwolfe3/status/1248377973914255360
2020-04-09 22:29:45,ZoeTillman,ZoeTillman,5,40,53,"Texas is expected to take this right back up to the 5th Circuit, which two days ago vacated the district judge's first TRO blocking the state's COVID-related abortion ban, see: ",,,,1248377590278057985,https://twitter.com/ZoeTillman/status/1248377590278057985
2020-04-09 22:28:52,GuzmanZidane,Texasknight99,0,0,1,"Harris County has been hit the hardest throughout Texas dude. People are dying from Covid-19, and the last thing Houston needs is to be in a similar situation as New York. So how about you PROTECT YOURSELF AND YOUR KIDS by staying INSIDE. Or just get infected and burden others. ",,,,1248377368227360775,https://twitter.com/GuzmanZidane/status/1248377368227360775
2020-04-09 22:28:26,ZoeTillman,,7,140,256,"NOW: A federal judge in Texas has, for a second time, granted a temporary restraining order blocking the state's COVID abortion ban — specific to medication abortions and certain time-sensitive surgical procedures https://assets.documentcloud.org/documents/6834373/4-9-20-PP-v-Texas-Second-TRO.pdf",,,,1248377257875234819,https://twitter.com/ZoeTillman/status/1248377257875234819
2020-04-09 22:27:48,stevenmazie,stevenmazie,2,9,14,"As @RMFifthCircuit points out, this order will be immediately challenged to the 5th circuit, which is likely to stay it and re-institute the covid-inspired ban on abortion in Texas. That will tee up a battle at the Supreme Court. ",,@RMFifthCircuit,,1248377097560526849,https://twitter.com/stevenmazie/status/1248377097560526849
2020-04-09 22:26:51,fishr312,DrGJackBrown,0,0,1,"Zero test kits where I live in Texas. That's the reason our #COVID_19 numbers are so low @GovAbbot WE NEED MORE TEST KITS IN SOUTH TEXAS! DO YOUR JOB! ",,@GovAbbot,#COVID_19,1248376857218527233,https://twitter.com/fishr312/status/1248376857218527233
2020-04-09 22:26:30,TexasGi07160814,ScottAdamsSays,0,0,0,"I found this data from the Texas state Covid website. A current listing of #beds and #available, #ICU beds and #available, #ventilators and #available by region. https://txdshs.maps.arcgis.com/apps/opsdashboard/index.html#/ed483ecd702b4298ab01e8b9cafc8b83",,,,1248376768773246979,https://twitter.com/TexasGi07160814/status/1248376768773246979
2020-04-09 22:24:34,porcelain2015,CharlesPumilia,0,0,0,"the one person I know with covid is a Republican from Texas. She is a Grandma.",,,,1248376283953692679,https://twitter.com/porcelain2015/status/1248376283953692679
2020-04-09 22:20:00,Mori4Real,,0,0,1,"AUSTIN, Texas (AP) — A 72-year-old is first Texas state inmate reported to be a possible COVID-19 fatality during the new coronavirus pandemic ",,,,1248375132877275136,https://twitter.com/Mori4Real/status/1248375132877275136
2020-04-09 22:16:05,prensafl,,0,0,0,"¿Buscas empleo en Texas? Aquí tenemos un listado de las empresas que están solicitando durante la pandemia de COVID-19 https://laprensafl.com/2020/04/05/buscas-empleo-en-texas-aqui-tenemos-un-listado-de-las-empresas-que-estan-solicitando-durante-la-pandemia-de-covid-19/?utm_term=Autofeed&amp;utm_medium=Social&amp;utm_source=Twitter#Echobox=1586331148",,,,1248374150344912896,https://twitter.com/prensafl/status/1248374150344912896
2020-04-09 22:16:03,BrianBernardLaw,,0,0,0,"Ex-Judge Slams Houston Criminal Judges for Forcing In-Person Appearances Amid COVID-19 Spread https://ift.tt/2JPA73g Texas LawyerAngela Morrishttps://images.law.com/contrib/content/uploads/sites/401/2020/04/Lawyers-Houston-Coronavirus-Article-202004091600.jpgState and Local Go…",,,,1248374139347337223,https://twitter.com/BrianBernardLaw/status/1248374139347337223
2020-04-09 22:12:43,amybster,,0,0,1,"Kudos to @StDavidsFDN who announced $10 Million Fund to support central Texas nonprofits impacted by COVID-19 ",,@StDavidsFDN,,1248373302352957448,https://twitter.com/amybster/status/1248373302352957448
2020-04-09 22:12:27,AndrewDahDude,,0,2,6,"Becoming very concerned about a widespread and dense tornado outbreak on Easter Sunday, getting the warnings out on a holiday, and what the ramifications of dealing with tornado damage during COVID-19 are. Texas and Virginia could be impacted at the same time.",,,,1248373235231719424,https://twitter.com/AndrewDahDude/status/1248373235231719424
2020-04-09 22:12:01,MarshallProj,,1,5,7,"Bartolo Infante, 72, was the first prisoner in Texas to die from COVID-19. The state is now locking down 15 facilities where there have been positive cases. More at @TexasTribune.",,@TexasTribune,,1248373124283891712,https://twitter.com/MarshallProj/status/1248373124283891712
2020-04-09 22:05:11,FRC7,,0,0,0,"4/9/2020 5PM #5: Other new #Covid-19 Cases: Texas 165 new, 10,230 total, 202 dead, 7 NEW DEATHS Sweden 722 new, 9,141 total, 793 dead, 106 NEW DEATHS (they have been practicing ""herd immunity"", everything is open, no ""social distancing"")",,,#Covid,1248371406968143872,https://twitter.com/FRC7/status/1248371406968143872
2020-04-09 22:05:02,Data4BlackLives,,2,25,57,"UPDATE: As of today, 8 more states have begun publicly reporting COVID-19 deaths and/or infections by race. Massachusetts, Maryland, Tennessee, Georgia, New York Statewide, Texas- San Antonio area, California -San Diego area and Virginia. ",,,,1248371369475223552,https://twitter.com/Data4BlackLives/status/1248371369475223552
2020-04-09 22:04:31,RockSolidDem,RealCandaceO,1,2,10,"Texas Trump Supporter Called Coronavirus a Hoax — She is Now Dead from COVID-19 https://www.politicalflare.com/2020/04/texas-trump-supporter-called-coronavirus-a-hoax-she-is-now-dead-from-covid-19/ via @NicoleJames",,@nicolejames,,1248371236750659584,https://twitter.com/RockSolidDem/status/1248371236750659584
2020-04-09 22:00:23,DFW_Rambler,,0,0,1,"@TXWorkforce Texas Workforce Commission Confronts COVID-19 Crisis: http://ow.ly/nrAN50zanxZ #txworkforce #covid19 #ramblernewspapers Written by @aubreymalee",,@TXWorkforce @aubreymalee,#txworkforce #covid19 #ramblernewspapers,1248370199067271168,https://twitter.com/DFW_Rambler/status/1248370199067271168
2020-04-09 22:00:08,rks127th,,1,5,12,"Kudos to the @SupremeCourt_TX. This 10th #COVID Order makes real sense and benefits a lot of people that are often not top of mind in the practice. #law #justice #Texas ",,@SupremeCourt_TX,#COVID #law #justice #Texas,1248370134504345600,https://twitter.com/rks127th/status/1248370134504345600
