date,username,to,replies,retweets,favorites,text,geo,mentions,hashtags,id,permalink
2020-04-09 14:46:37,UnitedWayLamar,,0,0,0,"Received our first donation for East Texas Giving Day today! You don't have to wait until April 28th - GIVE TODAY! All funds go to our COVID-19 Crisis Fund. https://www.easttexasgivingday.org/nonprofits?keyword=United+Way+of+Lamar+County",,,,1248261037348073473,https://twitter.com/UnitedWayLamar/status/1248261037348073473
2020-04-09 14:46:05,DonnAhhhhhh,,0,0,0,"Me trying to explain to a man trying to find a barber to cut his hair why it's so serious and you can't do that right now. He said #COVID is fake and he'll pray for me. #coronavirus #COVIDIOT #Texas ",,,#COVID #coronavirus #COVIDIOT #Texas,1248260901406457856,https://twitter.com/DonnAhhhhhh/status/1248260901406457856
2020-04-09 14:45:00,elmananarey,,0,1,4,"#TEXAS Continúan al alza casos de COVID-19. https://www.elmanana.com/continuan-al-alza-casos-de-covid-19-nuevos-contagios-confirman-covid-19-pandemia/5067061",,,#TEXAS,1248260629346914307,https://twitter.com/elmananarey/status/1248260629346914307
2020-04-09 14:45:00,elmananareynosa,,0,0,1,"#TEXAS Continúan al alza casos de COVID-19. https://www.elmanana.com/continuan-al-alza-casos-de-covid-19-nuevos-contagios-confirman-covid-19-pandemia/5067061",,,#TEXAS,1248260629313585152,https://twitter.com/elmananareynosa/status/1248260629313585152
2020-04-09 14:45:00,innovaccer,,0,0,2,"Sanitas USA, a healthcare provider active in Florida, New Jersey, Texas, and Connecticut, has tapped Innovaccer to support a virtual COVID-19 screening and triage program. Read about the coverage here. https://hubs.ly/H0plDrl0 #healthcare #covid19 #HealthForAll",,,#healthcare #covid19 #HealthForAll,1248260628457938946,https://twitter.com/innovaccer/status/1248260628457938946
2020-04-09 14:44:18,DrBangor,,1,1,0,"With Texas Gov. Comm. on #PwD, @teainfo and @TexasHHSC will hold a COVID-19 Disability Policy Q&amp;A on Friday, 4/17 10-11:30am CT. Submit questions and Register: https://zoom.us/webinar/register/WN_TivsZUuERJiEHFZzuJHKug",,@teainfo @TexasHHSC,#PwD,1248260455455502336,https://twitter.com/DrBangor/status/1248260455455502336
2020-04-09 14:44:00,Elizabe23340680,,0,0,0,"""COVID-19 is spreading in nursing homes. Texas won't share details."" ",,,,1248260379836366848,https://twitter.com/Elizabe23340680/status/1248260379836366848
2020-04-09 14:42:17,reenajade,,1,0,1,"As of Wednesday night, the state only had 1,790 case reports out of the total 9,353 confirmed COVID-19 cases in Texas. We were told investigations take time to complete after lab test results are received, and there's a significant portion of cases where race or data is unknown.",,,,1248259944635338752,https://twitter.com/reenajade/status/1248259944635338752
2020-04-09 14:41:28,TruePatriotAZ,,0,0,0,"Texas gonna Texas as long as it's held in the death grip of the #GOP. #GOPKillsGrandma “COVID-19 is spreading in nursing homes. Texas won't share details.” by @TexasTribune",,@TexasTribune,#GOP #GOPKillsGrandma,1248259743275048962,https://twitter.com/TruePatriotAZ/status/1248259743275048962
2020-04-09 14:40:44,kay_douglas,,0,0,0,"Texas reports first death of prisoner with COVID-19 https://m.chron.com/news/houston-texas/article/First-Texas-inmate-dies-of-Covid-19-15188098.php?utm_source=newsletter&amp;utm_medium=email&amp;utm_campaign=Chron_CatchUp&amp;utm_term=Chron&amp;utm_content=headlines&amp;stn=nf&amp;utm_campaign=CMS%20Sharing%20Tools%20(Mobile)&amp;utm_source=t.co&amp;utm_medium=referral via @houstonchron",,@HoustonChron,,1248259556599267328,https://twitter.com/kay_douglas/status/1248259556599267328
2020-04-09 14:40:28,flomodental,,0,0,0,"OPEN During #Covid19? To be clear, we WILL open for #dentalemergencies as allowed by #FlowerMound #Texas #DentonCounty &amp; #CDC Don’t #SocialDistance with #toothpain (972) 355-2222 #covid #covid2020 #coronavirus #smile #teeth #dentist #emergencymedicine #pain #dentalemergency",,,#Covid19 #dentalemergencies #FlowerMound #Texas #DentonCounty #CDC #SocialDistance #toothpain #covid #covid2020 #coronavirus #smile #smile #teeth #dentist #emergencymedicine #pain #dentalemergency,1248259491243712512,https://twitter.com/flomodental/status/1248259491243712512
2020-04-09 14:40:00,KXAN_News,,5,1,3,"Head of Texas DSHS says the state it increasing COVID-19 testing capacity every day ",,,,1248259371202760711,https://twitter.com/KXAN_News/status/1248259371202760711
2020-04-09 14:39:25,pana,,0,0,0,"STUPID is as STUPID does. Texas woman calls COVID-19 a hoax. She is now dead from her willful ignorance. ",,,,1248259223193976833,https://twitter.com/pana/status/1248259223193976833
2020-04-09 14:38:23,indivisible_usa,,1,2,3,"""[Kelli] Weldon also confirmed that the health commission was tracking COVID-19 cases in nursing homes statewide, though *she declined to release its figures*."" Why all the secrecy guys? What are you hiding? #covid #coronavirus #Texas",,,#covid #coronavirus #Texas,1248258964753702917,https://twitter.com/indivisible_usa/status/1248258964753702917
2020-04-09 14:38:12,TexasStandard,,0,1,1,"On air: We’ll get the latest economic info on Texas and the COVID-19 pandemic from state comptroller Glenn Hegar. Find a station to listen, starting at 10: http://texasstandard.org/listen",,,,1248258920990347266,https://twitter.com/TexasStandard/status/1248258920990347266
2020-04-09 14:37:17,TTUPFR,,0,0,2,"Please see the following updates regarding Grading Options for Spring 2020 and Virtual Commencement: https://mailchi.mp/ttu/parent-family-enewsletter-covidupdate6 Please visit the Texas Tech University coronavirus (COVID-19) website for additional information and updates: https://www.depts.ttu.edu/communications/emergency/coronavirus/ #TTULovesFamilies",,,#TTULovesFamilies,1248258687413747716,https://twitter.com/TTUPFR/status/1248258687413747716
2020-04-09 14:37:01,TomFlowers,,0,1,1," “COVID-19 is spreading in nursing homes. Texas won't share details.” by @TexasTribune",,@TexasTribune,,1248258621122674688,https://twitter.com/TomFlowers/status/1248258621122674688
2020-04-09 14:36:01,SrTechClub,,0,0,0,"We call it the conference call two-step. Not to be confused with the Texas two-step. Make a Family Conference Call with your iPhone | Senior Tech Club https://buff.ly/3c03nQV It's FREE during COVID-19 #SeniorTech",,,#SeniorTech,1248258371461013506,https://twitter.com/SrTechClub/status/1248258371461013506
2020-04-09 14:35:55,John_Walton_,,0,0,0,"East Texas prisoner first in state to die after testing positive for COVID-19 ",,,,1248258344730624002,https://twitter.com/John_Walton_/status/1248258344730624002
2020-04-09 14:35:35,Edinburgcisd,,0,0,1,"Texas, recuerda la importancia del distanciamiento social. Evite espacios públicos y manténgase alejado de los demás (al menos 6 pies). Si continuamos siguiendo la guía de salud pública, menos de nuestros amigos y familiares se verán afectados por COVID-19. #StayHomeTexas #ECISD",,,#StayHomeTexas #ECISD,1248258258596331521,https://twitter.com/Edinburgcisd/status/1248258258596331521
2020-04-09 14:35:23,IcodeSouthlake,,0,2,0,"#Onlinecamp #Steam #Technology #Kidsactivity #Coding #Tech #Family #Southlake #Texas #Dallas #Grapevine #Keller #HourOfCode #Colleyville #Euless #GirlsIncTarrant #Girlswhocode #Girlsintech #WomenWhoCode #COVID #Virus #OnlineClasses #OnlineCourses #InstructorLed #Livesupport",,,#Onlinecamp #Steam #Technology #Kidsactivity #Coding #Tech #Family #Southlake #Texas #Dallas #Grapevine #Keller #HourOfCode #Colleyville #Euless #GirlsIncTarrant #Girlswhocode #Girlsintech #WomenWhoCode #COVID #Virus #OnlineClasses #OnlineCourses #InstructorLed #Livesupport,1248258211163111424,https://twitter.com/IcodeSouthlake/status/1248258211163111424
2020-04-09 14:35:08,mwindex,,0,0,0,"AUSTIN, Texas (AP) — A 72-year-old is first Texas state inmate reported to be a possible COVID-19 fatality during the new coronavirus pandemic. https://www.mineralwellsindex.com/news/health/first-state-prison-inmate-dies-of-covid-19-lockdown-expands/article_66985bea-f0e2-528c-aad5-64f27b66d993.html#utm_campaign=blox&amp;utm_source=twitter&amp;utm_medium=social",,,,1248258148466556928,https://twitter.com/mwindex/status/1248258148466556928
2020-04-09 14:33:34,Jackd91696902,,0,0,0," “COVID-19 is spreading in nursing homes. Texas won't share details.” by @TexasTribune",,@TexasTribune,,1248257753358843905,https://twitter.com/Jackd91696902/status/1248257753358843905
2020-04-09 14:33:27,tak_jord,nicolecobler,0,0,0,"Not but a few weeks ago @JohnCornyn thought #COVID was a huge fcking joke. Too bad, Texas, you suckers are on your own. Leadership FAIL FAIL FAIL FAIL FAIL FAIL",,@JohnCornyn,#COVID,1248257722799345665,https://twitter.com/tak_jord/status/1248257722799345665
2020-04-09 14:32:03,reenajade,,1,2,6,"We're seeing reports across the country about African Americans and Hispanics being at higher risk of death from the coronavirus, but the racial data for COVID-19 patients in Texas is incomplete. @SpecNewsATX @SpecNewsSA",,@SpecNewsATX @SpecNewsSA,,1248257373413814273,https://twitter.com/reenajade/status/1248257373413814273
2020-04-09 14:31:21,Robert4LMAD,,0,0,0,"TPPF, Coalition Makes 9 Recommendations for Families During COVID-19 to Texas DFPS https://www.texaspolicy.com/press/tppf-coalition-makes-9-recommendations-for-families-during-covid-19-to-texas-dfps via @TPPF",,@TPPF,,1248257195902468096,https://twitter.com/Robert4LMAD/status/1248257195902468096
2020-04-09 14:31:16,rhodes_trust,ktkadakia,0,1,4,"'COVID-19 Therapies As A Test Case For Coverage, Coding, And Payment Reforms'. Great article by Current #RhodesScholar Kushal (Texas &amp; @LincolnAlumni 2019).",,@LincolnAlumni,#RhodesScholar,1248257174511517697,https://twitter.com/rhodes_trust/status/1248257174511517697
2020-04-09 14:31:00,wdtnews,,0,0,0,"Public health experts say information about the spread of COVID-19 through Texas and Florida in the next few days could be crucial in predicting how many Americans are likely to die from the pandemic. (via @latimes)",,@latimes,,1248257106152734723,https://twitter.com/wdtnews/status/1248257106152734723
2020-04-09 14:30:16,drjknanda,,0,0,0,"COVID 19 Outbreak And The International Liability Regime: A Legal Perspective On The Class Action Complaint In Texas District Court #CoronavirusOubreak #ChinaMustExplain",,,#CoronavirusOubreak #ChinaMustExplain,1248256922999877632,https://twitter.com/drjknanda/status/1248256922999877632
2020-04-09 14:30:08,ErinForYall,,0,4,18,"Texas Health and Human Services will provide more than $168 million in emergency SNAP food benefits as part of their COVID-19 response. SNAP recipients will see the added amount on their Lone Star Card by April 15 for this month’s benefits, and by May 15 for next month’s benefits ",,,,1248256888107495425,https://twitter.com/ErinForYall/status/1248256888107495425
2020-04-09 14:29:00,TarletonPrez,,0,7,83,"Thankful for our local SMSC testing center and healthcare professionals. Partnering with the Texas A&amp;M Vet Med Lab @tarletonstate donated 110 #Covid_19 testing kits. #UnitedAsOne #DoYourPart",,@TarletonState,#Covid_19 #UnitedAsOne #DoYourPart,1248256603574472704,https://twitter.com/TarletonPrez/status/1248256603574472704
2020-04-09 14:28:42,linhlandao,,10,56,85,"""Les Asiatiques st victimes de discrimination comme l’avaient été les Américains d’origine arabe ou pakistanaise"" après les attentats 09/11. Ex: une famille agressée au couteau au Texas ! Comment réagir? #racismeantiasiatique #JeNeSuisPasUnVirus #Covid_19",,,#racismeantiasiatique #JeNeSuisPasUnVirus #Covid_19,1248256526428573696,https://twitter.com/linhlandao/status/1248256526428573696
2020-04-09 14:28:30,veteran_texas,TPWDnews,0,0,1,"Someone tell useless Texas Gov. Greg Abbott that Covid-19 had already been attacking the barnyard for over two months while he was asleep at the wheel for Trump. Vote BLUE 2029 for leadership. Mishijo...",,,,1248256479431471106,https://twitter.com/veteran_texas/status/1248256479431471106
2020-04-09 14:28:29,TomballISD,,0,0,2,"Texas, remember the importance of social distancing. If you must go out, avoid public spaces and keep your distance from others (at least 6 feet). If we continue to follow valuable public health guidance, fewer of our friends &amp; family will be affected by COVID-19. #StayHomeTexas",,,#StayHomeTexas,1248256473089609728,https://twitter.com/TomballISD/status/1248256473089609728
2020-04-09 14:26:58,ArthurCoronad11,ntanner1029,0,0,0,"I don't! I live in Texas where it's just plain better! Besides, Covid-19 Started in China! A travel ban to and from China from the get go would have been very effective! Ever think about that?",,,,1248256091865169921,https://twitter.com/ArthurCoronad11/status/1248256091865169921
2020-04-09 14:26:03,TDCAANews,,0,0,0,"Coronavirus In Texas: First Prison Inmate Dies Of COVID-19, As Statewide Lockdowns Expand ",,,,1248255861996355590,https://twitter.com/TDCAANews/status/1248255861996355590
2020-04-09 14:24:24,RafranzDavis,,0,1,3,"COVID-19 is spreading in nursing homes. Texas won't share details. ",,,,1248255447062241281,https://twitter.com/RafranzDavis/status/1248255447062241281
2020-04-09 14:21:51,keratx,,0,0,1,"An 8th Dallas Police Officer has tested positive for COVID-19. Here's the latest on how the pandemic is affecting North Texas. https://kerane.ws/2wq8pXK",,,,1248254806411616257,https://twitter.com/keratx/status/1248254806411616257
2020-04-09 14:19:31,DjDynasty,VZWSupport,1,0,0,"The person who died was the first COVID-19 death in the state of Texas. Honestly hope your 1% smug board all get it, because they are heartless cucks who deserve to all perish in the great cleansing ragaving the country.",,,,1248254215589421056,https://twitter.com/DjDynasty/status/1248254215589421056
2020-04-09 14:19:10,Giaqm,,0,0,2,"Para los que dicen que las pruebas rápidas de detención del covid no sirven, en texas las entregan en 15 minutos! Gobernador de Texas anuncia que farmacias Walgreens harán pruebas de coronavirus por autoservicio http://uni.vi/Jwgv102dJxl via @Univision62",,@Univision62,,1248254129119657984,https://twitter.com/Giaqm/status/1248254129119657984
2020-04-09 14:19:08,elvenezolanohou,,0,0,1,"Texas Children's Hospital proporciona estipendio a los empleados durante COVID-19 https://bit.ly/39QHSk4",,,,1248254119678283776,https://twitter.com/elvenezolanohou/status/1248254119678283776
2020-04-09 14:17:27,rmcgrudiva,,0,0,0,"COVID-19 May Be Silently Spreading Across Rural Texas, Researchers Say – Texas Monthly ",,,,1248253695210463233,https://twitter.com/rmcgrudiva/status/1248253695210463233
2020-04-09 14:17:17,texas2987,,0,0,0,"Texas oil field workers now helping protect medical professionals in COVID-19 fight | http://kens5.com",,,,1248253653401681923,https://twitter.com/texas2987/status/1248253653401681923
2020-04-09 14:15:27,cbs11jack,,0,4,4,"#ICYMI A N. #Texas company, Prestige Ameritech has partnered with the @TxNationalGuard to make 2 million face masks per week for healthcare workers. The news comes as the state’s top doctor says efforts to prevent the spread of COVID-19 are working https://cbsloc.al/3b5XQYQ @CBSDFW",,@TxNationalGuard @CBSDFW,#ICYMI #Texas,1248253193039028224,https://twitter.com/cbs11jack/status/1248253193039028224
2020-04-09 14:14:54,KLBKNews,,0,0,0,"East Texas prisoner first in state to die after testing positive for COVID-19 ",,,,1248253056791314432,https://twitter.com/KLBKNews/status/1248253056791314432
2020-04-09 14:14:14,ATXMobileNotary,,0,0,0,"Due to #covid, online #notarizations are more readily available in Texas. If you have the means and need an appointment, I can help during the weekday evenings or weekends. More info:",,,#covid #notarizations,1248252888251600901,https://twitter.com/ATXMobileNotary/status/1248252888251600901
2020-04-09 14:13:16,sophiegrits,,0,0,0,"""COVID-19 is spreading in nursing homes. Texas won't share details."" ",,,,1248252643643809793,https://twitter.com/sophiegrits/status/1248252643643809793
2020-04-09 14:12:37,FOX4,,1,14,303,"Nurses cheer for North Texas COVID-19 survivor as she leaves the hospital https://bit.ly/2Rpi9ch",,,,1248252482863665152,https://twitter.com/FOX4/status/1248252482863665152
2020-04-09 14:12:22,mshouston,,0,0,0,"COVID-19 is spreading in nursing homes. Texas won't share details. ",,,,1248252419399655424,https://twitter.com/mshouston/status/1248252419399655424
2020-04-09 14:11:15,HedgesPictures,,0,0,2,"I just signed the petition to support Texas brewers during the COVID-19 crisis by allowing them to temporarily deliver and ship beer to Texans practicing social distancing. Support small businesses &amp; sign the petition! ",,,,1248252138104524801,https://twitter.com/HedgesPictures/status/1248252138104524801
2020-04-09 14:09:25,OBranstiter,startelegram,0,0,0,"""9,353 confirmed COVID-19 cases in Texas. Of those, 1,491 people are hospitalized and 177 have died. More than 96,250 Texans have been tested."" ",,,,1248251677246963713,https://twitter.com/OBranstiter/status/1248251677246963713
2020-04-09 14:08:07,Patrick_West,,0,0,2,"Texas has over 28 Million people. Texas has over 5 Million people with no health insurance. Texas has performed less than 100,000 COVID tests. Texas' tests take 7-10 days to produce results. No one has any idea how widespread the virus is in this state.",,,,1248251346664505351,https://twitter.com/Patrick_West/status/1248251346664505351
2020-04-09 14:07:28,OdmsCounselors,,0,0,0,"Texas Health and Human Services has established a COVID-19 Mental Health Support Line. Call 833-986-1919 to speak with a mental health professional for help dealing with stress, anxiety, or depression. ",,,,1248251183128399872,https://twitter.com/OdmsCounselors/status/1248251183128399872
2020-04-09 14:07:12,guttertramp,,0,0,0,"COVID-19 is spreading in nursing homes. Texas won't share details. ",,,,1248251116560629760,https://twitter.com/guttertramp/status/1248251116560629760
2020-04-09 14:04:54,TVMA,,0,0,2,"The Texas Animal Health Commission provided some COVID-19 FAQs for livestock and pet owners. http://ow.ly/SzAy50z9Y3P @TAHC",,@TAHC,,1248250539625689088,https://twitter.com/TVMA/status/1248250539625689088
2020-04-09 14:03:28,hondoisd1,,0,0,1,"Texas, remember the importance of social distancing. If you must go out, avoid public spaces and keep your distance from others (at least 6 feet). If we continue to follow valuable public health guidance, fewer of our friends &amp; family will be affected by COVID-19. #StayHomeTexas",,,#StayHomeTexas,1248250176696799232,https://twitter.com/hondoisd1/status/1248250176696799232
2020-04-09 14:02:48,nickpowellchron,,0,2,0,"On A1 today: COVID-19 outbreaks at Texas nursing homes raise questions about transparency, safety of elderly residents W/ @taygoldenstein and @emfoxhall",,@taygoldenstein @emfoxhall,,1248250011546046465,https://twitter.com/nickpowellchron/status/1248250011546046465
2020-04-09 14:01:03,GreaterTexoma,,0,0,0,"Texas monthly housing sales hovered around record highs in January. We do not expect to see the COVID-19 outbreak reflected in the housing data until the second quarter of the year. Take a look at this article from Texas A&amp;M for their major findings: http://ow.ly/Fhwg30qwjRk",,,,1248249569428660229,https://twitter.com/GreaterTexoma/status/1248249569428660229
2020-04-09 14:00:50,TexasLyceum,,0,0,0,"Texas and COVID-19: Social Responsibility and Philanthropy Forum Thursday, April 9, from 4-5 pm CST Join Texas Lyceum alumni and experts in the field for a conversation around the impact of COVID-19 on the social responsibility and philanthropy sectors. ",,,,1248249517201166336,https://twitter.com/TexasLyceum/status/1248249517201166336
2020-04-09 14:00:10,RoyalISD,,0,0,0,"Texas Health and Human Services has established a COVID-19 Mental Health Support Line. Call 833-986-1919 to speak with a mental health professional for help dealing with stress, anxiety, or depression. ",,,,1248249347436769280,https://twitter.com/RoyalISD/status/1248249347436769280
2020-04-09 14:00:05,newsjournal,,0,1,3,"The Texas Education Agency has uploaded at-home learning resources for districts as school closures amid the COVID-19 pandemic continue. ",,,,1248249328805666816,https://twitter.com/newsjournal/status/1248249328805666816
2020-04-09 14:00:03,KETK,,0,1,1,"BREAKING: East Texas prisoner first in state to die after testing positive for COVID-19. Who was it &amp; what unit? ",,,,1248249319049678850,https://twitter.com/KETK/status/1248249319049678850
2020-04-09 13:59:56,Emilyyy_claire_,,0,0,0,"COVID-19 is spreading in nursing homes. Texas won't share details. ",,,,1248249289827995648,https://twitter.com/Emilyyy_claire_/status/1248249289827995648
2020-04-09 13:59:21,mfgenericans,,0,2,6,"Texas Workforce Commission is a pathetic organization that is fucking over thousands of unemployed freelancers including myself. I can't access anything. Online or over the phone. I filed for unemployment almost a month ago before they even implemented covid-19 into their system.",,,,1248249143580979200,https://twitter.com/mfgenericans/status/1248249143580979200
2020-04-09 13:58:34,BucsNationCP,,0,0,0,"#Bucs WR Mike Evans' foundation donates $100K to COVID-19 relief efforts in Florida, Texas ",,,#Bucs,1248248943932145664,https://twitter.com/BucsNationCP/status/1248248943932145664
2020-04-09 13:58:07,WFSolutionsETX,,0,0,0,"Recursos TWC COVID-19 Jueves 9 de abril a las 11AM Regístrese aquí: https://us02web.zoom.us/meeting/register/uZAodO6srDsuX2pePZsSxdmViAY_8NkFpg Además, descubra cómo navegar por Texas Fuerza laboral Comisiones y los sitios web de Workforce Solutions East Texas para acceder a la información. ",,,,1248248832762081280,https://twitter.com/WFSolutionsETX/status/1248248832762081280
2020-04-09 13:55:44,taygoldenstein,,0,1,0,"Via @FOX26Houston: Texas City nursing home resident taking experimental COVID-19 treatment speaks out: “The Lord is going to take care of me; whatever is going to happen is going to happen ... I feel like it's going to help I really do."" ",,@FOX26Houston,,1248248230090956800,https://twitter.com/taygoldenstein/status/1248248230090956800
2020-04-09 13:54:54,CarpeDiemOrBust,,0,0,0,"COVID-19 is spreading in nursing homes. Texas won't share details. ",,,,1248248022074449920,https://twitter.com/CarpeDiemOrBust/status/1248248022074449920
2020-04-09 13:53:39,SueGreenbergPR,,0,0,1,"A Bookstore That Closed During the Pandemic Started a Literature Hotline. Now People Are Calling in for Life Advice. – Texas Monthly #bookstoread #COVID #bookstore",,,#bookstoread #COVID #bookstore,1248247709372317696,https://twitter.com/SueGreenbergPR/status/1248247709372317696
2020-04-09 13:52:41,NewBostonISD,,0,0,2,"Texas, remember the importance of social distancing. If you must go out, avoid public spaces and keep your distance from others (at least 6 feet). If we continue to follow valuable public health guidance, fewer of our friends &amp; family will be affected by COVID-19. #StayHomeTexas",,,#StayHomeTexas,1248247463275663363,https://twitter.com/NewBostonISD/status/1248247463275663363
2020-04-09 13:51:50,heraldodejuarez,,0,0,0,"#Local | Supera Ciudad Juárez en muertes por Covid-19 a El Paso, Texas “Los han estado atendido mejor y allá obviamente hay más recursos en cuanto a equipamiento en los hospitales y por eso es que ha sido así la dinámica”, añadió. ",,,#Local,1248247252306419720,https://twitter.com/heraldodejuarez/status/1248247252306419720
2020-04-09 13:48:38,spanportumass,,0,2,4,"We want to hear your ideas and see your creations! Thank you to @ElPesoHero for sharing this awesome bilingual poster from Texas- ¡Juntos Podemos Vencer el Covid-19! #AloneTogether",,@ElPesoHero,#AloneTogether,1248246445561405442,https://twitter.com/spanportumass/status/1248246445561405442
2020-04-09 13:45:12,WfordDemo,,0,0,0,"AUSTIN, Texas (AP) — A 72-year-old is first Texas state inmate reported to be a possible COVID-19 fatality during the new coronavirus pandemic. ",,,,1248245581790580740,https://twitter.com/WfordDemo/status/1248245581790580740
2020-04-09 13:44:08,RAntoshak,,0,0,0,"Cotton Grower - On a Mission to Prevent COVID-19 Spread in Rural Texas ",,,,1248245312252039168,https://twitter.com/RAntoshak/status/1248245312252039168
2020-04-09 13:43:43,John_Tedesco,,1,2,0,"4/ In Houston, COVID-19 has killed a disproportionate number of African Americans. But while other Texas counties have released demographic case data, including breakdowns by ZIP code, race and ethnicity, Houston and Harris County haven't. https://www.houstonchronicle.com/news/houston-texas/houston/article/black-lives-suffer-worst-coronavirus-doctor-hou-15186952.php #covid19",,,#covid19,1248245208799571969,https://twitter.com/John_Tedesco/status/1248245208799571969
2020-04-09 13:43:32,Drobb5_,,0,0,0,"bro just crossed over into Texas.. state troopers literally have a check point for covid-19 testing.",,,,1248245160481185799,https://twitter.com/Drobb5_/status/1248245160481185799
2020-04-09 13:42:24,FranRN,,0,0,0,"The Jefferson County Health Department was notified of the county’s first death due to COVID-19 yesterday. A man from Texas in his 50s was diagnosed and hospitalized on March 26th, and he passed away yesterday. The department says Jefferson County has had three confirmed cases",,,,1248244874542899200,https://twitter.com/FranRN/status/1248244874542899200
2020-04-09 13:41:57,sandrap104,,1,0,0,"Texas Walgreens to offer drive-through testing for COVID-19, governor says ",,,,1248244763964264449,https://twitter.com/sandrap104/status/1248244763964264449
2020-04-09 13:41:24,mcwashtx,,0,0,0,"Just a reminder to TEXANS!! Texas City COVID-19 patients receive hydroxychloroquine https://www.galvnews.com/news/free/article_b59bab46-543a-5116-8e37-2f330a8fc008.html?utm_medium=social&amp;utm_source=twitter&amp;utm_campaign=user-share via @GalvNews",,@GalvNews,,1248244623572533249,https://twitter.com/mcwashtx/status/1248244623572533249
