date,username,to,replies,retweets,favorites,text,geo,mentions,hashtags,id,permalink
2020-04-14 23:59:55,eamonnwarner,AndySlater,0,0,0,"*the state capital of Texas ponders aloud how their economy recovered so quickly from Covid-19, as a man in a monk robe and hood bursts through the door* ""IT'S ME AUSTIN! IT WAS ME ALL ALONG AUSTIN!"" ",,,,1250212221008752640,https://twitter.com/eamonnwarner/status/1250212221008752640
2020-04-14 23:59:00,gm_noticias,,0,0,1,"#Texas Los oficiales de policía, detuvieron a Juan Ricardo Rodríguez de 48 años, tras hacerle el alto cuando conducía, se percataron que se encontraba intoxicado, al tratar de arrestarlo el sujeto amenazó a los agentes con ser portador del COVID-19. ",,,#Texas,1250211987277176832,https://twitter.com/gm_noticias/status/1250211987277176832
2020-04-14 23:58:57,bemille78796826,,0,0,0,"Texas Woman Who Claimed COVID-19 Was ‘Media Driven’ Hoax Dies From Virus ",,,,1250211974480363520,https://twitter.com/bemille78796826/status/1250211974480363520
2020-04-14 23:57:24,americapcsradio,,0,0,0,"Actualizaciones en vivo de COVID-19: más de 100 muertes relacionadas con coronavirus reportadas en el norte de Texas https://www.infoesvidanoticias.com/virales/actualizaciones-en-vivo-de-covid-19-mas-de-100-muertes-relacionadas-con-coronavirus-reportadas-en-el-norte-de-texas/",,,,1250211585500610561,https://twitter.com/americapcsradio/status/1250211585500610561
2020-04-14 23:55:13,corona__watch,,2,2,3,"Breakdown of #Coronavirus cases by US states: New York 202,208 New Jersey 68,824 Massachusetts 28,163 Michigan 27,001 Pennsylvania 25,465 California 25,145 Illinois 23,247 Florida 21,628 Louisiana 21,518 Texas 14,624 Georgia 14,578 #COVID19 #COVID_19 #CoronavirusUSA",,,#Coronavirus #COVID19 #COVID_19 #CoronavirusUSA,1250211036336193538,https://twitter.com/corona__watch/status/1250211036336193538
2020-04-14 23:54:44,tomthuang,,0,0,2,"Texas elected officials push for emergency response to racial disparities emerging in COVID-19 pandemic ",,,,1250210913833095168,https://twitter.com/tomthuang/status/1250210913833095168
2020-04-14 23:50:47,asomer,TonesHyus,2,0,5,"My friend is a NP at Texas Children's Hospital in the Medical Center &amp; she said there's like a handful of Covid-19 cases between all the hospitals down there &amp; they're not low on anything. Not everywhere is NYC. So, let's open back up.",,,,1250209921406324736,https://twitter.com/asomer/status/1250209921406324736
2020-04-14 23:50:03,snddev,,0,0,0,"Some people across North Texas are complaining of irregular sleep patterns since COVID-19 restrictions kicked in. Some local doctors are offering tips. ",,,,1250209734214508545,https://twitter.com/snddev/status/1250209734214508545
2020-04-14 23:49:58,TexasIFC,,0,1,3,"Texas Sigma Alpha Mu has partnered with AEPHI to raise money for the Central Texas Food Bank in relief of the COVID-19 pandemic. Every little bit helps, it takes so little to go so far. #greeksdoinggood",,,#greeksdoinggood,1250209716493582342,https://twitter.com/TexasIFC/status/1250209716493582342
2020-04-14 23:48:50,TXGaryJoiner,,0,2,0,"Texas Farm Bureau is hosting a Tele-Town Hall on Thursday, April 16, at 7 p.m. (CST), on COVID-19 impacts and SBA programs, loans. You must pre-register in order to participate. Tele-Town Hall will call registrants from a 254 phone #just prior to 7 p.m. https://dashboard.teletownhall.us/registration/A8GZDM963NR4",,,,1250209430580404229,https://twitter.com/TXGaryJoiner/status/1250209430580404229
2020-04-14 23:48:33,WKBN,,0,0,1,"2 nursing homes account for all COVID-19 deaths, nearly half of all cases in South Texas county http://dlvr.it/RTnQBm",,,,1250209358572474368,https://twitter.com/WKBN/status/1250209358572474368
2020-04-14 23:48:01,tasbnews,,0,4,4,"In this episode of TASB Talks: Lege Update, Dax and Q talk about the impacts the COVID-19 pandemic has had so far on Texas school districts and the state budget. https://bit.ly/2Rv8hO1 #txed #txlege",,,#txed #txlege,1250209222761107457,https://twitter.com/tasbnews/status/1250209222761107457
2020-04-14 23:44:30,AndersonRamy,,1,0,16,"Dude said, re-open Guymon this morning. I check social media today and another person died from Covid in Texas county. People stay the hecken home. I don't think you understand that people's lives are at stake. HE HASNT LEFT YOU OR FORSAKEN YOU. GOD IS STILL GOOD.",,,,1250208338094297090,https://twitter.com/AndersonRamy/status/1250208338094297090
2020-04-14 23:43:49,GOminiFab,GregAbbott_TX,1,1,6,"While you’re bragging about the federal government sending Texas residents stimulus money, Texas is 49th in COVID-19 testing, 10th in number of cases, 14th in new cases, and 16th in total deaths. We’re also #1 in uninsured residents, uninsured children, and uninsured veterans.",,,,1250208166224244736,https://twitter.com/GOminiFab/status/1250208166224244736
2020-04-14 23:40:00,dallasnews,,4,3,8,"Texas elected officials push for emergency response to racial disparities emerging in COVID-19 pandemic https://buff.ly/2K76VoE",,,,1250207206471073794,https://twitter.com/dallasnews/status/1250207206471073794
2020-04-14 23:37:00,rayeelizward,,0,0,0,"An old book, pulled from storage during the Covid-19 pandemic, tells a story of ""civic morality"" in early 20th century Texas. It stands in stark contrast to a 21st century scarred by climate change and a leadership void. http://chryscomm.com/2020/04/14/if-we-know-so-much-why-dont-we-do-something/",,,,1250206452901347332,https://twitter.com/rayeelizward/status/1250206452901347332
2020-04-14 23:37:00,greyhound3333,ClayTravis,1,0,2,"Time to go back to work. There are > 28, 998, 591 Texas NOT hospitalized with Covid, or percentage of Texans hospitalized with Covid is 4.859 x 10 to the minus 3rd power.",,,,1250206451127246848,https://twitter.com/greyhound3333/status/1250206451127246848
2020-04-14 23:34:43,kfdmnews,,0,2,2,"DEVELOPING: Southeast Texas Regional EOC reports 266 COVID-19 cases in six county area; increase of 8 since Monday ",,,,1250205875588993025,https://twitter.com/kfdmnews/status/1250205875588993025
2020-04-14 23:33:32,relivorganix,,0,0,0,"I’m gettin used to this #shelterinplace . . #stayhome #lounging #covid #areyouokay #bekind #austinlife #ilovemygermanshepherd #instadog #photooftheday #chillin #tuesdaymotivation @Austin, Texas https://www.instagram.com/p/B--tiKaBaOF/?igshid=pw8q50pa8dgn",,,#shelterinplace #stayhome #stayhome #lounging #covid #areyouokay #bekind #austinlife #ilovemygermanshepherd #instadog #photooftheday #chillin #tuesdaymotivation,1250205577919131648,https://twitter.com/relivorganix/status/1250205577919131648
2020-04-14 23:32:08,ttuhscmed,,0,3,11,"More than 100 students recently created a task force to help support the communities throughout West Texas. Making masks for the @umchealthsystem Emergency Department is just one of the many ways they are making an impact during the COVID-19 pandemic. #TTUHSCmed",,@umchealthsystem,#TTUHSCmed,1250205226017214467,https://twitter.com/ttuhscmed/status/1250205226017214467
2020-04-14 23:30:17,SInow,,3,8,19,"Elite Texas QB prospect Garrett Nussmeier is on the verge of making a verbal commitment. He explains his original plan and how it has changed amid the COVID-19 pandemic with @SIAllAmerican ",,@SIAllAmerican,,1250204761007304708,https://twitter.com/SInow/status/1250204761007304708
2020-04-14 23:28:56,realVikingCat,,1,0,4,"Prediction: Trump will tell states to reopen by May 1. Republican led states will feel pressure, reopen, and a 2nd COVID spike start in May. Hardest hit will be Texas. #clustertrump #PressConference #PressBreifing #TrumpVirus #trumpMeltdown #TrumpPandemic #coronavirus #COVID19",,,#clustertrump #PressConference #PressBreifing #TrumpVirus #trumpMeltdown #TrumpPandemic #coronavirus #COVID19,1250204421427998720,https://twitter.com/realVikingCat/status/1250204421427998720
2020-04-14 23:28:56,SubversiveArts,,0,2,2,"https://coronavirus.jhu.edu/map.html So it makes me queasy that Texas isn't reporting COVID-19 testing numbers to national databases. Key to our recovery isn't it? @GregAbbott_TX",,@GregAbbott_TX,,1250204421381935104,https://twitter.com/SubversiveArts/status/1250204421381935104
2020-04-14 23:28:44,medenix,,0,0,0,"Texas elected officials push for emergency response to racial disparities emerging in COVID-19 pandemic ",,,,1250204369896833027,https://twitter.com/medenix/status/1250204369896833027
2020-04-14 23:27:21,DanAlvaradoMX,,0,0,0,"Tamaulipas, NL, Coahuila y Chihuahua coordinan acciones con Texas ante Covid-19 https://ift.tt/2yTj91F @OpnoticiasTam #SomosGenteDeAcción #SigamosEnAcción #TamaulipasEnAcción #UnidosYFuertes #Tamaulipas #Mx",,@OpnoticiasTam,#SomosGenteDeAcci #SigamosEnAcci #TamaulipasEnAcci #UnidosYFuertes #Tamaulipas #Mx,1250204022340030472,https://twitter.com/DanAlvaradoMX/status/1250204022340030472
2020-04-14 23:26:55,headovmetal,,0,0,0,"Texas ranks 49th in the U.S. for completed COVID-19 tests | The Texas Signal ",,,,1250203914567286784,https://twitter.com/headovmetal/status/1250203914567286784
2020-04-14 23:25:22,cd_hooks,,2,5,18,"it was not inevitable that COVID empty out these places. a high standard of care would have prevented it. incidentally, Texas has one of the worst nursing home systems in the country ",,,,1250203522987110401,https://twitter.com/cd_hooks/status/1250203522987110401
2020-04-14 23:24:48,jacquel08832741,,1,0,0,"Covid-19 is giving the democratic’s what they want. A reason to take your rights away. Camron county in Texas just made it illegal to take children under 14 anywhere but school and home. They also say no more than two people can ride in one car. What’s next.",,,,1250203383413293058,https://twitter.com/jacquel08832741/status/1250203383413293058
2020-04-14 23:23:22,SandraESanchez,,0,3,1,"2 nursing homes in @Cameron_County account for all #COVID-19 deaths, nearly half of all cases in South Texas county; @HidalgoCounty @judgeCortez still wants the National Guard to come help. My #BorderReport story.",,@cameron_county @HidalgoCounty @JudgeCortez,#COVID #BorderReport,1250203022216564736,https://twitter.com/SandraESanchez/status/1250203022216564736
2020-04-14 23:22:00,TexasStandard,,0,12,9,"Texas is seeing legal pushback to COVID-related state orders on abortion and jail releases. @steve_vladeck has more:",,@steve_vladeck,,1250202677453217799,https://twitter.com/TexasStandard/status/1250202677453217799
2020-04-14 23:18:09,FeedDallas,,0,0,0,"CBS Dallas: Coronavirus In Texas: 1 New COVID-19 Case In Frisco, 103 Total Cases https://ift.tt/3ej8j5z #dallas",,,#dallas,1250201709609132039,https://twitter.com/FeedDallas/status/1250201709609132039
2020-04-14 23:16:10,OBRtweets,,0,0,0,"Dr. Debra Patt @dapattmd of Texas Oncology @TexasOncology and Dr. Samuel Silver of the University of Michigan Medical Center @umichmedicine discuss the impacts of COVID-19 on patients with cancer and provide insight on safety within their practices. https://bit.ly/3emhOka",,@dapattmd @TexasOncology @umichmedicine,,1250201208054116352,https://twitter.com/OBRtweets/status/1250201208054116352
2020-04-14 23:15:28,Tonky15016081,cjchivers,0,0,1,"Charles Butt's HEB Grocery Store management team began preparing for COVID-19 to enter its Texas market in January 2020. They were made aware of the threat by publicly available news reports.",,,,1250201033810292738,https://twitter.com/Tonky15016081/status/1250201033810292738
2020-04-14 23:14:56,OpnoticiasTam,,0,0,0,"#OPnoticias Tamaulipas, NL, Coahuila y Chihuahua coordinan acciones con Texas ante Covid-19 - https://opinionpropia.mx/tamaulipas-nl-coahuila-y-chihuahua-coordinan-acciones-con-texas-ante-covid-19/ @gobtam #TamaulipasEnAcción",,@gobtam,#OPnoticias #TamaulipasEnAcci,1250200896983699456,https://twitter.com/OpnoticiasTam/status/1250200896983699456
2020-04-14 23:10:06,GoberGroup,,0,0,0,"While the Trump Administration’s preference to delay delivery of census data by 4 months may be entirely valid given the COVID-19 crisis, a practical impact of that delay will be an even more chaotic redistricting process in Texas and other states without full-time legislatures.",,,,1250199683101798405,https://twitter.com/GoberGroup/status/1250199683101798405
2020-04-14 23:09:05,media_lhs,,0,5,24,"Congratulations to Michael Hill and Garrett Mastin, 1st place district winners in SkillsUSA Texas Region 7 - In Game Design! These guys were set to represent LHS at State before Covid-19. @traciem28 @BrandonHBoyd @ShellySlaton @asoderquist @TeamLufkinISD",,@traciem28 @BrandonHBoyd @ShellySlaton @asoderquist @TeamLufkinISD,,1250199424955027457,https://twitter.com/media_lhs/status/1250199424955027457
2020-04-14 23:07:58,js26783_joe,,0,2,1,"15,000 infections, 300 deaths with little testing & this idiot, reckless Governor ABBOTT wants to open up Texas. Good luck! What We Know About COVID-19 Cases in North Texas, Around the State ",,,,1250199146088337410,https://twitter.com/js26783_joe/status/1250199146088337410
2020-04-14 23:07:45,brent74,tarheel_texas,0,0,0,"There was just as many deaths from SARS this very month 10 years ago. If we had even earlier testing like we did with Covid-19 you would find as many deaths. Just because we are detecting respiratory diseases earlier doesn't make them more dangerous.",,,,1250199090224336903,https://twitter.com/brent74/status/1250199090224336903
2020-04-14 23:03:34,fishr312,,0,0,1,"@GovAbbott YOU BETTER NOT OPEN TEXAS NEXT WEEK YOU WILL KILL THOUSANDS OF TEXANS LOOK AT THE MODELS FROM UT AND A&amp;M GET SCIENTIFIC FACTS FROM REAL SCIENTISTS!!! DEATH WILL BE ON YOUR HANDS. WE NEED TEST KITS IN SOUTH TEXAS WAKE-UP #COVID_19Texas",,@GovAbbott,#COVID_19Texas,1250198037479206920,https://twitter.com/fishr312/status/1250198037479206920
2020-04-14 23:03:06,jereklara15,,0,0,0,"Marathon has always been a quiet town, but right now if this makes any sense it’s actually more quiet than what it used to be before tourism stopped “Small-Town Dispatches: Sleepy Marathon Quieter Than Ever During COVID-19 | Texas Highways” ",,,,1250197920869122048,https://twitter.com/jereklara15/status/1250197920869122048
2020-04-14 23:02:37,michaelsbarajas,,0,12,3,"As COVID-19 continues to spread in lockups across Texas, @GregAbbott_TX is fighting on several fronts to restrict who judges can let out",,@GregAbbott_TX,,1250197799226036224,https://twitter.com/michaelsbarajas/status/1250197799226036224
2020-04-14 23:00:11,AthReview,,0,0,0,"AUSTIN, Texas – Aqua Texas announced today that it will donate $10,000 to three local food banks across its service territory to provide community support in response to the COVID-19 pandemic. ",,,,1250197186891124739,https://twitter.com/AthReview/status/1250197186891124739
2020-04-14 22:58:11,ChloeBellaMia,vickyparaschou,1,2,10,"My friend was in the first wave of COVID infections, he lives in Texas, He was in ICU twice they gave him the Hydroxy cocktail and he was better the next day. At the time no one was talking about it.",,,,1250196684929486862,https://twitter.com/ChloeBellaMia/status/1250196684929486862
2020-04-14 22:57:05,tdtnews,,0,3,8,"Five women took to Facebook looking to collect “cards of encouragement” for high school seniors in Central Texas amid the evolving COVID-19 pandemic, but were shocked with just how much community support they have received. ",,,,1250196406243123201,https://twitter.com/tdtnews/status/1250196406243123201
2020-04-14 22:55:34,MichaelLotfi,Joshthomastn,0,0,0,"Yet appeals court rule “Texas can’t suspend constitution to deny abortions during covid crisis”",,,,1250196026700566537,https://twitter.com/MichaelLotfi/status/1250196026700566537
2020-04-14 22:55:00,kwtx,,0,0,2,"Central Texas county judge questions COVID-19 reports. ",,,,1250195882148089861,https://twitter.com/kwtx/status/1250195882148089861
2020-04-14 22:54:32,CarpenterPM,PatrickSvitek,0,1,1,"Texas has 422 covid cases. Looks as though that'll soon be 4,220.",,,,1250195766376873987,https://twitter.com/CarpenterPM/status/1250195766376873987
2020-04-14 22:54:31,PiersonLaVigne,,0,0,1,"You guys know how the Texas flag can be flown by itself without the US Flag? Well Ohio should have the same right now since we fucking know what we’re doing with covid",,,,1250195759208837121,https://twitter.com/PiersonLaVigne/status/1250195759208837121
2020-04-14 22:52:30,IcodeSouthlake,,0,1,1,"#Onlinecamp #Camp #Steam #Technology #Kidsactivity #Coding #Tech #Family #Southlake #Texas #Dallas #Grapevine #Keller #HourOfCode #Colleyville #Euless #GirlsIncTarrant #Girlswhocode #Girlsintech #WomenWhoCode #COVID #Virus #OnlineClasses #OnlineCourses #InstructorLed #Livesupport",,,#Onlinecamp #Camp #Steam #Technology #Kidsactivity #Coding #Tech #Family #Southlake #Texas #Dallas #Grapevine #Keller #HourOfCode #Colleyville #Euless #GirlsIncTarrant #Girlswhocode #Girlsintech #WomenWhoCode #COVID #Virus #OnlineClasses #OnlineCourses #InstructorLed #Livesupport,1250195251349917697,https://twitter.com/IcodeSouthlake/status/1250195251349917697
2020-04-14 22:52:16,DadWithaBlog,GoosesChannel,2,0,14,"Indiana has a population of 6.7 million. Maryland 6 mil. Ohio, 11 m. Colorado 5.8 m. Texas, 29 m. And each one of them individually have over 300 deaths. None of those states are even in the top 10 of US COVID deaths. Tell me again what total population has to do with anything?",,,,1250195195993481216,https://twitter.com/DadWithaBlog/status/1250195195993481216
2020-04-14 22:51:07,Kathy97569597,GregAbbott_TX,1,0,0,"Governor Abbott PLEASE do not open Texas. I live in Harris County and have been home since 3/31 suspected COVID- 19. Harris County and Houston do not have adequate testing.",,,,1250194906804609024,https://twitter.com/Kathy97569597/status/1250194906804609024
2020-04-14 22:50:35,AtmaDrohi,tapasya_s,1,0,0,"Janma Dina Subhakankshalu! From someone who is very very closely related to a gorgeous #HinduAmerican pulmonologist working in Texas! She is doing night shift in a COVID-19 unit! The other day she said she is ready get married and I said I will suggest a few of my friends! ",,,#HinduAmerican,1250194771718651905,https://twitter.com/AtmaDrohi/status/1250194771718651905
2020-04-14 22:49:40,BlackPhysicists,,0,2,4,"Texas Tech Professor Would Reconsider Being Atheist if President Trump Dies of COVID-19 https://j.mp/34zL0zI #physics",,,#physics,1250194541644316673,https://twitter.com/BlackPhysicists/status/1250194541644316673
2020-04-14 22:46:09,UTRGV_ECC,,0,1,0,"The Governor’s Small Business Webinar Series will provide Texas small business owners and entrepreneurs with timely, relevant, actionable information on the COVID-19 recovery resources. Register at: http://gov.texas.gov/business/event/the-governors-small-business-webinarseries-central-texas A Center of @utrgv_gcr",,@utrgv_gcr,,1250193653240410124,https://twitter.com/UTRGV_ECC/status/1250193653240410124
2020-04-14 22:44:06,Yallitics,,2,2,4,"Dozens of patients in Texas just finished a treatment of hydroxychloroquine to battle COVID-19. How did it go? The Jasons talk to their doctor on this week's Y'all-tics. ",,,,1250193137252909056,https://twitter.com/Yallitics/status/1250193137252909056
2020-04-14 22:40:00,AirShow15,,0,0,1,"Of the top 13 states with Covid cases, Texas has the least fatalities with 318. #StaySafe",,,#StaySafe,1250192105345036288,https://twitter.com/AirShow15/status/1250192105345036288
2020-04-14 22:39:54,KathyCybele,randypcox,0,0,0,"Meet Sequin, Texas - estimated population 25,191 As of April 14, 2:28 P.M. E.T. - 25,175 people have died from COVID-19 in the USA. How many towns full of people will need to die in order to satisfy the Republican's lust for power? #DyingTowns",,,#DyingTowns,1250192080569135104,https://twitter.com/KathyCybele/status/1250192080569135104
2020-04-14 22:36:59,KArtzTL,,0,0,0,"Texas Judges Are Suing the Governor Over No-Money Bonds During COVID-19 Pandemic https://at.law.com/YbG35x?cmp=share_twitter via @TexasLawyer",,@TexasLawyer,,1250191348151586816,https://twitter.com/KArtzTL/status/1250191348151586816
2020-04-14 22:35:09,GGober_Tx,snowmanomics,0,0,1,"Texas will be tough because D's needed good voter registration efforts leading up to election and COVID could squash that. Will need to get creative reaching potential new voters.",,,,1250190887193378816,https://twitter.com/GGober_Tx/status/1250190887193378816
2020-04-14 22:34:21,markischarles,,1,0,6,"Texas is about to be overrun with covid-19. No one listened.",,,,1250190683496988676,https://twitter.com/markischarles/status/1250190683496988676
2020-04-14 22:34:09,justmeinbigd,,0,0,1,"Tuesday, May 5, North Texas Giving Tuesday Now, to encourage donor support for nonprofit organizations reeling from the impact of the COVID-19 pandemic. Early Giving is open now through May 4. https://www.northtexasgivingday.org/index.php https://twitter.com/NTxGivingDay/status/1245438425957834759",,,,1250190636231335937,https://twitter.com/justmeinbigd/status/1250190636231335937
2020-04-14 22:33:57,Robinson_OU,,0,0,0,"Our newest blog post discusses newspaper coverage of COVID-19 in Texas from January to the start of April. Find it at: ",,,,1250190584255479809,https://twitter.com/Robinson_OU/status/1250190584255479809
2020-04-14 22:32:59,IcodeSouthlake,,0,2,2,"#Onlinecamp #Camp #Steam #Technology #Kidsactivity #Coding #Tech #Family #Southlake #Texas #Dallas #Grapevine #Keller #HourOfCode #Colleyville #Euless #GirlsIncTarrant #Girlswhocode #Girlsintech #WomenWhoCode #COVID #Virus #OnlineClasses #OnlineCourses #InstructorLed #Livesupport",,,#Onlinecamp #Camp #Steam #Technology #Kidsactivity #Coding #Tech #Family #Southlake #Texas #Dallas #Grapevine #Keller #HourOfCode #Colleyville #Euless #GirlsIncTarrant #Girlswhocode #Girlsintech #WomenWhoCode #COVID #Virus #OnlineClasses #OnlineCourses #InstructorLed #Livesupport,1250190342068019204,https://twitter.com/IcodeSouthlake/status/1250190342068019204
2020-04-14 22:30:16,drpatsyp,,0,1,0,"Texas GOP fears 2020 election as state reels from COVID-19 blunders and oil industry collapse: report #SmartNews",,,#SmartNews,1250189657607987200,https://twitter.com/drpatsyp/status/1250189657607987200
2020-04-14 22:28:45,kennedym0113,,0,0,0,"@realDonaldTrump @ABC @V2019N we have 1/3 of the cOvid cases in the world trump is blaming WHO Texas has over 14600 cases in the US. He of course is blaming everyone else. He failed to act, if he is not held accountable there is something wrong with our govt @ICCT_TheHague @WHO",,@realDonaldTrump @ABC @V2019N @ICCT_TheHague @WHO,,1250189275687260160,https://twitter.com/kennedym0113/status/1250189275687260160
2020-04-14 22:27:35,RoguePetScience,,0,0,0,"Owner Craig of Shaggy Dog Market with 2 locations one in Kyle and one in Buda Texas. Learn his Origins story and why he decided to open a pet store, and also how Covid 19 has impacted his buissness and how he is serving his customers. ",,,,1250188982882914305,https://twitter.com/RoguePetScience/status/1250188982882914305
2020-04-14 22:26:14,ExquiziteFacez,,0,0,0,"Sayyyy #covid when are you going to move around?! @Arlington, Texas https://www.instagram.com/p/B--l1PvJUdi/?igshid=6puy05egjq0c",,,#covid,1250188641877590017,https://twitter.com/ExquiziteFacez/status/1250188641877590017
2020-04-14 22:24:05,BernardLawFirm,,0,1,0,"Houston Lawyers Demand Judges End In-Person Appearances Amid COVID-19 Outbreak Texas LawyerAngela Morrishttps://images.law.com/contrib/content/uploads/sites/401/2020/04/Virtual-Court-Article-202004131606.jpgState and Local Government/News/Criminal Law/Ju… ",,,,1250188102565605387,https://twitter.com/BernardLawFirm/status/1250188102565605387
2020-04-14 22:22:39,riseupblue,tedcruz,0,0,0,"Shut up Raphael. It took Trump insulting your family before you endorsed him. Why is Texas still 49th is Covid 19 testing? Do your job!",,,,1250187740085354496,https://twitter.com/riseupblue/status/1250187740085354496
2020-04-14 22:22:18,BrianBernardLaw,,0,0,0,"Houston Lawyers Demand Judges End In-Person Appearances Amid COVID-19 Outbreak https://ift.tt/3coZhCh Texas LawyerAngela Morrishttps://images.law.com/contrib/content/uploads/sites/401/2020/04/Virtual-Court-Article-202004131606.jpgState and Local Government/News/Criminal Law/Ju…",,,,1250187651245891584,https://twitter.com/BrianBernardLaw/status/1250187651245891584
2020-04-14 22:21:37,JoeBullBoyer,PaulZeise,0,0,5,"Texas has 2400 deaths from pneumonia in February and March and 318 from Covid-19 compared to 1400 from pneumonia in all of 2016. But that’s just a coincidence",,,,1250187479988174852,https://twitter.com/JoeBullBoyer/status/1250187479988174852
2020-04-14 22:17:38,ElizMarkowitz,,3,2,14,"I’ll be on Facebook Live with @priteshgandhimd in about 45 minutes to talk about healthcare and higher education in the time of #COVID19. Please submit any last minute questions here! #covid #texas #txlege #vote #healthcare #highereducation #education",,@priteshgandhimd,#COVID19 #covid #texas #txlege #vote #healthcare #highereducation #education,1250186480166805505,https://twitter.com/ElizMarkowitz/status/1250186480166805505
2020-04-14 22:16:42,CityLakeDallas,,0,0,0,"April 14, 2020 – Denton County Public Health (DCPH) has announced One COVID-19 Related Death and 14 New COVID-19 Cases in Denton County. For more information on COVID-19 in Lake Dallas, Denton County, or the State of Texas, please visit http://lakedallas.com/Coronavirus.",,,,1250186244845428737,https://twitter.com/CityLakeDallas/status/1250186244845428737
2020-04-14 22:15:00,KFOX14,,1,0,1,"Health officials said today that #Texas has had more than 14,600 cases of COVID-19, and 318 deaths. ",,,#Texas,1250185814731976704,https://twitter.com/KFOX14/status/1250185814731976704
