date,username,to,replies,retweets,favorites,text,geo,mentions,hashtags,id,permalink
2020-04-14 08:36:16,TheMaverick21,,3,2,6,"In response to Covid, governors are forming regional groups to plan action. Texas has joined the Big 12 group of states, which has 10 total states. The group consists of 8 important states, and 2 random states, added just to get to the 10 total.",,,,1249979775382368258,https://twitter.com/TheMaverick21/status/1249979775382368258
2020-04-14 08:24:44,stefanodonno75,,0,0,0,"WORLD ADVERTISING FREE BUSINESS ACTION a cura di Stefano Donno : Texas Gov. Greg Abbot COVID-19 update: Helping sma... https://worldadvertisingfreebusinessaction.blogspot.com/2020/04/texas-gov-greg-abbot-covid-19-update.html?spref=tw",,,,1249976870625476609,https://twitter.com/stefanodonno75/status/1249976870625476609
2020-04-14 08:19:57,Taiwan2S,TECO_HTX,0,0,3,"Em nome de #Taiwan, a DG Chen entregou 100.000 máscaras para #Texas. Isso não apenas reafirma a amizade entre a TW&amp;TX, mas cumpre a promessa da Pres @iingwen de apoiar os parceiros na luta com o COVID-19. Muito obrigado a @TXsecofstate, @RepAlGreen, @RepPeteOlson &amp;@HubertVo149",,@iingwen @TXsecofstate @RepAlGreen @RepPeteOlson,#Taiwan #Texas,1249975669901189120,https://twitter.com/Taiwan2S/status/1249975669901189120
2020-04-14 08:13:18,profeuloge,,0,0,0,"UNCLE TRUMP WE LED BOTH POLITICS AT THE WHITE HOUSE AND ECONOMY TO TEXAS AND NEW MEXICO. WE DON'T KNOW WHAT THOSE RENTING THE CAPITOL HAVE MORE THAN ME. WE ARE ASKING INVESTIGATION ABOUT AMERICA COVID 222666 HOLOCAUST TOOK THE LIVES OF AMERICANS ESPECIALLY BLACKS. ",,,,1249973994335408129,https://twitter.com/profeuloge/status/1249973994335408129
2020-04-14 07:58:21,Maureen2,MiamiHerald,0,0,0,"Florida, Texas, Arkansas, Georgia, Alabama, Tennessee, and Mississippi are in a deadly competition for most stupid white Trump toady governor in charge. They keep one upping on the Stupid as their Citizens die from COVID-19. ",,,,1249970233588060161,https://twitter.com/Maureen2/status/1249970233588060161
2020-04-14 07:51:53,profeuloge,,0,0,0,"UNCLE TRUMP WE LED BOTH POLITICS AT THE WHITE HOUSE AND ECONOMY TO TEXAS AND NEW MEXICO. WE DON'T KNOW WHAT THOSE RENTING THE CAPITOL HAVE MORE THAN ME. WE ARE ASKING INVESTIGATION ABOUT AMERICA COVID 222666 HOLOCAUST TOOK THE LIVES OF AMERICANS ESPECIALLY BLACKS. ",,,,1249968604981886977,https://twitter.com/profeuloge/status/1249968604981886977
2020-04-14 07:51:09,profeuloge,,0,0,0,"UNCLE TRUMP WE LED BOTH POLITICS AT THE WHITE HOUSE AND ECONOMY TO TEXAS AND NEW MEXICO. WE DON'T KNOW WHAT THOSE RENTING THE CAPITOL HAVE MORE THAN ME. WE ARE ASKING INVESTIGATION ABOUT AMERICA COVID 222666 HOLOCAUST TOOK THE LIVES OF AMERICANS ESPECIALLY BLACKS. ",,,,1249968419765719040,https://twitter.com/profeuloge/status/1249968419765719040
2020-04-14 07:35:10,profeuloge,,0,0,0,"UNCLE TRUMP WE LED BOTH POLITICS AT THE WHITE HOUSE AND ECONOMY TO TEXAS AND NEW MEXICO. WE DON'T KNOW WHAT THOSE RENTING THE CAPITOL HAVE MORE THAN ME. WE ARE ASKING INVESTIGATION ABOUT AMERICA COVID 222666 HOLOCAUST TOOK THE LIVES OF AMERICANS ESPECIALLY BLACKS. ",,,,1249964400104083461,https://twitter.com/profeuloge/status/1249964400104083461
2020-04-14 07:34:08,profeuloge,,0,0,0,"UNCLE TRUMP WE LED BOTH POLITICS AT THE WHITE HOUSE AND ECONOMY TO TEXAS AND NEW MEXICO. WE DON'T KNOW WHAT THOSE RENTING THE CAPITOL HAVE MORE THAN ME. WE ARE ASKING INVESTIGATION ABOUT AMERICA COVID 222666 HOLOCAUST TOOK THE LIVES OF AMERICANS ESPECIALLY BLACKS. ",,,,1249964140258566144,https://twitter.com/profeuloge/status/1249964140258566144
2020-04-14 07:23:34,bluebirdie13,Rogers4Texas,0,0,2,".I live in Texas, I call my Senators at lease once a week. No one answers at CRUZ’s office nor at CORNYN ‘s office for the past 3 weeks. Excuse the Covid-19 virus. They got their pay checks! They don’t give a damn! ",,,,1249961480751104000,https://twitter.com/bluebirdie13/status/1249961480751104000
2020-04-14 07:20:41,profeuloge,,0,0,0,"UNCLE TRUMP WE LED BOTH POLITICS AT THE WHITE HOUSE AND ECONOMY TO TEXAS AND NEW MEXICO. WE DON'T KNOW WHAT THOSE RENTING THE CAPITOL HAVE MORE THAN ME. WE ARE ASKING INVESTIGATION ABOUT AMERICA COVID 222666 HOLOCAUST TOOK THE LIVES OF AMERICANS ESPECIALLY BLACKS. ",,,,1249960753290936321,https://twitter.com/profeuloge/status/1249960753290936321
2020-04-14 07:19:22,profeuloge,,0,0,0,"UNCLE TRUMP WE LED BOTH POLITICS AT THE WHITE HOUSE AND ECONOMY TO TEXAS AND NEW MEXICO. WE DON'T KNOW WHAT THOSE RENTING THE CAPITOL HAVE MORE THAN ME. WE ARE ASKING INVESTIGATION ABOUT AMERICA COVID 222666 HOLOCAUST TOOK THE LIVES OF AMERICANS ESPECIALLY BLACKS. ",,,,1249960422813417472,https://twitter.com/profeuloge/status/1249960422813417472
2020-04-14 07:17:30,profeuloge,,0,0,0,"UNCLE TRUMP WE LED BOTH POLITICS AT THE WHITE HOUSE AND ECONOMY TO TEXAS AND NEW MEXICO. WE DON'T KNOW WHAT THOSE RENTING THE CAPITOL HAVE MORE THAN ME. WE ARE ASKING INVESTIGATION ABOUT AMERICA COVID 222666 HOLOCAUST TOOK THE LIVES OF AMERICANS ESPECIALLY BLACKS. ",,,,1249959950576648196,https://twitter.com/profeuloge/status/1249959950576648196
2020-04-14 07:16:59,profeuloge,,0,0,0,"UNCLE TRUMP WE LED BOTH POLITICS AT THE WHITE HOUSE AND ECONOMY TO TEXAS AND NEW MEXICO. WE DON'T KNOW WHAT THOSE RENTING THE CAPITOL HAVE MORE THAN ME. WE ARE ASKING INVESTIGATION ABOUT AMERICA COVID 222666 HOLOCAUST TOOK THE LIVES OF AMERICANS ESPECIALLY BLACKS. ",,,,1249959823644528642,https://twitter.com/profeuloge/status/1249959823644528642
2020-04-14 07:16:24,profeuloge,,0,0,0,"UNCLE TRUMP WE LED BOTH POLITICS AT THE WHITE HOUSE AND ECONOMY TO TEXAS AND NEW MEXICO. WE DON'T KNOW WHAT THOSE RENTING THE CAPITOL HAVE MORE THAN ME. WE ARE ASKING INVESTIGATION ABOUT AMERICA COVID 222666 HOLOCAUST TOOK THE LIVES OF AMERICA ESPECIALLY BLACKS. ",,,,1249959676973899778,https://twitter.com/profeuloge/status/1249959676973899778
2020-04-14 07:11:09,AppTrailerFish,,0,0,0,"Texas startup adds new services to help apartment-dwellers combat COVID-19 - CultureMap Dallas ",,,,1249958355109580800,https://twitter.com/AppTrailerFish/status/1249958355109580800
2020-04-14 07:09:22,Mondaq,,0,0,0,"Texas (Again) Loosens Telemedicine Restrictions In Response To COVID-19 https://j.mp/3elxHaP By @seyfarthshawLLP",,@seyfarthshawLLP,,1249957906973417472,https://twitter.com/Mondaq/status/1249957906973417472
2020-04-14 07:09:15,melissapk,,0,0,0,"@jimmykimmel #HealthcareHeroes I nominate the infectious control nurse at Columbus Community Hospital in Columbus Texas who offered COVID help to my mom during a recent blood transfusion. I believe the nurse's name is Jennifer but I'll confirm tomorrow.",,@jimmykimmel,#HealthcareHeroes,1249957876992561153,https://twitter.com/melissapk/status/1249957876992561153
2020-04-14 06:50:18,lonestarmilitia,,0,0,0,"@SenTedCruz @GregAbbott_TX Many of us Texans are about to exercise our U.S. and Texas Constitutional rights. I understand a need for public safety regarding COVID-19 but it's time the people are free to live their lives and we're about too. Get ready. Remember the Alamo.",,@SenTedCruz @GregAbbott_TX,,1249953108391845888,https://twitter.com/lonestarmilitia/status/1249953108391845888
2020-04-14 06:47:32,lonestarmilitia,,0,0,0,"@SenTedCruz I think you're a great Senator. Many of us Texans are about to exercise our U.S. and Texas Constitutional rights. I understand a need for public safety regarding COVID-19 but it's time the people are free to live their lives and we're about too.",,@SenTedCruz,,1249952413106286598,https://twitter.com/lonestarmilitia/status/1249952413106286598
2020-04-14 06:45:10,lonestarmilitia,,0,0,0,"@DanPatrick I think you're a great Lt. Gov. Many of us Texans are about to exercise our U.S. and Texas Constitutional rights. I understand a need for public safety regarding COVID-19 but it's time the people are free to live their lives and we're about too.",,@DanPatrick,,1249951816579760128,https://twitter.com/lonestarmilitia/status/1249951816579760128
2020-04-14 06:38:37,lonestarmilitia,,0,0,0,"@SenTedCruz @GregAbbott_TX I think you're a great Senator. many of us Texans are about to exercise our U.S. and Texas Constitutional rights. I understand a need for public safety regarding COVID-19 but it's time the people are free to live their lives and we're about too.",,@SenTedCruz @GregAbbott_TX,,1249950168599928834,https://twitter.com/lonestarmilitia/status/1249950168599928834
2020-04-14 06:36:46,Pishang_co,,0,0,0,"My dads life is the best Planned retirement in this year around june or july due to my mum's 4 years contract to texas. Covid-19 happened and here he is just sitting around waiting for all of it to cooldown. Sorry to break it to you but i guess youre retiring early .",,,,1249949702230958081,https://twitter.com/Pishang_co/status/1249949702230958081
2020-04-14 06:36:17,lonestarmilitia,,0,0,0,"@GregAbbott_TX I think you're a great governor but many of us Texans are about to exercise our U.S. and Texas Constitutional rights. I understand a need for public safety regarding COVID-19 but it's time the people are free to live their lives and we're about too. We are TX!",,@GregAbbott_TX,,1249949579417698304,https://twitter.com/lonestarmilitia/status/1249949579417698304
2020-04-14 06:31:24,rosarioalcala,,0,0,0,"@JohnCornyn @tedcruz are senators doing nothing for Texas but retweeting worthless crap while residents lose their lives! Cornyn - Cruz ? You got anything real to help Texas? Family of Austin ISD food service worker who lost battle with COVID-19 speaks out ",,@JohnCornyn @tedcruz,,1249948352067907584,https://twitter.com/rosarioalcala/status/1249948352067907584
2020-04-14 06:28:34,russianjewess,LibertyRalston,0,0,1,"I avoid them as much as possible. We’ve been having considerable quiet round up and return to sender during COVID. No matter the origin, they get dumped on the other side of the place of entry &amp; no longer Texas’s problem. Did you ask me how much I care? ",,,,1249947638839103488,https://twitter.com/russianjewess/status/1249947638839103488
2020-04-14 06:20:02,policeofficer,,0,13,12,"63 Harris Co. jail workers and 46 inmates now with COVID-19 #Texas #Coronavirus",,,#Texas #Coronavirus,1249945492215259136,https://twitter.com/policeofficer/status/1249945492215259136
2020-04-14 06:18:03,michaeldcargill,,7,13,35,"I can't wait to walk into the bank. It’s now mandatory to wear a face mask in Austin Texas. No thought goes into these policies at all. #Covid_19 #coronavirus #ATX #Merica @PhilJankowski @natalieonfox7 @bridgetonfox7 @koskionfox7 @Kaceyonfox7 @Steveonfox7 @jenniferonFOX7",,@PhilJankowski @NatalieOnFOX7 @BridgetonFOX7 @KoskionFOX7 @KaceyonFox7 @jenniferonFOX7,#Covid_19 #coronavirus #ATX #Merica,1249944989813084160,https://twitter.com/michaeldcargill/status/1249944989813084160
2020-04-14 06:13:59,Notiviza,,0,0,0,"Tamaulipas, NL, Coahuila y Chihuahua coordinan acciones con Texas ante Covid-19 ",,,,1249943969909350402,https://twitter.com/Notiviza/status/1249943969909350402
2020-04-14 06:13:26,lorriebelle84,,0,0,0,"Maybe MN Governor could have a conversation with this TX to figure out how to manage the Covid-19 recovery. Texas gov thinks 'most states can reopen even sooner than later,' 'we don't have to wait until May 1' https://fxn.ws/2RCBuGZ #FoxNews",,,#FoxNews,1249943831115714560,https://twitter.com/lorriebelle84/status/1249943831115714560
2020-04-14 06:13:25,BeardTrends,Bender_B_Rodrig,0,0,0,"Like Democrats arent voting entirely along party lines for their own policies and special interests that even a large number of Democrats won't support? Or trying to sneak those failed votes into COVID-19 relief bills? Come on. ",,,,1249943824731967488,https://twitter.com/BeardTrends/status/1249943824731967488
2020-04-14 06:10:32,Al_Maldives,,1,0,0,"#Texas governor wants to 'slowly' reopen business. ⁦@realDonaldTrump⁩ says that's the federal government's decision. #coronavirus #CoronaCrisis #CoronaAlert #CoronavirusOutbreak #CoronaVirusUpdate #Covid #Covid_19 #Covid19 #Business #Economy #Jobs",,@realDonaldTrump,#Texas #coronavirus #CoronaCrisis #CoronaAlert #CoronavirusOutbreak #CoronaVirusUpdate #Covid #Covid_19 #Covid19 #Business #Economy #Jobs,1249943099737923584,https://twitter.com/Al_Maldives/status/1249943099737923584
2020-04-14 06:07:38,elizabethmary57,TaraLaRosa,0,0,0,"In Jan my father-in-law was in the hospital in Texas ICU overflowing no beds! They told him flu &amp; viral pneumonia. All the symptoms of Covid. Hospital Covid like w chaos. Now hospitals are empty in Texas. mortality rate low @274? I think it’s been here! NOW ECON DESTROYED! Sad.",,,,1249942371837624321,https://twitter.com/elizabethmary57/status/1249942371837624321
2020-04-14 05:57:55,BeardTrends,NightShift512,0,0,0,"Immoral how? Like adding 2.2 billion in frivolous spending into a COVID-19 relief bill? No that was Pelosi. Maybe mail in voting, no that's also the Democrats.",,,,1249939926344519682,https://twitter.com/BeardTrends/status/1249939926344519682
2020-04-14 05:56:07,ABCNoticiasMX,,1,0,13,"Busca NL cooperación entre estados contra COVID-19 El gobernador Jaime Rodríguez se reunió con sus homólogos de la zona noreste y autoridades de Texas. ",,,,1249939470134030338,https://twitter.com/ABCNoticiasMX/status/1249939470134030338
2020-04-14 05:49:41,covidtx,,0,0,0,"What we know about the 416 confirmed cases of COVID-19 in East Texas https://www.kltv.com/2020/04/11/what-we-know-about-confirmed-cases-covid-east-texas/ #covidtx",,,#covidtx,1249937853196505095,https://twitter.com/covidtx/status/1249937853196505095
2020-04-14 05:49:32,pujaroy32668969,,0,0,0,"US court blocks Texas curbs on medication abortion during Covid-19 pandemic ",,,,1249937816743796736,https://twitter.com/pujaroy32668969/status/1249937816743796736
2020-04-14 05:47:29,Al_Maldives,,0,0,0,"Coronavirus in #Texas: Texas reports 13,906 cases and 287 deaths | The Texas Tribune #coronavirus #CoronaCrisis #CoronaAlert #CoronavirusOutbreak #CoronaVirusUpdate #Covid #Covid_19 #Covid19",,,#Texas #coronavirus #CoronaCrisis #CoronaAlert #CoronavirusOutbreak #CoronaVirusUpdate #Covid #Covid_19 #Covid19,1249937301242646530,https://twitter.com/Al_Maldives/status/1249937301242646530
2020-04-14 05:40:21,VictorMattoon,,0,0,0,"COVID-19 Patients Given Unproven Drug In Texas Nursing Home In 'Disconcerting' Move ",,,,1249935503010361344,https://twitter.com/VictorMattoon/status/1249935503010361344
2020-04-14 05:21:12,IamLita,,0,0,0,"..Texas Woman Who Claimed COVID-19 Was ‘Media Driven’ Hoax Dies From Virus - https://go.shr.lc/3aLIFUx via @Shareaholic",,@Shareaholic,,1249930682853285888,https://twitter.com/IamLita/status/1249930682853285888
2020-04-14 05:18:29,keclrl,,0,0,0,"Was a beautiful day for an isolated drive #thewoodlands #texas #Blaze #pink #flames #mini #minis #miniusa #minigirl #minicooper #isolation #quarantine #covid_19 #deserted @The Woodlands, Texas https://www.instagram.com/p/B-8wNunjYBv/?igshid=dxrxpums3q81",,,#thewoodlands #texas #Blaze #pink #flames #flames #mini #minis #miniusa #minigirl #minicooper #isolation #quarantine #covid_19 #deserted,1249930000368898048,https://twitter.com/keclrl/status/1249930000368898048
2020-04-14 05:17:35,covidtx,,0,0,0,"WATCH: Gov. Abbott sees ‘glimmers of hope’ with COVID-19, but too early to say when Texas can reopen https://www.ksat.com/news/local/2020/04/13/watch-gov-abbott-sees-glimmers-of-hope-with-covid-19-but-too-early-to-say-when-texas-can-reopen/?__vfz=medium%3Dsharebar #covidtx",,,#covidtx,1249929774094581760,https://twitter.com/covidtx/status/1249929774094581760
2020-04-14 05:15:56,sjmmz34,Trrrav_,1,0,0,"Read YOUR tweet again. You said a covid test won't stop people from needing a ventilator. Nothing metaphorical about it. It's false. If you can't see that basic fact, then good luck to you. I hope tests are plentiful when you need one.",,,,1249929361341288454,https://twitter.com/sjmmz34/status/1249929361341288454
2020-04-14 05:15:31,Rubikz,,1,0,9,"**Alt timeline in which COVID-19 doesn't exist** Just got back from Japan, so many good ramen spots! 3 weeks till Texas! Can't wait to see the mandem!",,,,1249929253501558784,https://twitter.com/Rubikz/status/1249929253501558784
2020-04-14 05:14:06,keclrl,,0,0,0,"All alone #covid_19 #quarantine #stayhome #deserted #thewoodlands #texas #anadarko #Blaze #pink #flames #mini #minis #miniusa #minicooper #minigirl @The Woodlands, Texas https://www.instagram.com/p/B-8vtsKDbtg/?igshid=1t6mn2u5q2fn",,,#covid_19 #quarantine #stayhome #stayhome #deserted #thewoodlands #texas #anadarko #Blaze #pink #flames #flames #mini #minis #miniusa #minicooper #minigirl,1249928900093902848,https://twitter.com/keclrl/status/1249928900093902848
2020-04-14 05:11:23,keclrl,,0,0,0,"Emptiness #Blaze #pink #flames #mini #minis #minicooper #miniusa #minigirl #quarantine #stayhome #covid_19 #empty #emptiness #alone #parkinggarage #thewoodlands #texas https://www.instagram.com/p/B-8vZ7rjRnM/?igshid=r5pmgdk006z0",,,#Blaze #pink #flames #flames #mini #minis #minicooper #miniusa #minigirl #quarantine #stayhome #stayhome #covid_19 #empty #emptiness #alone #parkinggarage #thewoodlands #texas,1249928216212537346,https://twitter.com/keclrl/status/1249928216212537346
2020-04-14 05:10:47,ArmyIWGFW,,0,0,0,"""Judge Bill Gravell, a judge in Williamson County, Texas, was caught attending his grandson’s birthday party on Tuesday April 7–the same day he had extended his order requiring everyone in the county to stay home until the end of April amid the COVID-1..."" ",,,,1249928063388987392,https://twitter.com/ArmyIWGFW/status/1249928063388987392
2020-04-14 05:01:49,Meding001,CNNPolitics,2,0,1,"Do you really want truth ? Covid 19 death per mill residents by states ( D: Dem governors, R: Rep ) New York (D) 513 New Jersey (D)275 Louisiana (D)190 Connecticut (D)168 Michigan (D) 161 Massachusetts (R)124 Georgia (R) 45 Florida (R) 24 California ( D) 18 Texas (R) 10",,,,1249925807453151232,https://twitter.com/Meding001/status/1249925807453151232
2020-04-14 05:01:05,Rdurb,charliekirk11,0,0,1,"A little space to stretch your legs goes a long way. Everythig is bigger in Texas. Except COVID-19 cases ",,,,1249925622052372480,https://twitter.com/Rdurb/status/1249925622052372480
2020-04-14 05:00:23,Meding001,nytimes,0,0,0,"Covid 19 death per mill residents by states ( D: Dem governors, R: Rep ) New York (D) 513 New Jersey (D)275 Louisiana (D)190 Connecticut (D)168 Michigan (D) 161 Massachusetts (R)124 Georgia (R) 45 Florida (R) 24 California ( D) 18 Texas (R) 10",,,,1249925444557733888,https://twitter.com/Meding001/status/1249925444557733888
2020-04-14 04:57:22,philanderwicks,,0,1,3,"Texas Doctor Gave Hydroxychloroquine To COVID-19 Patients Without Consent. ",,,,1249924686739275776,https://twitter.com/philanderwicks/status/1249924686739275776
2020-04-14 04:56:33,SolDeZamora,,0,0,0,"Los estados fronterizos sólo contabilizan 389 casos al 6 de abril, estos son 27 mil 176 menos que los registrados en Arizona, California, Nuevo México y Texas #COVID-19 #Cuarentena #YoMeQuedoEnMiCasa https://bit.ly/2V6bx4D",,,#COVID #Cuarentena #YoMeQuedoEnMiCasa,1249924479935025154,https://twitter.com/SolDeZamora/status/1249924479935025154
2020-04-14 04:56:27,soldemorelia,,0,0,1,"Los estados fronterizos sólo contabilizan 389 casos al 6 de abril, estos son 27 mil 176 menos que los registrados en Arizona, California, Nuevo México y Texas #COVID-19 #Cuarentena #YoMeQuedoEnMiCasa https://bit.ly/2V6bx4D https://bit.ly/2V6bx4D",,,#COVID #Cuarentena #YoMeQuedoEnMiCasa,1249924456853786624,https://twitter.com/soldemorelia/status/1249924456853786624
2020-04-14 04:53:10,RegionalDeTam,,0,0,0,"Tamaulipas, NL, Coahuila y Chihuahua coordinan acciones con Texas ante Covid-19 - http://elregionaldetamaulipas.com/?p=35286",,,,1249923628390649856,https://twitter.com/RegionalDeTam/status/1249923628390649856
2020-04-14 04:41:43,LumineuxOr,,0,0,1,"Nuevo León, Coahuila, Tamaulipas y Texas se unen para enfrentar el COVID-19 - http://PacoZea.com",,,,1249920747188948994,https://twitter.com/LumineuxOr/status/1249920747188948994
2020-04-14 04:39:11,JoseAngelDesign,,0,1,0,"Excited to share the latest addition to my #etsy shop: Skull Mouth Green Neck Gaiter https://etsy.me/2wySYMW #texas #mask #face #shield #cover #corona #covid #faceshield #facemask",,,#etsy #texas #mask #face #shield #cover #corona #covid #faceshield #facemask,1249920110627823617,https://twitter.com/JoseAngelDesign/status/1249920110627823617
2020-04-14 04:39:00,TexasObserver,,1,3,10,"As the pandemic spread, the @Guttmacher Institute found that patients in Texas would face the biggest increase in travel as a result of COVID-19 abortion bans. One woman saw that borne out—she had to travel 18 hours round trip for a medication abortion. ",,@Guttmacher,,1249920063605321728,https://twitter.com/TexasObserver/status/1249920063605321728
2020-04-14 04:38:50,notrealsmart,ritholtz,0,0,1,"Three points: 1) Article does a great job of highlighting current administration gaps 2) Article does not address all post Bush II gaps in the Obama administration 3) Article does not address that NE - west coast, COVID-19 is lethal but for areas like Texas, Influenza is riskier",,,,1249920021733814272,https://twitter.com/notrealsmart/status/1249920021733814272
2020-04-14 04:38:33,_BENJ4MIN_,,0,0,1,"How I be, working from home. Also, first post since 2017. The things this quarantine makes us do. #covid @Fort Stockton, Texas https://www.instagram.com/p/B-8rpeQhmgR/?igshid=4t2tkct7j6wz",,,#covid,1249919952020258816,https://twitter.com/_BENJ4MIN_/status/1249919952020258816
2020-04-14 04:37:45,GailAScott65,funder,0,0,0,"Scott, the Republicans in Texas demand one mandatory state covid website that is NOT reporting accurate numbers (e.g. same numbers 2 consecutive days, etc.) Last time I felt this uninformed was the Vietnam war when stats were under-reported. Thank God for our mainstream media!",,,,1249919749791891458,https://twitter.com/GailAScott65/status/1249919749791891458
2020-04-14 04:37:09,AgenciaVmc,,0,0,1,"En este primer intercambio binacional, el Gobernador, Francisco García Cabeza de Vaca, propuso homologar la aplicación de pruebas rápidas de COVID-19, como ya lo implementa Texas, e insistió en evitar los viajes no esenciales de… https://agenciainformativavmc.com/2020/featured/53749/",,,,1249919600537604097,https://twitter.com/AgenciaVmc/status/1249919600537604097
2020-04-14 04:34:30,drwangmd,,0,0,0,"North Texas doctor’s offices are hurting, too, and they’re crucial to the COVID-19 response ",,,,1249918933131571201,https://twitter.com/drwangmd/status/1249918933131571201
2020-04-14 04:30:47,TampsInforma,,0,0,0,"Tamaulipas, NL, Coahuila y Chihuahua coordinan acciones con Texas ante Covid-19 https://tamaulipasinforma.com.mx/?p=9150 @gobtam @fgcabezadevaca",,@gobtam @fgcabezadevaca,,1249917997394923521,https://twitter.com/TampsInforma/status/1249917997394923521
2020-04-14 04:27:59,NoresteDigital,,0,3,4,"#AvisoEspecial: #Tamaulipas reporta 4 nuevos casos de COVID-19, suman 80 http://norestedigital.net/2020/04/13/tamaulipas-reporta-4-nuevos-casos-de-covid-19-suman-80/ #FelizMartes #NLD #Reynosa #Matamoros #CdVictoria #Tampico #Madero #Altamira #CDMX #Edomex #ContingenciaPositiva #Monterrey #Texas #Veracruz #SLP #QuedateEnCasa #ConLosNiñosNo",,,#AvisoEspecial #Tamaulipas #FelizMartes #NLD #Reynosa #Matamoros #CdVictoria #Tampico #Madero #Altamira #CDMX #Edomex #ContingenciaPositiva #Monterrey #Texas #Veracruz #SLP #QuedateEnCasa #QuedateEnCasa #ConLosNi,1249917290449195009,https://twitter.com/NoresteDigital/status/1249917290449195009
2020-04-14 04:25:08,Vi3tRevenant,,0,1,1,"Texas: 63 Harris Co. jail workers and 46 inmates now with COVID-19 ",,,,1249916575936917505,https://twitter.com/Vi3tRevenant/status/1249916575936917505
2020-04-14 04:20:15,MightyHealthful,,0,0,0,"Federal Appeals Court Reinstates Texas Abortion Ban Instituted During COVID-19 Crisis ",,,,1249915345399242753,https://twitter.com/MightyHealthful/status/1249915345399242753
2020-04-14 04:15:51,delinjerosin,,0,0,0,"'People at home have got to start paying attention,' says Texas lawyer on COVID-19 front lines https://www.abajournal.com/web/article/10-questions-a-texas-lawyer-is-on-covid-19-front-lines via @ABAJournal",,@ABAJournal,,1249914236886831106,https://twitter.com/delinjerosin/status/1249914236886831106
2020-04-14 04:15:00,DrMLernerMDPhD,ErinMPerrine,0,0,0,"Get a round table of#treating doctors come up with a doctor strategy#.Delayed treatment is catastrophic#ventilation is too late 80% death rate.Stop holding back doctors .Listen to#Senator Ron Johnson.Dr Robin Armstrong Texas Nursing home HCQ 54 covid+ treated No hospital.",,,,1249914026374692867,https://twitter.com/DrMLernerMDPhD/status/1249914026374692867
2020-04-14 04:15:00,KSNNews,,0,0,2,"The ongoing COVID-19 pandemic on Monday prompted the U.S. Census Bureau to ask Congress to give the agency an extension until Oct. 31 to collect data, which at least one South Texas congressman favors to allow rural border communities more time to respond. ",,,,1249914025300963334,https://twitter.com/KSNNews/status/1249914025300963334
2020-04-14 04:14:55,web_n_tech,,0,0,0,"US court blocks Texas curbs on medication abortion during Covid-19 pandemic https://mdworld.co/us-court-blocks-texas-curbs-on-medication-abortion-during-covid-19-pandemic/",,,,1249914004207788033,https://twitter.com/web_n_tech/status/1249914004207788033
2020-04-14 04:12:50,charleywilkison,,0,5,10,"Elected officials are beginning to join CLEAT’s position of asking for COVID-19 to be a presumptive disease for 1st Responders in Texas @CLEAT @NAPOpolice @FWPOA @DallasNLLEO @WacoPoliceAssoc @ATXPOA @SAPoliceAssn @DSAofBC @EPMPOA @EPCSOA",,@CLEAT @NAPOpolice @FWPOA @DallasNLLEO @WacoPoliceAssoc @ATXPOA @SAPoliceAssn @DSAofBC @EPMPOA @EPCSOA,,1249913481811427328,https://twitter.com/charleywilkison/status/1249913481811427328
