date,username,to,replies,retweets,favorites,text,geo,mentions,hashtags,id,permalink
2020-04-25 15:00:33,TTUengaged,,1,0,0,"A collaborative group of faculty from Texas Tech University and the Texas Tech University Health Sciences Center (TTUHSC) are joining forces to create 3D-printed face shields and face masks for health care workers in hopes of fighting the spread of the coronavirus (COVID-19). ",,,,1254062749082177536,https://twitter.com/TTUengaged/status/1254062749082177536
2020-04-25 15:00:06,TxBeechChris,,0,0,0,"Texas Dental Association: Allow the use of TeleDentistry for Texas dentists during the COVID-19 Pandemic. - Sign the Petition! http://chng.it/XkrM8CMC via @Change",,@Change,,1254062636842377217,https://twitter.com/TxBeechChris/status/1254062636842377217
2020-04-25 14:57:38,MarktheSpaman,,0,0,0,"#DOJ halts Dallas spa touting ozone treatment for COVID-19 ~ https://www.timesrecordnews.com/story/news/local/2020/04/24/doj-halts-dallas-spa-touting-ozone-treatment-covid-19/3021570001/ via @TimesRecordnews @KowalickNews Texas.",,@timesrecordnews @KowalickNews,#DOJ,1254062016274345984,https://twitter.com/MarktheSpaman/status/1254062016274345984
2020-04-25 14:52:22,Jsuardi1,,0,0,0,"Texas COVID-19 testing among worst in nation - ABC13 Houston https://abc13.com/6127913/?taid=5ea39e78e1ba140001280262 #SmartNews",,,#SmartNews,1254060689628381184,https://twitter.com/Jsuardi1/status/1254060689628381184
2020-04-25 14:52:17,DormanHill,,0,0,0,"Should be noted that Texas also lags behind many states for deaths per 100000, hospitalizations per 100000 and we have almost 500000 open jobs that need to be filled Texas COVID-19 testing still less than 1% as Central Texas counties see case increases ",,,,1254060669181333507,https://twitter.com/DormanHill/status/1254060669181333507
2020-04-25 14:52:06,planejoy,,0,0,0,"Texas Anti-Vaxxers Fear Mandatory COVID-19 Vaccines More Than the Virus Itself https://www.texasmonthly.com/news/texas-anti-vaxxers-fear-mandatory-coronavirus-vaccines/ And they should! Beware eugenicist Gates &amp; vaccines!",,,,1254060622645526528,https://twitter.com/planejoy/status/1254060622645526528
2020-04-25 14:48:53,aquanette69,,0,0,0,"@HEB and their partners (as they refer to their employees) have been true Texas Heroes during this crisis. From the beginning they have strived to help us make it through safely. I love me some #HEB ...now about my rumpled bread loaf. #StayHome #Covid_19 #COVID19",,@HEB,#HEB #StayHome #StayHome #Covid_19 #COVID19,1254059815099383813,https://twitter.com/aquanette69/status/1254059815099383813
2020-04-25 14:48:42,dpmlawfirm,,0,0,0,"Texas Law Firm Group handling Covid-19 Business Interruption Claims ",,,,1254059767099727872,https://twitter.com/dpmlawfirm/status/1254059767099727872
2020-04-25 14:48:06,Xenophon9,,0,1,0,"Texas COVID-19 testing among worst in nation http://a.msn.com/01/en-us/BB13amFE?ocid=st2 #TexasGOPFail #TrumpGOPCostLivesAndJobs",,,#TexasGOPFail #TrumpGOPCostLivesAndJobs,1254059615685402626,https://twitter.com/Xenophon9/status/1254059615685402626
2020-04-25 14:47:00,DandmanH,,0,0,1,"Neighbors in Katy Texas lining up for food Help... Covid economy victims... we are all in this Together! ",,,,1254059338899079172,https://twitter.com/DandmanH/status/1254059338899079172
2020-04-25 14:44:58,JusticeFoTXKids,,0,0,1,"Changes to the juvenile justice system must be implemented everywhere, but especially in Texas. RT @taylershreve: RT @fadergator: The number of kids in secure detention decreased by 24% in March in response to #Covid_19, a one month reduction equivalent…",,@taylershreve @fadergator,#Covid_19,1254058826569039873,https://twitter.com/JusticeFoTXKids/status/1254058826569039873
2020-04-25 14:44:00,bcastiglia44,,0,0,0,"COVID-19 Bombshell:Texas Bars Can Reopen for Takeout ",,,,1254058586428157952,https://twitter.com/bcastiglia44/status/1254058586428157952
2020-04-25 14:43:53,NTXCMC,,0,0,1,"We can have a deepening hunger for the Lord despite the COVID-19 pandemic, says @deaconharold as he reflects on the joyful mysteries of the #Rosary. Join the live, virtual North Texas #Catholic Men's Conference now at http://www.catholicbrothersforchrist.com on Facebook or YouTube.",,@deaconharold,#Rosary #Catholic,1254058554522288129,https://twitter.com/NTXCMC/status/1254058554522288129
2020-04-25 14:41:22,PulpNews,,0,0,0,"#Texas #father teaches kids importance of serving others during COVID-19 outbreak - Apr 25 @10:38 AM ET https://oddcrimes.com/static/2020/04/25/Texas-father-teaches-kids-importance-of-serving-others-during-COVID-19-outbreak.php",,,#Texas #father,1254057920096079872,https://twitter.com/PulpNews/status/1254057920096079872
2020-04-25 14:36:44,SarahLynn2390,GarrettHaake,0,0,12,"I miss Beto. Biden needs to reach out to him to do some on the ground campaigning in Texas (when it's safe to do so). He hasn't been here too much (even before Covid-19) and Texans are noticing.",,,,1254056753857269760,https://twitter.com/SarahLynn2390/status/1254056753857269760
2020-04-25 14:35:53,CreativeInv,businessinsider,0,5,7,"Meanwhile, in Texas, San Antonio Nurse Creates Highly Efficient Masks for COVID-19 Cases https://atlantablackstar.com/2020/04/20/san-antonio-nurse-creates-highly-efficient-masks-for-possible-surge-in-covid-19-cases/ via @atlblackstar",,@ATLBlackStar,,1254056543663906816,https://twitter.com/CreativeInv/status/1254056543663906816
2020-04-25 14:35:37,raj96630401,,0,0,0,"Truth!!!! #newbraunfelstx #comalcounty #bexarcounty #methodistaircare1 #flightparamedic #paramedic #emergencypreparedness #emergencyroom #flightnurse #covid_19 #stoicism #stayhome #trueleaders @New Braunfels, Texas https://www.instagram.com/p/B_aEuE8A4ZP/?igshid=1rny43st8l00b",,,#newbraunfelstx #comalcounty #bexarcounty #methodistaircare1 #flightparamedic #paramedic #emergencypreparedness #emergencyroom #flightnurse #covid_19 #stoicism #stayhome #stayhome #trueleaders,1254056474814406656,https://twitter.com/raj96630401/status/1254056474814406656
2020-04-25 14:33:03,MetroTexRE,,0,0,0,"Texas home sales increase in first quarter of 2020; COVID-19 creates uncertainty for second quarter | DFW Real Estate - https://bit.ly/2S0b6Hh #housingmarket #northtexas #covid19",,,#housingmarket #northtexas #covid19,1254055827209629697,https://twitter.com/MetroTexRE/status/1254055827209629697
2020-04-25 14:27:51,PepeEnzo2,JohnCornyn,0,0,1,"This article shows social distancing has worked in Texas. COVID-19 hasn’t “just disappeared.” Healthy people MUST get tested so we can understand how many pre-symptomatic cases we have. The buck now stops with Governors, now that Trump made it clear, he isn’t responsible.",,,,1254054521640226820,https://twitter.com/PepeEnzo2/status/1254054521640226820
2020-04-25 14:24:23,WondaSa08762447,,0,0,0,"Here is a look at the latest COVID-19 headlines from around Houston, Texas for Friday, April 24. ",,,,1254053649623506944,https://twitter.com/WondaSa08762447/status/1254053649623506944
2020-04-25 14:17:00,TexasObserver,,2,72,46,"More than one-fifth of all Texas counties have only one or no primary care physician. So far, more than 100 COVID-19 cases have been reported in counties with only one—or no—licensed physician. ",,,,1254051788761657346,https://twitter.com/TexasObserver/status/1254051788761657346
2020-04-25 14:15:15,MuellerWhois,AnnaMollyTX,0,0,0,"Texas hospitals are going to be overrun in 2-3weeks tops. People are going to die and families will ask if they were tested for COVId. When that answer is sorry he don’t have the tests, even the Magats in Tx are going to flip out at the GOP.",,,,1254051347944615938,https://twitter.com/MuellerWhois/status/1254051347944615938
2020-04-25 14:15:06,Yombe,JustPaigeK,25,91,349,"Definitely not. Texas’ Gov. Abbott, along w/ his Trump-sycophants Dan Patrick, Ken Paxton, John Cornyn+, have, despite scientific evidence of the risk, re-opened TX. TX is the most uninsured in nation, and in the lower 5 for COVID-19 testing. ",,,,1254051310854438912,https://twitter.com/Yombe/status/1254051310854438912
2020-04-25 14:12:19,sheldonchang,JohnCornyn,0,0,0,"Let's see what's happening in Texas: -Texas leaves families in the dark over coronavirus at state run homes -COVID-19 Patients Given Unproven Drug (hydrochloroquine) In Texas Nursing Home",,,,1254050609487065093,https://twitter.com/sheldonchang/status/1254050609487065093
2020-04-25 14:11:09,UTexasMcCombs,,0,0,2,"Texas McCombs Professor James Scott's collaboration with other UT researchers is featured on @cbsaustin | Latest UT model projects 64% probability that COVID-19 deaths have peaked in Texas https://bit.ly/2yLROhN",,@cbsaustin,,1254050315869073409,https://twitter.com/UTexasMcCombs/status/1254050315869073409
2020-04-25 14:09:14,thekohler,ComradeTheD,1,0,2,"Find out what it feels like to win Arizona, Michigan, Wisconsin, Florida, and North Carolina at the same time. Hell, as Covid deaths mount, maybe even Texas. But hey, we lost the votes of a bunch of loser tankies from blue states. ",,,,1254049835130511362,https://twitter.com/thekohler/status/1254049835130511362
2020-04-25 14:08:39,_laurenduhon,,0,0,0,"Dozens of COVID-19 Cases Have Been Reported in Rural Texas Counties With No Hospitals and No Licensed Physicians ",,,,1254049686828318725,https://twitter.com/_laurenduhon/status/1254049686828318725
2020-04-25 14:07:15,seriouslyfit,,0,0,0,"Texas COVID-19 testing among worst in nation - ABC13 Houston #SmartNews",,,#SmartNews,1254049337665097728,https://twitter.com/seriouslyfit/status/1254049337665097728
2020-04-25 14:05:58,777mhallockgma1,,0,1,1,"Texas COVID-19 testing among worst in nation - ABC13 Houston https://abc13.com/6127913/?taid=5ea39e78e1ba140001280262",,,,1254049012044398592,https://twitter.com/777mhallockgma1/status/1254049012044398592
2020-04-25 14:03:12,BrendaSJeffreys,,0,0,0,"In time of COVID-19 crisis, here's how people who passed the February 2020 Texas Bar Exam will take their oath https://bit.ly/2KwzZGb @TexasLawyer",,@TexasLawyer,,1254048318847684611,https://twitter.com/BrendaSJeffreys/status/1254048318847684611
2020-04-25 14:03:02,njtxgal,realDonaldTrump,2,0,0,"Texas is at the very bottom of COVID-19 testing per capita.",,,,1254048273356279809,https://twitter.com/njtxgal/status/1254048273356279809
2020-04-25 13:59:53,CeliaBobo,,0,0,0,"Texas COVID-19 testing among worst in nation - ABC13 Houston #SmartNews https://abc13.com/6127913/?taid=5ea39e78e1ba140001280262",,,#SmartNews,1254047480439857152,https://twitter.com/CeliaBobo/status/1254047480439857152
2020-04-25 13:59:51,willbarrett_1,,0,0,0,"Texas AG on state easing COVID-19 restrictions to slowly reopen economy Ken Paxton, Texas Attorney General, discusses the state updating guidelines for places of worship amid the coronavirus crisis. ",,,,1254047475444461568,https://twitter.com/willbarrett_1/status/1254047475444461568
2020-04-25 13:59:30,AKMorlan,,0,0,0,"@SRuhle Dallas, TX - A federal court entered a permanent injunction halting a purported “ozone therapy” center in Dallas, Texas, from offering unproven treatments for coronavirus disease (COVID-19). https://www.morelaw.com/verdicts/case.asp?n=&amp;s=TX&amp;d=139891",,@SRuhle,,1254047387401797632,https://twitter.com/AKMorlan/status/1254047387401797632
2020-04-25 13:52:41,GeminiInk,,0,0,0,"Love in the Time of Covid-19 – A Virtual Writing Retreat with author Tina Barry; The Big Texas Read! - https://mailchi.mp/geminiink.org/igniting-the-fire-708573",,,,1254045668987023360,https://twitter.com/GeminiInk/status/1254045668987023360
2020-04-25 13:52:25,__nuz,tallmaurice,0,0,2,"That entire county of Texas has 130 out of their nearly 6000 hospital beds being occupied by covid patients. What’s the argument for keeping communities like that locked down?",,,,1254045601311920129,https://twitter.com/__nuz/status/1254045601311920129
2020-04-25 13:47:17,rhotwire,,0,0,0,"Texas COVID-19 testing among worst in nation - ABC13 Houston #SmartNews ⁦@realDonaldTrump⁩ ⁦@greggutfeld⁩ ⁦@JesseBWatters⁩ ⁦@TheFive⁩ @danaPerino https://abc13.com/6127913/?taid=5ea39e78e1ba140001280262",,@realDonaldTrump @greggutfeld @JesseBWatters @TheFive @DanaPerino,#SmartNews,1254044311248928770,https://twitter.com/rhotwire/status/1254044311248928770
2020-04-25 13:45:48,thomas9023,,0,0,1,"I still think we're being lied to. I've spoken to a few people I know and trust across Texas, and I'm hearing that nurses are being sent home, beds are empty.. it's not what the media is trying to portray..80-90% people who contract covid-19 survive. What's the flue rate?",,,,1254043938073255940,https://twitter.com/thomas9023/status/1254043938073255940
2020-04-25 13:39:57,Lam88881,,1,0,0,"Texas-04/25 6:30am Increased 992, 109% above projected. Projected Peak Date (PPD) 4/12, half width 26.4 days. Peak Cases 956. PPD moved down a day due to huge increase. #Houston #Covid #Covid19 #medtwitter #harriscounty #Texas #charts",,,#Houston #Covid #Covid19 #medtwitter #harriscounty #Texas #charts,1254042463834181632,https://twitter.com/Lam88881/status/1254042463834181632
2020-04-25 13:39:50,goyer_sara,JohnCornyn,0,0,0,"John Cornyn- speak time the fact that the president is trying the KILL PEOPLE with his ill advice on how to treat Covid. He’s a lunatic and so are you if you don’t speak up and tell Texas that you don’t believe this nonsense! He’s unfit to speak about anything, much less this!",,,,1254042436164292609,https://twitter.com/goyer_sara/status/1254042436164292609
2020-04-25 13:33:46,ksreef512,,0,0,1,"When quarantine use to be fun.....and I was internally sponsored by Kroger’s wine section. PS. HOOK EM • • • • • • • • krogerco @TexasSports #covid_19 #stayhome #socialdistancing #booze #houston #texas #tx #htx… https://www.instagram.com/p/B_YmcnWlE1u/?igshid=1gopehwauhq9u",,@texassports,#covid_19 #stayhome #stayhome #socialdistancing #booze #houston #texas #tx #htx,1254040907759919110,https://twitter.com/ksreef512/status/1254040907759919110
2020-04-25 13:33:22,ccox888,LabradorYuki,0,0,1,"The man's a fucking maniac! Truly! And my brother lives in Houston, Texas. Terrifies me that he's living over there with Trump in charge of COVID-19 measures. ",,,,1254040807872491520,https://twitter.com/ccox888/status/1254040807872491520
2020-04-25 13:33:19,OmmVisions,,0,0,0,"COVID-19 Patients Given Unproven Drug In Texas Nursing Home In 'Disconcerting' Move ",,,,1254040794576621569,https://twitter.com/OmmVisions/status/1254040794576621569
2020-04-25 13:32:48,SouthernFlorida,,0,3,1,"Dozens of COVID-19 Cases Have Been Reported in Rural Texas Counties With No Hospitals and No Licensed Physicians ",,,,1254040668080607233,https://twitter.com/SouthernFlorida/status/1254040668080607233
2020-04-25 13:32:08,WatkinsDolf,,0,0,0,"Dozens of COVID-19 Cases Have Been Reported in Rural Texas Counties With No Hospitals and No Licensed Physicians https://www.texasobserver.org/covid-19-texas-map-rural",,,,1254040496760139776,https://twitter.com/WatkinsDolf/status/1254040496760139776
2020-04-25 13:31:18,WatkinsDolf,,0,0,0,"COVID-19 Cases Now Tied to Meat Plants in Rural Texas Counties Wracked with Coronavirus ",,,,1254040287447519233,https://twitter.com/WatkinsDolf/status/1254040287447519233
2020-04-25 13:26:04,georg_dreyman,Haag_N_Daz,0,0,1,"#HerdImmunity has been part of successfully defeating viruses for hundreds of years. But now it’s different? And multiple studies now show that transmission of Covid is most prevalent at home. #Texas ",,,#HerdImmunity #Texas,1254038971841155072,https://twitter.com/georg_dreyman/status/1254038971841155072
2020-04-25 13:25:16,ChaimSteinberge,,0,0,0,"I didn't realize the disparity between NYC and elsewhere: ""more Covid-19 fatalities on Nassau County . . . than in all of California . . . more fatalities in Westchester . . . than in Texas"" Covid deaths &gt; 16 x . ",,,,1254038770690723842,https://twitter.com/ChaimSteinberge/status/1254038770690723842
2020-04-25 13:25:01,TheAnnoyedMan,Prof_John_Frink,1,0,1,"This is an excellent thread. In Tarrant County, Texas, where I live, there are 1,706 reported COVID-19 cases to date, and 46 deaths .... out of a 2020 population of 2,127,850 people. Fort Worth—the county seat—is a decent sized city of 750,000 people. 46 dead, out of 2,127,850. ",,,,1254038707658784770,https://twitter.com/TheAnnoyedMan/status/1254038707658784770
2020-04-25 13:21:58,beachbly65,,0,0,0,"Spring has sprung!. Another beautiful day in AUSTIN. One COVID +. I’m home to enjoy this weather @Adirondack, Austin, Texas https://www.instagram.com/p/B_Z8Sm0lhX7dbWSszAZW0CPvBRHBoEP1ojb_qQ0/?igshid=1j6bq58hugh5k",,,,1254037938159091722,https://twitter.com/beachbly65/status/1254037938159091722
2020-04-25 13:17:22,K540B,JessLivMo,0,0,0,"immigrants near the mexico / texas / arizona borders overrun mexican hospitals with Covid 19 ",,,,1254036780757778434,https://twitter.com/K540B/status/1254036780757778434
2020-04-25 13:12:44,rusportsfan2,,0,0,0,"Texas AG on state easing COVID-19 restrictions to slowly reopen economy ",,,,1254035617463205890,https://twitter.com/rusportsfan2/status/1254035617463205890
2020-04-25 13:09:41,debrajsaunders,AriFleischer,8,36,83,"As of Friday, there have been more Covid-19 fatalities on Long Island’s Nassau County (population 1.4 million) than in all of California (population 40 million). There have been more fatalities in Westchester County (989) than in Texas (611). ",,,,1254034849268150272,https://twitter.com/debrajsaunders/status/1254034849268150272
2020-04-25 13:06:42,tflinn1,CMCRET,0,0,2,"The Dark Angel of COVID is going to expose himself, 1K graduating cadets, and countless others for nothing more than satisfying the ego of a child, @realDonaldTrump I suggest U inject yourself with disinfectants before attending.",,@realDonaldTrump,,1254034098156449792,https://twitter.com/tflinn1/status/1254034098156449792
2020-04-25 13:00:04,KVUE,,1,4,7,"Texas COVID-19 testing still less than 1% as Central Texas counties see case increases ",,,,1254032427435032576,https://twitter.com/KVUE/status/1254032427435032576
2020-04-25 12:59:43,OurAmericanLife,,0,0,1,"Texas AG on state easing COVID-19 restrictions to slowly reopen economy ",,,,1254032340654985218,https://twitter.com/OurAmericanLife/status/1254032340654985218
2020-04-25 12:55:12,TVPromoGuy,,0,0,0,"This is how my Saturday is going... how ‘bout you? @krispykreme #covid_19 #coronavirus @Dallas, Texas https://www.instagram.com/p/B_Z5OqQnjRf/?igshid=1732uuwuxjvtt",,@krispykreme,#covid_19 #coronavirus,1254031205093109760,https://twitter.com/TVPromoGuy/status/1254031205093109760
2020-04-25 12:45:05,SrAndrewFSP,,23,17,256,"Sr. Mary Guadalupe (my fellow Texan!) passed away last night - not from COVID 19. Rest In Peace, dear Sister! (Pic of us visiting Sr. Guadalupe (center) when she was visiting family in Texas.) ",,,,1254028658802675712,https://twitter.com/SrAndrewFSP/status/1254028658802675712
2020-04-25 12:45:00,JusticeFoTXKids,,0,0,0,"Changes to the juvenile justice system must be implemented everywhere, but especially in Texas. RT @fadergator: The number of kids in secure detention decreased by 24% in March in response to #Covid_19, a one month reduction eq… https://twitter.com/i/web/status/1254021472898756609",,@fadergator,#Covid_19,1254028638183395330,https://twitter.com/JusticeFoTXKids/status/1254028638183395330
2020-04-25 12:44:51,JusticeFoTXKids,,0,0,0,"Changes to the juvenile justice system must be implemented everywhere, but especially in Texas. RT @Jflo1268: RT @fadergator: The number of kids in secure detention decreased by 24% in March in response to #Covid_19, a one month reduction equivalent…",,@Jflo1268 @fadergator,#Covid_19,1254028599151255552,https://twitter.com/JusticeFoTXKids/status/1254028599151255552
2020-04-25 12:30:01,kytxcbs19,,0,0,0,"The chief operating officer at The Texas State Aquarium says the behavior of the animals has changed during the COVID-19 pandemic. ",,,,1254024864681340929,https://twitter.com/kytxcbs19/status/1254024864681340929
2020-04-25 12:29:40,JFSLT905,,0,0,0,"@tedcruz hey Rafael are you hiding? You and Cornyn are useless! What have you done during covid other than catching it? Texas is last in testing but opening up already! ",,@tedcruz,,1254024777150406657,https://twitter.com/JFSLT905/status/1254024777150406657
2020-04-25 12:27:04,Parker_Rush,neeratanden,0,0,1,"@GregAbbott_TX @GovAbbott is a typical ""Republican first over country."" He's first in line to open the state &amp; kiss Trump's ass. Texas ranks #48 in testing. For a population of 29 Mil, less than 1% has been tested. Abbott has no idea how many #COVID cases we have. #COVID2019",,@GregAbbott_TX @GovAbbott,#COVID #COVID2019,1254024124982104065,https://twitter.com/Parker_Rush/status/1254024124982104065
2020-04-25 12:24:49,Frances719,,0,0,0,"Google Texas A&amp;M Pets COVID-19 there are a lot if articles out out my the Vets ",,,,1254023558772203521,https://twitter.com/Frances719/status/1254023558772203521
2020-04-25 12:23:32,LunaIssy,,0,0,1,"Will screaming change the way covid-19 has changed our lives? This Texas protestor seems to think so. ",,,,1254023235525439488,https://twitter.com/LunaIssy/status/1254023235525439488
2020-04-25 12:21:57,BostonJudy3,JohnCornyn,2,18,54,"John go ahead and stop social distancing if that’s what you are trying to say. Go for it and deep breathe that sunny Covid Texas air. Let us know how it works out for you. In the mean time, I hope the rest of Texas stays distanced and safe, ",,,,1254022835250647041,https://twitter.com/BostonJudy3/status/1254022835250647041
2020-04-25 12:18:03,MarkDau34132405,,0,0,0,"Texas COVID-19 testing among worst in nation - ABC13 Houston #SmartNews",,,#SmartNews,1254021856098738176,https://twitter.com/MarkDau34132405/status/1254021856098738176
2020-04-25 12:17:08,DrSchwertner,,7,18,56,"With antibody studies in NY, LA, and Miami Dade County showing an exponentially higher prevalence of Covid 19 in the population than initially thought, it makes no sense to remain shut down. Our strategy must change. Reopen Texas. #txlege",,,#txlege,1254021624820641793,https://twitter.com/DrSchwertner/status/1254021624820641793
2020-04-25 12:16:52,rr1955,iamthemajority2,0,1,3,"In Texas my county has setup a covid only facility, granted it’s hush hush exactly where it is.",,,,1254021558831644673,https://twitter.com/rr1955/status/1254021558831644673
2020-04-25 12:15:45,DallasTexasExes,,0,0,2,"Dallas Texas Exes hosted a parade for ⁦@Parkland⁩ Hosp #Covid Trauma ward 1st responders on Fri night. Longhorns decorates cars and circled the unit after donating 270 meals, ⁦@tiffstreats⁩ cookies and donating ⁦@KendraScott⁩ jewelry",,@Parkland @tiffstreats @KendraScott,#Covid,1254021274931789825,https://twitter.com/DallasTexasExes/status/1254021274931789825
2020-04-25 12:15:27,CounselorCarol1,,0,0,0,"Technology firm @Dataminr predicts that THREE counties in Texas (Lubbock, Hildalgo, Jefferson) will be the new COVID-19 hotspots, just as @GregAbbott_TX opens up Texas on Monday. Lubbock already has 494 cases. ",,@Dataminr @GregAbbott_TX,,1254021199757279232,https://twitter.com/CounselorCarol1/status/1254021199757279232
2020-04-25 12:12:20,WiskiFam,,0,0,2,"Burning off germs, fishing, hiking, and bickering like a quarantine family of 7 on Lake Weatherford #family #life #quarantine #socialdistancing #covid_19 #hiking #fishing #bigfamily #texas #weatherford @Weatherford… https://www.instagram.com/p/B_Z0UhMpwao/?igshid=1wefl7ah627di",,,#family #life #quarantine #socialdistancing #covid_19 #hiking #fishing #bigfamily #texas #weatherford,1254020414428381184,https://twitter.com/WiskiFam/status/1254020414428381184
2020-04-25 12:08:26,sandra4killeen,,0,0,0,"Dozens of COVID-19 Cases Have Been Reported in Rural Texas Counties With No Hospitals and No Licensed Physicians ",,,,1254019434311831555,https://twitter.com/sandra4killeen/status/1254019434311831555
2020-04-25 12:00:00,okayplayer,,0,6,15,"""I take dialysis four times a week."" Scarface (@BrotherMob) shares an update on his COVID-19 recovery, warns Georgia and Texas about re-opening. http://bit.ly/2Y4O1XQ",,@BrotherMob,,1254017312769728512,https://twitter.com/okayplayer/status/1254017312769728512
2020-04-25 11:50:03,LindiweGrace,HuffPost,0,0,0,"And yet, Covid infections were pretty high in Alabama, Georgia, Texas, Louisiana, Florida, and California.",,,,1254014807617011715,https://twitter.com/LindiweGrace/status/1254014807617011715
2020-04-25 11:49:37,DonLinn,s_m_i,0,0,2,"With Harris County (Houston) beset by Covid-19 and the oil and gas economy in shambles... I love Texas and Texans but come on.",,,,1254014701106847746,https://twitter.com/DonLinn/status/1254014701106847746
2020-04-25 11:47:55,gundam_cat,,0,0,0,"-_- Texas lottery sales surge as COVID stimulus money arrives ",,,,1254014271169728513,https://twitter.com/gundam_cat/status/1254014271169728513
2020-04-25 11:40:26,WordNews_it,,0,0,1,"Covid-19 nel mondo. #Wn #wordnewsit #attualità #cronaca #informazione #giornaleonline #legalità #cultura #ambiente #coronavirusnelmondo #usa #texas #germania #ecuador #emergenzacoronavirus #pandemia #morticovid19 Articolo di Simona di Sarno",,,#Wn #wordnewsit #attualit #cronaca #informazione #giornaleonline #legalit #cultura #ambiente #coronavirusnelmondo #usa #texas #germania #ecuador #emergenzacoronavirus #pandemia #morticovid19,1254012389114208256,https://twitter.com/WordNews_it/status/1254012389114208256
2020-04-25 11:40:00,KENS5,,0,0,1,"In various interviews this week, Gov. Greg Abbott discussed opening the state of Texas gradually based on the rate of spread of COVID-19. ",,,,1254012278283948032,https://twitter.com/KENS5/status/1254012278283948032
