date,username,to,replies,retweets,favorites,text,geo,mentions,hashtags,id,permalink
2020-04-25 17:23:27,HughDeWitter,,0,0,0,"Mgen resists macrolides and FQNs (to 100 and 90%), scavenges iron (FUR pathway), subclinical/chronic, rarely found by culture, found in 25% of BAL in +18y cohort. We rule it out in err if M.pneumoniae negative. See U.Texas study below. #covid19 covid autopsy coronavirus sarscov2",,,#covid19,1254098712227438597,https://twitter.com/HughDeWitter/status/1254098712227438597
2020-04-25 17:21:43,RustyFairbanks,thehill,0,0,0,"Once Beto starts talking, those 5 points will disappear. Let's wait and see how many people die from COVID-19 in Texas. Toe tags should say ""Compliments of Trump &amp; Abbot."" ",,,,1254098274249666561,https://twitter.com/RustyFairbanks/status/1254098274249666561
2020-04-25 17:16:23,IrvingFisher16,,0,0,1,"Cuomo is a genius! COVID deaths per million: New York: 1,117 Texas: 21",,,,1254096932680671238,https://twitter.com/IrvingFisher16/status/1254096932680671238
2020-04-25 17:13:53,K1Lawren,DrStevenHotze,0,0,0,"Hotze, a conservative leader in Texas, continues wreaking havoc in Harris County by falsely portraying COVID as no big deal &amp; expecting @GregAbbott_TX to pull a Kemp in Texas. Another @GOP member willing to kill grandma!",,@GregAbbott_TX @GOP,,1254096303472115713,https://twitter.com/K1Lawren/status/1254096303472115713
2020-04-25 17:12:27,RobWrig84228996,JohnCornyn,0,0,0,"Cronyman is busy faking deathcount in Texas with GOP governor. Covid-19 death in Texas : 200 Death from Texans forgetting to breath:15000",,,,1254095943059660800,https://twitter.com/RobWrig84228996/status/1254095943059660800
2020-04-25 17:09:14,5_2blue,,0,6,4,"A meatpacking plant in Deep East Texas appears to be connected to an outbreak of COVID-19 in a rural part of the state where the number of coronavirus cases has skyrocketed in recent weeks.",,,,1254095134192525318,https://twitter.com/5_2blue/status/1254095134192525318
2020-04-25 17:02:49,pharmacopsych,PeterHotez,0,0,0,"Perhaps Dr. Hotez, you could be in charge of the at least Texas’ “re-opening” program. Science-based, evidence-based, and effectively ↓ COVID-19 while ↑ safe working conditions. ",,,,1254093518529847297,https://twitter.com/pharmacopsych/status/1254093518529847297
2020-04-25 17:02:06,cdrtx,,0,0,0,"Texas Had a State Office That Could Have Investigated Racial Disparities in COVID-19 Cases. Lawmakers Defunded it Three Years Ago. ",,,,1254093337671405569,https://twitter.com/cdrtx/status/1254093337671405569
2020-04-25 17:01:19,TheColonyTX,,0,0,0,"Join us for North Texas Giving Tuesday! As relief efforts are launched worldwide to help aid families because the COVID-19 pandemic, North Texas Giving Tuesday, May 5th, will be a collaborative emergency... Schedule your gift today at https://soo.nr/PGab.",,,,1254093142837600259,https://twitter.com/TheColonyTX/status/1254093142837600259
2020-04-25 17:00:06,bcmhouston,,0,12,23,"Join Dr. Pedro Piedra, Dr. Robert Atmar, @DocWoc71 and other experts from around the Texas Medical Center May 2-3 as they break down the current COVID-19 situation and the way forward. http://bit.ly/covidevent #COVID19",,@DocWoc71,#COVID19,1254092833222524929,https://twitter.com/bcmhouston/status/1254092833222524929
2020-04-25 17:00:03,KAMCNews,,0,0,0,"Three South Plains area prisons have confirmed cases of COVID-19 in either inmates or staff members, according to the Texas Department of Criminal Justice. ",,,,1254092822615142400,https://twitter.com/KAMCNews/status/1254092822615142400
2020-04-25 16:59:27,kimleannelliot,SethCotlar,0,0,2,"A petulant buffoon can’t be a reassuring presence in a crisis. If Trump goes down in November, it will be because of the daily COVID-19 press conferences. One sentence my friend wrote: “If I avoid listening to Trump, I stay calm.” And yes she’s white, older and Texas born.",,,,1254092671712235520,https://twitter.com/kimleannelliot/status/1254092671712235520
2020-04-25 16:58:54,MamaRNLove,neeratanden,0,0,1,"@GovAbbott Texas has seen a doubling of #'s of new cases and deaths in the last 2 weeks across all metro areas in Texas. Despite this you're about to announce easing SIP restrictions tomorrow. How do you think COVID-19 and GOP poll #'s will look 2 weeks from now?",,@GovAbbott,,1254092533782773764,https://twitter.com/MamaRNLove/status/1254092533782773764
2020-04-25 16:57:21,GlobalPandemics,,0,0,0,"COVID-ALERT: Texas Town Unilaterally Re-Opens from Coronavirus Lockdown - Global Pandemic News | #Coronavirus #COVID19 - https://globalpandemic.net/news/texas-town-unilaterally-re-opens-from-coronaviruslockdown/",,,#Coronavirus #COVID19,1254092144802959363,https://twitter.com/GlobalPandemics/status/1254092144802959363
2020-04-25 16:56:22,Suzanne5419,GregAbbott_TX,4,3,25,"Please open Texas completely! Covid death Numbers do not warrant this shutdown and 24 million unemployed.",,,,1254091893862019073,https://twitter.com/Suzanne5419/status/1254091893862019073
2020-04-25 16:55:20,becker_sbecker,,0,0,0,"This episode features Don Taylor, a consultant & healthcare leadership strategy and policy professor at University of Texas. He discusses how leaders can establish a feeling of safety in this period of uncertainty with the COVID-19 pandemic and more. https://lnkd.in/eZJ2ZUU",,,,1254091635576778753,https://twitter.com/becker_sbecker/status/1254091635576778753
2020-04-25 16:53:25,MAG_Milli,,0,1,4,"Covid cases increase by 28 today and y’all still trying to be out and open Texas.......",,,,1254091152791347200,https://twitter.com/MAG_Milli/status/1254091152791347200
2020-04-25 16:52:30,keeltyc,,1,3,6,"""There have barely been any Covid-19 deaths in Texas! We should stop the lockdown, it's unnecessary."" Let's try that in other contexts, shall we? ""There's never been an attack on the US with a stolen nuclear weapon! We should stop guarding our missiles, it's unnecessary.""",,,,1254090922452795392,https://twitter.com/keeltyc/status/1254090922452795392
2020-04-25 16:52:25,Catenigma,nwinograd,1,1,0,"Nathan. I’m reading an email from your No Kill Advicacy Center about CoVid and cats. Let me be a data point. I was exposed to the virus in early March and very ill by the 20th. My son is in Texas working on research so I was alone in bed for almost 3 weeks recovering 2/2",,,,1254090902865416192,https://twitter.com/Catenigma/status/1254090902865416192
2020-04-25 16:52:17,ReportFocus,,0,0,3,"Texas man who was on life support for 3 weeks recovers from COVID-19 https://www.reportfocusnews.com/2020/04/25/texas-man-who-was-on-life-support-for-3-weeks-recovers-from-covid-19/",,,,1254090867197034496,https://twitter.com/ReportFocus/status/1254090867197034496
2020-04-25 16:51:18,MamaRNLove,PatrickSvitek,0,0,1,"As Texas begins our ascent up the curve of covid-19 cases and deaths, these #'s will change. In the week containing this poll, Tx saw the #'s of deaths and cases at least double across all metro areas. Easing SIP will increase the rate of infection and strain health care systems.",,,,1254090618722189313,https://twitter.com/MamaRNLove/status/1254090618722189313
2020-04-25 16:48:14,TTUSystem,TTUHSC,0,2,12,"A group of faculty, physicians and students from @TTUHSC, @TexasTech, @utpb &amp; Monahans, Texas have formed a COVID-19 consortium to help the health care workers of West Texas. ",,@TTUHSC @TexasTech @utpb,,1254089847385587719,https://twitter.com/TTUSystem/status/1254089847385587719
2020-04-25 16:45:09,TTUHSC,,0,2,7,"Thirty-four rural West Texas hospitals have received a total of 741 3D-printed face shields produced by the West Texas 3D COVID-19 Relief Consortium since March 30. The group is working to quickly produce PPE to meet the needs of health care workers. http://www.wt3dreliefconsortium.com",,,,1254089073939054593,https://twitter.com/TTUHSC/status/1254089073939054593
2020-04-25 16:36:42,TamaraAlexis,,0,0,0,"76 trombones Trumbo’s Back blowing off Steam . Capture The Spread — hustler . Strip Flags stars and it’s stripes of cage GB George Bush whacked Texas boys in this to get her . Dismount back snakes - covid 19 - WWW Dot Six . Zero hour zero .",,,,1254086947108249600,https://twitter.com/TamaraAlexis/status/1254086947108249600
2020-04-25 16:35:16,VOTETEXAS22,,0,0,1,"Just went shopping at @Academy - no problem. Fuck covid and China and the @WHO. Love TEXAS! #Liberty or #Death",,@Academy @WHO,#Liberty #Death,1254086583856304130,https://twitter.com/VOTETEXAS22/status/1254086583856304130
2020-04-25 16:32:59,CeeJayT07381069,,0,1,2,"TEXAS: Families say they were unaware of COVID-19 outbreak inside Burleson nursing home ",,,,1254086010931200000,https://twitter.com/CeeJayT07381069/status/1254086010931200000
2020-04-25 16:30:33,CherylJaneBean2,,0,0,0,"Here is a look at the latest COVID-19 headlines from around Houston, Texas for Saturday, April 25. ",,,,1254085400282509312,https://twitter.com/CherylJaneBean2/status/1254085400282509312
2020-04-25 16:29:07,MatthewVeasey,Buster_ESPN,1,2,8,"Arizona: 7.2 million people with just over 6,000 cases (.083%) Florida: 21.5 million people with just over 30,500 cases (.142%) Texas: 29 million people with just under 23,000 cases (.079%) Total: 57.7 million people across three states and 59,500 COVID-19 cases (.103%) #playball",,,#playball,1254085037248729092,https://twitter.com/MatthewVeasey/status/1254085037248729092
2020-04-25 16:27:34,Marlonj_argueta,,0,1,0,"'The Father of Environmental Justice' Isn't Surprised by COVID-19 Health Disparities – Texas Monthly ",,,,1254084649585987584,https://twitter.com/Marlonj_argueta/status/1254084649585987584
2020-04-25 16:23:40,fox34,,0,0,4,"Texas Tech Laboratory was state's first lab to test for COVID-19 ",,,,1254083667258982402,https://twitter.com/fox34/status/1254083667258982402
2020-04-25 16:21:04,EricDBarrera,,1,0,1,"WATCH: San Antonio may have reached its peak in COVID-19 cases, Texas governor says ",,,,1254083012595257346,https://twitter.com/EricDBarrera/status/1254083012595257346
2020-04-25 16:13:45,EmmeIsaacs,JudgeClayJ,0,0,0,"The Texas Workforce Commissioner needs COVID-19 funds to pay claims of the unemployed - including those in Dallas County. When you take those funds to pay your pals, Jenkins, you’re stealing from what could provide food and medicine to those suffering job loss. Using special",,,,1254081172411494415,https://twitter.com/EmmeIsaacs/status/1254081172411494415
2020-04-25 16:10:43,abigailcolter51,tedcruz,0,0,1,"Instead of snarking about HRC, why don't you warn the people of Texas that they cannot trust Covid-19 information coming from President Trump because it conflicts with recommendations of CDC. BTW, why are you so blasé about testing for Covid-19 in Texas? Afraid of facts?",,,,1254080407596707840,https://twitter.com/abigailcolter51/status/1254080407596707840
2020-04-25 16:03:02,OralRobertsU,,0,0,3,"Texas Ranger &amp; Former ORU Baseball Star Jose Trevino Brings Joy to Others During COVID-19 by Playing Bingo with Nursing Home Residents. Watch the story at https://bit.ly/2zqkSMd",,,,1254078473162895361,https://twitter.com/OralRobertsU/status/1254078473162895361
2020-04-25 16:02:01,KHayhoe,maxboykoff,2,11,43,"There's one more stage I've discovered between Stage 4 and 5 - recommend a solution that doesn't work. Like carbon capture for re-injection into oil and gas wells to increase production (and CO2 ems) like Petra Nova in Texas ... and I think we ALL know examples for covid-19 ",,,,1254078216303755270,https://twitter.com/KHayhoe/status/1254078216303755270
2020-04-25 16:00:07,BrookingsMetro,,0,0,2,"The week of April 13 to April 19 introduced even larger numbers of counties with a high prevalence of COVID-19 into the South, across states that already witnessed an expansion as well as in Texas and North Carolina. https://brook.gs/2VqVeiZ",,,,1254077740480901121,https://twitter.com/BrookingsMetro/status/1254077740480901121
2020-04-25 15:52:50,fuoco_fatuo,TomFoxPhoto,0,0,0,"7.4% of all Texas covid-19 deaths occurred in Tarrant County, where Colleyville is located. There are currently over 1100 confirmed cases in Tarrant County, of 13000 in Texas. ",,,,1254075908178219009,https://twitter.com/fuoco_fatuo/status/1254075908178219009
2020-04-25 15:50:03,ZurickDavis,,0,0,0,"Practice Revenues Down by Half or More, Say 60% of #Physicians at Texas Medical Association #COVID-19 Town Hall https://www.texmed.org/TexasMedicineDetail.aspx?id=53358 via@ZurickDavis #leadership",,,#Physicians #COVID #leadership,1254075205112287243,https://twitter.com/ZurickDavis/status/1254075205112287243
2020-04-25 15:50:02,pgbhoyar,,0,2,1,"Chatbots Help Texas Officials Cope With Flood of Coronavirus Unemployment Claims https://www.wsj.com/articles/chatbots-help-texas-officials-cope-with-flood-of-coronavirus-unemployment-claims-11587634202 via @WSJ #ChatBots #AI #AIML #Covid-19 #MachineLearning #DataScience #Bots",,@WSJ,#ChatBots #AI #AIML #Covid #MachineLearning #DataScience #Bots,1254075204172644353,https://twitter.com/pgbhoyar/status/1254075204172644353
2020-04-25 15:50:00,KAMRLocal4News,,0,0,1,"The Texas Workforce Commission opened a new call center on Friday, April 24 in order to help with the influx of calls regarding unemployment benefits amid the COVID-19 pandemic. ",,,,1254075195477970947,https://twitter.com/KAMRLocal4News/status/1254075195477970947
2020-04-25 15:45:15,JusticeFoTXKids,,0,1,0,"Changes to the juvenile justice system must be implemented everywhere, but especially in Texas. RT @nic_fisher: RT @nic_fisher: Juvenile Justice Centers &amp; Vulnerable Youth Latest Victims Of COVID-19 The #juvenilejustice system has been failing our ki…",,@nic_fisher @nic_fisher,#juvenilejustice,1254073996871696385,https://twitter.com/JusticeFoTXKids/status/1254073996871696385
2020-04-25 15:44:51,JusticeFoTXKids,,0,1,0,"Changes to the juvenile justice system must be implemented everywhere, but especially in Texas. RT @sickmund: RT @nic_fisher: Juvenile Justice Centers &amp; Vulnerable Youth Latest Victims Of COVID-19 The #juvenilejustice system has been failing our ki…",,@sickmund @nic_fisher,#juvenilejustice,1254073899467366401,https://twitter.com/JusticeFoTXKids/status/1254073899467366401
2020-04-25 15:44:24,AbcoSpecialties,,0,0,0,"#satchat #stressrelief for #Covid_19 #business &amp; personal #debt. Chapter7 chapter11 chapter13 #hope. Spring Tomball Oak Ridge NewWaverly Willis, NewCaney Splendora Woodlands Conroe Magnolia Montgomery Texas. FREE #bankruptcy consult. http://woodlandsbankruptcy.com #AD #finances",,,#satchat #stressrelief #Covid_19 #business #debt #hope #bankruptcy #AD #finances,1254073784283381760,https://twitter.com/AbcoSpecialties/status/1254073784283381760
2020-04-25 15:44:22,JulianSST_,,1,1,2,"Being 17, and having a December Birthday I may get to vote this election because of COVID, if I do, I cannot convince myself to vote for Biden, I'm in Texas, not a swing state so doesn't matter, either way, I'd vote for Howie and probably mostly blue down-ticket #DropOutBiden",,,#DropOutBiden,1254073776167358466,https://twitter.com/JulianSST_/status/1254073776167358466
2020-04-25 15:43:00,kostadis_tech,jen_rice_,1,0,0,"Couple of interesting points. Having a white guy from Texas appropriating a civil rights icon who fought for the right to be treated with dignity by other white guys is obscene. The second is that he has several key risk factors associated with COVID - age and weight. ",,,,1254073434201444353,https://twitter.com/kostadis_tech/status/1254073434201444353
2020-04-25 15:42:49,AnewMoo,politico,0,0,0,"Since Texas hasn’t reported any of their COVID-19 information correctly or up to date, this move is absolutely going to make the second wave more deadlier than the first. He doesn’t care about humans, he only cares about the money.",,,,1254073384796856321,https://twitter.com/AnewMoo/status/1254073384796856321
2020-04-25 15:42:07,Heather_Fashion,JohnCornyn,1,0,0,"In the last 21 days Texas has averaged 809 new cases of covid. In the last two days the average new cases has been 1146; that is a 41.6% increase and not a good trend to base a decision to “open up” your state, Senator!!",,,,1254073210846486529,https://twitter.com/Heather_Fashion/status/1254073210846486529
2020-04-25 15:41:21,AbcoSpecialties,,0,0,0,"For #satchat #Covid_19 #debt? #quotesoftheday ""Life can be good. Get #debtfree."" FREE #bankruptcy attorney consult Conroe Magnolia Porter Splendora NewCaney NewWaverly Klein Kingwood Willis Huntsville Tomball Montgomery The Woodlands Spring Texas http://woodlandsbankruptcy.com #AD",,,#satchat #Covid_19 #debt #quotesoftheday #debtfree #bankruptcy #AD,1254073015962402817,https://twitter.com/AbcoSpecialties/status/1254073015962402817
2020-04-25 15:39:59,nathanTHEmute,TomFoxPhoto,0,0,0,"BREAKING NEWS: Texas sees giant spike in new COVID-19 cases. ",,,,1254072671203201025,https://twitter.com/nathanTHEmute/status/1254072671203201025
2020-04-25 15:39:00,tasbnews,,0,2,6,"Across the country, and certainly here in Texas, the education community is stepping up during the COVID-19 crisis. These stories will put a smile on your face : https://bit.ly/3bkzbjo #TxEdRising",,,#TxEdRising,1254072427413483520,https://twitter.com/tasbnews/status/1254072427413483520
2020-04-25 15:38:26,AbcoSpecialties,,0,0,0,"#SaturdayThoughts for #Covid_19 #debt: Lawyer,Yvette Recio, helps people who feel trapped in debt from credit cards, medical bills, loans, etc.; The Woodlands, Texas area. https://www.google.com/search?ei=UxsjXsybGIq-tQXez5yICw&amp;q=Yvette+Recio+helps+people+who+feel+trapped+in+debt+from+credit+cards%2C+medical+bills%2C+loans%2C+etc.%3B+The+Woodlands%2C+Texas+area.&amp;oq=Yvette+Recio+helps+people+who+feel+trapped+in+debt+from+credit+cards%2C+medical+bills%2C+loans%2C+etc.%3B+The+Woodlands%2C+Texas+area.&amp;gs_l=psy-ab.12...22623.28218..33083...0.0..0.0.0.......9....1..gws-wiz.OD0fcSV9Wjg&amp;ved=0ahUKEwiMkdX9so3nAhUKX60KHd4nB7EQ4dUDCAs. #creditcarddebt, #medicalbillsdebt #thewoodlandstexas #AD #bankruptcy",,,#SaturdayThoughts #Covid_19 #debt #creditcarddebt #medicalbillsdebt #thewoodlandstexas #AD #bankruptcy,1254072284396032001,https://twitter.com/AbcoSpecialties/status/1254072284396032001
2020-04-25 15:36:54,mtaylor_tx,AP,0,0,0,"@GovAbbott What’s your plan/system for tracking in Texas? Only 1% +\- of Texans have been tested for #Covid_19 &amp; you have no definitive public mask mandate. #Texasdeservesbetter #ASYMPTOMATIC",,@GovAbbott,#Covid_19 #Texasdeservesbetter #ASYMPTOMATIC,1254071897945452544,https://twitter.com/mtaylor_tx/status/1254071897945452544
2020-04-25 15:36:24,cbsmireya,CBSNews,4,13,44,"My son is 4 years old. This was a gut-wrenching story to read... but I made myself finish it. As states start to reopen, Texas one of them, I needed a reminder that this IS NOT OVER. Stay safe. Stay vigilant. Stay healthy. #Covid_19 #CoronaUpdate #CBSNews",,,#Covid_19 #CoronaUpdate #CBSNews,1254071771671781376,https://twitter.com/cbsmireya/status/1254071771671781376
2020-04-25 15:35:51,coop22089074,,0,1,0,"Texas AG on state easing COVID-19 restrictions to slowly reopen economy ",,,,1254071634979368960,https://twitter.com/coop22089074/status/1254071634979368960
2020-04-25 15:33:09,brayc2,,0,0,1,"@GregAbbott_TX So Texas experienced 10K (FATC:look it up) death from the common flu last year. And yet, we are destroying our economy over COVID 19. MAKES NO SENSE! Open Texas up for business, NOW! ",,@GregAbbott_TX,,1254070953333719046,https://twitter.com/brayc2/status/1254070953333719046
2020-04-25 15:30:11,MananaZoo,,0,1,1,"WATCH: San Antonio may have reached its peak in COVID-19 cases, Texas governor says ",,,,1254070208320491526,https://twitter.com/MananaZoo/status/1254070208320491526
2020-04-25 15:29:51,phils4always,AndrewWBloom,0,0,4,"I strongly believe Texas is. Very little testing is being done. Also, I find it curious while COVID-19 deaths is low, the number of deaths from pneumonia have tripled over the same period last year.",,,,1254070124618940416,https://twitter.com/phils4always/status/1254070124618940416
2020-04-25 15:26:45,maryderrickart,random_texas,1,0,0,"at least this poll is from 2019...but before he left an aircraft carrier with over 5000 to become sitting ducks to COVID-19 AND FIRED THE CAPTAIN FIGHTING TO SAVE THEIR LIVES ",,,,1254069344029589504,https://twitter.com/maryderrickart/status/1254069344029589504
2020-04-25 15:26:32,wholelottawoodz,,0,0,0,"After this Covid 19 bullshit #WHOLELOTTAWOODZSHIT gone turn TF up! @Dallas, Texas https://www.instagram.com/p/B_aKi18JnfL/?igshid=d3l7d5v2dfaz",,,#WHOLELOTTAWOODZSHIT,1254069287351922690,https://twitter.com/wholelottawoodz/status/1254069287351922690
2020-04-25 15:25:53,brayc2,,0,0,0,"Texas is likely similar to other states . Compare deaths from COVID 19 and unemployment it has caused from reaction. Drama Queens/fake news hysteria make COVID 19 appear threatening. Numbers say it is no worse than the flu. FACT: FLu killed nearly 10K in Texas this year. ",,,,1254069124734627841,https://twitter.com/brayc2/status/1254069124734627841
2020-04-25 15:22:03,chiyemeh,,0,0,0,"FOX NEWS: Texas AG on state easing COVID-19 restrictions to slowly reopen economy http://dlvr.it/RVRXph",,,,1254068160593944576,https://twitter.com/chiyemeh/status/1254068160593944576
2020-04-25 15:21:42,epbusiness,,0,0,1,"16th Confirmed Positive COVID-19 Case Announced in Maverick County, Texas ",,,,1254068071846875137,https://twitter.com/epbusiness/status/1254068071846875137
2020-04-25 15:20:55,scbor_texas,,0,0,0,"May 04, 2020, 1:00pm - 2:00pm Virtual Webinar Join Texas REALTORS® for a virtual chat with esteemed economist Dr. Mark Dotzour, who will discuss the impact of COVID-19 on the economy and real estate industry. https://www.texasrealestate.com/members/events/event-list/whats-next-for-texas-real-estate-finding-opportunity-in-uncertain-times/?fbclid=IwAR1FvjJUPOUQVhQLR11x2oUbEmBUz_1a0yf0daBYJ48YIaEsdXpTv3AO8jM",,,,1254067875247259649,https://twitter.com/scbor_texas/status/1254067875247259649
2020-04-25 15:20:29,JuanMar63464196,LoloPeniche,0,0,0,"Exijo terminantemente que @FelipeCalderon y @VicenteFoxQue,Repartan a todo el Pueblo de #Mexico,el Dinero obtenido de los excedentes petroleros,en caso contrario que sean enjuiciados y llevados a Prision por Traición a la Patria. #CDMX #ElPuebloManda #Covid_19 #25Abril #Texas ",,@FelipeCalderon @VicenteFoxQue,#Mexico #CDMX #ElPuebloManda #Covid_19 #25Abril #Texas,1254067765268361221,https://twitter.com/JuanMar63464196/status/1254067765268361221
2020-04-25 15:20:27,TeagueGlen,WaywardDogcomix,3,0,1,"We have over 20,000 beds in Texas. 1600 covid patients hospitalized. You call that overwhelmed. I know, we're social distancing to not overwhelm. You must be retired or can work from home.",,,,1254067759320883201,https://twitter.com/TeagueGlen/status/1254067759320883201
2020-04-25 15:18:43,USBP_MLucio,TDEM,1,0,0,"Find a local COVID test site in Texas. Check out the below information from the state of Texas! #COVID19Testing",,,#COVID19Testing,1254067319527092229,https://twitter.com/USBP_MLucio/status/1254067319527092229
2020-04-25 15:17:30,HelpPeopleVote,,0,0,0,"COVID-19 Cases Now Tied to Meat Plants in Rural Texas Counties Wracked with Coronavirus ⁦@maddow⁩ Numerous ⁦@TysonFoods⁩ plants have serious outbreaks. Did the company not take action? How do they take care of employee’s?",,@maddow @TysonFoods,,1254067016153157632,https://twitter.com/HelpPeopleVote/status/1254067016153157632
2020-04-25 15:17:01,MichelleRomero,JohnnieMo,0,0,2,".@Glenn_Hegar , Texas' top financial officer, said “it remains unclear how the price drop will affect state revenues, but it could affect whether money already allocated in the budget will actually become available.” #txlege #Covid_19 #coronavirus",,@Glenn_Hegar,#txlege #Covid_19 #coronavirus,1254066895118090241,https://twitter.com/MichelleRomero/status/1254066895118090241
2020-04-25 15:12:40,bridgettwagner,bridgettwagner,1,2,2,"“As of Friday, there have been more Covid-19 fatalities on Long Island’s Nassau County (population 1.4 million) than in all of California (population 40 million)... more fatalities in Westchester County (989) than in Texas (611).” ",,,,1254065800656424962,https://twitter.com/bridgettwagner/status/1254065800656424962
2020-04-25 15:11:25,njtxgal,Pappiness,0,0,3,"Texas is ranked last in COVID-19 testing and our GOP (of course) governor is talking about reopening.",,,,1254065483416047618,https://twitter.com/njtxgal/status/1254065483416047618
2020-04-25 15:01:41,NTXCMC,,0,0,2,"Are you finding moments of grace amid the COVID-19 pandemic? Let's pray this fasting will create a long-lasting intimacy with #Christ. Join our live stream North Texas #Catholic Men's Conference at http://www.catholicbrothersforchrist.com on Facebook or YouTube. Thank you @deaconharold!",,@deaconharold,#Christ #Catholic,1254063033598566405,https://twitter.com/NTXCMC/status/1254063033598566405
2020-04-25 15:01:40,TTUengaged,,1,0,0,"The joint efforts led to the creation of the West Texas 3D COVID-19 Relief Consortium, a collaborative community involving several departments at TTUHSC, Texas Tech, the University of Texas-Permian Basin, Odessa College, local businesses, concerned citizens and aviators.",,,,1254063031711129601,https://twitter.com/TTUengaged/status/1254063031711129601
2020-04-25 15:01:33,AutoDetailingTX,,0,0,0,"WE ARE OPEN!! Auto detailing brings out the best! Ask about our COVID-19 Sanitization Services!! Auto Detailing Austin LLC 512-910-7CAR http://www.AutoDetailingTX.com 1601 Bench Mark Dr., STE B Austin, TX 78728 #AutoDetailing #Cleaning #Austin #Texas and Share to Receive $10 OFF ",,,#AutoDetailing #Cleaning #Austin #Texas,1254063001637961728,https://twitter.com/AutoDetailingTX/status/1254063001637961728
