date,username,to,replies,retweets,favorites,text,geo,mentions,hashtags,id,permalink
2020-04-27 19:35:28,reenajade,,1,6,12,"Gov. Abbott is giving an update now on the next phase of reopening the Texas economy. He says the COVID-19 infection rate has been on the decline in Texas for the past 17 days, and the state has the 3rd most recoveries in the country. @SpecNewsATX @SpecNewsSA",,@SpecNewsATX @SpecNewsSA,,1254856711665565696,https://twitter.com/reenajade/status/1254856711665565696
2020-04-27 19:35:20,sierraamber16,,1,1,9,"According to Abbott, the infection rate for COVID-19 in the state of Texas has been on a decline for the past 17 days. The number of people in Texas who have recovered from COVID-19 will soon exceed the number infected.",,,,1254856676110471169,https://twitter.com/sierraamber16/status/1254856676110471169
2020-04-27 19:35:17,tplohetski,,2,5,4,"JUST IN: Governor says 'lives saved are priceless, but the price has been steep' in announcing plans to move forward with reopening Texas. He is enumerating things state has done to keep numbers of COVID-19 cases lower.",,,,1254856662675935234,https://twitter.com/tplohetski/status/1254856662675935234
2020-04-27 19:35:10,bequik1,,0,0,0,"LIVE: Gov. Greg Abbott may widen reopening of Texas during COVID-19 https://youtu.be/7hTYoDKG5U4 via @YouTube",,@YouTube,,1254856634838290432,https://twitter.com/bequik1/status/1254856634838290432
2020-04-27 19:35:07,JBontkeCBS,,1,2,3,"Kicking off a big press conference with @GovAbbott on reopening the Texas economy. He says COVID-19 rates have been on a decline in Texas for the past 17 days. ""Hospital capacity has remained abundant... we must not forget the lives lost"" @cbsaustin",,@GovAbbott @cbsaustin,,1254856621982838784,https://twitter.com/JBontkeCBS/status/1254856621982838784
2020-04-27 19:34:48,JeremySWallace,,1,3,3,"Texas @GovAbbott starts his briefing saying COVID-19 has been on decline for 17 days and that the state still has plenty of hospital beds remaining. Also notes we've had far few deaths than many states. ",,@GovAbbott,,1254856542458765313,https://twitter.com/JeremySWallace/status/1254856542458765313
2020-04-27 19:34:31,KRLD,,0,3,0,"Listen to Gov Greg Abbott’s latest on Texas’ COVID-19 here now: ",,,,1254856473051410433,https://twitter.com/KRLD/status/1254856473051410433
2020-04-27 19:34:31,MarcDuvoisin,,0,6,11,"Texas Gov. Greg Abbott: COVID-19 infection rate in Texas has declined for past 17 days. ""At the same time, we must not forget those who have lost their lives."" But: ""The tragedies in Texas have been far fewer than in most other states.""",,,,1254856470790725633,https://twitter.com/MarcDuvoisin/status/1254856470790725633
2020-04-27 19:34:27,VictoriaPIO,,0,1,1,"Today's press briefing will be PUSHED BACK to 4 p.m., because Governor Abbott will be making an announcement at 2:30 p.m. regarding the continued re-opening of Texas. Today's press briefing speaker will be Dr. John McNeill, our local health authority, to discuss COVID-19.",,,,1254856453413838848,https://twitter.com/VictoriaPIO/status/1254856453413838848
2020-04-27 19:34:15,MollyAndAMic,,1,0,1,"ABBOTT: hospitalization rate has remained steady. Says tragedies in Texas has been far fewer and has third most recoveries of COVID-19 in America.",,,,1254856405330231297,https://twitter.com/MollyAndAMic/status/1254856405330231297
2020-04-27 19:34:08,bbcott,,0,0,0,"WATCH LIVE: Gov. Greg Abbott is detailing his plans to reopen Texas economy during the COVID-19 pandemic. ",,,,1254856373201846272,https://twitter.com/bbcott/status/1254856373201846272
2020-04-27 19:34:07,theeagle,,0,1,1,"Watch live as Texas Gov. Greg Abbott makes an announcement regarding Texas' response to COVID-19 at the State Capitol in Austin. ",,,,1254856371977064449,https://twitter.com/theeagle/status/1254856371977064449
2020-04-27 19:33:40,TALK1370,,0,1,0,"LIVE NOW: Texas @GovAbbott is giving an update on the state's response to COVID-19. ",,@GovAbbott,,1254856258517004288,https://twitter.com/TALK1370/status/1254856258517004288
2020-04-27 19:33:07,KAGSnews,,0,0,0,"Here are the latest COVID-19 updates, closures and postponements in Central Texas for Monday, April 27. ",,,,1254856118485958657,https://twitter.com/KAGSnews/status/1254856118485958657
2020-04-27 19:33:02,OPUCTX,,0,0,0,"Watch Governor Abbott announce new details about the COVID-19 situation in Texas at 2:30 pm today here: ",,,,1254856097812234240,https://twitter.com/OPUCTX/status/1254856097812234240
2020-04-27 19:32:09,somoskrgv,,0,0,0,"Actualización sobre el #coronavirus en Texas, acompañenos en Somos El Valle canal 5.2 cable 1240 o aquí https://www.krgv.com/pages/live-stream-somos-el-valle/ #krgv #rgv #valle #noticias #covid-19 ",,,#coronavirus #krgv #rgv #valle #noticias #covid,1254855874197233665,https://twitter.com/somoskrgv/status/1254855874197233665
2020-04-27 19:32:00,thenexttodie,jsmccullou,0,1,0,"Texas's highest court stayed the scheduled execution of Edward Busby next week, via @jsmccullou: https://twitter.com/jsmccullou/status/1254846385729540099 This is the sixth consecutive execution pushed back in Texas, most but not all due to COVID-19. -TM",,@jsmccullou,,1254855839355043841,https://twitter.com/thenexttodie/status/1254855839355043841
2020-04-27 19:31:47,HoustonMundo,,0,0,0,"Los residentes de #Texas podrán ubicar los centros de pruebas del #COVID-19 cerca de su comunidad a través de un mapa interactivo, el cual a su vez proporcionará información referente a horarios de servicio y contacto del sitio.",,,#Texas #COVID,1254855784891994114,https://twitter.com/HoustonMundo/status/1254855784891994114
2020-04-27 19:31:38,Telemundo39,,0,3,2,"EN VIVO: Conferencia de prensa del gobernador de Texas sobre la situación del COVID-19 ",,,,1254855743641018369,https://twitter.com/Telemundo39/status/1254855743641018369
2020-04-27 19:31:22,noticiashouston,,1,5,2,"EN VIVO: Conferencia de prensa del Gobernador de Texas Greg Abbott sobre el covid-19 en la región ",,,,1254855677329108992,https://twitter.com/noticiashouston/status/1254855677329108992
2020-04-27 19:31:01,MSUNewsDigest,,0,0,0,"Faculty, students can compete for grants for COVID-19 research through Texas A&amp;M University School of Innovation program | The Eagle | ",,,,1254855589902954500,https://twitter.com/MSUNewsDigest/status/1254855589902954500
2020-04-27 19:30:18,KTBS,,1,0,1,"Watch Now - Texas Gov. Greg Abbott briefing on COVID-19. It's on KTBS 3.3, http://ktbs.com and your KTBS 3 Now connected devices. &gt;&gt; https://bit.ly/2OtE5Qt",,,,1254855408507686914,https://twitter.com/KTBS/status/1254855408507686914
2020-04-27 19:30:00,TexasObserver,,0,4,1,"Mapping reported COVID-19 cases in Texas per doctor: ",,,,1254855334834782208,https://twitter.com/TexasObserver/status/1254855334834782208
2020-04-27 19:30:00,FOX4,,6,12,11,"WATCH LIVE: Gov. Abbott announces next phase of plan to re-open parts of Texas economy amid COVID-19 pandemic https://www.fox4news.com/live",,,,1254855334612684801,https://twitter.com/FOX4/status/1254855334612684801
2020-04-27 19:26:48,obedmanuel,,11,23,68,"Big question for Texas Gov. Greg Abbott: what course of action will he take if Texas sees massive spike in COVID-19 cases after attempting to reopen the state?",,,,1254854527649329153,https://twitter.com/obedmanuel/status/1254854527649329153
2020-04-27 19:25:47,Detroitunionist,,0,1,1,"UAW member at GM's Arlington, Texas, plant dies from coronavirus - and how GM gets off with saying they've not had COVID-19 fatalities. https://www.freep.com/story/money/cars/general-motors/2020/04/27/uaw-gm-arlington-texas-plant-dies-coronavirus/3032514001/ via @freep",,@freep,,1254854271335649280,https://twitter.com/Detroitunionist/status/1254854271335649280
2020-04-27 19:25:03,dallasnewsnow,,0,0,0,"More Than 800 Inmates, Nearly 300 Staffers Positive for COVID-19 in Texas Prisons: TDCJ http://dlvr.it/RVYvDd",,,,1254854089990483968,https://twitter.com/dallasnewsnow/status/1254854089990483968
2020-04-27 19:25:02,AngieChenButton,,0,0,1,"Tune in now for Governor Abbott's announcement regarding Texas' response to COVID-19. ",,,,1254854086731509760,https://twitter.com/AngieChenButton/status/1254854086731509760
2020-04-27 19:23:08,HeatherjoyK,,0,0,0,"I supported Feeding Texas and their efforts to ensure healthy food to those impacted by COVID-19 and the financial fallout.",,,,1254853605405982721,https://twitter.com/HeatherjoyK/status/1254853605405982721
2020-04-27 19:20:00,ksatnews,,3,10,20,"WATCH LIVE: Gov. Abbott announces plan to reopen Texas amid COVID-19 pandemic at 2:30 p.m. ",,,,1254852816864260096,https://twitter.com/ksatnews/status/1254852816864260096
2020-04-27 19:18:11,JacobQKnight,,1,3,13,"Excited for @GovAbbott to announce the next steps in reopening Texas as we continue to march toward 30K COVID cases and remain damn near last in testing. Bring on the death wave, y’all, with @DanPatrick acting like the Grim Reaper’s Flava Flav.",,@GovAbbott @DanPatrick,,1254852359492157441,https://twitter.com/JacobQKnight/status/1254852359492157441
2020-04-27 19:17:14,LCComplex,,0,2,1,"In response to COVID-19, the East Texas Food Bank is holding a drive-thru emergency food box distribution at the Longview Convention Complex Fairgrounds on Thursday, April 30, from 10 a.m. to 12 p.m., or while supplies last. https://www.facebook.com/events/1586749178175083/",,,,1254852122073534469,https://twitter.com/LCComplex/status/1254852122073534469
2020-04-27 19:13:40,Iamonfya,,0,0,0,"Proud to support a company @legionmofficial that supports the community! #supportsmallbusiness #heroes #legion #covid_19 #maskon @Alvin, Texas https://www.instagram.com/p/B_fuIQoJ3_x/?igshid=1t9d3vg563gso",,@LegionMOfficial,#supportsmallbusiness #heroes #legion #covid_19 #maskon,1254851223129382914,https://twitter.com/Iamonfya/status/1254851223129382914
2020-04-27 19:09:03,ASM_Kenya,,0,0,0,"The Texas Medical Center Chapter of the ASM in collaboration with Taste of Science will be hosting a two-part COVID-19 Webinar series on May 2nd and 3rd at 2 PM CDT to inform the general public! Zoom meeting link: ",,,,1254850060782833665,https://twitter.com/ASM_Kenya/status/1254850060782833665
2020-04-27 19:08:50,BillBishopKHOU,,3,9,12,"The Texas Department of Criminal Justice says 65-year old Correctional Officer Coy D. Coffman Jr. has passed away. On April 17th, he was admitted to a Texarkana hospital suffering symptoms consistent with COVID-19. His test returned positive on April 19th. #khou #HTownRush",,,#khou #HTownRush,1254850005699100675,https://twitter.com/BillBishopKHOU/status/1254850005699100675
2020-04-27 19:08:37,pumkin4444,,0,0,0,"@RepLloydDoggett @MayorAdler @GregAbbott_TX #there is no excuse for Texas to be taking temperatures when Abbott Labs has the real test. Get those test distributed to all businesses and restaurants. If you have antibodies you need to go home, then go get a Covid test.",,@RepLloydDoggett @MayorAdler @GregAbbott_TX,#there,1254849952532004864,https://twitter.com/pumkin4444/status/1254849952532004864
2020-04-27 19:08:33,Brendan_Fehmie,,0,0,0,"These Texas state troopers don’t give a fuck anymore about covid checkpoints I just saw they let someone through on a bicycle",,,,1254849937721798656,https://twitter.com/Brendan_Fehmie/status/1254849937721798656
2020-04-27 19:07:32,ReneeRants,,0,0,0,"Texas Gov. Abbott to address new COVID guidelines at 2:30 pm Central for the State of Texas. Tune in!",,,,1254849682171473925,https://twitter.com/ReneeRants/status/1254849682171473925
2020-04-27 19:04:38,TXCapTonight,,0,2,0,"#ICYMI Poll: Most Texas Voters Think COVID-19 Will Soon Be Contained - @jamesrhenson joined us to discuss",,@jamesrhenson,#ICYMI,1254848952521949184,https://twitter.com/TXCapTonight/status/1254848952521949184
2020-04-27 19:04:11,TimeForChores,ChuckCallesto,0,0,6,"In Texas, we are planning stages of opening, slowly. Every county has been impacted differently so it won’t be a cookie cutter approach. Continue using precautions! Places with few COVID cases should open, WITH precautions.",,,,1254848839615483907,https://twitter.com/TimeForChores/status/1254848839615483907
2020-04-27 19:00:45,KOYNFM,,0,0,0,"One COVID-19 Vaccine Candidate from Texas...Read more here: http://ow.ly/lyFv50zpnfQ",,,,1254847973466529792,https://twitter.com/KOYNFM/status/1254847973466529792
2020-04-27 19:00:01,WBRCnews,,0,0,1,"Texas man shares story of surviving COVID-19 after losing his father to it ",,,,1254847790762659851,https://twitter.com/WBRCnews/status/1254847790762659851
2020-04-27 19:00:00,NCATalumni,,1,3,11,"Aggies on the Front Lines with COVID-19 Feature Kiana Kimber, Registered Nurse, Austin, Texas http://aggiesonthefrontlines.ncatsualumni.org/?p=21 #AggiesOnTheFrontLines #COVID19 #coronavirus #NCAT #AggiesDO #AggiePride #NCATAlumni",,,#AggiesOnTheFrontLines #COVID19 #coronavirus #NCAT #AggiesDO #AggiePride #NCATAlumni,1254847783825276928,https://twitter.com/NCATalumni/status/1254847783825276928
2020-04-27 18:57:06,danvzla,,0,0,0,"Outbreak of COVID-19 at a Texas Chick-fil-A sickens 11 employees https://www.chron.com/coronavirus/article/Outbreak-of-COVID-19-at-a-Texas-Chic-fil-A-15226423.php?utm_campaign=socialflow&amp;utm_source=facebook.com&amp;utm_medium=referral&amp;fbclid=IwAR37X1eWA5ycL1XcXvvoQfcErwJbWPo1lr8fui5JCSkTz9lpQopgAvUj4mE&amp;utm_campaign=CMS%20Sharing%20Tools%20(Desktop)&amp;utm_source=t.co&amp;utm_medium=referral via @houstonchron",,@HoustonChron,,1254847054561583108,https://twitter.com/danvzla/status/1254847054561583108
2020-04-27 18:56:52,CW39Houston,,1,1,0,"ZIP CODE COVID-19 - Search your zip code. Coming up at 2:30 today, Gov. Abbott will update public on re-opening Texas. Tune in now! ",,,,1254846994398547968,https://twitter.com/CW39Houston/status/1254846994398547968
2020-04-27 18:56:38,kristenobacter,,0,2,1,"The Texas Medical Center Chapter of the @ASMicrobiology in collaboration with @TasteofScience will be hosting a two-part COVID-19 Webinar series on May 2nd and 3rd at 2 PM CDT to inform the general public! ",,@ASMicrobiology @TasteOfScience,,1254846937943216128,https://twitter.com/kristenobacter/status/1254846937943216128
2020-04-27 18:56:19,MrBlakeGreen,,0,0,2,"“For the first time in 70 years, 100-year-old professor Thomas Freeman cannot go to work at Texas Southern University.” Great story, ⁦@cindylgeorge⁩! #TSUProud Soul Survivor: Wisdom from a TSU professor who went to work for 70 years until COVID-19 ",,@cindylgeorge,#TSUProud,1254846858570145796,https://twitter.com/MrBlakeGreen/status/1254846858570145796
2020-04-27 18:55:02,Joenlance,,0,0,0,"Texas MS-150 2020” Bike Ride Cancelled... NOT Multiple Sclerosis. COVID-19 Cancelled the “Texas MS-150 2020” Bike Ride scheduled for May 2-3, 2020... Unfortunately! Multiple Sclerosis was Not Cancelled! (April 25, 2020), I did my Century Ride 100+ miles... I ride you donate. ",,,,1254846535071944704,https://twitter.com/Joenlance/status/1254846535071944704
2020-04-27 18:52:33,KeyserS61800303,Texas__Gary,0,0,0,"The same people that somehow believe Covid-19 is racist. ",,,,1254845910439223296,https://twitter.com/KeyserS61800303/status/1254845910439223296
2020-04-27 18:48:21,HusdonScott,,0,0,0,"Texas Supreme Court: COVID-19 Not An Excuse To Suspend Texas Constitution ",,,,1254844854409912320,https://twitter.com/HusdonScott/status/1254844854409912320
2020-04-27 18:47:22,AgustineHernan1,,0,0,0,"Our numbers are steadily declining for COVID-19, but I feel like this is only the beginning. Try to social distance yourself and only leave your home for essentials. Stay safe and be strong Texas!",,,,1254844604987453442,https://twitter.com/AgustineHernan1/status/1254844604987453442
2020-04-27 18:45:36,ReporteraErikaF,,0,1,0,"#coronavirus #Covid_19mx #PandemiaMundial Así sobreviven los migrantes mexicanos en #USA #Texas #California #Illinois #Chicago @lopezobrador_ Y @m_ebrard debieran abordar el tema:",,@lopezobrador_ @m_ebrard,#coronavirus #Covid_19mx #PandemiaMundial #USA #Texas #California #Illinois #Chicago,1254844162127597569,https://twitter.com/ReporteraErikaF/status/1254844162127597569
2020-04-27 18:45:12,TexasDeptofAg,,0,1,5,"Governor Greg Abbott will provide more details today on how the state will move forward with its phased plan to reopen the Texas economy during the COVID-19 #TexasAgricultureMatters",,,#TexasAgricultureMatters,1254844059895697409,https://twitter.com/TexasDeptofAg/status/1254844059895697409
2020-04-27 18:45:10,TXRealtors,,0,1,2,"Join Texas REALTORS® for a virtual chat on May 4 with esteemed economist Dr. Mark Dotzour, who will discuss the impact of COVID-19 on the economy and real estate industry. https://txrealto.rs/2S2htcW",,,,1254844052933050374,https://twitter.com/TXRealtors/status/1254844052933050374
2020-04-27 18:45:06,recentertx,,0,0,3,"Texas' seasonally adjusted unemployment rate last month was 4.7 percent, up from 3.5 percent in March 2019. The rise in unemployment and slowdown of job growth are due to the impacts of COVID-19 pandemic on the state and national economies. Read more: https://txrec.io/2qXkxKv",,,,1254844034276884481,https://twitter.com/recentertx/status/1254844034276884481
2020-04-27 18:45:02,TexomasHomepage,,0,0,0,"As many blood centers are seeing a decline in donations amid the COVID-19 outbreak, we here at KFDX, Texoma's Fox, and Texoma's Homepage have teamed up with Texas Blood Institute to hold a blood drive. Everyone that donates will receive a free KFDX or KJTL coffee mug. ",,,,1254844020288872448,https://twitter.com/TexomasHomepage/status/1254844020288872448
2020-04-27 18:45:00,wmbfnews,,0,0,0,"Texas man shares story of surviving COVID-19 after losing his father to it &gt;&gt; ",,,,1254844010386120705,https://twitter.com/wmbfnews/status/1254844010386120705
2020-04-27 18:42:55,ReporteraErikaF,,0,0,1,"#coronavirus #Covid_19mx #covid19EUA #Chicago #California #Texas How mexican migrantes survive the #PandemiaMundial #MundialCovid in #USA? Why @realDonaldTrump exclude them foro economic helps? https://lasillarota.com/mundo/migrantes-mexicanos-en-eu-sin-trabajo-y-mas-expuestos-al-covid-19-covid-19-coronavirus-pandemia-salud/385099",,@realDonaldTrump,#coronavirus #Covid_19mx #covid19EUA #Chicago #California #Texas #PandemiaMundial #MundialCovid #USA,1254843484386754564,https://twitter.com/ReporteraErikaF/status/1254843484386754564
2020-04-27 18:39:41,MegaDoctor,,0,0,0,"MeGustaTV will video stream Governor Abbott Making Announcement Regarding Texas’ Response To COVID-19 https://texasborderbusiness.com/megustatv-will-video-stream-governor-abbott-making-announcement-regarding-texas-response-to-covid-19/ via @tbbusiness",,@TBBusiness,,1254842672956743681,https://twitter.com/MegaDoctor/status/1254842672956743681
2020-04-27 18:39:24,CopCrime,,0,0,1,"TX: Two more Texas prison inmates with COVID-19 die Story by @kwtx",,@kwtx,,1254842598675619844,https://twitter.com/CopCrime/status/1254842598675619844
2020-04-27 18:39:23,rozbooker,,9,0,0,"Protesting Your Property Taxes in the Time of CoViD-19 With the current coronavirus pandemic, homeowners across northern Texas are wondering if they could protest their property valuations. ",,,,1254842596205006848,https://twitter.com/rozbooker/status/1254842596205006848
2020-04-27 18:37:44,InTheThickShow,,0,0,0,"UT/TT Poll: Texas Voters Likely to Re-Elect Trump, Show Stronger Approval for State’s COVID-19 Response ",,,,1254842180016975873,https://twitter.com/InTheThickShow/status/1254842180016975873
2020-04-27 18:36:33,ramichael2,,0,0,0,"Someone Remixed Texas Pastor Kenneth Copeland COVID-19 Sermon http://975kgkl.com/someone-remixed-texas-pastor-kenneth-copeland-covid-19-sermon/?trackback=twitter_mobile @KGKL975",,@KGKL975,,1254841884993781760,https://twitter.com/ramichael2/status/1254841884993781760
2020-04-27 18:35:20,Jwrong,,0,0,1,"State of Texas 29.47 million with 663 Covid-19 deaths.",,,,1254841575659667456,https://twitter.com/Jwrong/status/1254841575659667456
2020-04-27 18:33:45,14ATX,debbie_american,0,0,0,"You mean feckless @GovAbbott ? The guy who's done nothing 2 oversee or advocate 4 Texas senior citizens in nursing homes? The jackhat whose biggest contribution 2 stop Covid is a tv ad advising us 2 wash our hands? The guy who's opening business b4 Texas hits it's peak? HELL NO! ",,@GovAbbott,,1254841178836602881,https://twitter.com/14ATX/status/1254841178836602881
2020-04-27 18:33:26,TexasTribune,,8,29,33,"New — Number of coronavirus tests administered in Texas: 290,517 Number of Texans testing positive for the virus: 25,297 Number of Texans who have died from COVID-19: 663 Explore the @TexasDSHS data here: http://bit.ly/3epFnJ2",,@TexasDSHS,,1254841099480416261,https://twitter.com/TexasTribune/status/1254841099480416261
2020-04-27 18:32:13,VixterRod,DanPatrick,0,0,5,"Will you be keeping future covid deaths in your prayers.....since you’re choosing economy over Texas lives???",,,,1254840794789433349,https://twitter.com/VixterRod/status/1254840794789433349
2020-04-27 18:32:11,huntlawtexas,,0,0,0,"Hunt Law Firm founder Alex Hunt and Senior Associate Attorney R. Melissa Masoom play ""FACT or FICTION"" on questions surrounding Texas Family Law and COVID-19. ",,,,1254840784978956294,https://twitter.com/huntlawtexas/status/1254840784978956294
2020-04-27 18:31:30,puro_golf,,1,3,6,"Spieth, Hovland y otros profesionales del PGA Tour jugarán un torneo benéfico esta semana en Texas. Lo recaudado irá en ayuda de los caddies del club, quienes tras la llegada del Covid-19, quedaron sin trabajo. ¿Te gustaría que se hiciera algo así en nuestro país? #PuroGolf",,,#PuroGolf,1254840611926159360,https://twitter.com/puro_golf/status/1254840611926159360
2020-04-27 18:30:19,Keystone_CGI,,0,0,0,"Hail has greatly affected various parts of Houston and the Texas area. This could bring a lot of damage to your roof and home. Contact our team today, as we will conduct a FREE roof inspection, while maintaining safe COVID-19 protocol! #HoustonRoofer #TXRoofing #RoofContractor",,,#HoustonRoofer #TXRoofing #RoofContractor,1254840315506294787,https://twitter.com/Keystone_CGI/status/1254840315506294787
2020-04-27 18:30:00,ABC7Amarillo,,0,1,2,"As the number of COVID-19 cases continues to rise in the Texas Panhandle, the Hansford County Hospital District is restricting the number of visitors to the hospital's patients, clinic and emergency department. ",,,,1254840234480529408,https://twitter.com/ABC7Amarillo/status/1254840234480529408
2020-04-27 18:29:42,latinorebels,,1,1,2,"UT/TT Poll: Texas Voters Likely to Re-Elect Trump, Show Stronger Approval for State’s COVID-19 Response https://www.latinorebels.com/2020/04/27/texaspolltrump/ via @latinorebels",,@latinorebels,,1254840159687901184,https://twitter.com/latinorebels/status/1254840159687901184
2020-04-27 18:29:20,EndFearNow,,0,0,0,"Texas man charged in knapsack killing of infant girl seeks release from jail out of fear of COVID-19 - http://ActionNewsJax.com",,,,1254840066733748227,https://twitter.com/EndFearNow/status/1254840066733748227
2020-04-27 18:29:00,VotePrTrump2020,,0,0,0,"Court rules Texas abortion ban can continue during COVID-19 pandemic | ",,,,1254839983724257280,https://twitter.com/VotePrTrump2020/status/1254839983724257280
2020-04-27 18:28:53,sue_bornstein,,1,5,11,"Far fewer than 1% of the 29 million Texans have undergone COVID testing to date. This appears to be a recipe for disaster. As Texas Prepares to Phase Out Stay-at-Home, Governor Abbott Says Nearly Half a Million Jobs Are Now Open ",,,,1254839953420419078,https://twitter.com/sue_bornstein/status/1254839953420419078
2020-04-27 18:28:01,TALK1370,,0,0,0,"HEADLINES: Texas voters likely to re-elect Trump, approve of state's COVID-19 response ",,,,1254839737870954504,https://twitter.com/TALK1370/status/1254839737870954504
2020-04-27 18:27:46,LauraHarrisNBC5,,2,6,8,"800+ INMATES HAVE COVID-19 More Than 800 Inmates, Nearly 300 Staffers Positive for COVID-19 in Texas Prisons: TDCJ ",,,,1254839673584787457,https://twitter.com/LauraHarrisNBC5/status/1254839673584787457
2020-04-27 18:25:15,FStexas,,0,0,0,"Work on your timing for rebounds with this drill. Try to keep the ball overhead the entire time. Good luck! #COVID_19 #wfh #homeworkout #basketball #basketballtraining #youthbasketball #stayhome #youthsports #youth #sports #austin #texas #atx #cedarpark",,,#COVID_19 #wfh #homeworkout #basketball #basketballtraining #youthbasketball #stayhome #stayhome #youthsports #youth #sports #austin #texas #atx #cedarpark,1254839039003418625,https://twitter.com/FStexas/status/1254839039003418625
2020-04-27 18:23:56,TBBusiness,,0,1,0,"MeGustaTV will video stream Governor Abbott Making Announcement Regarding Texas' Response To COVID-19 ",,,,1254838709150760960,https://twitter.com/TBBusiness/status/1254838709150760960
2020-04-27 18:22:29,SteveTaylorRGG,,0,0,0,"Given what happened at the meatpacking plant in Cactus, Texas, what guarantee can @USAmbMex offer that COVID-19 will not strike in the border Maquila plants in Mexico? Ambassador Landau wants the plants re-opened. Maquila workers fear catching COVID-19.",,@USAmbMex,,1254838345068404737,https://twitter.com/SteveTaylorRGG/status/1254838345068404737
2020-04-27 18:20:31,TexBusiness,,0,0,0,"Outbreak of COVID-19 at a Texas Chic-fil-A sickens 15 employees. #Beaumont #EastTexas",,,#Beaumont #EastTexas,1254837849943347207,https://twitter.com/TexBusiness/status/1254837849943347207
2020-04-27 18:18:37,FieldDiamond,,0,0,1,"More Than 800 Inmates, Nearly 300 Staffers Positive for COVID-19 in Texas Prisons: TDCJ https://www.nbcdfw.com/news/coronavirus/more-than-800-inmates-nearly-300-staffers-positive-for-covid-19-in-texas-prisons-tdcj/2358782/",,,,1254837371448832005,https://twitter.com/FieldDiamond/status/1254837371448832005
2020-04-27 18:16:03,973KISSFM,,0,0,0,"Texas man tells story of surviving COVID-19 after losing his father to it ",,,,1254836725190459399,https://twitter.com/973KISSFM/status/1254836725190459399
