date,username,to,replies,retweets,favorites,text,geo,mentions,hashtags,id,permalink
2020-04-27 21:12:24,BernardLawFirm,,0,0,0,"Trial by Zoom: We Have Begun a New Era Texas LawyerRandy Kesslerhttps://images.law.com/contrib/content/uploads/sites/404/2017/11/Randy-Kessler-Article-201711031418.jpgCases and Courts/Commentary/Family Law/Legal Education/Litigation/Legal Services/COVID-… ",,,,1254881105368489984,https://twitter.com/BernardLawFirm/status/1254881105368489984
2020-04-27 21:11:48,Houston_TeVon,,0,0,5,"I see they opening Texas us on Friday and so i did a research paper on Covid-19 2 weeks ago and the numbers were 600k confirmed and now in two weeks we are at 1M ",,,,1254880953618567169,https://twitter.com/Houston_TeVon/status/1254880953618567169
2020-04-27 21:10:53,kennygstevenson,,1,0,0,"""Don't mess with Texas!"" COVID-19: Hold my beer",,,,1254880721153359872,https://twitter.com/kennygstevenson/status/1254880721153359872
2020-04-27 21:09:58,doggomomX2,doggomomX2,0,0,0,"This is so crazy cause Texas is reopening and there’s people at my company working the front lines in other places telling me it’s “like a war zone” with how bad COVID is in their area ",,,,1254880493709004801,https://twitter.com/doggomomX2/status/1254880493709004801
2020-04-27 21:09:02,LadyMenopause,kelvinddavis,0,0,3,"It's OK Greg, we're probably still winning on gun sales, but we'll totes let Texas win on COVID cases. Assclown. ",,,,1254880258051862528,https://twitter.com/LadyMenopause/status/1254880258051862528
2020-04-27 21:07:31,SarahSilly6,butterdaboi,0,0,0,"Texas Covid-19 actual numbers per State of Texas website http://txdshs.maps.arcgis.com/apps/opsdashboard/index.html#/3f048ced32804271aafe8b9640bcb4a7",,,,1254879876609441797,https://twitter.com/SarahSilly6/status/1254879876609441797
2020-04-27 21:06:43,ThomasC05493526,,0,0,0,"@GregAbbott_TX sorry guv but u r wrong about opening up Texas. U have endangered the population 2appease donors. Lives will b lost &amp; it will bsquarely on ur thin shoulders. Pitiful, COVID-19 is not going away, not enough testing, &amp; ur 26k aday will mean it will take3yrs IDIOT!",,@GregAbbott_TX,,1254879672581664772,https://twitter.com/ThomasC05493526/status/1254879672581664772
2020-04-27 21:06:24,aggie_hood,Walter_Dragone,0,1,10,"Texas has just over 1,500 COVID hospitalizations right now. Calm down, Walt. We're going to be fine.",,,,1254879595435888645,https://twitter.com/aggie_hood/status/1254879595435888645
2020-04-27 21:05:39,OceanBlueWave20,MSNBC,1,0,2,"Does that mean Texas will experience a 25% increase in COVID-19 deaths? I say again, nothing has changed medically or scientifically to warrant relaxing social-distancing. This will backfire on Governor Abbott.",,,,1254879406570508291,https://twitter.com/OceanBlueWave20/status/1254879406570508291
2020-04-27 21:05:12,glogirl92,,0,0,0,"More Than 800 Inmates, Nearly 300 Staffers Positive for COVID-19 in Texas Prisons: TDCJ https://www.nbcdfw.com/news/coronavirus/more-than-800-inmates-nearly-300-staffers-positive-for-covid-19-in-texas-prisons-tdcj/2358782/?_osource=db_npd_nbc_kxas_twt_shr All of Them Including The Staff are Disposable!",,,,1254879294272212993,https://twitter.com/glogirl92/status/1254879294272212993
2020-04-27 21:04:48,themomfactor,MSNBC,0,0,0,"@GovAbbott are you and your health system ready for an increase in covid. Can a Texas citizen sue you for wrongful death? ",,@GovAbbott,,1254879193671757824,https://twitter.com/themomfactor/status/1254879193671757824
2020-04-27 21:04:34,TJGlobal16,ProgressFan4,0,0,2,"Governor Abbot has no clue how widespread COVID-19 is in his state, so Texas is basically screwed!",,,,1254879133093572612,https://twitter.com/TJGlobal16/status/1254879133093572612
2020-04-27 21:04:06,ReneRod12491497,,1,4,7,"Being the 2nd largest municipality,I find it dangerous to keep the residents of @City_of_Socorro waiting for specific information reguarding our area on #Covid_19 @mayor_margo @KTSMtv @KFOX14 @abc7breaking @CBS4Local @Telemundo48 @Univision26 #socorro #Texas",,@City_of_Socorro @mayor_margo @KTSMtv @KFOX14 @abc7breaking @CBS4Local @Telemundo48 @Univision26,#Covid_19 #socorro #Texas,1254879015803863040,https://twitter.com/ReneRod12491497/status/1254879015803863040
2020-04-27 21:03:40,UrbanHippy,,0,0,0,"@Wfaa your poll is flawed. Is it the right time to open up Texas? Isn’t that a loaded question? Do you mean back to the way it was prior to COVID-19 or opening the way Abbott laid out?",,@wfaa,,1254878907372888071,https://twitter.com/UrbanHippy/status/1254878907372888071
2020-04-27 21:03:19,Aeazy117,,0,20,47,"Opening Texas back up is the worst possible thing to do especially right now. There are still cases of Covid-19 rising in the Permian Basin and opening back up will only make things worse",,,,1254878819409854465,https://twitter.com/Aeazy117/status/1254878819409854465
2020-04-27 21:03:15,TXKGazette,,0,0,0,"Bowie County, Texas' COVID-19 death toll rose by one Monday, reaching a total of eight deaths attributed to the disease caused by the new coronavirus. The county's overall coronavirus case count reached a new high of 94. https://www.texarkanagazette.com/news/texarkana/story/2020/apr/27/another-covid-19-death-reported-bowie-county/825694/?preview=26a05ca94f278df22de36e64a1fd0053 via @TXKGazette",,@TXKGazette,,1254878800170627072,https://twitter.com/TXKGazette/status/1254878800170627072
2020-04-27 21:03:09,JesusQlla20,,3,8,22,"Texas, y’all doing it wrong. If we “recommend” to continue social distancing and wearing facial coverings, no one is going to take it seriously. I HATE IT HERE!!! COVID-19 is real and not going away just because y’all want to reopen businesses... ",,,,1254878777768845313,https://twitter.com/JesusQlla20/status/1254878777768845313
2020-04-27 21:02:40,Meding001,WSJ,2,0,6,"Covid 19 deaths per million residents by states New York 1153 New Jersey 680 Connecticut 537 Massachusetts 440 Louisiana 373 Michigan 320 Illinois 155 Washington 103 Georgia 91 Florida 53 Wisconsin 49 California 44 North Carolina 32 Texas 24",,,,1254878653181317121,https://twitter.com/Meding001/status/1254878653181317121
2020-04-27 21:02:28,Lyssatron,,1,0,0,"Greg Abbott is an absolute fucking idiot. Opening Texas is going to spike covid 19 because people are not going to take the right measures to protect themselves and others! I’m telling y’all this is hands down the STUPIDEST decision he could have made. It’s about to get worse",,,,1254878603067756550,https://twitter.com/Lyssatron/status/1254878603067756550
2020-04-27 21:02:12,NotAlsoKnownAs,,0,0,0,"Damn. I love Texas, but they have 2 of the top-5 metropolitan populations and 6 of the top-20 city populations ... yet, they're near lowest percentage of Covid-19 tested states. I hope it works out for that big ol' state, but I've got a bad feeling about this.",,,,1254878539523948545,https://twitter.com/NotAlsoKnownAs/status/1254878539523948545
2020-04-27 21:01:56,VigarooLocal,,0,0,0,"Living in Austin During COVID-19: Ways to Help, Things to Do http://goo.gl/FVFU8Y #AustinTX #tech #Texas",,,#AustinTX #tech #Texas,1254878471731331072,https://twitter.com/VigarooLocal/status/1254878471731331072
2020-04-27 21:01:30,JessicaDelRey_,,0,9,26,"Y’all Texas Covid numbers bout to skyrocket like Patrick Mahomes is the 3rd quarter. . Y’all better pray for us. Our governor is fucking dumb and so are our people.",,,,1254878360519532544,https://twitter.com/JessicaDelRey_/status/1254878360519532544
2020-04-27 21:01:28,juliecowens,LarryGDean1,0,0,0,"So is state of Texas going to pay for the 700,000 additional funerals this will cause? Texas is a hot spot for covid. Only a moron would go to a movie or restaurant right now. Good. Thin the herd. ",,,,1254878350830698498,https://twitter.com/juliecowens/status/1254878350830698498
2020-04-27 21:01:10,our_science,,0,0,0,"Texas Policy Lab partners with Harris County judge on COVID-19 response http://news.rice.edu/2020/04/23/texas-policy-lab-partners-with-harris-county-judge-on-covid-19-response-2/#.XqdGgAqGR7w.twitter",,,,1254878279229599744,https://twitter.com/our_science/status/1254878279229599744
2020-04-27 21:01:05,misskatstroud,,0,1,11,"As a child I was offended by the Spongebob episode where they called Texas stupid but as an adult I now know that Spongebob was ahead of its time anyway we’re gonna have fun with a rise of cases of Covid-19 on May 1st !!!!",,,,1254878255922008071,https://twitter.com/misskatstroud/status/1254878255922008071
2020-04-27 21:01:02,Corporacion540,,0,2,11,"Este lunes el precio del petróleo sufrió importantes caídas, especialmente el de Texas, en medio de problemas para almacenar el crudo, debido a la pandemia de la COVID-19. #AsiComoSuena #CorpoTv #NoticieroEnLinea",,,#AsiComoSuena #CorpoTv #NoticieroEnLinea,1254878245876649985,https://twitter.com/Corporacion540/status/1254878245876649985
2020-04-27 21:00:53,ErinForYall,,1,7,11,"I have joined my House colleagues in requesting Gov. Abbott issue an order directing @TexasTDI, Division of Worker’s Compensation to rule any Texas First Responder testing positive for COVID-19 be presumed to have contracted the disease in the Line of Duty. ",,@TexasTDI,,1254878207762972677,https://twitter.com/ErinForYall/status/1254878207762972677
2020-04-27 21:00:48,Agent_Poogle,,0,0,0,"The chart shows COVID-10 impact on the daily volume of single-family homes sold in North Texas. Indeed, the April numbers are promising but certainly not the norm. Are you interested in working with a REALTOR that can guide with real-time market data? Contact Poogle (972)4087402 ",,,,1254878184992055312,https://twitter.com/Agent_Poogle/status/1254878184992055312
2020-04-27 21:00:39,slimsquid,PKsavvy,1,0,0,"It’s going to allow thousands to get back to work and not loose their home, pay rent, fees their families... Stimulate the destroyed economy. “Texas has seen a decline in Covid cases for 17 days straight” Sound like good enough reasoning to me?",,,,1254878147331448842,https://twitter.com/slimsquid/status/1254878147331448842
2020-04-27 21:00:30,Anyrubik,NBCNews,0,0,0,"#deadbyeconomy #texasstyle thanks to Abbott’s greed, pro life when the economy doesnt suffer now we in texas are subject to a social experiment he lift stay at home order and suggest no one should mandate face masks might as well we all hang out with covid patients and get it",,,#deadbyeconomy #texasstyle,1254878111390408704,https://twitter.com/Anyrubik/status/1254878111390408704
2020-04-27 21:00:03,kytxcbs19,,1,0,0,"Governor Greg Abbott on Monday announced the first phase of the State of Texas' ongoing plan to safely and strategically open Texas while minimizing the spread of COVID-19. ",,,,1254877997288562690,https://twitter.com/kytxcbs19/status/1254877997288562690
2020-04-27 21:00:00,AscensionSeton,,0,2,5,"Healthcare Hero Iza Ferrino is an ICU nurse at Dell Seton Medical Center at The University of Texas. She is fighting COVID-19 up close and personal. Learn more about her experience on the front lines. ",,,,1254877984785399814,https://twitter.com/AscensionSeton/status/1254877984785399814
2020-04-27 20:59:29,Micki_b30,,0,0,0,"#texas #covid_19 https://www.instagram.com/p/B_f6PK4gqFi/?igshid=nlgrjn1g9mmk",,,#texas #covid_19,1254877851918229506,https://twitter.com/Micki_b30/status/1254877851918229506
2020-04-27 20:57:14,TreySerna,,2,0,1,"JUST IN: Here’s a breakdown on Gov. Greg Abbott’s COVID-19 presser. COVID-19 cases in Texas have been declining for the past 17 days Texas’ stay-at-home order will expire this Thursday, state will begin re-opening in phases on May 1. ",,,,1254877287125745666,https://twitter.com/TreySerna/status/1254877287125745666
2020-04-27 20:56:52,hedcannon,CathyYoung63,0,0,0,"Medium-sized Texas towns like Abilene and Tyler are laying off nurses bc their COVID cases are low but they can’t do “elective surgeries” like colonoscopies or cancer-related procedures. We’re all acting like we live in NYC.",,,,1254877195362807808,https://twitter.com/hedcannon/status/1254877195362807808
2020-04-27 20:56:01,NayelySpring910,TimothyImholt,0,0,0,"It actually is possible. This isn't a herd immunity problem and that won't work. Other nations actually took this ish seriously and have reduced their COVID cases and death. We aren't doing that in Texas and nor am I am will to just give up my life for something stupid",,,,1254876979989549059,https://twitter.com/NayelySpring910/status/1254876979989549059
2020-04-27 20:56:00,bambamwilliams3,,0,1,3,"soo all these methheads and crackheads we got in west Texas and ain't nun of them got the covid 19.....someone hand me a crack pill they might be on to something ",,,,1254876978202783744,https://twitter.com/bambamwilliams3/status/1254876978202783744
2020-04-27 20:55:36,manon_irwaen,,1,6,9,"""quel état a porté plainte contre la chine à propos du covid-19 ?"" - Floride -Texas -Michigan ou le ",,,,1254876875073236992,https://twitter.com/manon_irwaen/status/1254876875073236992
2020-04-27 20:55:24,HelloWoodlands,,0,0,0,"Today @GovAbbott announced the first phase of the State of Texas’ ongoing plan to ""safely and strategically open Texas while minimizing the spread of COVID-19."" Phase I will begin Friday May 1 and continue until at least May 18. ",,@GovAbbott,,1254876827786661892,https://twitter.com/HelloWoodlands/status/1254876827786661892
2020-04-27 20:55:18,ABCNewsLive,,0,0,2,"“Houston Texas COVID Sitters” is offering free household management and tutoring services for local medical workers and their families. http://abcn.ws/2Y5Vcip Aanchal Thadani and Madhushree Zope join @ABC News to discuss their efforts.",,@ABC,,1254876799483461632,https://twitter.com/ABCNewsLive/status/1254876799483461632
2020-04-27 20:52:57,adelelovie95,,3,0,5,"So Texas is going to reopen soon. My aunt is an RN in Dallas and an entire ward of her hospital is quarantined due to COVID. Texas pls. Don't do this.",,,,1254876208296329216,https://twitter.com/adelelovie95/status/1254876208296329216
2020-04-27 20:52:27,UnlimitedPoten3,,0,0,0,"Hi all! I need your help with a research study we are conducting at Texas Tech University on the impact of the COVID-19 pandemic. It takes 20-30 minutes to complete. Please consider helping us collect this important data! https://ttupsych.az1.qualtrics.com/jfe/form/SV_9KLxd7qIEeJzkzz #COVID19",,,#COVID19,1254876082551095297,https://twitter.com/UnlimitedPoten3/status/1254876082551095297
2020-04-27 20:52:06,FOXWestTexas,,0,0,0,"Live COVID-19 updates: Gov. Greg Abbott to announce plans to reopen Texas ",,,,1254875993971531777,https://twitter.com/FOXWestTexas/status/1254875993971531777
2020-04-27 20:51:59,Anil_WasTaken,,3,0,4,"I meet the most interesting people in Overwatch. Topic: Sunlight kills COVID-19 within seconds. Learnded: Texas has the biggest sky. (Everything is bigger in Texas they say....) WeSmart ",,,,1254875965748019202,https://twitter.com/Anil_WasTaken/status/1254875965748019202
2020-04-27 20:51:45,killerbeezzz_4,JayHart909,0,1,2,"Here’s my application of the word: “The wealthy would rather unleash Covid on Texas workers, health pros &amp; employees forced back into a dangerous work environment, than forgo dinner out. If they can’t exploit their workers for their own gain, they will unleash their wrath.",,,,1254875909573640192,https://twitter.com/killerbeezzz_4/status/1254875909573640192
2020-04-27 20:51:45,OTOOLEFAN,GregAbbott_TX,1,11,22,"Texas is 49th in COVID-19 testing. I'm sure this will work out GREAT! #IDIOT",,,#IDIOT,1254875907065511938,https://twitter.com/OTOOLEFAN/status/1254875907065511938
2020-04-27 20:51:19,WinnerzNvrQuit,JoviTaliban,1,3,32,"number of people in Texas OVER 28 million that is .0000357 of the population. which means that more people die from everything else than the Covid. lets get back to work y'all",,,,1254875796554088454,https://twitter.com/WinnerzNvrQuit/status/1254875796554088454
2020-04-27 20:50:19,Meding001,MSNBC,0,0,0,"Covid 19 deaths per million residents by states New York 1108 New Jersey 660 Connecticut 493 Massachusetts 374 Louisiana 365 Michigan 310 Illinois 140 Washington 99 Georgia 88 Florida 51 Wisconsin 49 California 41 North Carolina 30 Texas 22",,,,1254875547177451520,https://twitter.com/Meding001/status/1254875547177451520
2020-04-27 20:50:11,News_Messenger,,0,0,1,"AUSTIN - Governor Greg Abbott today announced the first phase of the State of Texas' ongoing plan to safely and strategically open Texas while minimizing the spread of COVID-19. Under Phase I, certain services and activities are allowed to open with… ",,,,1254875514982076416,https://twitter.com/News_Messenger/status/1254875514982076416
2020-04-27 20:50:10,Lacish_Ael_Dae,,0,0,0,"For everyone so absolutely mind blown about texas reopening, consider that they have 600 covid deaths so far when they normally have ~2400 flu deaths. ",,,,1254875507579125760,https://twitter.com/Lacish_Ael_Dae/status/1254875507579125760
2020-04-27 20:49:48,PrisGalstaun,wfaa,1,0,1,"Pray for us. Texas is the 2nd worst state in the country for Covid-19 testing with only 332 tests conducted for every 100,000 people and we are not contact tracing, either. This is the textbook definition of insanity. But, gotta go hang out, eat out, get hair and nails done. Sigh ",,,,1254875415329624064,https://twitter.com/PrisGalstaun/status/1254875415329624064
2020-04-27 20:49:44,Kevin_Fed16,,0,0,0,"For everyone freaking out that Texas is to reopen this week, you’re more than welcome to camp your happy ass on the couch until 2030 when COVID has been all but eradicated.",,,,1254875399848448001,https://twitter.com/Kevin_Fed16/status/1254875399848448001
2020-04-27 20:48:38,WilliamOckhamTx,chrislhayes,0,0,4,"Here's a graph of the three day rolling average of new COVID-19 cases in Texas, based on the state's data. Reopening restaurants for in person dining seems like a bad idea. ",,,,1254875124039385088,https://twitter.com/WilliamOckhamTx/status/1254875124039385088
2020-04-27 20:48:33,rcwllmkns,WSJ,0,0,0,"governor abbott is really leaning into the ""everything is bigger in texas"" motto when it comes to covid ",,,,1254875101872500741,https://twitter.com/rcwllmkns/status/1254875101872500741
2020-04-27 20:48:16,SAReport,,3,1,2,"Citing a declining rate in new COVID-19 infections, Gov. Greg Abbott laid out a phased plan to reopen the Texas economy. https://therivardreport.com/the-latest-on-how-coronavirus-is-affecting-san-antonio/?utm_medium=Social&amp;utm_source=Twitter#Echobox=1588020490",,,,1254875031928266752,https://twitter.com/SAReport/status/1254875031928266752
2020-04-27 20:48:09,BrianBernardLaw,,0,0,0,"Trial by Zoom: We Have Begun a New Era https://ift.tt/3bHLWVr Texas LawyerRandy Kesslerhttps://images.law.com/contrib/content/uploads/sites/404/2017/11/Randy-Kessler-Article-201711031418.jpgCases and Courts/Commentary/Family Law/Legal Education/Litigation/Legal Services/COVID-…",,,,1254875002555465731,https://twitter.com/BrianBernardLaw/status/1254875002555465731
2020-04-27 20:47:10,SamHarless126,,0,0,0,"Check out my Facebook Page http://www.facebook.com/samharless126 for updates on Governor Abobott's plan to reopen Texas businesses as well as other announcements on COVID activities. ",,,,1254874752415666176,https://twitter.com/SamHarless126/status/1254874752415666176
2020-04-27 20:47:08,LordPitaya,,1,0,4,"Texas, damn near the bottom of the list in per-capita testing for Covid-19, is having its stay-at-home order lifted by the end of the week Greg Abbott is an entire Saturday morning cartoon villain",,,,1254874744685502466,https://twitter.com/LordPitaya/status/1254874744685502466
2020-04-27 20:45:24,JoviTaliban,OANN,1,3,11,"Number of Covid cases in Texas today, 838. Number of cases on April 7th, 986.",,,,1254874309740367872,https://twitter.com/JoviTaliban/status/1254874309740367872
2020-04-27 20:44:14,FHMultifamily,,0,0,1,"Open Texas! Gov. Greg Abbott’s stay at home order expires Thursday - https://mailchi.mp/marcusmillichap/covid-2103070 #Coronavirus #COVID19 #COVID #Realestate #news #investing #multifamily",,,#Coronavirus #COVID19 #COVID #Realestate #news #investing #multifamily,1254874018072670215,https://twitter.com/FHMultifamily/status/1254874018072670215
2020-04-27 20:42:28,BlakePowersMdia,,0,0,0,"COVID-D9 UPDATE! Good News Texas! But Are We Truly Ready? VIDEO details at http://Facebook.com/BlakePowersMedia",,,,1254873571161264136,https://twitter.com/BlakePowersMdia/status/1254873571161264136
2020-04-27 20:42:16,Planeta_Politic,,1,0,1," El precio de los futuros del petróleo West Texas Intermediate (WTI) marcó una nueva violenta caída este lunes de un 24,3%, hasta los 12,83 dólares por barril, debido a la falta de espacio para su almacenamiento y la caída de la demanda mundial causada por la pandemia de covid.",,,,1254873521362276353,https://twitter.com/Planeta_Politic/status/1254873521362276353
2020-04-27 20:41:53,markahix,,0,0,2,"Greg Abbott says that we've slowed COVID-19 in Texas, and that means we can reopen. In other news, train with stuck throttle had brakes applied and it slowed down, so now we can let off the brakes and it sure won't speed right back up and skip the rails or anything.",,,,1254873424272465923,https://twitter.com/markahix/status/1254873424272465923
2020-04-27 20:41:49,BlakePowersRdio,,0,0,0,"COVID-D9 UPDATE! Good News Texas! But Are We Truly Ready? VIDEO details at http://Facebook.com/BlakePowersMedia",,,,1254873409726676992,https://twitter.com/BlakePowersRdio/status/1254873409726676992
2020-04-27 20:41:40,mageedelina,,0,0,0,"University of Texas at Austin: Small reimbursement of tuition for lack of resource availability due to COVID-19 - Sign the Petition! http://chng.it/hLRJBVB2 via @Change",,@Change,,1254873371365564416,https://twitter.com/mageedelina/status/1254873371365564416
2020-04-27 20:41:19,ProgressFan4,,0,1,2,"Study after study shows that African-Americans and poor communities are among the most vulnerable to Covid-19. They cannot afford to stay home, disproportionately lack health care, and disproportionately suffer pre-existing conditions. Texas @GovAbbott is not worried.",,@GovAbbott,,1254873279979978753,https://twitter.com/ProgressFan4/status/1254873279979978753
2020-04-27 20:41:05,Gidgys,,0,0,0,"LIVE: Gov. Greg Abbott may widen reopening of Texas during COVID-19 https://youtu.be/7hTYoDKG5U4 via @YouTube",,@YouTube,,1254873224074141699,https://twitter.com/Gidgys/status/1254873224074141699
2020-04-27 20:40:06,kiii3news,,0,0,0,"Here are the latest COVID-19 updates, closures and postponements in Central Texas for Monday, April 27. ",,,,1254872975754625024,https://twitter.com/kiii3news/status/1254872975754625024
2020-04-27 20:39:55,dailydigger19,fox7austin,1,1,3,"""Abbott: Texas business will open in phases. Phase 1 begins May 1, Phase 2 can begin as early as May 18. Two weeks of data needed to confirm no flare-up of COVID-19. Texans need to maintain safe distancing practices."" ",,,,1254872927956348929,https://twitter.com/dailydigger19/status/1254872927956348929
2020-04-27 20:39:39,diario_standard,,0,1,1,"El Gobernador de #Texas (Greg Abbott) da por terminada la contingencia #COVID__19 y a partir del 1 de Mayo , todos los establecimientos están autorizados para volver a dar servicio: centros comerciales, restaurantes, cines. Ccp #Tamaulipas #NuevoLeon #Coahuila #SanLuisPotosi",,,#Texas #COVID__19 #Tamaulipas #NuevoLeon #Coahuila #SanLuisPotosi,1254872863737290758,https://twitter.com/diario_standard/status/1254872863737290758
2020-04-27 20:39:00,CoachCashion,,1,0,9,"Normal Texas etiquette: Eye contact, a smile, a nod, maybe even a ""how ya doin'?"", etc. It hasn't been true 100% of the time, but I've noticed this COVID-19 thing has put a damper on the above norm. C'mon, Texans. Let's not let this thing turn us into a bunch a Yankees!",,,,1254872699576487936,https://twitter.com/CoachCashion/status/1254872699576487936
2020-04-27 20:38:28,fishr312,CNNPolitics,1,1,4,"@GovAbbott I will do everything in my power to make you pay financially and/or politically if ANY of my family members or friends die of COVID_19 BECAUSE YOU JUMPED THE GUN and open Texas before we've even had the chance to be tested! I'm appalled and I hope you pay dearly.",,@GovAbbott,,1254872565690007555,https://twitter.com/fishr312/status/1254872565690007555
2020-04-27 20:38:05,IcodeSouthlake,,0,2,1,"#Onlinecamp #Camp #Steam #Technology #Kidsactivity #Coding #Tech #Family #Southlake #Texas #Dallas #Grapevine #Keller #HourOfCode #Colleyville #Euless #GirlsIncTarrant #Girlswhocode #Girlsintech #WomenWhoCode #COVID #Virus #OnlineClasses #OnlineCourses #InstructorLed #Livesupport",,,#Onlinecamp #Camp #Steam #Technology #Kidsactivity #Coding #Tech #Family #Southlake #Texas #Dallas #Grapevine #Keller #HourOfCode #Colleyville #Euless #GirlsIncTarrant #Girlswhocode #Girlsintech #WomenWhoCode #COVID #Virus #OnlineClasses #OnlineCourses #InstructorLed #Livesupport,1254872467497259014,https://twitter.com/IcodeSouthlake/status/1254872467497259014
2020-04-27 20:37:38,CWILK1989,,3,7,27,"So Texas has a plan is to open again, despite a rising number of cases, but at ""25% capacity"" Smh......@GregAbbott_TX I get you value currency over human life but come on! Texans will be waiting in tightly packed lines in front of stores and a 2nd wave of Covid-19 is imminent. ",,@GregAbbott_TX,,1254872354938896391,https://twitter.com/CWILK1989/status/1254872354938896391
2020-04-27 20:37:32,wowlexiwow,,0,0,2,"Texas governor is letting restaurants, movie theaters, and malls open May 1st.. our covid deaths have gone up almost 100 in less than 24 hours..",,,,1254872331245309957,https://twitter.com/wowlexiwow/status/1254872331245309957
