date,username,to,replies,retweets,favorites,text,geo,mentions,hashtags,id,permalink
2020-04-25 11:37:03,mog7546,,3,22,16,"#Texas in 49th Place #HOUSTON -- Despite conducting more than 66,000 tests over the last week, Texas still remains near the BOTTOM OF THE LIST for overall COVID-19 testing nationwide. 7,762 tests per 1 million residents #MOG https://abc13.com/6127913/?taid=5ea39e78e1ba140001280262",,,#Texas #HOUSTON #MOG,1254011537288724480,https://twitter.com/mog7546/status/1254011537288724480
2020-04-25 11:24:23,nikkiandalo,,0,0,0,"Texas Pups in Little Elm was evicted because they could not pay their rent during COVID-19 crisis. ",,,,1254008350448267266,https://twitter.com/nikkiandalo/status/1254008350448267266
2020-04-25 11:20:37,rmgoldman1,bec215,1,0,2,"It doesn't. But supporting a President who does reject science, , etc.., can open one up to some condescension. I'm equally tired of MAGAs calling me an Ivory Tower snob not in touch with the ""real world"" Then I see this Texas MAGA who died of the Covid-19: ",,,,1254007402489356289,https://twitter.com/rmgoldman1/status/1254007402489356289
2020-04-25 11:03:23,abc13houston,,8,8,16,"Texas COVID-19 testing among worst in nation https://abc13.co/2KybIQb",,,,1254003064316538880,https://twitter.com/abc13houston/status/1254003064316538880
2020-04-25 11:00:21,AnitaBu1963,,0,2,1,"Texas COVID-19 testing among worst in nation - ABC13 Houston https://abc13.com/6127913/?taid=5ea39e78e1ba140001280262 #SmartNews",,,#SmartNews,1254002301917773824,https://twitter.com/AnitaBu1963/status/1254002301917773824
2020-04-25 11:00:12,mdott00,tedcruz,0,0,1,"Too bad you don’t volunteer at a Texas COVID hotspot.",,,,1254002263846248449,https://twitter.com/mdott00/status/1254002263846248449
2020-04-25 10:50:11,12NewsNow,,0,0,3,"Comptroller Glenn Hegar says Texas could replenish the fund by getting a federal loan or using some of the COVID-19 money coming to the state. ",,,,1253999744696954881,https://twitter.com/12NewsNow/status/1253999744696954881
2020-04-25 10:47:29,SalsaPrice,,0,1,2,"COVID death per million: New York: 1,085 New Jersey: 632 Connecticut: 493 Mass.: 374 Louisianna: 356 Mich.: 310 ... Florida: 51 California: 41 Texas: 22 Oregon: 21 Wyoming: 12 Hawaii: 9",,,,1253999062136881156,https://twitter.com/SalsaPrice/status/1253999062136881156
2020-04-25 10:42:16,DavidDeLong62,DavidDeLong62,0,0,0,"supports her campaign, and Beto mobilizes to help out. When Texas goes, it will break, quickly, and Republicans will wake up and realize they're going to lose TX. Abbott is testing minimally and downplaying covid, but we're nowhere near our peak and the numbers will climb.",,,,1253997750955450374,https://twitter.com/DavidDeLong62/status/1253997750955450374
2020-04-25 10:41:38,StevenABC13,,14,23,36,"Texas has started re-opening from the pandemic shutdown. But it’s important to remember the state continues to rank among last in the country for COVID-19 testing. http://abc13.com/6127913/ #abc13",,,#abc13,1253997592570142724,https://twitter.com/StevenABC13/status/1253997592570142724
2020-04-25 10:25:55,deace1,tribelaw,0,0,0,"Trump said over a month ago that April and warmer weather would likely eradicate Covid 19. Why was the virus so devastating in Florida, Texas and other southern states where weather was already hot ?",,,,1253993633780584453,https://twitter.com/deace1/status/1253993633780584453
2020-04-25 10:25:28,MrScottReynolds,foxjust,0,0,0,"Florida, Texas, Cali, &amp; Arizona barely have 3,000 total covid deaths, low hospitalization rates and over 100 mill people not to mention highest elderly populations... Florida and Texas late and laxed “stay at home”. What do you both say on this? Warm weather impact?",,,,1253993520848830468,https://twitter.com/MrScottReynolds/status/1253993520848830468
2020-04-25 10:05:47,KarineOmry,,0,15,17,"#Covid_19 #Texas prisons. Please pay attention to the numbers. April 10 - Positive tests - prisoners 132 staff 69 April 24 - Positive tests - prisoners 752 staff 274 @GovAbbott how do you protect people (prisoners and employees) in prison? #IncarceratedPeopleMatter @iheartpaps",,@GovAbbott @iheartpaps,#Covid_19 #Texas #IncarceratedPeopleMatter,1253988567359066113,https://twitter.com/KarineOmry/status/1253988567359066113
2020-04-25 10:03:52,Lianarukmini,,0,0,0,"Texas COVID-19 testing among worst in nation - ABC13 Houston #SmartNews https://abc13.com/6127913/?taid=5ea39e78e1ba140001280262",,,#SmartNews,1253988084779298818,https://twitter.com/Lianarukmini/status/1253988084779298818
2020-04-25 09:55:14,ANGELASOFIALM,,1,0,2,"Han notado que China, siendo el país que más energía consume, aprovecha precios bajos para acumular petróleo. Mientras el Brent —referencia para Europa—, se desploma y El crudo West Texas —referencia para EE.UU.— cotiza a precios negativos; sigo con mi teoría ¡Covid fue creado!",,,,1253985915988566022,https://twitter.com/ANGELASOFIALM/status/1253985915988566022
2020-04-25 09:34:33,thequeenb76119,,0,0,0,"East Texas meat processing plant investigated for COVID-19 outbreak ",,,,1253980710047793152,https://twitter.com/thequeenb76119/status/1253980710047793152
2020-04-25 09:33:53,thequeenb76119,,0,0,0,"Mobile COVID-19 testing site opens in East Texas; sites planned tomorrow in Marshall, Henderson, &amp; Carthage ",,,,1253980541277417477,https://twitter.com/thequeenb76119/status/1253980541277417477
2020-04-25 09:28:36,bullcityzen,tedcruz,0,0,0,"Ted, how many people in your state are dying right now from COVID-19. How many people in your state actually thought it was a good idea to ingest disinfectant? Probably a lot, cause ya know it’s Texas. So get your balls back and stand up for what is right. #tedhasnoballs",,,#tedhasnoballs,1253979212475703297,https://twitter.com/bullcityzen/status/1253979212475703297
2020-04-25 09:20:52,joemharris,,0,0,0,"Texas COVID-19 testing among worst in nation https://abc13.com/texas-covid-19-testing-among-worst-in-nation/6127913/ via @ABC13Houston",,@abc13houston,,1253977263365906432,https://twitter.com/joemharris/status/1253977263365906432
2020-04-25 09:12:56,ChrisLe15970575,cnni,7,0,1,"According to Trump the heat will kill off Covid-19, hurrah California, New Mexico and Texas are saved, NOT!",,,,1253975267367956485,https://twitter.com/ChrisLe15970575/status/1253975267367956485
2020-04-25 09:10:28,ReginaHouTX,,0,0,0,"Texas Chief Nurse Designs Masks That Protect Better Against COVID-19 Than N95 ",,,,1253974647143628800,https://twitter.com/ReginaHouTX/status/1253974647143628800
2020-04-25 09:09:52,LyceumWC,,0,0,0,"COVID-19 Cases Now Tied to Meat Plants in Rural Texas Counties Wracked with Coronavirus ",,,,1253974497792864256,https://twitter.com/LyceumWC/status/1253974497792864256
2020-04-25 09:06:21,Emily_Lykos,,1,8,27,"[Texas, USA] Discovery of a new symptom of Covid 19 ",,,,1253973611553206272,https://twitter.com/Emily_Lykos/status/1253973611553206272
2020-04-25 09:05:19,MyMartialArtsTV,,0,0,0,"East Texas martial arts studio adjusts to COVID-19 pandemic with online classes - KLTV ",,,,1253973354148700160,https://twitter.com/MyMartialArtsTV/status/1253973354148700160
2020-04-25 08:56:05,cakikeith,,0,0,0,"Texas COVID-19 testing among worst in nation - ABC13 Houston https://abc13.com/6127913/?taid=5ea39e78e1ba140001280262 #Coronavirus #Texas",,,#Coronavirus #Texas,1253971026657964032,https://twitter.com/cakikeith/status/1253971026657964032
2020-04-25 08:52:31,InProphecy,,0,0,0,"Federal Courts Uphold Texas, Arkansas Abortion Orders Amid COVID-19 https://harbingersdaily.com/federal-courts-uphold-texas-arkansas-abortion-orders-amid-covid-19/ via @HarbingersDaily",,@HarbingersDaily,,1253970132977610752,https://twitter.com/InProphecy/status/1253970132977610752
2020-04-25 08:50:59,denuribe73,,0,0,0,"Texas COVID-19 testing among worst in nation - ABC13 Houston https://abc13.com/6127913/?taid=5ea39e78e1ba140001280262 #SmartNews",,,#SmartNews,1253969742928334848,https://twitter.com/denuribe73/status/1253969742928334848
2020-04-25 08:40:16,pirata_21,,0,2,4,"Stati Uniti, serie di tornado distruttivi in Oklahoma e Texas: almeno 6 vittime. #Trump:""Provate a respingerli con il ventilatore. #candeggina #Covid_19",,,#Trump #candeggina #Covid_19,1253967047660376065,https://twitter.com/pirata_21/status/1253967047660376065
2020-04-25 08:39:44,sonofselassie,,0,0,1,"Texas COVID-19 testing among worst in nation - ABC13 Houston https://abc13.com/6127913/?taid=5ea39e78e1ba140001280262",,,,1253966914860146689,https://twitter.com/sonofselassie/status/1253966914860146689
2020-04-25 08:33:04,SkyeAshly,,0,0,0,"Texas Right to Know Calls on US to Consider COVID-19 Ozone Therapy After It Shows Promise in Italy | P&amp;T Community https://www.ptcommunity.com/wire/texas-right-know-calls-us-consider-covid-19-ozone-therapy-after-it-shows-promise-italy",,,,1253965236387733509,https://twitter.com/SkyeAshly/status/1253965236387733509
2020-04-25 07:45:52,mjpdillon,,0,0,0,"States with the lowest amount of Covid-19 testing: South Carolina = .86% Arizona = .81% Texas = .78% Virginia = .76% Kansas = .73% Ohio (6th Worst)= .88% Gee, I'm so happy to live in a 21st-Century Republican state.",,,,1253953358181928960,https://twitter.com/mjpdillon/status/1253953358181928960
2020-04-25 07:42:06,6NewsCTX,,0,0,0,"Inside Texas Politics: TWC could replenish unemployment money with federal loan or COVID-19 funds ",,,,1253952408390193153,https://twitter.com/6NewsCTX/status/1253952408390193153
2020-04-25 07:39:05,kiii3news,,0,0,2,"The chief operating officer at The Texas State Aquarium says the behavior of the animals has changed during the COVID-19 pandemic. ",,,,1253951651746066432,https://twitter.com/kiii3news/status/1253951651746066432
2020-04-25 07:37:54,TexansRevolt,,0,0,0,"Texas COVID-19 testing among worst in nation - ABC13 Houston #SmartNews https://abc13.com/6127913/?taid=5ea39e78e1ba140001280262",,,#SmartNews,1253951351035437058,https://twitter.com/TexansRevolt/status/1253951351035437058
2020-04-25 07:34:09,7SinsOfTrump,,0,3,4,"Texas COVID-19 testing among worst in nation - ABC13 Houston https://abc13.com/6127913/?taid=5ea39e78e1ba140001280262",,,,1253950410571694083,https://twitter.com/7SinsOfTrump/status/1253950410571694083
2020-04-25 07:05:15,KABBFOX29,,0,0,0,"New online COVID-19 map shows closest test collection sites in Texas ",,,,1253943135216046080,https://twitter.com/KABBFOX29/status/1253943135216046080
2020-04-25 07:01:25,Omambala_Chuks,,0,23,7,"#RT #FreeBiafra #IPOB A suit has been filed in a Texas District Court in the US seeking compensatory damages of over $20 trillion US Dollars against China for the “creation and release, accidental or otherwise” of the Novel Coronavirus (COVID-19) as a b… ",,,#RT #FreeBiafra #IPOB,1253942173575385088,https://twitter.com/Omambala_Chuks/status/1253942173575385088
2020-04-25 07:01:19,Africadisruptiv,,0,0,0,"Rice University ignites innovation in response to COVID-19 crisis - TMC News - Texas Medical Center News ",,,,1253942148388528129,https://twitter.com/Africadisruptiv/status/1253942148388528129
2020-04-25 06:48:56,ShuckSandra,,0,0,0,"Mark Cuban: It’s too soon to reopen Texas businesses amid coronavirus https://www.dallasnews.com/business/2020/04/22/mark-cuban-its-too-soon-to-reopen-texas-businesses-amid-coronavirus/ In WA State Gov Inslee let 21,000 Boeing workers back in the Seattle area plants, the epicenter of Covid. But business in counties with hardly any Covid cant work! People want fairness",,,,1253939029411655681,https://twitter.com/ShuckSandra/status/1253939029411655681
2020-04-25 06:48:15,loveGoldenHeart,jburnmurdoch,0,0,0,"1 U.S. example: As of April 24th, Texas has tested ~ 242,547 people. TX population: *29 million* 22,806 positive COVID-19 cases 593 deaths 1,674 hospitalized Source: Texas Tribune + U.S.Census Bureau To compare, NY population is 8.4 million. Tested by April 24th: 730, 656",,,,1253938859412533250,https://twitter.com/loveGoldenHeart/status/1253938859412533250
2020-04-25 06:46:59,mostlyjokes,taylorjharris,1,0,0,"Trump hate is overwhelming. He would have even lost against Bernie and even if Covid never happened. But against Biden? My god. He may lose every state except for like the 3 dumbest ones. He’ll lose Texas.",,,,1253938540553084928,https://twitter.com/mostlyjokes/status/1253938540553084928
2020-04-25 06:28:11,vogler79,,3,20,34,"A federal court entered a permanent injunction halting a purported “ozone therapy” center in Dallas, Texas, from offering unproven treatments for coronavirus disease (COVID-19), the Department of Justice announced Friday. ",,,,1253933807373291520,https://twitter.com/vogler79/status/1253933807373291520
2020-04-25 06:26:44,wendydshaffer,,0,0,0,"Texas COVID-19 testing among worst in nation - ABC13 Houston https://abc13.com/6127913/?taid=5ea39e78e1ba140001280262 #SmartNews",,,#SmartNews,1253933442514841600,https://twitter.com/wendydshaffer/status/1253933442514841600
2020-04-25 06:26:20,FernandaCamino,ricburton,0,0,0,"#EstadosUnidos #Texas #SanAntonio #Bancos de #comida en plena pandemia de #Covid_19/#COVID__19/#coronavirus ...",,,#EstadosUnidos #Texas #SanAntonio #Bancos #comida #Covid_19 #COVID__19 #coronavirus,1253933340681474053,https://twitter.com/FernandaCamino/status/1253933340681474053
2020-04-25 06:21:03,cbtuck62,,0,0,0,"Texas COVID-19 testing among worst in nation - ABC13 Houston https://abc13.com/6127913/?taid=5ea39e78e1ba140001280262 #SmartNews",,,#SmartNews,1253932013158928384,https://twitter.com/cbtuck62/status/1253932013158928384
2020-04-25 06:13:15,MaryOttt,,0,0,0,"4/24/20 Daily Texas COVID Stats: ",,,,1253930050329731073,https://twitter.com/MaryOttt/status/1253930050329731073
2020-04-25 06:09:37,speakout_april,ZachsMind,0,0,2,"I agree. Abbott’s response to COVID is pathetic. Texas is one of the worst for testing ( coverup), but Abbott’s response to last year’s mass shootings was an absolute disgrace. He’s terrible. I’d like to see his numbers w/Independents, and Democrats.",,,,1253929134348210177,https://twitter.com/speakout_april/status/1253929134348210177
2020-04-25 06:08:27,OMAHAGEMGIRL,,0,0,1,"Texas COVID-19 testing among worst in nation - ABC13 Houston https://abc13.com/6127913/?taid=5ea39e78e1ba140001280262 #SmartNews",,,#SmartNews,1253928841732448257,https://twitter.com/OMAHAGEMGIRL/status/1253928841732448257
2020-04-25 06:04:21,LilliSawyer17,,0,0,1,"Texas Has Gotten So Tough with Planned Parenthood During COVID Crisis That PP's Suing the State ",,,,1253927810063724544,https://twitter.com/LilliSawyer17/status/1253927810063724544
2020-04-25 06:03:26,euronewses,,0,2,8,"#COVID-19: #Georgia, #Oklahoma y #Alaska se unen a #Texas en los primeros pasos de la reapertura de la #economía en #EEUU, donde el número de muertos por la #pandemia supera ya los 50.000. #yomequedoencasa",,,#COVID #Georgia #Oklahoma #Alaska #Texas #econom #EEUU #pandemia #yomequedoencasa #yomequedoencasa,1253927579616251906,https://twitter.com/euronewses/status/1253927579616251906
2020-04-25 05:51:13,xihualcoatl_mx,,0,0,0,"Covid-19 en Texas: las bolsas de muertos salen más baratas https://cuartarepublica.com/2020/04/25/covid-19-en-texas-las-bolsas-de-muertos-salen-mas-baratas/",,,,1253924505724039169,https://twitter.com/xihualcoatl_mx/status/1253924505724039169
2020-04-25 05:47:08,MarieWa96269124,,0,0,0,"So ready for Texas to reopen!!!! I'm tired of just sitting here not being able to do anything cuz of this COVID 19 stuff!!!!!",,,,1253923479264669702,https://twitter.com/MarieWa96269124/status/1253923479264669702
2020-04-25 05:27:25,AnimeWorld31,,0,0,1,"San Antonio may have reached its peak in COVID-19 cases, Texas governor says ",,,,1253918515087716357,https://twitter.com/AnimeWorld31/status/1253918515087716357
2020-04-25 05:26:51,EECC506,,0,0,2,"As of April 24th...593 deaths in Texas from COVID-19 since March 17th. At this rate it will only take 89 YEARS to reach the 483K predicted by models and used by Judge Clay Jenkins to justify closing Dallas County. I think TX hospitals can handle the load. #OpenTexasNOW",,,#OpenTexasNOW,1253918374754766848,https://twitter.com/EECC506/status/1253918374754766848
2020-04-25 05:25:05,KAGSnews,,0,0,0,"Inside Texas Politics: TWC could replenish unemployment money with federal loan or COVID-19 funds ",,,,1253917929864921089,https://twitter.com/KAGSnews/status/1253917929864921089
2020-04-25 05:21:51,carlofiorletta,georginapond1,0,0,1,"maybe if #COVID #FailureInChief gave Lyin' Ted a map marked with a sharpie. #Texas #VoteBlue2020",,,#COVID #FailureInChief #Texas #VoteBlue2020,1253917113879855104,https://twitter.com/carlofiorletta/status/1253917113879855104
2020-04-25 05:21:28,Stormin457,jodywayzata,1,0,1,"This is not a rainy day. This is nation wide Katrina you dip-wad! Florida and Texas got hurrican aid. All states will get COVID 19 aid.",,,,1253917019520581634,https://twitter.com/Stormin457/status/1253917019520581634
2020-04-25 05:14:04,BrynestadJulee,gaslightingus2,0,0,0,"Using your numbers, 0.08 of the population of Texas has tested positive for Covid and 0.003 of the population of Texas has died of Covid. How is that genocide?",,,,1253915156188246018,https://twitter.com/BrynestadJulee/status/1253915156188246018
2020-04-25 05:12:56,foxnewsradio,,1,0,6,"Businesses in Texas are reopening again. But only on a pick-up and delivery basis. Oklahoma and Alaska are also beginning to ease COVID-19 restrictions. Georgia has begun the most far-reaching relaxation of the nationwide lockdown. Listen &amp; Subscribe: ",,,,1253914868891160577,https://twitter.com/foxnewsradio/status/1253914868891160577
2020-04-25 05:12:12,dalepitbull210,,1,40,66,"hello everyone I’m painting masks for $10 each and half of the proceeds are going to Ayuda, Raices, and, the Refugee Services of Texas that are all supporting immigrants during covid!! If you would like one please dm me ",,,,1253914687902822400,https://twitter.com/dalepitbull210/status/1253914687902822400
2020-04-25 05:08:58,Animus58420344,OFB2020,0,0,0,"Texas Issues With Public Access yo Privatized #COVID testing thanks to gov abbot &amp; Criminal AG Ken Paxton ",,,#COVID,1253913870604865537,https://twitter.com/Animus58420344/status/1253913870604865537
2020-04-25 05:08:45,WeForNews,,0,0,0,"Retail businesses in the #US state of #Texas have reopened for the first time in weeks, as a slow reopening process have started amid the #COVID19pandemic. #Covid_19 #COVIDー19",,,#US #Texas #COVID19pandemic #Covid_19 #COVID,1253913816947134465,https://twitter.com/WeForNews/status/1253913816947134465
2020-04-25 05:07:36,ians_india,,0,0,1,"Retail businesses in the #US state of #Texas have reopened for the first time in weeks, as a slow reopening process have started amid the #COVID19pandemic. #Covid_19 #COVIDー19",,,#US #Texas #COVID19pandemic #Covid_19 #COVID,1253913530815913985,https://twitter.com/ians_india/status/1253913530815913985
2020-04-25 04:53:43,SDrinkowski,,0,0,0,"@TXWorkforce making sure I have my facts straight; People are supposed to be looking for another job if they are unemployed due to Covid even though they have been told they will be rehired when the state of Texas lifts restrictions...",,@TXWorkforce,,1253910036323225608,https://twitter.com/SDrinkowski/status/1253910036323225608
2020-04-25 04:52:07,LizForTX8,,6,18,55,"COVID-19 update: Yesterday: 886,709 cases; 50,243 deaths Texas: 22,393 cases; 576 deaths Currently: 925,038 cases; 52,185 deaths Texas: 23,170 cases; 601 deaths You know what's also sad? It seems Trump/Pence don't even care. They look like they just want re-elected. Pathetic.",,,,1253909634118815746,https://twitter.com/LizForTX8/status/1253909634118815746
2020-04-25 04:48:41,Aaron72570034,,0,0,0,"Sens. Cruz, Risch, SFRC Republicans Send Letter to UN Secretary General Requesting an Independent Review of WHO’s COVID-19 Response | Ted Cruz | U.S. Senator for Texas https://www.cruz.senate.gov/?p=press_release&amp;id=5074",,,,1253908768082939906,https://twitter.com/Aaron72570034/status/1253908768082939906
2020-04-25 04:46:29,WanderNWoodsman,,0,0,0,"Texas COVID-19 testing among worst in nation - ABC13 Houston https://abc13.com/6127913/?taid=5ea39e78e1ba140001280262 #SmartNews",,,#SmartNews,1253908212618686464,https://twitter.com/WanderNWoodsman/status/1253908212618686464
2020-04-25 04:40:18,MMFrazier,marthamaccallum,0,0,0,"We didn't have enough tests in Texas to get ahead of it. Now if COVID-19 strikes I a nursing facility, we are behind.",,,,1253906656607506433,https://twitter.com/MMFrazier/status/1253906656607506433
2020-04-25 04:38:27,OratorBlog,,6,109,65,"STILL THINK COVID-19 WAS NOT A MAN MADE WEAPONIZED VIRUS? ALONG WITH DR FAUCI &amp; THE NIAID, THE WUHAN LEVEL 4 LAB PARTNERED WITH: UNIVERSITY OF SOUTH CAROLINA UNIVERSITY OF NORTH TEXAS ECOHEALTH ALLIANCE NATIONAL INST OF HEALTH NATIONAL WILDLIFE FEDERATION ",,,,1253906191391965190,https://twitter.com/OratorBlog/status/1253906191391965190
2020-04-25 04:35:55,bohemianglytz,,0,0,0,"US States: Most new cases. #NewYork #NewJersey #Massachusetts #California #Illinois #Pennsylvania #Michigan #Virginia #Maryland #Texas 4/24/20 #coronavirus #Covid19 #CoronaUpdate #CoronaWillEndSoon #CoronavirusLiar #CoronavirusOutbreak #Covid_19 #COVIDー19 https://www.politico.com/interactives/2020/coronavirus-testing-by-state-chart-of-new-cases/",,,#NewYork #NewJersey #Massachusetts #California #Illinois #Pennsylvania #Michigan #Virginia #Maryland #Texas #coronavirus #Covid19 #CoronaUpdate #CoronaWillEndSoon #CoronavirusLiar #CoronavirusOutbreak #Covid_19 #COVID,1253905554281426949,https://twitter.com/bohemianglytz/status/1253905554281426949
2020-04-25 04:32:17,jazmineperezz_,,0,1,2,"If Texas reopens and you go to the beach/crowded places I hope YOU GET COVID and learn your lesson",,,,1253904642842546183,https://twitter.com/jazmineperezz_/status/1253904642842546183
2020-04-25 04:31:22,lacittanews,,0,0,0,"Aveva cucito decine di mascherine anti covid dopo aver saputo che mancavano negli ospedali ed era diventata una piccola eroina. La piccola Lexi Collins, 10 anni, è morta in un tragico incidente stradale a Munday, una città dello stato del Texas. #coronav https://lacittanews.it/?p=30461",,,#coronav,1253904408502571010,https://twitter.com/lacittanews/status/1253904408502571010
2020-04-25 04:30:53,bohemianglytz,,1,0,0,"US States: Least tests per capita. #Kansas #Virginia #Texas #Arizona #Kentucky #SouthCarolina #Colorado #Ohio #Nebraska #Minnesota 4/24/20 #coronavirus #Covid19 #CoronaUpdate #CoronaWillEndSoon #CoronavirusLiar #CoronavirusOutbreak #Covid_19 #COVIDー19",,,#Kansas #Virginia #Texas #Arizona #Kentucky #SouthCarolina #Colorado #Ohio #Nebraska #Minnesota #coronavirus #Covid19 #CoronaUpdate #CoronaWillEndSoon #CoronavirusLiar #CoronavirusOutbreak #Covid_19 #COVID,1253904287379279872,https://twitter.com/bohemianglytz/status/1253904287379279872
2020-04-25 04:29:56,TBBusiness,,0,0,0,"AUSTIN –Texas Health and Human Services recently received federal approval to allow Texans to purchase groceries online using Supplemental Nutrition Assistance Program benefits during the COVID-19 pandemic. ",,,,1253904049851772928,https://twitter.com/TBBusiness/status/1253904049851772928
2020-04-25 04:28:41,bohemianglytz,,0,0,0,"US States: Least cases per capita. #Texas also on least tests per capital so could have unidentified cases. 4/24/20 #coronavirus #Covid19 #CoronaUpdate #CoronaWillEndSoon #CoronavirusLiar #CoronavirusOutbreak #Covid_19 #COVIDー19 https://www.politico.com/interactives/2020/coronavirus-testing-by-state-chart-of-new-cases/",,,#Texas #coronavirus #Covid19 #CoronaUpdate #CoronaWillEndSoon #CoronavirusLiar #CoronavirusOutbreak #Covid_19 #COVID,1253903736692330497,https://twitter.com/bohemianglytz/status/1253903736692330497
2020-04-25 04:27:19,redheart1900,,0,0,0,"Los datos de covid-19 en Harris/Houston, Texas son 5,330 los mismo de ayer. Eso quiere decir que no ha habido aumento de casos. Me alegra eso. ",,,,1253903390716854272,https://twitter.com/redheart1900/status/1253903390716854272
2020-04-25 04:25:18,yaeger,,0,0,4,"If #Texas helps elect Biden in Nov because enough olds died of #Covid_19, the ones Lt Gov ⁦@DanPatrick⁩ said would be happy to die for the good of the country, I’m gonna write him a thank you note.",,@DanPatrick,#Texas #Covid_19,1253902883478593540,https://twitter.com/yaeger/status/1253902883478593540
2020-04-25 04:23:54,fbajak,LiseDigger,0,3,2,"How would you like to be stricken by COVID-19 in a place with few or no doctors? It’s happening in Texas. ",,,,1253902531039821830,https://twitter.com/fbajak/status/1253902531039821830
2020-04-25 04:19:35,NoresteDigital,,0,4,5,"#Portada: #CMIC aporta importantes recursos al @DIF_Tam http://norestedigital.net/2020/04/24/cmic-aporta-importantes-recursos-al-dif-tamaulipas/ #FelizSabado #NLD #Reynosa #Matamoros #CdVictoria #Tampico #Madero #Altamira #CDMX #Edomex #Monterrey #Texas #Veracruz #SLP #QuedateEnCasa #Covid_19 #ViernesDeYaValió #SiSalgoDeEsta #Tamaulipas #Tam",,@dif_tam,#Portada #CMIC #FelizSabado #NLD #Reynosa #Matamoros #CdVictoria #Tampico #Madero #Altamira #CDMX #Edomex #Monterrey #Texas #Veracruz #SLP #QuedateEnCasa #QuedateEnCasa #Covid_19 #ViernesDeYaVali #SiSalgoDeEsta #Tamaulipas #Tam,1253901445784653825,https://twitter.com/NoresteDigital/status/1253901445784653825
2020-04-25 04:19:00,KENS5,,0,9,7,"CORONAVIRUS RENT HELP: ""The State of Texas will be able to provide much-needed financial relief to Texans struggling with housing due to challenges posed by COVID-19,"" said Governor Abbott. ",,,,1253901296861687808,https://twitter.com/KENS5/status/1253901296861687808
2020-04-25 04:15:48,asomer,,0,0,1,"Update: #TWC was giving me incorrect information about having to file a #PUA claim. I have mostly W2 wages in my base period, *but* lost a 1099 job due to #Covid_19. The best part: they say they don't know how to fix it, yet. Way to go @TXWorkforce!! #Unemployment #Texas ",,@TXWorkforce,#TWC #PUA #Covid_19 #Unemployment #Texas,1253900494570954755,https://twitter.com/asomer/status/1253900494570954755
